,title,description,price,points,cluster_label,cosine_similarity
6023,Hermann J. Wiemer 2012 Lemberger (Seneca Lake),"Intense aromas of summer blackberries and cherry preserves waft from the nose of this rich, fruity, yet elegantly structured red. The palate is classic in style marked by ruffles of peppery spice and fine-grained tannins. A streak of menthol lingers through a long, black cherry finish.",32.0,91,1,0.999695852416706
6026,Madrigal 2011 Petite Sirah (Napa Valley),"Intensely aromatic, this is a spicy, sublime and soft wine, elegant and unexpected, bright and alive and fresh instead of overbearing. Its rustic roots endear rather than distract, with an exuberance of blueberry at its core.",35.0,91,1,0.999695852416706
6028,Milbrandt 2012 Sentinel Red (Wahluke Slope),"Cabernet Sauvignon (70%) makes up the majority of this wine along with Merlot (23%), Malbec (5%) and Petit Verdot. It's aromatically brooding, with notes of black fruit, toffee, moist soil and a floral top note. The palate pulls few punches with its rich, high-octane flavors and firm tannins but manages to keep it all in balance.",55.0,91,1,0.999695852416706
6032,Gorman 2008 The Evil Twin Cabernet Sauvignon-Syrah (Red Mountain),"This is beautifully aromatic and assertively tannic, with monster fruit that overtakes the 100% new oak and shows no hint of heat from the 15.5% alcohol. It's big, yet graceful, with veins of smoke and rock wrapped around the dense cassis and berry fruit. Young as it is, this has immense concentration and depth.",60.0,94,1,0.999695852416706
6033,Iron Horse 1996 Joy! Rosé Sparkling (Green Valley),"This Brut-style wine feels extraordinarily refined in the mouth, with a silky, airy texture. The flavors of toffee, butterscotch, orange marmalade and vanilla bean are rich, but balanced with yeasty bitterness and bright acidity. Gorgeous to drink now, anywhere, anytime, with practically anything. Pricey, yes, but worth it for special occasions.",160.0,94,1,0.999695852416706
6036,Coquelicot 2008 Sixer Red (Happy Canyon of Santa Barbara),"This wine is dry and crisp and enormously complex. It flatters the palate with waves of blackberries, cherries, currants, tangerines, bacon, white pepper and sweet vanilla oak, and the all-important tannin structure is fine. It's 94% Syrah, while 6% Viognier brings the perfect bite of acidity and citrus.",35.0,94,1,0.999695852416706
6045,DaMa 2009 DaMaNation G-S-M (Columbia Valley (WA)),"This is a GSM blend from a single vineyard, Lonesome Springs. Tobacco and vanilla scents merge into a midpalate with light red fruits. The acidity and smooth tannins keep it clean and tasty through the finish.",32.0,89,1,0.999695852416706
6047,Dry Creek Vineyard 2012 Dry Chenin Blanc (Clarksburg),"This insanely sippable wine is ready for spring oyster gatherings or gulping down on its own. Low in alcohol with just 6 g/L residual sugar, it's crisp, deliciously light and yet mouth-filling in tropical fruit and peach. Another masterful Chenin from Dry Creek Vineyard.",12.0,89,1,0.999695852416706
6048,Dutton Estate 2012 Dutton Ranch Kylie's Cuvée Sauvignon Blanc (Russian River Valley),"The wine is fermented in steel tanks and aged for a few months in neutral oak barrels. The result is dry, tart and complex, with gooseberry, green grass and white pepper flavors, enriched with hints of golden mangoes and vanilla.",21.0,89,1,0.999695852416706
6053,Kessler-Haak 2011 Lafond Vineyard Syrah (Sta. Rita Hills),"You might want to stash this Syrah away for a year or so to let it mellow. Right out of the bottle, it's tannic and fresh in red berry and stone fruit jam. Cool-climate complexities of pepper and grilled bacon enhance the pleasure.",32.0,89,1,0.999695852416706
6055,Pacific Rim 2012 Sweet Riesling (Columbia Valley (WA)),"Sweet but not too sweet for some entrées, such as spicy Thai food, this brings a fruity mix of pear, pineapple and orange-creamsickle flavors. It's smooth and soft, not at all sugary, and framed with fresh acids.",10.0,89,1,0.999695852416706
6059,"Wölffer 2010 Lombardo Merlot (The Hamptons, Long Island)","Deeply saturated with blackberry and plum flavors, this powerful, boldly structured Merlot balances rich fruit with complex shades of earth and mineral. Umami-rich whiffs of soy sauce and hay linger from nose to finish, hinting towards its development. It's pleasant now, but should meld considerably through 2019.",35.0,89,1,0.999695852416706
6070,Dancing Coyote 2006 Petite Sirah (Clarksburg),"Fans of inky black, tannicly thick and powerfully flavored Petite Sirahs will be dancing in the wine aisles over this one, from a smallish Delta appellation. It's bone dry, with intense black currant, chocolate, fig and smoky vanilla flavors, and should develop nuances for many years.",13.0,89,1,0.999695852416706
6087,Nottingham Cellars 2009 Supremacy Red (Livermore Valley),"A rich, concentrated Livermore Valley Bordeaux blend, comprised of 79% Cabernet Sauvignon and lesser percentages of Petit Verdot, Merlot, Malbec and Cabernet Franc. This vintage of Supremacy has a big presence, smelling of earth and cinnamon, a layering of blackberry and chocolate lingering in the background. A wine with great texture and mellowing tannins ready to drink now or in 5–7 years.",48.0,89,1,0.999695852416706
6090,Cuda Ridge Wines 2010 Merlot (Livermore Valley),"This Livermore Valley Merlot has a smooth, seductive aroma of cinnamon spice and clove upon opening, followed by rich notes of dark velvety plum. Long on the finish, it's a classically mannered California Merlot ready for the dinner table or to sip on its own.",25.0,89,1,0.999695852416706
6096,Smashberry 2011 Red (Central Coast),"This wine is dark, rich and delicious, if a little tannic. Waves of blackberries, currants, anise and dark chocolate lead to a dry but voluptuous finish. Good value in a full-bodied red.",12.0,89,1,0.999695852416706
6106,PasoPort 2009 Vinho Tinto Red (Paso Robles),"This dark, dry, tannic wine is rich in blackberries and cherries, with earthy notes of mushrooms and herbs. It's pretty tight and astringent now, but should soften over the next 5–6 years. The blend is Tempranillo, Touriga Nacional and Souzão.",34.0,88,1,0.999695852416706
6109,Sawtooth 2010 Skyline Red,"Lushly fruited with blueberry, black cherry and plum, this Idaho-sourced red blend is mostly Cabernet Sauvignon, with small amounts of seven other grapes. Smooth and flavorful, it finishes with a dash of cocoa.",11.0,88,1,0.999695852416706
6130,Anthony Road 2009 Martini Reinhardt Selection Riesling (Finger Lakes),"Penetrating notes of melon, stone fruit and white florals set apart this lavish Riesling from Anthony Road. Semisweet in style with honeyed fruit flavors, it's balanced by bracing lime acidity and crushed-stone minerality that extends the finish.",30.0,91,1,0.999695852416706
6140,Buttonwood 2016 Estate Grown Grenache Blanc (Santa Ynez Valley),"This is a very summery bottling, with bright, fruity aromas recalling guava, peach, gardenia, pineapple and lemon-lime soda. That fruit salad aspect persists on the palate, but it's cut by a powerful burst of acidity, making it great for lakeside sipping.",22.0,89,1,0.999695852416706
6143,Cinnabar 2014 Carignan (Contra Costa County),"This savory, spicy wine is relatively light but offers a tasty combination of non-fruit flavors such as black pepper, beef broth and wood smoke. It's medium bodied, lightly tannic and quite complex for its moderate concentration.",38.0,89,1,0.999695852416706
6153,St. Innocent 2015 Freedom Hill Vineyard Pinot Blanc (Willamette Valley),"One-quarter of this wine was fermented in neutral oak, the rest in stainless steel. At 12.5% alcohol, the light, almost airy wine brings immaculate fruit flavors of apple and pear, with a pleasing, minerally mouthfeel. It offers the faintest suggestion of caramel as it winds down.",22.0,89,1,0.999695852416706
6154,Stephen Ross 2015 Dante Dusi Vineyard Zinfandel (Paso Robles),"Soft yet perky strawberry aromas meet licorice, fennel bulb and cinnamon on the nose of this well balanced Zinfandel from a historic vineyard. There is a strong garrigue edge to the palate and a touch of roasted meat, giving depth to the bright and candied red fruit. Great with barbecue.",36.0,89,1,0.999695852416706
6156,Tercero 2016 Aberration Cabernet Franc (Santa Barbara County),"Rhône variety-focused winemaker Larry Schaeffer ventures into Bordeaux territory with this bottling, which he recommends served with a slight chill. Smooth berry aromas meet grapeseed and crushed plum on the nose. The palate is light, fresh and easy to enjoy, with red fruit and dried herb flavors, proving easy to quaff.",35.0,89,1,0.999695852416706
6163,Griffin Creek 2012 Cabernet Franc (Rogue Valley),"Thick and tannic, this wine, among all the single-varietal offerings from Griffin Creek, shows a bit more ripeness to the black, muscular fruits. It's dense in the mouth, with cassis, cocoa and coffee, bolstered with sharp, piercing acidity.",40.0,87,1,0.999695852416706
6164,Griffin Creek 2012 Syrah (Rogue Valley),"Tangy blackberry and briary boysenberry drive this bus. Accented with an herbal note, the wine finishes with streaks of licorice, espresso and chalk.",40.0,87,1,0.999695852416706
6191,Amalie Robert 2012 Our Muse Viognier (Willamette Valley),"Minute quantities of these rare Viogniers are produced, which is a shame, because they are distinctive and enlightening. Deep gold and intensely aromatic with brilliant floral notes, this is a beautifully balanced wine, with the acidity and skin flavors to put a crisp frame around the ripe peach and apricot fruit.",40.0,93,1,0.999695852416706
6225,:Nota Bene 2006 Verhey Vineyard Malbec (Yakima Valley),"Young and fresh, this 100% Malbec has tight, spicy, peppery fruit that leads into a surprisingly long finish. It's not tricked up with oak, but the sharp young berry flavors evolve in the mouth and bring on clove, wintergreen and mint, which resonate through a lingering finish. Though the fruit lacks flesh, it doesn't hold back on pure flavor, and promises good things ahead for this new vineyard.",30.0,89,1,0.999695852416706
6232,Reyes 2011 Robby's Red (California),"This six-year-old blend of 46% Syrah, 32% Cabernet Sauvignon and 22% Merlot is showing its age, with aromas of reduced cherry sauce, tar and cocoa dust. The rustic palate is full of leather, tobacco, dried cherries and dusty earth flavors. Still interesting, but drink up soon.",22.0,86,1,0.999695852416706
6235,Séamus Wines 2014 Shannon Wood Vineyard Sauvignon Blanc (Russian River Valley),"This crisp tightly woven white is showy in fresh-cut grass and gooseberry flavors, with an underlying grasp of grapefruit and lemon. The texture is gritty.",29.0,86,1,0.999695852416706
6237,Uphill Vineyards 2016 Estate Grown Rosato di Primitivo (Amador County),"This is a rounded mouth-filling wine that takes mild watermelon aromas and adds subtle white peach and pear flavors. It's quite rich in texture, low in acidity and alcohol, and has a lingering finish.",23.0,86,1,0.999695852416706
6238,Veramar 2016 JB Winemaker Series Cabernet Franc (Shenandoah Valley),"This Cabernet Franc has pronounced aromas of red and black cherries, violets, lavender, licorice and juniper berries. Tart berries and toasty oak show on the palate, yet mild tannins offer little structure. The finish is long and tart.",34.0,86,1,0.999695852416706
6246,Belle Ambiance 2016 Pinot Grigio (California),"Apple, melon and a touch of vanilla give a tasty spectrum of aromas and flavors to this medium-bodied wine. It's light enough to sip easily but has a bit of depth to the flavors that makes it interesting.",10.0,86,1,0.999695852416706
6260,Brander 2012 Merlot (Santa Ynez Valley),"Cigar box and very ripe strawberry dominate the aromatic profile, though a bit of bell pepper lingers in the background. It's light and racy on the palate, with cherry cola, cedar and mellow tannins, making for a very fresh and fun wine, best served after mild chilling.",22.0,89,1,0.999695852416706
6261,Haka by Labyrinth 2010 Freebird Red (Paso Robles),"This blend of Merlot and Tempranillo, with touches of Petit Verdot and Cabernet Sauvignon, opens with notes of warm cherry pie, black tobacco and cedar. Fresh boysenberry starts the palate, with mouthwatering spice in the midpalate and mocha on the finish.",22.0,89,1,0.999695852416706
6265,Naggiar 2010 Don Giovanni Estate Grown Red (Sierra Foothills),"This bold, dry, firmly tannic wine will taste good now with rich foods, but could easily improve with aging through 2017. It is deeply colored, full bodied and a bit sandy in texture, yet that grip seems O.K. in this wine, balanced by the ripe fruit flavors.",25.0,89,1,0.999695852416706
6274,Wise Villa 2012 Estate Grown and Produced Touriga Nacional (Sierra Foothills),"This well-balanced red made from a variety used in Port wines grows on you with each sip. It has bright cherry and raspberry aromas, exotic floral flavors, good acidity, a smooth texture and medium body. It should be versatile with food.",34.0,89,1,0.999695852416706
6282,Columbia Winery 2013 Grenache Rosé (Horse Heaven Hills),"This wine is electric pink in color, with notes of strawberry bubblegum and cranberry. It drinks off dry, with watermelon and red fruit flavors that linger on the finish.",24.0,89,1,0.999695852416706
6283,Comartin 2011 The Porterhouse Syrah-Grenache (Central Coast),"This 90% Syrah and 10% Grenache blend, named as an ode to the winemaker's butcher-ancestors, begins with scents of blueberry crème brûlée with a spearmint glaze. The flavors are comparably light, with tarter blueberry, some licorice on the midpalate and a tannic finish.",30.0,89,1,0.999695852416706
6284,Cooper-Garrod 2010 Finley Vineyard Estate Syrah (Santa Cruz Mountains),"The pretty but powerful nose is like striking a gusher of black gold in a field of lavender, full of tar, violet and blueberry. Leather and deep purple fruit lead the palate, with charred meat savoriness, black pepper spice and plum skin tannins making a good case for this seven-acre vineyard that was planted in 1998.",29.0,89,1,0.999695852416706
6285,Dunham 2011 Trutina Red (Columbia Valley (WA)),"A blend of 57% Merlot, 37% Cabernet Sauvignon and 6% Syrah, this opens with a sweetly spiced bouquet of red and purple fruits. The medium weight midpalate brings tart plum and cherry flavors, plentiful acidity and moderate, balanced tannins. Drink now through 2020.",29.0,89,1,0.999695852416706
6288,Hobo 2008 Treborce Vineyard Zinfandel (Dry Creek Valley),"Hobo's Zins are almost always among the most balanced and elegant out there, while preserving the variety's spicy, briary personality. This lovely single-vineyard bottling is dry and refined, showing complex flavors of blackberries, cherries, raspberries, blueberries and spices. Drink now.",30.0,92,1,0.999695852416706
6292,William Harrison 2006 Estate Bottled Cabernet Franc (Rutherford),"A lovely wine that makes the case for bottling Cab Franc on its own. Shows beautifully ripe, fine Napa tannins with complex flavors of red cherries, red currants, licorice, cola and cedar. Think of it as a Cabernet Sauvignon that's lighter in body and more elegant.",45.0,92,1,0.999695852416706
6295,Peju 2006 Reserve Estate Bottled Cabernet Franc (Rutherford),"Peju's regular Cab Franc, released a year ago, was immediately drinkable. This reserve, with a tiny case production, is denser and more tannic, but shows the same charm. It's a fat, fleshy wine, with luscious black cherry tart, cola and caramelized oak flavors. Fine now, and should develop for 5–7 years.",95.0,92,1,0.999695852416706
6300,Kendall-Jackson 2007 Highlands Estates Trace Ridge Red (Knights Valley),"Doesn't have quite the sheer ravishing power of the winery's Trace Ridge Cabernet, but this Cab-based Bordeaux blend is nuanced and possibly more complex and Bordeaux-like. The flavors are of currants, blackberries, cherries, anise and cedar, aged in 78% new French oak. Give it until 2011 to mellow.",75.0,92,1,0.999695852416706
6302,Miraflores 2006 Botricelli Semillon-Sauvignon Blanc (California),"This is a late-harvest dessert wine blend of Sémillon and Sauvignon Blanc. It's very rich and very sweet and very easy to like. Backed up with firm acidity, it shows extraordinarily ripe flavors of pineapples, apricots, oranges, honey, crème brûlée, vanilla bean, buttered toast and cinnamon spices.",40.0,92,1,0.999695852416706
6303,Hobo 2008 Branham Rockpile Vineyard Zinfandel (Rockpile),"A beautiful Zin, dry and spicy. Shows lush, intricate flavors of blackberries, black raspberries, anise, pepper, cola and cedar. A very fine interpretation of a dusty Sonoma Zinfandel.",30.0,92,1,0.999695852416706
6320,Buena Vista 2012 Merlot (Carneros),"Made in a relatively light-bodied, soft style, this wine has a weedy, herbal element at its heart, and could use more fruit to balance out. It ends in a taste of bittersweet chocolate and espresso.",20.0,84,1,0.999695852416706
6326,Twisted 2013 Moscato (California),"Light apple and floral aromas lead to rich flavors like apple, honey and grapefruit and a definite sweetness. This wine is fresh and easy to enjoy.",8.0,84,1,0.999695852416706
6335,Wente 2005 Crane Ridge Merlot (Livermore Valley),"Direct and thin, this Merlot has simple currant, cocoa, licorice and oakspice flavors that finish totally dry.",20.0,83,1,0.999695852416706
6339,Baywood 2006 Vineyard Select Symphony (California),Not much going on in this off-dry wine. It has very thin flavors of vanilla and pineapples.,9.0,82,1,0.999695852416706
6341,Midnight 2005 Malbec (Paso Robles),"Simple, tannic and harsh, with sugared blackberry tea, raisin and black pepper flavors.",28.0,82,1,0.999695852416706
6344,Brutocao 2005 Contento Vineyard Primitivo (Mendocino),"Simple and sweet, this Primitivo has jammy flavors of black raspberries, cherries and chocolate. It's a little heavy and soft.",20.0,82,1,0.999695852416706
6345,Maryhill 2005 Cabernet Franc (Columbia Valley (WA)),"This is light and seems a little sparkly, as if there is a hint of secondary fermentation going on. For Cab Franc it's light and generic, without the spice or substance of the grape.",20.0,82,1,0.999695852416706
6347,Deerfield Ranch 2004 Cuveé Merlot (North Coast),"Like the '03, this Merlot is a little too sweet for comfort, showing sugary cherry flavors that taste like melted jam. It's also very soft and lacks a firm structure.",27.0,82,1,0.999695852416706
6350,Jacuzzi 2006 Morine Ranch Primitivo (Lake County),"Shows blackberry and cherry flavors that taste candied, almost medicinal. Okay with burgers and pizza.",22.0,82,1,0.999695852416706
6356,Signorello 2005 Padrone Proprietary Red Wine Red (Napa Valley),"Marks a welcome return to the magnificence of the 2002, although more recent vintages haven't exactly been slouches. The '05 is amazing, a densely structured, deeply flavored Bordeaux blend that's mainly Cabernet Sauvignon. Shows classic notes of cassis, currants and black cherry liqueur, while 70% new oak adds enticingly rich layers of sweet toast and smoky vanilla. The tannins are pure, classic Napa, very refined and ripe, offering solid structural support with no trace of astringency. Beautiful now, and should slowly develop for many years.",110.0,97,1,0.999695852416706
6361,Chehalem 2013 Ridgecrest Vineyards Gamay Noir (Ribbon Ridge),"A rare grape in Oregon, this is a bright garnet shade and scented with cranberry and raspberry fruit. Acidity brings significant snap to the flavors, so much so that for many tasters it will show best with some greasy/smoky grilled meats. A hint of Band-Aid comes up in the finish, but does not distract.",24.0,87,1,0.999695852416706
6365,Sanguis 2012 1/1 Syrah (Central Coast),"This one-barrel bottling is quite intriguing, offering unexpected aromas and flavors. An element of crunched grapeseeds and unfermented wine grapes mixes with licorice, olive and pepper on the nose. A similar sense pervades the palate, along with light coffee and brown tea flavors. It's slightly odd, but also an interesting change of pace.",125.0,87,1,0.999695852416706
6369,Sonoma-Cutrer 2014 Winemaker's Release Sauvignon Blanc (Russian River Valley),"A light, refreshing version of the variety from the heart of the Russian River, this traffics in medium-bodied peach and lime, ending with a sweetness of acidity.",25.0,87,1,0.999695852416706
6372,Beckmen 2012 Cuvee Le Bac Red (Santa Ynez Valley),"One of the more reliable, affordably priced Rhône blends in the state, this mix of 43% Grenache, 34% Syrah, 15% Mourvèdre and 8% Counoise offers slightly shy aromas of black and red licorice, red currant and cinnamon candy, tucked behind a layer of slate. The palate is more simplistic, with purple fruits most prevalent.",25.0,87,1,0.999695852416706
6376,Joullian 2014 Family Reserve Sauvignon Blanc (Carmel Valley),"Lemon custard, ripe Gala apples and a seemingly sweet candy element show on the nose of this wine from a family-owned producer. Bright energy and ripe apple characterize the palate, along with green pear skins and stonefruit.",26.0,87,1,0.999695852416706
6378,V. Sattui 2010 Dry Riesling (Napa Valley),"This wine is a great example of why Riesling is so increasingly popular. Despite the “dry” title on the label, it's actually a bit off-dry and crisp in acidity, with clean, savory flavors of limes, kiwi fruits, honey and vanilla. So easy to like, and the alcohol is relatively low.",20.0,88,1,0.999695852416706
6393,Pinanfarina 2006 Vino Rosso Red (Napa Valley),"This Bordeaux blend feels harsh in the mouth. It just doesn't offer the richness you want from a Napa wine. The blackberry flavors are edged in overripe raisins, but the biggest problem is the bitter tannins.",55.0,84,1,0.999695852416706
6394,Longoria 2008 Clover Creek Vineyard Tempranillo (Santa Ynez Valley),"A decent but clumsy wine, showing the pitfalls of this variety in California. It's very dry and silky in texture, but hot in alcohol, and there's a burnt taste to the cherry and oak flavors. Not going anywhere.",36.0,84,1,0.999695852416706
6396,Geyser Peak 2007 Sauvignon Blanc (California),"This is a very pungent Sauvignon Blanc, aggressive in those green aromas and flavors generally lumped under the descriptive term of gooseberry. It's dry and clean and acidic, with a finish like the juice of Meyer lemons.",12.0,84,1,0.999695852416706
6406,Fujishin 2009 Bitner Vineyard Viognier,"Thin and tart, sharp citrus rind scents and flavors; then an unexpectedly sugary note in the finish.",15.0,83,1,0.999695852416706
6415,Novy 2011 Garys' Vineyard Syrah (Santa Lucia Highlands),"Some wineries releasing a new Garys' Syrah would charge a lot more, but Novy keeps their prices moderate. While this wine is enormously tannic and dry, it shows a complex range of blackberry and stone fruit, tobacco, currant, charred meat bone, black pepper and mineral flavors, with the oak influence evident but subtle. Given the extreme dryness and tannins, as well as significant alcohol, the question is will the wine age. It doesn't seem likely to, so decant and drink up through 2020.",32.0,90,1,0.999695852416706
6416,One Woman 2010 Estate Reserve Merlot (North Fork of Long Island),"Luscious blackberry and cherry notes are marked with hints of bramble and spice in this bold yet elegantly framed wine. The palate feels lush and warm with judicious oak, yet bright, with a shower of cranberry acidity and fine-grain tannins that penetrate through the finish.",48.0,90,1,0.999695852416706
6419,Sheldrake Point 2012 Dry Riesling (Finger Lakes),"Yellow peaches, waxy white florals and honeysuckle perfume this intensely aromatic wine. Floral notes persist on the palate as well, but are elegantly balanced with soft mineral tones and an invigorating lime acidity. Distinctly elegant, it finishes with a lingering hint of tea leaves.",16.0,90,1,0.999695852416706
6428,Doyenne 2011 Métier Red (Red Mountain),"This southern Rhone-style blend consists of 35% Mourvèdre, 40% Grenache and 25% Syrah. Steely minerality underscores pretty cherry fruit, with a light and peppery streak of herb running through the tannins.",44.0,90,1,0.999695852416706
6429,Doyenne 2011 Signature Syrah (Red Mountain),"The winery's most-available Syrah is co-fermented with a splash of Viognier. The fruit is tight and compact, clean with red and black berry flavors, framed by firm, polished tannins.",42.0,90,1,0.999695852416706
6432,Gloria Ferrer 2003 Carneros Cuvée Sparkling (Carneros),"The blend is Pinot Noir and Chardonnay. The wine remains tough, dry and scoury at the age of 11 years, showing its yeastiness and subtle flavors of Meyer lemons and limes. It's elegant, but probably not going anywhere, so drink up. Sushi will be an ideal companion.",70.0,90,1,0.999695852416706
6434,Novelty Hill 2011 Merlot (Columbia Valley (WA)),"Plum and especially blueberry fruit compels your interest immediately. It's cloaked in precisely focused tannins that frame an extended, lightly chocolaty finish.",23.0,90,1,0.999695852416706
6460,Sidecar 2015 G-Force Red (Oregon),"This blend of 60% Gamay, 28% Cabernet Franc and 12% Pinot Noir, sourced from widely separate vineyards throughout Oregon, is a surprising success. The flavors are ripe, recalling sweet mulberry and blackberry, and the polished tannins wrap it up nicely. Drink up.",29.0,90,1,0.999695852416706
6463,Kokomo 2015 Grenache (Dry Creek Valley),"Bright and generously oaked, this wine is ripe and softly layered, an explosion of strawberry and raspberry that takes on a jammy consistency of power and big flavor.",36.0,90,1,0.999695852416706
6467,Niner 2009 Twisted Spur Red (Paso Robles),"Soft and a little warm in alcohol, this blend has rich flavors of red berries, red currants, smoked meat and exotic spices. It's an easy wine to drink with barbecue.",30.0,87,1,0.999695852416706
