,title,description,price,points,cluster_label,cosine_similarity
9025,Barnard Griffin 2011 Merlot (Columbia Valley (WA)),"Aromatic and fruity, this is front-loaded with pretty accents of toast and baking spices. There's 10% Cabernet Sauvignon in the blend, but it's Merlot's show, with forward, smooth, chocolaty goodness around a core of raspberry candy.",17.0,89,1,0.999695852416706
9035,Orsi Family Vineyards 2013 Sangiovese (Dry Creek Valley),"This small-production Tuscan-inspired wine shows sour cherry fruit and a funky note of peat. Low in oak and tannin, it's softly layered and slightly salty, appealing in its Old World style.",28.0,88,1,0.999695852416706
9040,Kontokosta 2013 Anemometer White (North Fork of Long Island),"This rich cream-textured blend of Chardonnay and Viognier evokes warming pastry notes of vanilla, caramel and crème brûlée. It's a dry full-bodied wine with soft acidity and accents of toast, smoke and orange peel.",35.0,88,1,0.999695852416706
9041,Atwater 2013 Big Blend Red (Finger Lakes),"This Syrah-based blend of five different red grapes may be “big” in blending components, but it's quite sleek and elegant on the palate. It's not a deeply concentrated brooding wine, but brisk and spry, offering fresh black-cherry and berry flavors. Soft feathery tannins and notes of cedar and forest floor linger on the finish.",25.0,88,1,0.999695852416706
9045,Terlato 2013 Cardinals' Peak Red (Napa Valley),"This blends 78% Cabernet Sauvignon, 17% Merlot and 5% Petit Verdot into a tightly woven package of red fruit, soft tannin and robust concentration. Full bodied, it shows the warmth and distinct power of the vintage.",50.0,88,1,0.999695852416706
9046,Terlato 2013 Devils' Peak Red (Napa Valley),"This blend of 61% Cabernet Franc, 35% Cabernet Sauvignon and 4% Merlot is dense and boldly tannic, with varietal characteristics of dried herb and a fruity core reminiscent of wild blackberry.",50.0,88,1,0.999695852416706
9051,Zaca Mesa 2013 Syrah (Santa Ynez Valley),"Dried blueberry, leather, soy and pepper notes show on the nose of this bottling from the region's Syrah pioneer. The palate is very dry and brimming with deep purple flower, black fruit and herb flavors.",25.0,88,1,0.999695852416706
9052,Zoetic Wines 2014 Complesso Sauvignon Blanc (Russian River Valley),"Blended with 5% Viognier and aged in a combination of new French oak, neutral oak and stainless steel, this is a full-bodied white that offers a wealth of ripe peach, apricot and key lime flavor.",27.0,88,1,0.999695852416706
9059,Midnight 2013 Synnove Petit Verdot (Paso Robles),"This wine needs plenty of breathing time, revealing pleasant hibiscus, rose, cranberry and tart cherry aromas as it opens. The flavors suggest pepper and red fruit, with a somewhat leathery aged character.",44.0,88,1,0.999695852416706
9060,Peachy Canyon 2010 Snow Zinfandel (Paso Robles),"This is Peachy Canyon's 100% Zinfandel, unblended, and it's a true expression of the variety, Paso Robles style. That means it's softly voluptuous and almost to the point of overripeness, with blackberry, raisin and spice flavors. Drink now.",36.0,88,1,0.999695852416706
9062,Samsara 2009 Larner Vineyard Grenache (Santa Ynez Valley),"A ripe red wine, brimming with cherry fruit, and heightened in texture by acidity. Not particularly complex, but rich and satisfying, making it one of the better Grenaches from California.",36.0,88,1,0.999695852416706
9063,Smasne Cellars 2008 Phinny Hill Vineyard Petit Verdot (Horse Heaven Hills),"Dark and chocolaty, with grainy tannins under deep cassis and black cherry fruit. Full-bodied and chewy, with coffee grounds and spices filling in the finish.",35.0,88,1,0.999695852416706
9067,Tangent 2010 Grenache Blanc (Edna Valley),"With no oak to interfere with the fruit, this wine shows flashy tangerine, pineapple, Meyer lemon and tart lime flavors that are bone dry, and brightened by Edna Valley acidity. It's savory, refreshing and frankly delicious.",20.0,88,1,0.999695852416706
9070,Venge 2010 Spettro White (Napa Valley),"Cabernet specialist Venge tinkers with white blends under the Spettro designation, with inconsistent results. This 2010 is mainly Sauvignon Blanc and Chardonnay, with a splash of Chenin Blanc. It's a good, sound white wine, dry and crisp in acidity, with mineral-infused pear, citrus fruit and apricot flavors. No oak is evident.",26.0,88,1,0.999695852416706
9074,Dutton Estate 2010 Kylie's Cuvée Sauvignon Blanc (Russian River Valley),"This is Dutton Estate's unoaked Sauvignon Blanc. It did not go through the malolactic fermentation, but it started as very ripe grapes, so what you get is pure citrus, Asian pear, white peach and green apple flavor, zesty and clean in acidity, with slight a sweetness in the finish. Nice with Indian, Chinese, Vietnamese fare.",20.0,88,1,0.999695852416706
9082,Fenestra 2009 Graciano (Lodi),"Livermore Valley-based Fenestra loves to source fun stuff from Lodi, and Graciano has proven to like Lodi very much. In Fenestra's hands this varietal is soft and round, perfectly fine drinking, a taste of Bing cherry in liquid form.",25.0,87,1,0.999695852416706
9085,Due Vigne 2007 Musso Family Vineyard Dolcetto (El Dorado County),"Grown at 2,400-feet elevation from Italian budwood, this Dolcetto, so common to Piedmont but almost unheard of in California, is muy grande, with mountainous tannins and flavors of coffee and toffee and bright notes of cranberry and cherry.",19.0,86,1,0.999695852416706
9087,Glenora 2010 Gewürztraminer (Finger Lakes),"Sweet on the nose, with scents of pink grapefruit skin, rose petals and lychee fruit, Glenora's bottling screams classic Gewürztraminer. Waxy lanolin notes and black tea notes on the finish add a touch of complexity to this slightly off-dry sip.",15.0,86,1,0.999695852416706
9088,Hard Row To Hoe 2010 Marsanne (Yakima Valley),"Waxy fruit flavors of peach, melon and banana, all a bit understated, lead through a light and pleasant quaffer with a hint of toast on the finish.",18.0,86,1,0.999695852416706
9089,Animale 2009 Dolcetto (Columbia Valley (WA)),"This alcoholic wine (15.9%, and you can taste it) is also tongue-scrapingly tannic. The black cherry and cassis fruit is fabulous, and quite ripe, but the alcohol starts to burn out the finish. Let the record show that some tasters will love this wine.",24.0,86,1,0.999695852416706
9092,Beresan 2008 The Buzz Yellow Jacket Vineyard Red Red (Walla Walla Valley (WA)),"Light fruit flavors run from melon into pale strawberry, with tannins that seem just on the edge of ripeness. Pleasant for the near term, but not for cellaring.",19.0,86,1,0.999695852416706
9093,Cabot Vineyards 2007 Syrah (Humboldt County),"From husband-and-wife team in California redwood country, comes this interesting Syrah, sourced from dry-farmed estate vines. Smelling of cedar pine and red fruit, it's very savory, full of pepper and leather, dark coffee and espresso. Lay it down another year or so to tame its wild soul.",24.0,86,1,0.999695852416706
9099,McGregor 2010 Semi-Dry Riesling (Finger Lakes),"Smoky and a bit stark with whiffs of struck flint and stone. This off-dry Riesling is piercing on the palate with nervy lime-juice and lime-skin flavors. The finish is medium long, ending on a softly floral, crushed-stone note.",18.0,86,1,0.999695852416706
9102,Murrieta's Well 2010 The Whip White Wine White (Livermore Valley),"Murrieta's blend of 31% Sauvignon Blanc, 27% Viognier, 15% Sémillon, 11% Pinot Blanc, 8% Orange Muscat and 8% Muscat Canellii is well-made and likable, medium-thick and somewhat sweet in style with citrus and almond accents. Delightfully quaffable.",19.0,86,1,0.999695852416706
9103,Ott & Murphy 2009 Double Bluff Red Red (Horse Heaven Hills),"This pretty, Rhône-style red blend consists of roughly equal parts Grenache, Cinsault and Syrah, with a splash of co-fermented Roussanne. It smells young and fruity, with candied scents of strawberry and raspberry. With plenty of breathing it gains a bit of midpalate weight, but the candied character remains.",19.0,86,1,0.999695852416706
9106,Rock Wall 2009 Holbrook Mitchell Vineyard Cabernet Franc (Napa Valley),"Tastes hot and prickly in alcohol, which puts everything else off, including the black cherry, bacon, olive and herb flavors, which are actually pretty good. Drink now.",32.0,86,1,0.999695852416706
9140,Chateau Ste. Michelle 2008 Syrah (Columbia Valley (WA)),"Co-fermented with Viognier (for the first time at Ste. Michelle), this aims for a brighter, softer style of Syrah. It's plenty soft, pleasantly accessible, and lightly toasty. The smoothness seems to have eliminated some of the brightness, the hills and valleys that make Syrah so distinctive in Washington.",13.0,87,1,0.999695852416706
9141,Chateau Walla Walla 2008 Syrah (Walla Walla Valley (WA)),"A big and oaky style, liquorous and full-flavored from the start. This is spot-on varietally, the fruit sourced from the Zerba Vineyards, and has a nice run through the midpalate with purple berry fruits and plenty of new oak. It turns a little chalky in the finish.",40.0,87,1,0.999695852416706
9142,Coeur d'Alene 2008 Syrah (Columbia Valley (WA)),"Pleasant red fruits awash in chocolaty oak craft an accessible, broadly open Syrah. Though it seems a bit generic, it is balanced and tasty; a good bottle for near-term drinking with simple grilled meats.",28.0,87,1,0.999695852416706
9153,Tudal 2010 Honker Blanc Sauvignon Blanc (Napa Valley),"Good price for a Sauvignon Blanc this nice to pair with food. It's basically dry, although you'll find a honeyed richness around the lemon, lime and green apple flavors, as well as plenty of savory acidity that gets those tastebuds watering.",14.0,87,1,0.999695852416706
9168,Handley 1995 Blanc de Blancs  (Anderson Valley),"From one of California’s coolest growing regions, the grapes nonetheless achieved the ripeness of white peaches, lending those notes to the aromas and flavors. It’s very clean and refreshing. There’s a nice toastiness that carries through to the finish, which is slightly sweet and bitter. To be released Spring 2001.",30.0,86,1,0.999695852416706
9176,Joseph Phelps 2014 Eisrébe Scheurebe (Napa Valley),"Floral in jasmine and orange blossom, this is a sultry, full-bodied after-dinner sipper, lilting in honey goodness yet light in stone fruit and layered acidity. It is enjoyable on its own but would be fabulous alongside a peach pie or apricot tart.",50.0,91,1,0.999695852416706
9180,Lumos 2014 Temperance Hill Vineyard Gewürztraminer (Oregon),"This dry, single-vineyard bottling is extremely aromatic, as only Gewürztraminer can be. The ripe lychee and grapefruit is subsumed in a cloud of baby powder. It's quite dry, and for those that want a supremely floral varietal expression of this grape, this is your go-to bottle.",19.0,91,1,0.999695852416706
9183,Plaisance Ranch 2012 Papa Joe's Private Stash Syrah (Applegate Valley),"Grown in a rather cool part of the Applegate Valley AVA, this offers aromatics of cured meat, peppery herb and a dash of iron ore. The fruit leans toward black cherry, and streaks of coffee and cola add to the complex finish. Drink now through 2025.",25.0,91,1,0.999695852416706
9185,Ravenswood 2013 Old Vine Zinfandel (Lodi),"This sophisticated, dry and affordable wine will shine at mealtime due to its balance between generous fruit flavors and an appetizing, moderately tannic texture. Aromas resemble raspberries and red cherries, while flavors are a bit riper than that. The acidity is lively and the finish lingers.",14.0,91,1,0.999695852416706
9195,Cinnabar 2012 Burbank Vineyard Tempranillo (Paso Robles),"This presents a rather fresh take on this often extracted grape, with raspberry and boysenberry juice, black pepper, dried strawberries and a touch of wild mint. There are nice coffee elements on the palate, along with sage and brown spices, but the boysenberry and fresh purple fruits shine throughout.",40.0,91,1,0.999695852416706
9203,Asuncion Ridge 2010 Nefarious Red (Paso Robles),"With flavors of black pepper, sweet charred meat, blackberry jam and toasty oak, this is a seriously good wine, reminiscent of the Northern Rhône. There's a streak of tart red cherries and cola that make this luscious wine enjoyable now.",36.0,89,1,0.999695852416706
9222,Bell 2008 Canterbury Vineyard Syrah (Sierra Foothills),"Tannic and brooding in its big-boned structure, this high-elevation-grown Syrah will please Cabernet Sauvignon drinkers in its upfront oak and herb overtones. But it remains true to its varietal roots, offering bright Bing cherry, black plum and licorice, complete with loads of earthiness and ground pepper.",36.0,88,1,0.999695852416706
9223,Bodega Rancho 2009 Vivio Vineyard Syrah (Bennett Valley),"Power marks this gigantic Syrah. What it lacks in subtlety, it makes up for with its sheer size. Syrah doesn't get much riper in blackberry, cherry and chocolate flavors. With its thick, rich tannins, drink it soon with beef and game dishes.",40.0,88,1,0.999695852416706
9224,Tercero 2008 Larner Vineyard Cuvée Loco Red (Santa Ynez Valley),"This is big, rich, thick wine, dripping with gooey cherry and chocolate flavors. Blended from equal parts Grenache and Syrah, it features some notable tannins, although it's voluptuous enough to drink now. Pair it with barbecue.",30.0,88,1,0.999695852416706
9225,Veritas 2010 Vintner's Reserve Red (Monticello),"Decidely savory on the nose, aromas of bacon, brûléed sugar, grilled herb and toast highlight the black fruit core. The palate is meaty and currently locked tight with superfirm, grippy tannins. Bone dry on the finish, this should be enjoyed with a chunk of rare beef to help tame the tannic blow.",35.0,88,1,0.999695852416706
9231,Sineann 2010 Abondante Red (Columbia Valley (WA)),"A witch's brew of five grapes, the Abondante is a fine wine to pair with pizza, offering interesting flavors of berry and stone fruit. What it lacks in focus, it makes up for with plenty of fruit and some unusual complexity.",24.0,88,1,0.999695852416706
9237,Northstar 2008 Stella Maris Red Red (Columbia Valley (WA)),"With just 2% Syrah, this is a Bordeaux-style blend, feauturing mostly Cabernet and Merlot. The rich entry features berry, chocolate and espresso, with a round midpalate and polished tannins. A hint of tar runs through the finish.",29.0,88,1,0.999695852416706
9238,Artezin 2010 Zinfandel (Dry Creek Valley),"High on the deliciousness-factor, this shows soft, seemingly sweet flavors of raspberry, cinnamon, smoky butter, sugar cookie and vanilla. It's a little one-dimensional, but that dimension is a nice one. Drink now.",25.0,88,1,0.999695852416706
9239,Bargetto 2009 Regan Vineyards Reserve Merlot (Santa Cruz Mountains),"This wine displays the aggressive acidity typical of Central Coast Merlots. While it's rich and dry in raspberry, cherry and red currant flavors, with a fine note of smoky oak, the tartness is central. Pairing this with ham will help tame the acids.",40.0,88,1,0.999695852416706
9242,Shypoke 2008 Charbono (Calistoga),"Charbono is an old-fashioned grape that almost nobody makes anymore, but Shypoke is giving it some love, and good for them. This is a really nice wine. It's as full-bodied, dry and tannic as a Merlot, but with different flavors, of black cherries, grilled meats and mushu plum sauce, with dusty exotic spices and a touch of funky smoke. It's soft enough to drink now.",40.0,91,1,0.999695852416706
9244,Clos du Val 2009 Ariadne Semillon-Sauvignon Blanc (Napa Valley),"This blend of Sémillon and Sauvignon Blanc is bone dry and sophisticated, with a bite of acidity that makes it exceptionally food friendly. Made with just a touch of oak, it's marked by brisk flavors of lemons, limes, green apples and Asian pears, with a hint of tart gooseberry. A mouthwateringly clean wine that's great as a cocktail sipper with little appetizers.",25.0,91,1,0.999695852416706
9245,Viento 2009 Pine Grove Vineyard Vintage Select Riesling (Columbia Gorge (OR)),"This is declassified ice wine, picked frozen. It does not have the depth of the other dessert wines from Viento, but it is a remarkable effort, textural and delicate, with threads of straw, honey, cracker, candied tropical fruits and more, but all in a light and delicate style. This could easily become a wine that will amaze people in a blind tasting given the price.",20.0,91,1,0.999695852416706
9247,Lachini 2009 Pinot Gris (Oregon),"Lovely scents suggest citrus rind, lemon cake, honeycomb, candied orange and more. Substantial fruit flavors run from lime on through ripe pineapple, and the supporting structure offers a firm foundation of acid and extract, with a pleasingly long finish.",22.0,91,1,0.999695852416706
9258,Cinnabar 2008 Mercury Rising Red (California),"A blend of the five major Bordeaux varieties, this is a deliciously soft wine. So easy to like for its rich blackberry, cherry, raspberry and smoky oak flavors, courtesy of 40% new barrels. Shows lots of class for the price.",21.0,90,1,0.999695852416706
9261,Donelan 2008 Kobler Family Vineyard Syrah (Green Valley),"A tough, tannic young wine that will benefit from two or three years in the bottle, but probably no more. It's bone dry and astringent now, with an intense core of blackberries, grilled meat and black pepper. Give it a few hours in a decanter before pouring.",45.0,90,1,0.999695852416706
9272,Convergence Zone 2009 Riesling (Yakima Valley),"Scented with notes of pine needle and lemon polish, this puts its concentration square in the mid-palate. There are pretty traces of honeyed botrytis, and a suggestion of sweetness, though the acidity keeps it on the dry side. Excellent length, with a pretty finish of honey and tea.",15.0,90,1,0.999695852416706
9278,Croma Vera 2015 Spanish Springs Vineyard Albariño (San Luis Obispo County),"Fresh-squeezed grapefruit, pomelo, Key lime, lemongrass, green papaya and Anjou pear combine for a very green, fruit-driven nose on this bottling from a vineyard just behind Pismo Beach. The palate is a tad ripe but shows apple soda, lime juice, cherimoya and apple-custard flavors.",26.0,87,1,0.999695852416706
9287,Almquist 2010 Vintner's Select Konnowac Vineyard Petit Verdot (Washington),"Light aromas of flowers, herbs and soil are followed by tart cranberry, smoke and citrus flavors and firm, gritty tannins. It doesn't stand up by itself but has a place at the dinner table alongside a juicy steak.",30.0,87,1,0.999695852416706
9288,Almquist 2010 Vintner's Select Tinto Doce Upland Vineyard Red (Washington),"The aromas are surprisingly reserved, with notes of vanilla, spice and brown sugar. The palate provides brown-sugar and purple-fruit flavors, with the vanilla notes from the oak riding high. Coffee flavors persist on the finish.",35.0,87,1,0.999695852416706
9290,Burnt Bridge 2013 Blend X Red (Walla Walla Valley (WA)),"This wine is two-thirds Merlot, with the balance Cabernet Sauvignon and Cabernet Franc. Mesquite, dark cherry, vanilla, herb and spice aromas lead to tart, tingly flavors with bunched up tannins.",40.0,87,1,0.999695852416706
9296,Harbes Family Vineyard 2014 Dry Rosé Merlot (North Fork of Long Island),"Candied cherry and berry aromas abound on the nose of this dry rosé, but the palate is surprisingly elegant. Pristine red cherry and raspberry flavors are fresh and bright, accented by savory, slightly bitter hints that lend nuance to the finish.",22.0,87,1,0.999695852416706
9297,Hensteeth 2010 Proprietary Red (Sonoma County),"Cabernet Sauvignon, Cabernet Franc and Petit Verdot come together to form an herbal, medium-bodied wine that drinks lean. Cedar, black tar and leather meet black pepper and chocolate while the tannins remain tight and firm.",49.0,87,1,0.999695852416706
9298,Indigené 2013 Philanthropist Red (Carmel Valley),"A strong boysenberry fruit character is spiced by anise, graphite, cedar and Dr Pepper notes on this bottling. The palate shows light red currant, ripe plum, mulberrry and strawberry, with a touch of pencil shavings adding complexity.",21.0,87,1,0.999695852416706
9299,J & J 2013 Les Collines Vineyard Malbec (Walla Walla Valley (WA)),"The aromas are light, with the notes of green herbs, flowers and plum, leaning pretty far into the green and savory. The flavors are plump and soft, with the concentration at times seeming faint.",35.0,87,1,0.999695852416706
9301,Latah Creek 2015 Hyatt Vineyard Muscat Canelli (Rattlesnake Hills),"Bright aromas of flowers and orange rind lead to perfumed, lightly spritzy sweet fruit flavors. Enjoy it as an apéritif.",11.0,87,1,0.999695852416706
9307,Schramsberg 2009 Blanc de Blancs Brut Sparkling (Napa-Sonoma-Marin),"Made from 100% Chardonnay, this bubbly shows Schramsberg's ease of producing rich, clean and elegant sparkling wines. It's delicious now in vanilla, yeast, lime and Asian pear flavors, with some sweetness from the dosage, but try giving it 5–6 years in the cellar.",37.0,91,1,0.999695852416706
9308,Turley 2010 Fredericks Vineyard Zinfandel (Sonoma Valley),"While this Zin is high in alcohol, which gives it some peppery heat, it's dry and complex. The flavors range from ripe blackberry, blueberry and currant to dark chocolate, licorice and warm-climate Zin spice. The vineyard contains 80-year-old vines, grown in the mountains above the valley floor, which explains the wine's unique concentration.",42.0,91,1,0.999695852416706
9309,Turley 2010 Pesenti Vineyard Zinfandel (Paso Robles),"This huge, rich Zinfandel is ripe—nearly overripe—with dry raisin, blackberry and currant flavors. There's a curious bitterness to the finish that must come from the shriveled grape skins, which add to the wine's complexity. The vineyard is on the cooler, hillier western side of Paso Robles. Not a Zin for everyone, it's nevertheless a classic example of its genre.",35.0,91,1,0.999695852416706
9313,Chateau Ste. Michelle 2011 Riesling (Columbia Valley (WA)),"A marvelous effort in a difficult year, this textbook Washington Riesling is bursting with apricot and peach goodness. Round and polished, it's long and textured, with an excellent wash of minerality.",9.0,91,1,0.999695852416706
9318,Saggi 2009 Red (Columbia Valley (WA)),"More Sangiovese (62%) is in the blend this year, with Cabernet and Syrah filling out the rest. It's dark and smoky, featuring an intriguing flavor mix of spun sugar and black cherry. It seems to hit a firm wall of toast and char that rounds out with some hours of breathing time. Certainly one of the best Saggi offerings to date.",45.0,91,1,0.999695852416706
9319,Scheid Vineyards 2008 Isabelle Sparkling (Monterey),"This is a brut-style bubbly, made from roughly equal parts of Pinot Noir and Chardonnay. It has fine acidity, with some sweetness to the strawberry and lime notes. There's a toasty, yeasty creaminess that makes it delightful.",45.0,91,1,0.999695852416706
9320,Vina Robles 2011 White4 White (Paso Robles),"This is an interesting wine that pushes the boundaries beyond the usual offerings in California. Blended from Viognier, Vermentino, Verdelho and Sauvignon Blanc, it's dry, tart and complex, with a broad range of citrus, white peach, dried apricot and white pepper flavors. Don't serve it too cold.",16.0,91,1,0.999695852416706
9322,K Vintners 2009 The Boy Grenache (Walla Walla Valley (WA)),"A blend of 90% Grenache and 10% Syrah from the Armada Vineyard, this expresses its characteristic mix of superripe fruit and organic funk. Cracker, berry, spice and earth components all seem to compete a bit in the mouth and need more bottle time to fully meld together.",50.0,91,1,0.999695852416706
9329,Doyenne 2011 Roussanne (Red Mountain),"Sourced exclusively from the Ciel du Cheval Vineyard, this pure Roussanne is fragrant with bright scents of apple and citrus. The fruit is set in an elegant frame of mineral-infused acids, and it stretches out on the palate into a lengthy, polished, refreshing finish.",34.0,91,1,0.999695852416706
9332,Reustle 2014 Smaragd Grüner Veltliner (Umpqua Valley),"This is the third separate cuvée of Grüner Veltliner from Reustle, and given the name (which means emerald), it's clearly meant to be modeled after the Austrian style. For those who relish a crisp, mineral-driven wine, with ripe fruit flavors of Meyer lemon, green apple and pink grapefruit, this rings all those bells and more. The length and definition are most impressive.",32.0,91,1,0.999695852416706
9337,Stephen Ross 2013 Jespersen Ranch Grenache (Edna Valley),"Rounded plum and berry aromas grow more complex thanks to hints of sarsparilla bark, rose buds, cinnamon stick and nutmeg on the nose of this cool-climate bottling. The palate is quite peppery, with dried red flowers, red plums, peppercorns, strawberries and a texturally earthy core of fine-grained tannins.",32.0,91,1,0.999695852416706
9339,Terre Rouge 2013 DTR Ranch Syrah (Fiddletown),"This is a very solid, well-structured and deeply flavorful wine from the first whiff of blackberries and black pepper to the mouth-coating but dry flavors to the lingering spicy finish. Best to drink after 2018.",40.0,91,1,0.999695852416706
9340,The Withers Winery 2013 Ruben Red (El Dorado),"This is a well-balanced, handsomely composed wine that is big in flavor and full in body. The aromas are spicy like black pepper and cardamom, the flavors are meaty, peppery, smoky and berry-like, for a great taste experience that goes way beyond the usual. It's made mostly from Mourvèdre grapes, with Syrah and Grenache in supporting roles.",38.0,91,1,0.999695852416706
9344,Joseph Filippi 2010 Velluto Red (Cucamonga Valley),"Strong cola, fresh pomegranate, pressed strawberry and dried spearmint notes show on the nose of this blend of 40% Tempranillo, 32% Petite Sirah, 18% Zinfandel and 10% Cabernet Sauvignon from east of Los Angeles. Very intriguing, extremely minty flavors pop on the palate, spicing up the baked blueberry and meaty beef elements.",29.0,91,1,0.999695852416706
