,title,description,price,points,cluster_label,cosine_similarity
23795,Quilceda Creek 2007 Red Wine Red (Columbia Valley (WA)),"You have to love the '07 vintage. This is drinking beautifully right now, though official release (September) is still a ways off. Rich and delicious, full-bodied and aromatic, with exotic barrel scents and a lovely mélange of chocolate, mocha, caramel and spice. But the fruit is the main story, and it's full, ripe and substantial—cherry and cassis, licorice and just a hint of leaf.",35.0,93,1,0.9791730291902131
23806,Tamarack Cellars 2007 DuBrul Vineyard Reserve Red (Rattlesnake Hills),"This single-vineyard blend's flavors run through all the berries right into dense cassis. It gathers more strength as it rolls through the midpalate, layering in earth and black cherries, with char and toast more noticeable than in the other Tamarack reds.",45.0,93,1,0.9791730291902131
23813,J. Bookwalter 2007 Foreshadow Merlot (Columbia Valley (WA)),"Supple and layered, this nicely captures the scope and scale of this superb vintage. It's still young, tight and quite compact, but shows threads of tobacco, anise, stone and pencil lead, along with full, fleshy, plum and cassis fruit. Great structure and dense, ripe tannins. This is a perfect illustration of why Washington Merlot can claim to be the best in the world outside of Pomerol.",36.0,93,1,0.9791730291902131
23826,Rulo 2007 Sauvignon Blanc (Columbia Valley (WA)),"Spicy, minty and sharp, this has a Sancerre-like edge, but with an extra weight to the fruit that is more reminiscent of like a South African Sauvignon Blanc. It's packed with green pea, herb, lemon and lots of citrusy flavors, all set against very sharp, bright but delicious natural acids.",15.0,91,1,0.9791730291902131
23828,McCrea 2007 Boushey Vineyard Sirocco Blanc White (Yakima Valley),"The blend is 37% Marsanne, 33% Grenache Blanc, 20% Picpoul and 10% Roussanne. Among McCrea's Rhône-inspired white wines, this is the most complete and complex. The stony, textural underpinning adds a lot of depth while the fruit mixes citrus and melon with hints of just-ripe green banana and papaya. It's a juicy yet subtle wine, with aging potential over the next half decade or so.",28.0,91,1,0.9791730291902131
23832,Chandler Reach 2007 Dessert Wine Viognier (Yakima Valley),"This was picked at the same time as the regular Viognier, but fermentation was stopped, leaving it as a sweet wine (about 4.8% r.s.). The fruit is laced with honey, lime and apricot; it's delicious without being cloying.",27.0,90,1,0.9791730291902131
24024,Domenico 2007 Primitivo (Amador County),"Thick and heavy, this is Port-like in its toffee and raisin aromas, with a trace of licorice in the background. Its syrupy consistency almost expresses an air of oxidation.",30.0,83,1,0.9791730291902131
24183,Novy 2007 Van der Kamp Vineyard Pinot Meunier (Sonoma Mountain),"A bit heavy and jammy-rich, with cherry pie filling, raspberry and red currant flavors. Oak adds the usual smoky, spicy notes. Drink now.",27.0,84,1,0.9791730291902131
24267,Mark Ryan 2007 Crazy Mary Ciel du Cheval Mourvèdre (Columbia Valley (WA)),"This Mourvèdre/Syrah blend has loads of wild berry and black cherry, spiced up with tarragon and other herbs. The Syrah fills in the middle with juicy berry and peppery spice. The tannins are balanced and firm, barky but not overpowering.",48.0,90,1,0.9791730291902131
24271,Girard 2007 Cabernet Franc (Napa Valley),"An appealing Cab Franc, among the better versions of the variety. Shows the weight and structure of a fine Napa Cabernet Sauvignon, except the flavors veer toward red cherries and red cherry liqueur. Drink now, with honey-baked ham.",40.0,90,1,0.9791730291902131
24329,Clos La Chance 2007 JoLi Estate Vineyard Meritage (Central Coast),"Ripe and powerful in blackberry, cherry, cassis and sweet oak flavors, with a spicy finish, this blend, which is mostly Cabernet Sauvignon, also is potent in tannins. It's a complex, nuanced wine, but is really too astringent for current consumption. Give it at least six years and try again.",50.0,92,1,0.9791730291902131
24485,Château Julien 2007 Private Reserve Merlot (Monterey County),"Nice to see such a nice Merlot from Château Julien, their best ever. It does what Merlot should, being dry and lush, with complex sour cherry, currant, herb, cocoa and spice flavors wrapped into smooth tannins. A lovely wine for drinking now.",42.0,90,1,0.9791730291902131
24486,Cinnabar 2007 Amber Knolls Vineyard Malbec (Lake County),"A super-dark, well integrated, gamy, ripe and tannic Malbec that opens well and dives straight into savory and peppery characteristics. The wine is an interesting, fruit-forward version of California Malbec from a vineyard more known for Cabernet Sauvignon. Big (15% alcohol) but age-worthy.",50.0,90,1,0.9791730291902131
24499,Saint Laurent 2007 Merlot (Wahluke Slope),"A nicely structured Merlot from the Wahluke Slope, with aromas of sandalwood and blueberries. The mixed berry flavors run into tart pie cherries, sprinkled with a little pepper (from a small amount of Cabernet Franc in the blend). Well crafted and balanced.",27.0,90,1,0.9791730291902131
24735,Atwater 2007 Cabernet Franc (Finger Lakes),"There are a number of lovely Cab Francs coming from the Finger Lakes, but the smell of ripe red cherries accented with rich mocha, vanilla and smoke make Atwater's especially enticing. Lusciously fruity on the palate with intense blackberry and raspberry flavors, it's balanced with rustic notes of bramble, herbs, earth and violets. Soft tannins and smoke carry through to a long finish.",18.0,88,1,0.9791730291902131
24797,Napa Cellars 2007 Merlot (Napa Valley),"A great buy in a smooth, dry Merlot that shows real Napa elegance and style. It's medium-bodied and lush, with appealing cherry, currant, licorice, tobacco, mocha and spice flavors. Drink now for the immediate appeal.",22.0,90,1,0.9791730291902131
24897,Olabisi 2007 King Vineyard Petite Sirah (Suisun Valley),"Black and thick, this Petite Sirah delivers on all the variety's attributes in warm-climate California. It's blisteringly gregarious yet rounded, with smoky dark-fruit flavors that are initially hard to capture and tannins that verge on puckering. But time rewards—this wine hits its stride after being allowed to open and swirled around a few times. Enjoy it with a rich risotto or rack of ribs.",38.0,89,1,0.9791730291902131
24914,Pomar Junction 2007 Merlot (Paso Robles),"This is a soft, hot Merlot. It has ripe flavors of cherries, red currants, red licorice, cocoa and pepper, and finishes dry.",28.0,85,1,0.9791730291902131
24929,Fenestra 2007 Silvaspoons Vineyard Alvarelhão (Lodi),"A Livermore Valley sourcing a Portuguese red grape variety from a Lodi vineyard. Does it work? The wine's dark purple yet subdued at first in flavor, opening slightly into tones of blueberry, raspberry and sour cherry, a smidgen of spice on the finish. Worth trying.",18.0,85,1,0.9791730291902131
25055,Robert Hall 2007 Blanc de Robles White (Paso Robles),"Dry and balanced, this is a great food wine, with its crunchy acidity and minerality. A combination of Roussanne, Grenache Blanc and Piquepol, it shows nuanced flavors of the zests of Meyer lemons and limes, figs and green melons. Robert Hall is producing some of the most interesting white wines in Paso Robles.",20.0,88,1,0.9791730291902131
25062,Clos du Bois 2007 Pinot Grigio (California),"This wine has lots going for it. It's bone dry and clean, with bright, perky flavors of chamomile tea, sour lemon candy, vanilla, wildflowers, and something rich and exotic, like sweet dates. A great job at a versatile, complex young wine, and easy to find, with 130,000 cases produced.",14.0,88,1,0.9791730291902131
25083,Sineann 2007 Celilo Vineyard Gewürztraminer (Columbia Gorge (OR)),"In 2007 the excellent Celilo vineyard serves up a stunning Gewürztraminer. The brilliantly displayed floral, citrus and mineral scents lead into a soft, rich and thoroughly delicious wine with layers of green berry, citrus, melon and mineral, along with refreshing acids and a streak of toasty hazelnut.",18.0,91,1,0.9791730291902131
25086,Viento 2007 Underwood Mountain Vineyard Riesling (Columbia Gorge (OR)),"Still spritzy, very tart and tangy, with orange peel and lemon drop flavors. Perhaps showing just a bit more intensity than the 2006, this is a terrific follow-up with the same mix of delicacy and power that suggests that the Columbia Gorge AVA may well be the best site in the Pacific Northwest to grow Riesling.",14.0,91,1,0.9791730291902131
25091,Foursight 2007 Sauvignon Blanc (Anderson Valley),"This unoaked Sauvignon Blanc shows the crisp tartness that Anderson Valley brings to white wines. Fully dry, its flavors suggest lemongrass, grapefruit and pepper, with a racy tang of cold steel. The aftertaste is long and powerful.",20.0,90,1,0.9791730291902131
25099,Navarro 2007 Pinot Gris (Anderson Valley),"Perfectly fills the need in California for a bone-dry, racy white wine. Acidity is the star here, enriched with savory lemon and lime zest, grilled pineapple, pepper and mineral flavors. After all the oak and supersweetness of too many wines, it makes you want to sing and dance.",18.0,90,1,0.9791730291902131
25114,Mauritson 2007 Zinfandel (Dry Creek Valley),"A lovely Zinfandel, classic and balanced, with an elegant tannin-acid structure. Shows typical Dry Creek Valley spices and briar, in addition to ripe blackberry, cherry, currant, Dr. Pepper cola and tobacco flavors.",27.0,90,1,0.9791730291902131
25165,Matthews 2007 Stillwater Creek Vineyard Sauvignon Blanc (Columbia Valley (WA)),"This vineyard-designated Sauv Blanc is half fermented in stainless steel, 40% in concrete eggs and the rest in French oak. It is completely different from the winery's Columbia Valley bottling, with much riper and rounder fruit flavors showing off stone fruits, such as peaches and apricots, along with tropical hints of papaya. There's plenty of stuffing and spice, and a perfect mix of the grape's innate herbaceous and grassy qualities, ramped up with riper, sweeter fruit.",30.0,91,1,0.9791730291902131
25175,Jana 2007 Old Vine Riesling (Napa Valley),"You could classify this as an off-dry wine, but it's just sweet and honeyed enough to be a dessert wine. With pleasant acidity providing balance, it shows flavors of ripe peaches, diesel, nectarines, apples, vanilla and buttercup flowers.",20.0,85,1,0.9791730291902131
25181,Snoqualmie 2007 Naked Riesling (Columbia Valley (WA)),"The Naked Riesling is organically farmed and produced. This new vintage already seems a bit tired and has an unusually deep (oxidized?) golden color. It's drinking well enough, like a somewhat aged apple cider, but does not have the sort of freshness that one would hope for in a just-released 2007 wine.",12.0,85,1,0.9791730291902131
25314,Daedalus Cellars 2007 Pinot Gris (Willamette Valley),"Delicate and poised, this unusual Pinot Gris was fermented half in stainless and half in neutral oak, then kept on the lees for an extended period before bottling. The wine reveals itself gracefully with mixed green apple and white peach; hints of baking spice and a wash of vanilla wafer appear right at the finish line.",18.0,88,1,0.9791730291902131
25315,Dr. Konstantin Frank 2007 Gewürztraminer (Finger Lakes),"This wine offers citrus—orange, grapefruit—and spice on the nose. On the palate, a sweeter array of apricot, tropical fruit and some lemon is buoyed by its minerality. A lusher style of Gewürtz that will pair well with spicy cuisine—think Indian curries.",18.0,88,1,0.9791730291902131
25321,Sunstone 2007 Viognier (Santa Ynez Valley),"Drier and more streamlined than many Viogniers out there, with a crisp spine of minerals that undergirds the variety's traditional exotic flavors. Beneath the chalk you'll find savory tastes of apricot jam, blood oranges, mint and vanilla.",29.0,88,1,0.9791730291902131
25325,RoxyAnn 2007 Pinot Gris (Rogue Valley),"Like biting right into a crisp Asian pear, this clean and brightly fruity wine accents the fresh flavors with just a hint of nutmeg and sweet spice.",17.0,88,1,0.9791730291902131
25495,Elizabeth Rose 2007 Sauvignon Blanc (Napa Valley),"Too powerful in feline and gooseberry aromas and flavors, this dry, tart in-your-face Sauvignon Blanc just isn't ripe enough to recommend.",18.0,80,1,0.9791730291902131
25496,Greenwood Ridge 2007 Sauvignon Blanc (Anderson Valley),"Greenwood Ridge often does a good job at Sauvignon Blanc, but not this year. The wine is irritating in unripe feline flavors and it's also off-dry, with 1.9% residual sugar.",18.0,80,1,0.9791730291902131
25497,Ironstone 2007 Sauvignon Blanc (California),"This unoaked Sauvignon Blanc is really powerful in feline characteristics. Too powerful. Unless you like that peculiar smell and taste, it will turn you off.",10.0,80,1,0.9791730291902131
25513,Smoking Loon 2007 Zinfandel (California),"Smells like tobacco and pepper, and then turns tannic and dry in the mouth, with blackberry flavors emerging after it warms up. A decent everyday Zin.",9.0,83,1,0.9791730291902131
25518,Firestone 2007 Discoveries Merlot (California),"A bit heavy and soft, although it's nicely dry, with good tannins. The cherry flavors are mixed with herbs, with a touch of smoky oak.",10.0,83,1,0.9791730291902131
25562,Castle Rock 2007 Merlot (Mendocino County),"A low-price, high-production Merlot from Mendocino County grapes that smells musky and tastes a bit bland.",10.0,82,1,0.9791730291902131
25603,Navarro 2007 Zinfandel (Mendocino),"ots of briary, brambly wild berry and cherry fruit in this robust Zin. Also lots of mouthwatering spices. It's basically dry, but jammy sweet also, suggesting pairing with barbecue sauces made with sugar.",19.0,86,1,0.9791730291902131
25911,Sparkling Pointe 2007 Topaz Imperial Sparkling (North Fork of Long Island),"Topaz Imperial is Sparkling Pointe's first nonvintage blend of the three traditional Champagne grape varieties. While intensely aromatic of ripe red berries and plums, it maintains an elegant dryness throughout. Rich on the palate with a soft, delicate mousse, it lingers long on an earthy, mushroom-scented finish.",33.0,87,1,0.9791730291902131
25919,Pellegrini Vineyards 2007 Petit Verdot (North Fork of Long Island),"Full bodied with a generously ripe black cherry and crème de cassis profile, this Petit Verdot (with just a hint of Merlot and Cab thrown in) is beautifully structured with a sturdy frame of tannins and minerality with shining tones of graphite and pencil lead.",22.0,87,1,0.9791730291902131
25955,a-non-ah-mus 2007 Alisos Vineyard Grenache (Santa Barbara County),"This is a feminine wine, soft, generous and fruity. The raspberry and cherry flavors are jammy. There's some heat on the finish from high alcohol. Drink now.",30.0,86,1,0.9791730291902131
26795,Insatiable 2007 Merlot (California),"A sound, everyday Merlot. It has ripe blackberry, cherry, currant and cola flavors, and feels smooth and rich in the mouth. Great job at this price.",10.0,85,1,0.9791730291902131
26796,Jacuzzi 2007 Barbera (Mendocino County),"Bring on the burgers and veal parmesan for this dry, exuberant table wine. It's tannic, with earthy flavors of cherries, currants, tobacco and oodles of peppery spice.",18.0,85,1,0.9791730291902131
26951,Sparkling Pointe 2007 Brut Sparkling (North Fork of Long Island),"Scents of freshly cut herbs add a verdant quality to the yellow plum and white flower notes on this brisk, minerally blend comprised of the traditional Champagne grape varieties. Dry and tonic in style, it finishes clean and crisp, with just a hint of sugar-cookie-crumb sweetness.",29.0,87,1,0.9791730291902131
27031,Prager 2007 Royal Escort Paladini Vineyard Port (Napa Valley),"This 100% Petite Sirah is very, very sweet. When the palate experiences this much concentrated brown sugar and caramel, it exults. The problem is that sweetness is pretty much all there is. You'll find blackberry jam and chocolate.",72.0,86,1,0.9791730291902131
27050,Pomar Junction 2007 Syrah (Monterey County),"This wine comes from the San Lucas area of the southern Salinas Valley, on the way toward Paso Robles. It's a peppery wine, rustic, hot and dry, with strong jammy flavors of cherries and blackberries, and a long, spicy finish. Drink now.",42.0,86,1,0.9791730291902131
27383,Hendry 2007 Block 28 Zinfandel (Napa Valley),"A soft, hot, funky wine. Despite a wealth of berry, chocolate and spice flavors, high alcohol gives it a chile pepper burn.",35.0,84,1,0.9791730291902131
27387,Franciscan 2007 Magnificat Meritage (Napa Valley),"Basically good, with jammy berry flavors, but ultimately clumsy, especially for the price. Shows overripe fruit and green tannins. Feels sharp toward the finish. Not going anywhere, so drink up.",50.0,85,1,0.9791730291902131
27401,Kana 2007 Old Vines Red Red (Yakima Valley),"This is old vine Lemberger, one of the first red grapes to be widely planted in eastern Washington. It comes from a 1979 planting at the Red Willow vineyard. Raspberry and cherry fruit flavors dominate, pretty and pure, but lacking in depth. Some Lemberger can approach the style of Dry Creek Zinfandel; this is more of a simple red quaffer.",18.0,85,1,0.9791730291902131
27483,Sonoma Smith 2007 Goldensong White (Sonoma County),"A savory wine made in a slightly sweet style that has flavors of pineapples, peaches, and vanilla oak. Acidity is all-important for balance.The blend is 92% Sauvignon Blanc and 8% Sémillon.",25.0,86,1,0.9791730291902131
27879,Chateau St. Jean 2007 Merlot (Sonoma County),"Run, don't walk, to find this rich Merlot. It shows vast berry, currant, mocha, licorice and cola flavors, wrapped into superfine tannins and balanced with fine acidity. Easy to find, with 7,600 cases produced.",25.0,93,1,0.9791730291902131
27967,Lost Canyon 2007 Stage Gulch Vineyard Syrah (Sonoma Coast),"This is a dark, glyceriney, full-bodied Syrah that should have been held back a little longer before release, but you can make up for that with cellaring. It's tannic and raw now, but packed with blackberry, currant, licorice and pepper flavors that are totally dry, and firmed up with crisp acids. Best for a few years after 2009.",38.0,91,1,0.9791730291902131
27974,Beresan 2007 Sémillon (Walla Walla Valley (WA)),"Always estate grown and 100% varietal, Beresan makes one of the best Sémillons in the state. Exceptionally dry and crisp, this again suggests sweet grain, citrus and light tropical fruits. Notes of lemon oil and even a hint of diesel come in as subtleties. Though not as full-bodied and rich as the 2006, it's an excellent, well-made bottle, more in the style of a Bordeaux blanc.",18.0,90,1,0.9791730291902131
27981,Rendition 2007 Petite Sirah (Alexander Valley),"Great price for a big, powerful red like this. Tough in tannins now, it shows classic flavors of currants, mocha, anise and pepper, and will develop over time. Classy and impressive.",9.0,90,1,0.9791730291902131
28018,Tulpen 2007 Syrah (Columbia Valley (WA)),"A Rhône blend that will, in future vintages, not be varietally named, this is far from a standard Washington Syrah. It's threaded beautifully with nuances of fruit and spice from the Viognier coferment, Grenache and Mourvèdre that are included. Aromatic, spicy and weaving together chocolate, licorice, granite, roasted meat and berry flavors, it is both substantial and forward.",20.0,92,1,0.9791730291902131
28168,Guenoc 2007 Victorian Claret Red (Lake County),"Distinctly sugary, which gives the blackberries and cherries a jammy sweetness. But it's clean and crisp. For those who like this style, it's pretty good.",15.0,84,1,0.9791730291902131
28332,Cosentino 2007 The Zin Zinfandel (Lodi),"Lusty and strong, this is Lodi Zinfandel at its most classic. It's a big, thick, softly ripe wine that floods the mouth with exuberant flavors of blackberry jam, chocolate, red and black currants and peppery spices. Easy to like. Drink now.",25.0,88,1,0.9791730291902131
28348,HammerSky 2007 Party of Four Estate Grown Red (Paso Robles),"This Bordeaux blend, based on equal parts Cabernet Sauvignon and Merlot, is softly opulent and ripe, in the way of many Paso Robles red wines. It floods the mouth with blackberries and currants, with spicy complexities from oak, and is fairly tannic, although not so much that a good steak won't cut through it. Best Now–2012.",59.0,88,1,0.9791730291902131
28349,Murphy-Goode 2007 Merlot (Alexander Valley),"Here's a good, robust red wine. It's not particularly Merlot-like, with its pepper, herb, cherry, red currant and cola flavors, wrapped into sticky tannins. But it's very dry and elegantly structured, and the alcohol is moderate. Fine with a nice steak or chop.",20.0,88,1,0.9791730291902131
28501,Concannon 2007 Heritage Petite Sirah (Livermore Valley),"Age has been kind to this Petite, one of Concannon's smalller bottlings. The wine is noticeably easygoing with mellowed plum and blackberry fruit and tamed tannins.",60.0,87,1,0.9791730291902131
28509,Due Vigne 2007 Musso Family Vineyard Nebbiolo (El Dorado County),"Due Vigne's mountain-grown Sierra Nebbiolo is savory, embellished with olive tapenade, sour cherry, cranberry and caramel, its tannins sufficiently managed to make this wine a rich, robust red with finesse. Small percentages of Barbera and Dolcetto are blended in.",26.0,87,1,0.9791730291902131
28568,Den Hoed 2007 Marie's View Red (Horse Heaven Hills),"It's a difficult challenge to blend six different grapes into a wine without sacrificing focus, but winemaker Rob Newsom has done a splendid job with this new vintage of Marie's View. Roughly a third Cabernet and a third Syrah, which provide a potent core of deep red and black fruits, the wine is nuanced with layers of spice, leaf, toasted grain, loam and coffee grounds. Fine acids promise a long life.",80.0,93,1,0.9791730291902131
28608,Blackbird Vineyards 2007 Paramour Red (Napa Valley),"Some wines are meant for immediate consumption. Others require age. This wonderful wine satisfies on both sides. It's softly rich and polished in tannins, with accessible blackberry, cassis and oak flavors. Yet it has the structure and depth to go for years. Now–2016, at least.",90.0,95,1,0.9791730291902131
28904,Guardian 2007 Conner Lee Vineyard Gun Metal Red Red (Columbia Valley (WA)),"The fruit is ripe and the tannins firm; winemaker Jerry Reiner is able to craft very ripe fruit while keeping the varietal character of the Cabs—earth and herb, with a touch of stem. Deep and substantial, this should age well for a decade or more.",37.0,91,1,0.9791730291902131
28905,JM Cellars 2007 Merlot (Red Mountain),"This is pure Washington Merlot, sourced from Klipsun, Ciel du Cheval and the original 1976 planting at Kiona. Initially stiff and herbal, it opens grudgingly, streaked with black olive, black cherry, earth and dark chocolate. The muscularity is a fine demonstration of why and how Washington Merlot is ageworthy; a showcase of tight black raspberry and cassis, with a core of iron.",38.0,91,1,0.9791730291902131
29087,Matchbook 2007 Tempranillo (Dunnigan Hills),"Shows the many difficulties of getting this finicky variety right. The wine is tough and gritty in tannins and scoury acids, with some unripe cherry, mint and sage flavors. But it's very dry and the alcohol is moderate.",15.0,84,1,0.9791730291902131
29167,Sunstone 2007 Pinot Grigio (Santa Barbara County),"This is a fine, dry, crisp sipper with rewarding flavors of citrus fruits, figs, wildflowers, honey, thyme and pepper. With its crisp acidity and oak-tinged creamy texture, its spectrum falls between Chardonnay and Sauvignon Blanc.",25.0,87,1,0.9791730291902131
29193,Le Vigne di Domenico 2007 Coure di Vigne Red (Paso Robles),"Here's a soft, lushly delicious wine to drink now with steak, veal, pork, chicken or just about anything that wants a dry, medium-bodied red wine. It's rich in berry, currant, tobacco, spice and cedar flavors, and possesses that hard to define quality of finesse.",35.0,87,1,0.9791730291902131
29195,Mosby 2007 Sangiovese (Santa Barbara County),"This Sangiovese wants decanting for a few hours to let it breathe and open up. Right out of the bottle, it's acidic and tannic, with lots of astringency covering the cherry, red currant and tobacco flavors. Drink now, with rich, oily fare.",28.0,87,1,0.9791730291902131
29197,Le Vigne di Domenico 2007 Ame de la Vigne Red (Paso Robles),"This is a very good blend from Paso Robles, showing the region's ability to ripen red grapes. It's a little on the soft side, but robust tannins provide good structure to the cherry, berry, beef jerky and pepper flavors. Drink now for freshness.",35.0,87,1,0.9791730291902131
29200,Cameron Hughes 2007 Lot 156 Syrah (Mendocino County),"It's a fine wine, full-bodied and dry, with spicy flavors of currants, teriyaki beef, black pepper and cola, with a bracing minerality that grounds the richness. Could be more concentrated, but it's a great value.",12.0,87,1,0.9791730291902131
29203,Columbia Crest 2007 Grand Estates Syrah (Columbia Valley (WA)),"This is a changed wine from previous vintages, now emphasizing the berry flavors of the fruit and not shying away from some chewy tannins. It seems more honest and direct, without the wash of vanilla and jam, and more food-friendly as well, with the stuffing to take on a flank or hanger steak.",12.0,87,1,0.9791730291902131
29210,Spring Valley Vineyard 2007 Frederick Red Wine Red (Walla Walla Valley (WA)),"Spring Valley wines have never been shy and retiring, but here the alcohol – 15.2% – seems to quickly mute the textural subtleties. Though it suggests a panoply of red and black fruits in the nose, the palate is a wash of coffee, toast, tannin and alcohol. The flavors get muddy and the alcohol strips the wine of its terroir.",50.0,87,1,0.9791730291902131
