,title,description,price,points,cluster_label,cosine_similarity
3238,Blue Valley 2015 Sauvignon Blanc (Middleburg),"This wine is alive with herbacious notes that give it a savory quality—cut grass and green olive blend effortlessly with rosewater and baked lemon. These are all well represented on the palate, which also offers a welcome green apple flavor. Good acidity and balanced weight offer a long and lifted finish, complex with character.",28.0,89,1,0.999695852416706
3247,Coquerel Family Wine Estates 2009 Merlot (Calistoga),"Oddly acidic and hard in the mouth for Merlot, a variety that's supposed to be soft and silky. You'll find black cherry flavors, but not enough to punch through the tannins. Doesn't seem capable of aging, so drink up.",35.0,86,1,0.999695852416706
3251,Kokomo 2009 Zinfandel (Dry Creek Valley),"A solid Zinfandel, a little sweet but not too much, with softly drinkable tannins. The flavors are ripe, suggesting raspberries, cherries, mocha, brown sugar, cinnamon and cloves.",28.0,86,1,0.999695852416706
3254,Mercer 2008 Spice Cabinet Vineyard Malbec (Horse Heaven Hills),"The new oak barrel flavors stick out aggressively, and help to create a strong impression of drying tannins. The fruit is light and chalky, with young vine flavors of generic red berries.",33.0,86,1,0.999695852416706
3257,Rock Hollow 2010 Vintner's Selection Sauvignon Blanc (Santa Barbara County),"The label doesn't tell you, but this is from the Firestone family's Curtis Winery vineyards in the Santa Ynez Valley. It's a very nice wine, especially at this price. A little too sweet, its orange, lime, lemongrass and vanilla flavors are balanced by crisp acidity.",13.0,86,1,0.999695852416706
3258,Thurston Wolfe 2008 Petite Sirah (Horse Heaven Hills),"The Zephyr Ridge vineyard provides the fruit for this brambly Petite Sirah. It was aged for 22 months in American oak, and has that roughshod character, a mix of wild berry, garrigue and clean earth.",20.0,86,1,0.999695852416706
3260,Zina Hyde Cunningham 2010 Sauvignon Blanc (Russian River Valley),"A little too sweet for comfort, with jammy orange, apricot and lime flavors. Brisk acidity and a savory minerality help restore balance, but the score would be higher if the finish were drier.",22.0,86,1,0.999695852416706
3266,Clayhouse 2009 Red Cedar Vineyard Malbec (Paso Robles),"Marked by zingy acidity, this Malbec shows Cabernet-like black currant flavors and strong, rich tannins. Bone dry, it needs a good steak to punch through the astringency.",35.0,86,1,0.999695852416706
3271,Waterstone 2008 Merlot (Napa Valley),"Soft and thin, with rustic berry, tobacco and spice flavors that finish sweet.",18.0,82,1,0.999695852416706
3273,Willowbrook 2010 Altes Vineyard Syrah (Sonoma County),"This rustic wine is overripe in prunes and raisins, and hot in alcohol. It's also as sweet as a minor Port.",42.0,82,1,0.999695852416706
3277,3Fools 2009 Del Rio Red Red (Oregon),"This southern Oregon Syrah has red-fruit aromas, with notes of perfume and plastic.",22.0,82,1,0.999695852416706
3280,Castoro Cellars 2010 Zinfusion Reserve Zinfandel (Paso Robles),"A bit unripe, with some vegetal flavors along with the blackberries. There's also a lot of sweet heat from high alcohol.",18.0,82,1,0.999695852416706
3295,Chalk Hill 2006 Estate Bottled Sauvignon Blanc (Chalk Hill),"Near perfect in the way it tastes almost sweet, then pulls back into dryness. The flavors of pineapples, green apples, pears, peaches and honeysuckle are made even more delicious by the judicious application of new oak and sur lie aging.",30.0,93,1,0.999695852416706
3296,Ojai 2004 Thompson Vineyard Syrah (Santa Barbara County),"Here's a big, rich, densely layered Syrah, the kind of wine that Cab or Merlot lovers who are looking for alternatives should discover. It's full-bodied, dry and oaky, yet with its cherry, chocolate, fig and licorice flavors, offers a whole different flavor profile. Brilliiant with pork tenderloin with a fruity sauce or stuffing.",45.0,93,1,0.999695852416706
3299,Andrew Will 2005 Ciel du Cheval Vineyard Red Wine Red (Red Mountain),"A classic Bordeaux blend. Tight and chewy, this fragrant wine adds whiffs of tobacco to its red currant and cherry fruit. It is a beautifully shaped wine, precise and balanced, compact and intriguing. It will reward decanting and should be cellared for a few years to give maximum enjoyment.",60.0,92,1,0.999695852416706
3303,Prix 2004 Reserve Melange Red (Napa Valley),"Rich in red currant, cassis, licorice, cola, vanilla cream and smoky oak flavors, with a smoothly tannic texture, this wine seems to be Cabernet-based. It's made solidly along Napa cult Cab lines, a softly voluptuous wine that's delicious now, and should age well for many years. From Hagafen.",75.0,92,1,0.999695852416706
3304,Soos Creek 2005 Champoux Vineyard Red Wine Red (Horse Heaven Hills),"This 95% Cabernet Sauvignon perfectly captures the vineyard's strengths: lush, ripe, fleshy fruit that shows perfectly ripened flavors of cherry and cassis, bolstered by ripe, chewy tannins. It's substantial but not tiring; the balance of fruit, acid and tannins holds it together through a spicy, lingering finish. It's just a delicious wine, and one that should cellar well also.",40.0,92,1,0.999695852416706
3308,Rancho Sisquoc 2007 Flood Family Vineyards Merlot (Santa Barbara County),"Dry and soft, with the taste of cherry, roasted almond, crunchy granola and fig health candy bar. Enjoyable, but simple. Drink now.",20.0,84,1,0.999695852416706
3309,Righteous 2008 Righteous Tempranillo (Walla Walla Valley (WA)),"This has so much raw, rough oak flavor when first opened that the fruit is nearly invisible. Tempranillo may well have a real future in the Walla Walla Valley, but first it has to be freed from the woods. Give this plenty of breathing time.",24.0,84,1,0.999695852416706
3313,Happy Canyon Vineyard 2009 Chukker Red (Happy Canyon of Santa Barbara),"Made from Cab Franc, Merlot and Cabernet Sauvignon, in that order, this is a very flavorful wine, with rich blackberry, black currant, cocoa and cedar flavors. But it's very sharp in acidity, with a jalapeño pepper burn that limits its appeal.",20.0,84,1,0.999695852416706
3314,181 2008 Merlot (Lodi),"Soft and simple, with slightly sweet pie-filling flavors of cherries and mocha. A decent, everyday wine for picnics, barbecue and such.",15.0,84,1,0.999695852416706
3315,Phantom Rivers 2007 Paso del Sol Red (Central Coast),"Soft, fruity and simple, with blackberry, cherry and mocha flavors. Basically dry, but tastes as sweet as jam. Syrah, Cabernet and Mourvèdre.",30.0,84,1,0.999695852416706
3317,Redtree 2009 Moscato (California),"Honey-sweet in orange and vanilla flavors, this wine has a good backbone of acidity that makes it crisp and clean. Drink it with vanilla desserts or even cheesecake.",8.0,84,1,0.999695852416706
3321,Longevity 2009 Viognier (Lodi),"Tastes frankly sweet, with sugary flavors of pineapple marmalade, vanilla custard and butterscotch. It's clean in acids and spicy in the finish. If this is your style, enjoy.",18.0,84,1,0.999695852416706
3353,Curtis 2011 Heritage Blanc White (Santa Barbara County),"This fun, delicious wine tastes generous in honey, pear, Meyer lemon, orange, nectarine and white flower flavors, which are balanced by zesty acids. The blend is Grenache Blanc, Roussanne and Viognier.",20.0,88,1,0.999695852416706
3360,Zaca Mesa 2010 Estate Grown and Bottled Grenache (Santa Ynez Valley),"A little one-dimensional but still delicious, this has wave after wave of ripe cherry-pie flavor. Smoky, sweet oak brings an alluring vanilla note, and the mouthfeel is soft and silky. Try pairing this with beef tartare.",35.0,88,1,0.999695852416706
3364,Novelty Hill 2011 Stillwater Creek Vineyard Roussanne (Columbia Valley (WA)),"There is a strong underpinning of mineral in this wine, supporting crisply defined flavors of melon, pineapple and citrus peel. A medium-ripe, medium-weight, supremely well-crafted and balanced Roussanne.",22.0,88,1,0.999695852416706
3382,Pomar Junction 2013 Merlot (Paso Robles),"The aromas are shy on this bottling, but with patience show gravel and blackberry juice. The mouthfeel is also a bit light, offering dark red and purple fruit alongside asphalt and espresso bean.",38.0,86,1,0.999695852416706
3383,Purple Heart Wines 2013 Red (Napa Valley),"Winemaker Ray Coursen is a Vietnam Vet, and this wine is made to honor other veterans of foreign wars. Soft, round and approachable on the palate, it's made from a majority of Merlot, with smaller additions of Cabernet Sauvignon, Cabernet Franc and Petit Verdot. Cedar, currant and a sweetness of vanilla fan out on the palate.",20.0,86,1,0.999695852416706
3385,Domino 2013 Merlot (California),"This wine has a good, deep color, lots of fruity aromas and flavors, and a smooth mouthfeel. It tastes grapy and jammy but dry, with light spicy accents to add interest.",7.0,86,1,0.999695852416706
3394,Kunde 2011 Kinneybrook Merlot (Sonoma County),"A simple Merlot, it's easy to drink, and will be very nice with everyday fare like burgers or tacos. It's dry and tannic, yet rich in cherries and red currants, with a smooth coating of toasty oak.",17.0,86,1,0.999695852416706
3399,Four Degrees of Riesling 2012 3rd Degree Late Harvest Sweet Riesling (Seneca Lake),"Smoke and mineral notes lend a prominent savory tone to this wine, contrasting a palate that's sunny and sweet with pressed apple and pear flavors. It's straightforward in style, but refreshing with bright lemon acidity and a lasting iced-tea sweetness.",15.0,86,1,0.999695852416706
3401,Jones of Washington 2013 Riesling (Ancient Lakes),"Still settling into its skin, this wine shows a light effervescence when first poured that lifts the notes of freshly cut pear, mandarin orange and wild flowers. It drinks off dry, with the concentration of the stone fruit flavors somewhat wanting.",13.0,86,1,0.999695852416706
3402,Leonard Oakes 2012 Reserve Series Sauvignon Blanc (New York),"Mineral in tone with faint apple and blossom aromas, this wine is demure, yet refreshing. The palate is moderately concentrated with white grapefruit flavor accented by zesty lime notes and a clean, wet-stone finish.",17.0,86,1,0.999695852416706
3403,Long Meadow Ranch 2013 Sauvignon Blanc (Napa Valley),"The strong, green streak of gooseberries will divide wine lovers on this 100% stainless steel-fermented wine. It's absolutely dry despite low alcohol, with brisk acidity.",20.0,86,1,0.999695852416706
3408,Pollak 2010 Estate Grown Meritage (Monticello),"Notes of thyme, cocoa and broad dark fruit lead to a malleable, medium-full palate. The finish conveys tang and iron.",28.0,86,1,0.999695852416706
3413,Three Fox 2012 Alouette Cabernet Franc (Middleburg),"Scents of thyme, tar, date and ripe strawberry lead onto the open-textured palate. Medium in length, the finish comes with fine-grain tannins and balanced acids.",29.0,86,1,0.999695852416706
3415,Bellwether 2012 A&D Vineyard Dry Riesling (Finger Lakes),"Whiffs of smoke lend a savory feel to pressed apple notes on this dry, delicately framed wine. The palate bristles with lemon-lime acidity and finishes long and lean with a hint of wet stones.",22.0,86,1,0.999695852416706
3419,Trump 2012 Rosé (Monticello),"The aromas of this rosé of Cabernet Sauvignon, Merlot and Cabernet Franc are direct and reminiscent of red currant jam on toast. Medium bodied and broad in feel, this has acids that offer plenty of cut, plus a touch of grapefruit zest that adds interest.",14.0,86,1,0.999695852416706
3424,Tre Nova 2009 Seccopassa Red (Columbia Valley (WA)),"This was fermented from dried Barbera, Sangiovese and Nebbiolo grapes, concentrating the flavors yet retaining an elegant lightness that belies its high alcohol. Mixed fig, raisin, soy and chocolate components lend extra complexity. It's drinking well and is perfect for near-term consumption.",60.0,88,1,0.999695852416706
3427,14 Hands 2013 Riesling (Washington),"In just a few years 14 Hands Riesling production has jumped from around 15,000 to more than 700,000 cases. Clearly the brand is doing something that consumers love. This is a fairly dry style, with forward, fruity flavors of ripe orange, apple and apricot. The length and concentration are spot on.",10.0,88,1,0.999695852416706
3428,Benmarl 2012 Cabernet Franc (Seneca Lake),"Scents of violets and savory herbs add complexity to tart, juicy red cherries and plums on this crisp, elegantly framed Cabernet Franc. A touch of menthol highlights a cool, acidic edge on the palate. Finishes moderately long with a murmur of fine-grained tannins.",20.0,88,1,0.999695852416706
3429,Hightower 2011 Murray Syrah (Red Mountain),"This is all estate-grown from the original (2004) planting. Tannins are smooth and the wine has a pleasing chocolate streak upon entry. Peppery and herbal highlights come into play through the finish, which firms up nicely.",20.0,88,1,0.999695852416706
3436,Mercer 2013 Riesling (Yakima Valley),"Just a smidge over the edge into off dry, this is a big, juicy wine with a luscious mix of tropical candy fruit flavors. It's like tasting an entire roll of tropical Life Savers all in a glass. The residual sugar is offset with balancing acidity, and it's a versatile wine that can accompany a wide range of slightly spicy foods.",12.0,88,1,0.999695852416706
3437,Mercer Canyons 2013 Riesling (Yakima Valley),"This new vintage is head and shoulders better than the previous effort. Light and pretty, with a delicate mix of citrus, melon, tangerine, lemon and lime, it's showing good length and impressive detail.",10.0,88,1,0.999695852416706
3440,Noble Vines 2013 242 Sauvignon Blanc (Monterey),"There's a pleasant sweetness to the nose, a mix of white flowers and fragrant apples. On the palate, green banana, apple juice and papaya rise to the occasion. A strong minerality holds through the finish.",13.0,88,1,0.999695852416706
3470,Retro 2009 Petite Sirah (Napa Valley),"Retro makes one of the best, most consistent Petite Sirahs in California. Even though they used to source their fruit from Howell Mountain and this bottling now is from Pope Valley and Calistoga, it still shows the same qualities of complex interest based on impeccable winemaking. It's an amazing wine, dry, full-bodied and tannic, with a complex range of berries, currants, herbs and white pepper. Truly a Petite Sirah for Cabernet lovers. Drink now–2020.",32.0,93,1,0.999695852416706
3482,Dark Matter 2006 Zinfandel (Howell Mountain),"Made in a ripe, soft style that's unusual for Howell Mountain, this Zin could almost be Grenache, or even a big Pinot Noir. The cherry pie filling, raspberry cream and Dr. Pepper flavors are wrapped into soft, gentle tannins. It's a luxurious, exotic Zinfandel whose heat from high alcohol adds a spicy element.",100.0,92,1,0.999695852416706
3484,Rusack 2008 Syrah (Santa Barbara County),"A huge wine, explosive in ripe fruit, elaborated with rich oak and wrapped into smooth, sweet tannins. Made from vineyards throughout the county, it dazzles with a complex of blackberry jam, mocha, date, bacon and smoky sandalwood flavors. Really impressive, especially at this price. Drink Now–2015.",25.0,92,1,0.999695852416706
3487,Viader 2008 Estate Limited Edition Red (Napa Valley),"This interesting wine is an unusual blend of Cabernet Sauvignon and other Bordeaux varieties with nearly half Syrah. It does what Napa does so well, offering a plethora of ripe, delicious cherry, black raspberry, dark chocolate, sweetly smoked oak and peppery spice flavors that are deep and long on the finish. A lovely, accessible wine to drink over the next few years.",50.0,92,1,0.999695852416706
3490,Donelan 2009 Walker Vine Hill Syrah (Russian River Valley),"Very young, needs plenty of time. Still showing fermentation notes, with brisk, grapey acidity and primary cherry and raspberry fruit flavors. Seems brilliantly constructed and capable of aging, though. Hold until after 2012.",45.0,92,1,0.999695852416706
3491,Beckmen 2008 Purisima Mountain Vineyard Grenache (Santa Ynez Valley),"The combination of very high alcohol and what tastes like residual sugar gives this Grenache an excessively sweet, glyceriney taste. It's fabulously rich in raspberry cream, blackberry jam, mocha, vanilla and cinnamon spice flavors. Very flamboyant and delicious, but really more of a dessert wine than a dry table wine.",48.0,91,1,0.999695852416706
3492,Viento 2009 Underwood Mountain Vineyards 55% Riesling/45% Gewurztraminer Ice Wine Gewürztraminer-Riesling (Columbia Gorge (OR)),"A field blend ice wine—don't see that very often—it's full-bodied, almost lush, and packed with mixed slightly candied fruits—tropical, stone fruits and citrus. Concentrated and poised, it balances on fresh acidity. Just a hint of plastic in the back of the finish.",60.0,91,1,0.999695852416706
3494,Clos Pegase 2009 Mitsuko's Vineyard Sauvignon Blanc (Carneros),"The best Clos Pegase Sauvignon Blanc in years. Made with a little oak, just enough for creaminess, it's marked by vibrant acidity and complex, lovely flavors of lemongrass, Meyer lemon candy, vanilla, white pepper and the distinct minerality that Carneros white wines often display. Great price for a wine this sophisticated.",20.0,91,1,0.999695852416706
3496,Elyse 2007 Zinfandel (Howell Mountain),"A real bruiser of a Zinfandel, dark in color, dry and tannic, brimming with massive flavors of wild blackberries, blueberries, dark chocolate and pie spices. The tannins are hard, in the way of this mountain. Drink Now–2013 before it loses fresh fruit.",37.0,91,1,0.999695852416706
3497,Francis Tannahill 2008 Passito White (Oregon),"A blend of Roussanne, Marsanne and Viognier, this was made in the passito style—grapes were dried to concentrate sugars, then pressed and fermented. The result is a terrific and unusual dessert wine, with candied fruits mixing papaya, guava, banana, Meyer lemon and more. The center is simply lush and fruity; the finish tails off gently with a honeyed kiss.",28.0,91,1,0.999695852416706
3502,Frog's Leap 2009 Sauvignon Blanc (Rutherford),"With no oak, this wine's inherent fruit stars, showing citrus, melons and peaches. With crisp acidity, it's clean, brisk and entirely dry, despite relatively low alcohol. But it's strong in those perfumed pyrazines that turn some people off.",18.0,86,1,0.999695852416706
3504,Washington Hills 2008 Riesling (Washington),"At 2.3% residual sugar, this is nicely balanced between sweet and dry. The fruit links peach, apricot and pear with a honey in tea streak that carries into the finish.",10.0,86,1,0.999695852416706
3505,Tagaris 2007 Frank Chiullino Chef Blend Red Red (Columbia Valley (WA)),"This red wine, named for the chef at the winery restaurant, is fruity and high-toned, with lots of cherry and berry flavor. All neutral oak, soft tannins, ready to drink.",55.0,86,1,0.999695852416706
3513,Crane Brothers 2006 Crane Ranch Vineyard Syrah (Napa Valley),"Rich in berry, cherry, cola, pepper and sandalwood flavors, but a bit off in texture. Feels jagged and angular, with some green tannins. Ready now.",36.0,86,1,0.999695852416706
3516,Enkidu 2006 Fazekas Petite Sirah (Napa Valley),"Showing the hard tannins and dryness of a young Petite Sirah, this is the kind of wine you normally would cellar. But there's a little streak of green unripeness that suggests aging will lead nowhere. So drink it now with big, lusty fare.",34.0,86,1,0.999695852416706
3518,Villa San Juliette 2008 Sauvignon Blanc (Paso Robles),"A very nice, likeable and super-drinkable Sauvignon Blanc, at an everyday price. Nicely crisp and just slightly sweet, it shows fruity flavors of citrus and tropical fruits, pears and melons.",12.0,86,1,0.999695852416706
3538,Plaisance Ranch 2013 Ranch Red (Applegate Valley),"This Bordeaux-style blend is 25% Merlot, the rest an even split between Malbec and Cabernet Franc. Stiff, tannic and earthy, it delivers robust flavors of herb and bark more than ripe fruit. With its assertive tannins, it should stand up well to a grilled tri-tip.",25.0,87,1,0.999695852416706
3540,Rodney Strong 2013 Zinfandel (Dry Creek Valley),"Leather saddle wafts from the glass atop ripe cherry, blackberry jam and brown sugar. Tightly wound in tannin and oak, this wine becomes pleasantly juicy on the finish.",30.0,87,1,0.999695852416706
3542,Sarah's Vineyard 2011 Old Vine Zinfandel (Santa Clara Valley),"Lavender and lilac are just part of the floral bouquet that emerges from this wine, which also shows a blackberry vinaigrette element on the nose. Once sipped, it's like sucking on a purple-flower candy, with more lavender as well as plum and a pencil-lead edge that cuts through the palate.",30.0,87,1,0.999695852416706
3544,Buena Vista 2013 Attila's Selection Zinfandel (Sonoma County),"This is a thick, rich and very ripe wine, with a charred back note making its way against higher-toned tastes of red raspberry and blackberry. The oak is integrated and the wine softly varietal, but it packs a punch on the palate.",38.0,87,1,0.999695852416706
3546,Glen Ellen 2009 Old Vine Zinfandel (California),"Pretty good for the price, with jammy cherry, berry, cocoa and spice flavors. An easy Zin to drink with BBQ or pasta with tomato sauce.",10.0,83,1,0.999695852416706
3547,Manzanita Creek 2005 Carreras Ranch Zinfandel (Dry Creek Valley),"A heavy, sweet Zin. With 16% alcohol, it tastes like a simple Port, with raisin, blackberry and chocolate flavors.",38.0,83,1,0.999695852416706
3551,Robert Mondavi 2010 Pinot Grigio (California),"Overtly sweet, with a white sugar edge to the citrus fruits, this is basically a dessert wine. Earns extra credit for cleanness and crisp acidity.",11.0,83,1,0.999695852416706
3554,Brophy Clark 2009 G-S-M (Santa Ynez Valley),"This blend of Grenache, Syrah and Mourvèdre is unbalanced. It's sweet in dessert red berry fruit, with an awkward streak of acidity.",13.0,83,1,0.999695852416706
3557,Cedar Mountain 2007 Hansen Vineyard Reserve Zinfandel (Livermore Valley),"Funky with prune and tobacco overwhelming any fresher fruit, this Livermore Zin is high in alcohol (15.8%), which coats the tongue for a long time after the wine goes down.",33.0,83,1,0.999695852416706
3561,Cosentino 2008 The Novelist Meritage (California),"A clumsy wine that aims for white Bordeaux in style and falls far short. There's plenty of oak and lees, but the underlying wine is thin and disappointing in citrus flavor.",18.0,83,1,0.999695852416706
3568,Jarvis 2008 Will Jarvis' Science Project Red (Napa Valley),"This weirdly named wine is a blend of 95% Cabernet Franc and 5% Merlot. It's a bit soft and melted in texture, like liquid licorice, with flavors of cherries, red currants, mocha, anise and smoky oak, and the finish is dry. Notable for the elegance and purity of its tannin structure.",105.0,90,1,0.999695852416706
3571,Syncline 2009 Subduction White White (Columbia Valley (WA)),"The latest version of this popular blend drops the Chardonnay and adds 11% Grüner Veltliner to the Roussanne-Viognier blend. It seems to elevate the aromatics, pushing lush scents of lemon drop, pineapple, and candied orange peel forward. Those perfectly rendered citrus peel flavors put a frame around the tart fruit, and there is a hint of white pepper in the spicy finish.",18.0,90,1,0.999695852416706
3576,Margerum 2007 M5 Red (Santa Barbara County),"A Châteauneuf-du-Pape-style Rhône blend that really nails it for satisfaction. Rich and fruity, spicy, yet with great structure. Defines the vintner's art of blending, comprised of five varieties sourced from a dozen vineyards. Fun and serious at the same time.",24.0,90,1,0.999695852416706
3577,Pedroncelli 2007 Family Vineyards Petite Sirah (Dry Creek Valley),"This is a great value in a Petite Sirah that shows how well the variety performs in a great vintage in a warmer climate. With 20% Syrah, which seems to add richness and nobility, the wine is bone dry and elegant in mouthfeel, with complex blackberry, black currant, grilled beef, black pepper and cedar flavors. Drink now.",15.0,90,1,0.999695852416706
3581,Longboard 2009 Sauvignon Blanc (Russian River Valley),"Just the kind of Sauvignon Blanc the valley produces so well. It's flavorful in citrus fruits, peaches, golden mangoes and honey, yet balanced with racy acidity. The dry, crisp finish makes it an ideal cocktail sipper.",20.0,90,1,0.999695852416706
3582,Margerum 2007 Colson Canyon Vineyard Syrah (Santa Barbara County),"If more Syrah tasted like this, more people would drink it. Beautifully ripe and soft, pure and rich in cherry and raspberry liqueur, smoke and pepper flavors. Ready now.",36.0,90,1,0.999695852416706
3591,X 2005 Petite Sirah (Paso Robles),"This is a heavy, bitterly tannic young wine that shows ripe blackberry and coffee flavors and spices. The raw astringency makes it tough now, fit only for greasy foods like barbecued ribs. It should age well for a long time, but will never quite overcome its rustic profile.",25.0,85,1,0.999695852416706
3597,Seia 2005 Alder Creek Vineyard Syrah (Horse Heaven Hills),"This is very soft upon entry, with remnants of penetrating spicy and herbal flavors that might have punched up the intensity if they hadn't been somehow smoothed over. It's difficult to assess, because many of the right pieces are all here, but somehow they have not jelled. The wine tastes acidic and sharp, with pineapple and citrus dominating, and a chalky, tannic finish. Perhaps it's just a matter of time?",30.0,85,1,0.999695852416706
3598,Kindred 2005 Marsanne-Roussanne-Viognier White (Russian River Valley),"This Rhône blend is soft and sugary sweet, with a honeyed, vanilla fudge and smoky oak edge. The underlying wine flavors are of peaches, pineapples and yellow apricots.",32.0,85,1,0.999695852416706
