,title,description,price,points,cluster_label,cosine_similarity
74949,Hard Row To Hoe 2007 Shameless Hussy Barbera (Columbia Valley (WA)),"This Barbera is very pruney in the nose, with scents of smoked meat under the fruit. Despite the suggestion that the grapes got a little baked, there is plenty of acid, perhaps an indication that this varietal is difficult to get right in Washington State vineyards. Drink this one soon.",20.0,85,1,0.9791730291902131
74952,Chaddsford 2007 Syrah (Pennsylvania),"There's ample varietal typicity here, with black and white pepper and meat notes on top of layers of green herbs, and licorice. Structurally, however, the wine has a few sharp elbows, with dry tannins and a disjointed oak note. All this is topped off by a pleasant, Fernet Branca-spiked finish. Drink now.",19.0,85,1,0.9791730291902131
74954,Snake River 2007 Arena Valley Vineyard Grenache,"Really charming, with sweetish brambly fruit and smooth plum nuances. Fairly concentrated, with a juicy, date and cranberry finish. Try with barbecue. Drink now to 2011.",19.0,85,1,0.9791730291902131
74956,Three Fox 2007 Il Signor Reserve Sangiovese (Virginia),"All cherry and sawdust upfront, backed up by a bed of velvety tannins. Vanilla and char notes dominate the palate while some berry-intense flavor comes through on the crisp finish. A year in the cellar would allow for some needed integration.",29.0,85,1,0.9791730291902131
74957,Vin du Lac 2007 Barrel Select Syrah (Columbia Valley (WA)),"Sweet, grapey, raspberry fruit is smothered in sweet spices, with flavors of spun sugar candy.",28.0,85,1,0.9791730291902131
75131,Glen Ellen 2007 Proprietor's Reserve Petite Sirah (California),"A bit thin and rugged, but gets the red wine job done, with cherry, plum and black pepper flavors that finish dry.",10.0,83,1,0.9791730291902131
75135,Minassian-Young 2007 GMSV Red (Paso Robles),"A basic red Rhône blend, with a dash of Viognier for acidic brightness. Shows simple, thin flavors of raspberries and cherries, with a dash of sweet oak.",22.0,83,1,0.9791730291902131
75141,Robert Pepi 2007 Pinot Grigio (California),"Bone dry and nicely crisp, and the price is right, but the wine itself has some problems. The fruits tend toward lean, tart grapefruits, lemons and limes, with a touch of vegetable.",11.0,83,1,0.9791730291902131
75143,Glen Ellen 2007 Proprietor's Reserve Old Vine Zinfandel (California),"Weedy and vegetal despite some decent raspberry, cherry and spice flavors. Okay for a big party where nobody's fussy.",10.0,83,1,0.9791730291902131
75144,Lava Cap 2007 Spring House Zinfandel (El Dorado),"Simple and jammy, this Zin shows fruity flavors of raspberries, cherries and oranges. It's a little sugary sweet.",22.0,83,1,0.9791730291902131
75148,Thacher 2007 Controlled Chaos Red (Paso Robles),"Soft and slightly sweet, this wine tastes like raspberry and cherry syrup with a dash of melted milk chocolate. It's also hot, with 15.7% of alcohol. Zinfandel, Mourvèdre and Grenache.",33.0,83,1,0.9791730291902131
75149,Thacher 2007 Triumverate Reserve Zinfandel (Paso Robles),"Good berry, cherry, chocolate, tobacco and spice flavors in this Zinfandel, but it's too soft and flat in structure. It's also frankly hot, with 15.7% alcohol, and has a Porty finish.",36.0,83,1,0.9791730291902131
75150,Minassian-Young 2007 Grenache (Paso Robles),"A simple wine, with cola, herb and raspberry tea flavors that are dry, but have a sharp mouthfeel. Seems unevenly ripened, with awkward tannins.",22.0,83,1,0.9791730291902131
75151,Niner 2007 Bootjack Ranch Sangiovese (Paso Robles),"Tart in acidity, with simple cherry flavors that taste baked into a pie. But the finish is fully dry. Tannic, too, with the result that the mouthfeel is hard as nails.",24.0,83,1,0.9791730291902131
75154,Buttonwood Farm 2007 Estate Grown Cabernet Franc (Santa Ynez Valley),"Not a bad wine, but green and minty-sweet, like a raspberry sour candy lozenge. The grapes and tannins just didn't get ripe enough.",22.0,83,1,0.9791730291902131
75157,Minassian-Young 2007 Black St. Peter Red (Paso Robles),"Soft and melted in fruit, with high alcohol that gives it a burn, this Zinfandel and Mourvèdre-based blend has raspberry, cola and spice flavors. Drink now with spicy burgers, ribs, roast pork.",23.0,83,1,0.9791730291902131
75260,Rancho Sisquoc 2007 Flood Family Vineyards Malbec (Santa Barbara County),"Very dry and tannic, a somewhat austere wine. But it has a deep core of blackberries and black currants along with a meatiness, like charred beef off the grill. Interesting and complex, for slow sipping with complex beef, pork and lamb dishes.",30.0,91,1,0.9791730291902131
75270,Clos du Val 2007 Merlot (Napa Valley),"A very pretty Merlot, and a good price for the elegant quality. It's dry and tannic, showing the Clos du Val style of controlled, somewhat aloof ripeness. There's a rich, attractive core of black cherry fruit. Will develop for a few years, but it's really best now, with a brief decant.",26.0,90,1,0.9791730291902131
75279,Sinclair Estate Vineyards 2007 Syrah (Columbia Valley (WA)),"Roundly fruity, loaded with bright berries, and nicely spiced with herbal (tobacco) highlights.  Immediately approachable and nicely structured, this open and generous effort glides into a smooth and chocolaty finish. The tannins have been especially well ripened and polished, so the bright fruit has no sharp edges.",35.0,90,1,0.9791730291902131
75280,Tempus Cellars 2007 Syrah (Columbia Valley (WA)),"Winemaker Joe Forest has brightened the fruit and livened up the mouthfeel by blending in 20% Grenache. Fresh raspberry flavors are wrapped into the earthier, herbal, lightly chocolaty character of the Syrah. Once-filled French barrels were used.",25.0,90,1,0.9791730291902131
75281,Three Rivers 2007 Malbec (Columbia Valley (WA)),"This is 90% Malbec and 10% Cabernet Sauvignon; it's dark, toasty, smoky, earthy and dappled with ground coffee flavors. The fruit holds its own—it's tight and tart and firm, with plenty of blackberry flavor. This wine keeps resonating through the palate into a solid, textural finish.",29.0,90,1,0.9791730291902131
75305,Sherwood House Vineyards 2007 Merlot (North Fork of Long Island),"Smoke and dark chocolate notes abound on this elegant Long Island Merlot (made with 10% Petit Verdot). A touch austere on the palate, it has a black plum flavor shaded with hints of resin, leaves and game. Bold tannins add structure and power.",30.0,86,1,0.9791730291902131
75308,Albemarle 2007 Simply Red Red (Monticello),"This blend offers flavors of blackberry jam, pastry spice, plum and licorice. It's full bodied, with a sturdy structure and forward flavors. The medium-to-long finish offers a spiced-berry note. Pair this with barbecued ribs or grilled New York strips.",18.0,86,1,0.9791730291902131
75562,Indigené 2007 Philanthropist Red (Central Coast),"This red blend is dry, tannic and coarse. It's also packed with cherry and blackberry jam flavors.",21.0,84,1,0.9791730291902131
75820,Eberle 2007 Steinbeck Vineyard - Wine-Bush Vineyard Zinfandel (Paso Robles),"A good, robust, everyday Zinfandel, with some special features. It's soft and dry and very flavorful, offering waves of raspberries, cherries, mocha, spices and sandalwood. Gets a few extra points for the finely ground tannins and clean, brisk scour of acidity.",24.0,88,1,0.9791730291902131
75825,Ca' del Solo 2007 Ca' del Solo Vineyard Muscat (Monterey County),"This is just the kind of white wine California needs more of. It's crisp in acidity, with a brilliant, unoaky focus of fruit. Best of all, the alcohol is a low 12.5%. There may be some residual sugar, but the tangerine flavors are so crisp, the wine feels dry. What a great sommelier wine.",17.0,88,1,0.9791730291902131
75836,Joseph Phelps 2007 Eisrébe White (Napa Valley),"A beautifully sweet, honeyed dessert wine with savory flavors of apricots, green apples and pineapples, this sweety is balanced with crisp acidity. Easy to drink, with just 8% alcohol.",50.0,88,1,0.9791730291902131
76063,Robert Hall 2007 Syrah (Paso Robles),"Made in a lighter, more elegant and accessible style, this is very fine and impressive Syrah, at a good price. Thoroughly dry and moderate in alcohol, it shows rich, smooth tannins that frame interesting flavors of blackberries, currants, sour cherry candy, tobacco, leather, crushed black pepper and smoky sandalwood. Ready now.",21.0,90,1,0.9791730291902131
76220,Terra d'Oro 2007 Deaver Vineyard Zinfandel (Amador County),"With inviting Dr. Pepper-like aromas, this Terra d'Oro Deaver Vineyard wine is structured like a building, with lots of savory layers over sweet. It's big alcohol-content wise at 15.5% but is a good example of Deaver's intriguing blend of power and finesse.",30.0,88,1,0.9791730291902131
76224,Aquinas 2007 Philosopher's Blend Reserve Red Red (Napa Valley),"A lovely, easy-to-like Bordeaux blend that stands proud next to Napa wines far more expensive. It's rich and sweet in raspberries, cherries and blackberries, with a smoky coat of oak. Drink now.",25.0,88,1,0.9791730291902131
76228,Brian Carter Cellars 2007 Tuttorossso Red (Yakima Valley),"This is Brian Carter's SuperTuscan blend––Sangiovese-dominated with 18% Cabernet Sauvignon and 11% Syrah. Stiff and unyielding when first opened, it rewards decanting with a broader expression of black, tarry fruits, black olives, coffee beans and dark chocolate.",30.0,88,1,0.9791730291902131
76309,Terry Hoage 2007 The 46 Grenache-Syrah (Paso Robles),"Here's a dark, rich, ripe and full-bodied southern Rhône-style wine that personifies Paso Robles reds. A blend of Grenache and Syrah, it offers gobs of cherry pie filling, anise, bacon and peppery spices wrapped into soft tannins. Finishes a bit hot. Drink soon.",45.0,88,1,0.9791730291902131
76314,Mazzocco 2007 West Dry Creek Zinfandel (Dry Creek Valley),"Mazzocco's Zins are dependably superripe and high in alcohol. This '07 is a big, strong wine, offering flavors of blackberry and blueberry jam, spread onto buttered white toast and sprinkled with anisette. It's delicious and heady.",32.0,88,1,0.9791730291902131
76316,Wilson 2007 Diane's Reserve Zinfandel (Dry Creek Valley),"A big, soft, ultrarich style of Zinfandel. It has very high alcohol, with flamboyant flavors of milk chocolate, oozingly ripe blackberries and blueberries, anise liqueur and black pepper. The finish is totally dry. Lusty and heady.",60.0,88,1,0.9791730291902131
76430,Zaca Mesa 2007 Black Bear Block Syrah (Santa Ynez Valley),"Made from 100% Syrah, this wine shows Zaca Mesa's house style of exceptionally ripe, heady fruit flavors tucked into a balanced, dry wine. It's as lush as velvet in the mouth, with complex flavors of blackberries, anise, cocoa and black pepper. Feels soft and light and yet powerful and insistent at the same time. Drink now–2013.",60.0,93,1,0.9791730291902131
76434,Terlato 2007 Pinot Grigio (Russian River Valley),"Break out the hors d'oeuvres for this tart young Pinot Grigio. It needs food to balance it out. The acid-backed flavors are savory, and include Meyer lemons, limes, lemongrass and sweet butter. Try with delicious little fish and pork appetizers baked in phyllo.",26.0,87,1,0.9791730291902131
76448,Lost Canyon 2007 Alegria Vineyard Syrah (Russian River Valley),"A good, complex, full-bodied Syrah, with some toughness in the texture and a minty note that's less than ripe. Bigtime tannins and extreme dryness call for well-marbled beef to coax out its best.",38.0,87,1,0.9791730291902131
76765,Occidental Road Cellars 2007 Syrah (Russian River Valley),"This Syrah was grown and produced by the winery owners, and held back almost five years before release. That's an impressive act of courage, but it has benefited the consumer. The wine, while still somewhat tannic, feels mellow, with a complex array of black fruits and berries, grilled bacon, sweet tobacco, dark chocolate and, above all, freshly crushed black pepper. An impressive Syrah that should change in interesting ways over the next six years.",38.0,93,1,0.9791730291902131
76889,:Nota Bene 2007 Ciel du Cheval Vineyard Syrah (Red Mountain),"Lovely delineation here, the berry/cherry fruit framed with coffee and chocolate from a 50/50 mix of French and American oak barrels. The surprise is the addition (via co-fermentation) of 6% Viognier, which stabilizes color and gives a pleasing, floral/citrus lift to the scents and flavors. Good balance and follow through.",35.0,91,1,0.9791730291902131
76892,William Church 2007 Sur La Mer Red (Columbia Valley (WA)),"A Bordeaux blend of five grapes, this melds blackberry and black cherry fruit with plenty of toasty oak and ground coffee. It's a nice mix of fruit and barrel, dark and smoky, but not too heavy at 14.2% alcohol.",28.0,91,1,0.9791730291902131
76893,Beresan 2007 The Buzz Red (Walla Walla Valley (WA)),"There should be plenty of buzz about The Buzz. Dense and dark, loaded with black fruits, coffee grounds and ground pepper, this high-alcohol, slightly volatile wine is not unlike some cult wines selling for four times the price.",19.0,91,1,0.9791730291902131
76894,Chateau Ste. Michelle 2007 Canoe Ridge Estate Merlot (Horse Heaven Hills),"A fine effort in this classic vintage, the Merlot is firm, almost muscular, and dappled with fresh herbs—cilantro and basil. The brambly blackberry fruit has the power to more than hold its own after 18 months in two-thirds new French oak.",22.0,91,1,0.9791730291902131
76928,Dusted Valley 2007 Grenache (Columbia Valley (WA)),"Grenache is not an easy grape to ripen in Washington, but this is just about perfect—juicy with fresh berry and rhubarb fruit, and added notes of marjoram, rosemary and cracked pepper. Full-bodied and pushing close to 15% alcohol, this is fine pizza wine.",28.0,89,1,0.9791730291902131
76939,Damiani 2007 Barrel Select Merlot (Finger Lakes),"The inky purple color announces the very serious intention of this robust, fruit-focused Merlot. Liquor-like intensity and gripping tannins command your attention while mocha, vanilla, cassis and raspberry flavors keep your palate entertained. The plum-infused finish is long and flavorful. Better after 2010.",35.0,89,1,0.9791730291902131
77179,Arcadian 2007 Stolpman Vineyard Syrah (Santa Ynez Valley),"This is a current release from Joe Davis, who holds his wines back until their prime. Hailing from Ballard Canyon, it shows black plum, pressed purple flowers, tanned leather and balsamic notes on the nose. There's a pleasantly yet softly structured texture to the palate, where dried blackberry, roast beef, lilac and Concord grape flavors arise.",45.0,93,1,0.9791730291902131
77284,Lake Sonoma 2007 Pinot Gris (Russian River Valley),"An easy, versatile food wine or cocktail sipper marked by crisp acidity and slightly sweet flavors of apricots, pineapples, oranges, vanilla and honeysuckle flowers.",17.0,84,1,0.9791730291902131
77287,Fritz 2007 Sauvignon Blanc (Russian River Valley),"Pretty thin, with very high acidity and just a trace of lemon, grapefruit and pepper flavors. The dryness and tartness are really clean and bracing, but if you're looking for richness, this will disappoint.",18.0,84,1,0.9791730291902131
77297,Perbacco Cellars 2007 Pinot Grigio (Santa Barbara County),"A little on the sweet side, with Lifesaver candy lemon, lime and pineapple flavors, this unoaked PG is clean and balanced with crisp acidity.",14.0,84,1,0.9791730291902131
77400,Wilson 2007 Ellie's Vineyard Petite Sirah (Dry Creek Valley),"Few wines are as ripe and fruity as this. It's explosive in raspberry jam and cherry pie flavors, with scads of dusty pie spices, and the smooth tannins make it silky in the mouth. The problem is excessive sweetness. If you like a sugary, glyceriney edge to your red wines, it's for you.",35.0,85,1,0.9791730291902131
77487,Mount Baker 2007 Barrel Select Syrah (Yakima Valley),"This “Barrel Select” Syrah has been ripened to pruneyness, yet remains short, hot and simple. It could be any red grape left to hang late and fermented at (perhaps) high temperatures.",14.0,83,1,0.9791730291902131
77719,Niner 2007 Bootjack Ranch Merlot (Paso Robles),"Good, deeply extracted flavors in this darkly soft wine, with blackberries, plums and spicy, chocolaty chai tea. It's nicely dry. The tannins are a little off, with some ragged, green edges that won't age away, so drink now.",24.0,86,1,0.9791730291902131
77726,Amalie Robert 2007 Syrah (Willamette Valley),"This is cool-climate fruit, from a vintage the winery describes as “the coolest year we have ever seen.” Nonetheless they have made a good wine, with balanced scents and flavors. It's definitely herbal, but also brings some cured meat and tart, wild cherry flavors into play.",35.0,86,1,0.9791730291902131
77734,Darcie Kent Vineyards 2007 DeMayo Vineyard Zinfandel (Livermore Valley),"Lots of briary wild blackberry, cherry and exotic spice flavors in this Zin, with cola, tobacco and mushu plum sauce complexities, and the finish is dry. Compromised by a hit of sharp acidity, but rich barbecue will help.",30.0,86,1,0.9791730291902131
77868,Geyser Peak 2007 Block Colection Russian River Ranches Sauvignon Blanc (Russian River Valley),"A really nice, versatile white wine to have with everything from salad Nicoise to roast chicken and pork enchiladas. Crisply acidic and bone dry, it shows tasty lemon and lime flavors, lots of pepper and a hint of gooseberry.",20.0,90,1,0.9791730291902131
78017,Castello di Borghese 2007 Cabernet Franc (North Fork of Long Island),"While soft on entry with slightly pulpy, sweet plum flavors, this Cab Franc gains intensity on the midpalate as spicy bramble notes and soft tannins accumulate. Approachable in style, it's a pleasant everyday red with just a hint of leafy green on the finish.",25.0,85,1,0.9791730291902131
78099,Jalama 2007 Giallo White (Santa Barbara County),"Made from Pinot Gris, this dry white wine tastes too oaky in buttered toast, buttered popcorn and caramel. It finishes with raw acidity.",20.0,82,1,0.9791730291902131
78101,Clayhouse 2007 Adobe Red Red (Central Coast),"A rugged wine, with harsh tannins and a green, unripe taste to the cherry-berry flavors.",15.0,82,1,0.9791730291902131
78110,Cinnabar 2007 Merlot (Paso Robles),"Ultraripe, simple and almost as sweet as jelly, with flavors of cherries, raspberries and vanilla. The alcohol is 15.9%.",21.0,82,1,0.9791730291902131
78143,Terlato 2007 Episode Red (Napa Valley),"This is Terlato's ambitious entry into the cult Cabernet lottery. Based on Cabernet Sauvignon, with Merlot, Petit Verdot and Cabernet Franc, it's an elaborate wine, deep and long in blackberry, cherry, currant, mocha and sandalwood flavors. The tannins are impressive, yet young, giving a tough, astringent mouthfeel. But ageability is brought into question by some superripeness, in the form of raisins.",175.0,90,1,0.9791730291902131
78206,Clos du Val 2007 Three Graces Blend Red (Napa Valley),"Clos du Val has always made wines with long-term cellaring in mind. This blend, based on Cabernet Sauvignon, is dry and tannic, with spicy, toasty oak dominating. Beneath that are rich, compelling notes of cassis and dark chocolate. The alcohol is refeshingly low, below 14%. This dramatic wine needs a minimum of six years, and should develop for at least ten.",65.0,93,1,0.9791730291902131
78464,Caraccioli 2007 Brut Cuvée Sparkling (Santa Lucia Highlands),"This sparkling wine, a blend of 60% Chardonnay and 40% Pinot Noir, is dry, creamy and rich in flavors of citrus, yeast and vanilla. It feels refined and silky on the palate, with a honeyed finish.",52.0,90,1,0.9791730291902131
78678,Jacob Franklin 2007 #50 Mon Chou Red (Napa Valley),"Marked by enormously ripe, powerful fruit flavors, this wine explodes with jammy blackberries, cherries and red plums. Oak adds even richer notes of toast and sweet caramel. Drink this deliciously soft wine now.",55.0,88,1,0.9791730291902131
78708,Veritas 2007 Doug & Mary Wolf Special Edition Reserve Cabernet Franc (Monticello),"This special edition release is perfect for those drinkers who enjoy the herbal and savory side of aged Cab Franc. Dried tobacco, jalapeño and red currant reduction start on the nose and carry to the medium-bodied palate. Streaks of graphite offer a bit of life to a wine that should be enjoyed soon. With its sandy tannins and still lively acid, enjoy alongside a lamb shank.",35.0,88,1,0.9791730291902131
78969,Kiona 2007 Reserve Estate Dry White Riesling (Red Mountain),"Spritzy, with light stone fruit flavors suggesting peach and pear. Hints of residual sugar, some good texture in the mouth, and a lactic, slightly buttery finish.",13.0,86,1,0.9791730291902131
79065,Ehret 2007 Syrah (Knights Valley),"Quite a good Syrah, although it's a little too soft, so open it now because it won't hold for too long. It's dry and silky smooth in the mouth, with rich, ripe blackberry, blueberry, chocolate, bacon and pepper flavors.",28.0,88,1,0.9791730291902131
79067,Zerba Cellars 2007 Wild Z Red (Walla Walla Valley (OR)),"Zerba's crowd-pleasing Wild Z blends Merlot, Cabernet Sauvignon and Syrah about equally, with a splash of Cabernet Franc to finish it off. It's a ripe, full, forward, chocolaty mouthful. It keeps the red fruit tart and tantalizing, while loading in the barrel flavors (French and American) to round off the finish. A fine follow-up to the excellent 2006.",20.0,88,1,0.9791730291902131
79068,Abacela 2007 Malbec (Umpqua Valley),"Exotic scents immediately characterize this wine as fascinating; weaving together incense, smoke, wild berry, baking spices and plum jam. Yet the wine retains a delicacy, lightness, its flavors based upon juicy acids rather than new oak. It showcases the fruit, and does so with grace and panache.",22.0,88,1,0.9791730291902131
79167,O•S Winery 2007 Champoux Vineyard Riesling (Horse Heaven Hills),"Intense, spicy and loaded with grapefruit, pineapple and citrus, this has a unique intensity and power. If you distill Washington Riesling down to its essential fruit/sugar/acid components, this expresses it beautifully. At just 9.8% alcohol, it's a definite Kabinett style, with so much acid that the 2% sugar does not signify.",22.0,91,1,0.9791730291902131
79277,Terra d'Oro 2007 Home Vineyard Zinfandel (Amador County),"A little too sweet, with a candied taste of sugared cherries, blackberries and cola, and a dash of caramel. Other than that the tannins are very fine.",30.0,84,1,0.9791730291902131
79278,Terra d'Oro 2007 Sangiovese (Amador County),"A tough, gritty wine not offering much richness. It's very dry and quite acidic, and the modest cherry flavors veer into tobacco, white pepper and sage.",18.0,84,1,0.9791730291902131
79281,Harmony Cellars 2007 Diamond Reserve Petite Sirah (Paso Robles),"There are some tough, astringent tannins in this wine that make it harsh on the palate and bitter on the finish. The actual flavors are of cola, raisins and black currants. Doesn't seem like an ager.",37.0,84,1,0.9791730291902131
79506,Concannon 2007 Nina's Cuvee Petite Sirah (Livermore Valley),"From one of Livermore's oldest producers, a small-production Petite Sirah, one of their specialties, all from an estate vineyard planted 40 years ago, this wine is super dark purple in color, very earthy, with nice chocolate and delicate fruit interspersed among the dusty tannins. Pretty and interesting.",25.0,87,1,0.9791730291902131
79516,Macari 2007 Rosé (North Fork of Long Island),"Strawberry cream on the nose and a subtle touch of lemon blended in with strawberry flavors gives this rosé a pretty balance of sweet and crisp. Fun, but with substance, it could be paired with everything from a light seafood salad to a heartier poultry dish.",15.0,86,1,0.9791730291902131
79540,Ironstone 2007 Obsession Symphony (California),"Ironstone's track record for this pretty dessert wine continues with the '07. It's off-dry, with residual sugar just under 2%, and polished flavors of pineapples, oranges, marzipan, honey and vanilla. High acidity adds the perfect touch of crispness.",8.0,85,1,0.9791730291902131
79572,Starry Night 2007 The Caboose Zinfandel (Alexander Valley),"Heavy in alcohol and overripe, but entirely dry, and the black currant, chocolate and pepper flavors will play well against richly sauced barbecue.",30.0,84,1,0.9791730291902131
79584,Dr. Konstantin Frank 2007 Pinot Gris (Finger Lakes),"Refreshing, lively, this Pinot Gris starts with aromas of grapefruit and lemon and leads into zesty flavors of white pepper, lemon and grapefruit. A touch acidic, the wine could use more fruit balance, but overall an enjoyable dry white choice.",17.0,83,1,0.9791730291902131
79625,Chaddsford 2007 Portfolio Collection Due Rossi Barbera-Sangiovese Red (Pennsylvania),"Fresh and appealing, this unusual blend of 80% Barbera and 20% Sangiovese really works. It's crisp and delicate, with obvious vanilla and mocha notes from 10 months aging in oak barrels and a medium, very berry finish. Try with grilled meat.",25.0,85,1,0.9791730291902131
79848,Kokomo 2007 Zinfandel (Sonoma County),"A lovely Zinfandel, soft and delicious. It has very ripe flavors of red cherries, red currants, raspberries, cocoa, anise and peppery spices, wrapped into rich, finely ground tannins. Drink now.",22.0,88,1,0.9791730291902131
79852,Woodinville Wine Cellars 2007 Artz Vineyard Sauvignon Blanc (Red Mountain),"A compelling mix, with bright, vivacious fruit flavors running from apple to pear, peach to papaya. The influence of barrels is felt more than tasted, but it does add a whisper of toast to the finish. Lively and fresh, this is a great wine for richer seafood.",18.0,89,1,0.9791730291902131
