,title,description,price,points,cluster_label,cosine_similarity
3647,Valentin Bianchi 2014 Famiglia Bianchi Cabernet Sauvignon (Mendoza),"Roasted, gritty aromas of bacon and spicy oak are burnt on the surface. This is fleshy and full in body, with moderate acidity. Herbal, minty, lightly green berry flavors have a rooty accent and oaky makeup. Finishing flavors of mint and raw oak blend into herbal berry leftovers.",20.0,88,8,0.9994698635153196
3770,La Playa 2013 Block Selection Tinga Reserve Cabernet Sauvignon (Colchagua Valley),"Dry, dusty blackberry aromas are restrained yet clean. This shows more density on a palate, with jammy black-plum and berry flavors leading to a fresh and satisfying full-length finish.",12.0,87,8,0.9994698635153196
3787,Concha y Toro 2013 Serie Riberas Gran Reserva Ribera del Tinguiririca Cabernet Sauvignon (Marchigue),"Light but staunch cherry and cassis aromas are infused with herb and spice notes. This is tight in feel, with bracing tartaric acidity that results in surface-level flavors of red-berry fruits. Racy, mildly green notes are present on a snappy, hot finish.",17.0,87,8,0.9994698635153196
3898,Watershed 2005 Awakening Cabernet Sauvignon (Margaret River),"Lifted and juicy, this impressive effort from Western Australia shows woodsy, cedary notes on a restrained nose. The palate is drenched in gorgeous cassis and cherry cordial fruit framed by gentle tannins. The crisp finish will cut through steak or pork dishes. Imported by America Uncorked.",25.0,89,8,0.9994698635153196
4020,Vicente Gandia 2010 Organic Cabernet Sauvignon (Spain),"The tea and raspberry aromas are easygoing, and that best describes this organic Cabernet Sauvignon. It's powerful enough on the palate, with a good berry flavor that tilts towards raspberry. The finish is herbal and peppery.",8.0,85,8,0.9994698635153196
4117,Viñalba 2014 Reserva Cabernet Sauvignon (Valle de Uco),"Damp earthy berry aromas are a touch murky. This feels bulky, grabby and tannic, while overriding flavors of coffee, toast and bitter chocolate make fruit a bit player. A choppy finish with hard tannins and herbal berry flavors puts this Cabernet in the midtier category.",15.0,85,8,0.9994698635153196
4192,Stark-Condé 2006 Cabernet Sauvignon (Stellenbosch),"This is an interesting Cabernet because of its balance of rich, plush fruit and exotic, plucky spice. The nose offers cloves, pepper and mocha, and on the palate, flavors of smoke, cracked pepper and plum are inviting. A stylish sip with aging potential.",27.0,89,8,0.9994698635153196
4232,Luigi Bosca 2012 Cabernet Sauvignon (Mendoza),"Crisp almost scratchy aromas of herbal red fruits are a bit strained. This feels solid, with ample volume. Earthy flavors of tomato sauce, mixed spices, stewed plum and cassis finish long and herbal, with some grace.",22.0,87,8,0.9994698635153196
4487,Rietvallei Estate Wine 2007 Juanita Rosé Cabernet Sauvignon (Robertson),"Fresh, fruity and charming, this rosé offers full-bodied flavors of strawberry and spice that are balanced and complex. A step above the typical flirty rosé, the wine gives style and substance and will handle heartier dishes—think Moroccan tagine or grilled, spiced fish.",19.0,88,8,0.9994698635153196
4582,Valle Secreto 2010 First Edition Cabernet Sauvignon (Cachapoal Valley),"On the nose, this Cab delivers a mix of vinegar, rubber and jumpy berry aromas. The palate is smooth but bland and soft, while flavors of licorice, prune and herbal notes finish easy.",18.0,86,8,0.9994698635153196
4584,Mancura 2011 Guardián Reserva Cabernet Sauvignon (Maipo Valley),"Scratchy berry aromas come with a hint of sweet-smelling plastic, but overall this bargain-priced Cab is good and welcoming. The palate has a pure, medium-bodied feel, while flavors of baked berry, cassis and chocolate finish with a mocha taste and mild heat.",10.0,86,8,0.9994698635153196
4596,Emiliana 2011 Natura Cabernet Sauvignon (Central Valley),"Minty aromas rest on top of scratchy raspberry scents. This feels a touch raw and choppy, with grating tannins pumping up herbal berry flavors that come with a carob-influenced aftertaste. A short, lightly herbal finish feels good and solid.",11.0,86,8,0.9994698635153196
4618,Concha y Toro 2013 Don Melchor Puente Alto Vineyard Cabernet Sauvignon (Puente Alto),"Initially this smells foxy, with jumpy untamed berry and plum notes racing across the nose. After the aromas come around, this is hard and choppy on the palate, while herbal black-plum and carob flavors finish more lushly than before, but still fairly tannic. Drink through 2023.",120.0,92,8,0.9994698635153196
4627,Koyle 2013 Royale Los Lingues Vineyard Cabernet Sauvignon (Colchagua Valley),"Spicy aromas of balsam wood, tobacco and sawmill work well with ripe but reserved red-berry scents. Tight, tannic but also fresh as opposed to drying, this Cabernet from a cool year delivers a classic set of herbal berry, plum and wood spice flavors. A ripped finish is dry and oaky now, with core fruit resting for the future. Drink 2018–2028.",26.0,92,8,0.9994698635153196
4686,Recanati 2010 David Vineyard Reserve Cabernet Sauvignon (Galilee),"Fragances of wild berries, bramble and honeysuckle pave the way for flavors of cherry cola, toffee and tangerine zest. This is soft and round in the mouth, with tannins that are almost imperceptible at first yet last through the finish, hand-in-hand with remarkably bright acidity.",27.0,90,8,0.9994698635153196
4709,Madmon 2012 Soreka Special Reserve Cabernet Sauvignon (Shomron),"An intense bouquet of blackberry, smoked meat, flint and violet paves the way for flavors of black currant, smoked meat, coffee bean and a hint of cranberry. Rich savory notes mingle with strong fruit flavors, all marked by a pleasingly persistent strain of tartness. Smooth, soft tannins prime the palate for the elegant finish.",30.0,92,8,0.9994698635153196
4770,Katnook Estate 2006 Odyssey Cabernet Sauvignon (Coonawarra),"Katnook's top Cabernet is always oaky, and the 2006 is no exception, featuring plenty of brown sugar and caramel aromas. Vanilla and cedar dominate the palate, forming an attractive wooden shell over cassis fruit. Drink it now if you like that sort of full-on youthful oak, or hold it a decade until it develops a soft, rich patina of age.",43.0,88,8,0.9994698635153196
4836,Hollen Family Vineyards 2007 Cabernet Sauvignon (Mendoza),"Cedar, tobacco and dried-berry aromas are mature and spicy. This shows preserving acidity and flavors of caramel, baked berries and spice. It lasts long on the finish; drink now.",15.0,89,8,0.9994698635153196
4967,Creación 2013 Cabernet Sauvignon (Maule Valley),"Latex, earth and briar patch aromas are rough on the nose. Cranberry, red plum, olive and herbal flavors finish a bit sour, with a snappy feel.",8.0,83,8,0.9994698635153196
4977,Montes 2013 Classic Series Cabernet Sauvignon (Colchagua Valley),"Blue-fruit aromas and flavors are indistinct on the nose. Massive tannins, lemony oak, plastic and graphite notes drive the palate. The finish is a forced marriage of licorice, oak, and vanilla.",13.0,82,8,0.9994698635153196
5013,Morgenhof 2009 Mint Haven Cabernet Sauvignon (Simonsberg-Stellenbosch),"The name of this wine doesn't lie; if you like mint, then this one's definitely for you! Gorgeous notes of fresh eucalyptus take center stage to the blackberry and boysenberry fruit backbone. The menthol continues on in the mouth, with a gripping and structured finish that tastes like Thin Mint crumbles.",24.0,90,8,0.9994698635153196
5025,Kaiken 2005 Cabernet Sauvignon (Mendoza),"A little big and heavy, but that's the style that Kaiken has pushed since arriving on the market a few years ago. This version has baked-fruit aromas backed by lemon peel and espresso, while the palate is rich, dark and syrupy, but also oaky and tannic. Seems to want to offer more than it can deliver. The 14.5% alcohol level tells you that it's a big boy.",14.0,86,8,0.9994698635153196
5186,Errazuriz 2013 Max Reserva Cabernet Sauvignon (Aconcagua Valley),"This is a powerful Cabernet comprised of all the key players. The nose is oaky, with coconut and vanilla aromas alongside fast and furious spiced berry scents. A meter-pushing palate tastes of spiced cherry, blackberry, herbs and chocolate, while the finish simmers with coffee and mocha notes. Drink through 2020.",20.0,92,8,0.9994698635153196
5278,Wakefield 2015 Cabernet Sauvignon (Clare Valley),"This medium-bodied Cabernet shows some of the variety's hallmark austerity in its firm structure. Cassis, sage and red currant aromas and flavors finish crisp and lingering. Drink now with rare beef or lamb, or hold and drink 2020–2025.",17.0,88,8,0.9994698635153196
5307,Ambiente 2009 Cabernet Sauvignon (Mendoza),"A sweet-styled Cabernet with raisin, black cherry and baked plum aromas. The feel is clacky and unsophisticated, and the flavors blend candied currant, prune and sugar. Grabby as well.",6.0,82,8,0.9994698635153196
5311,Bodega Vistandes 2008 Viña Famatina Cabernet Sauvignon (Famatina Valley),"Stalky and green smelling, with tobacco and stemmy fruit aromas. The palate is scratchy and stewy, with soupy flavors of tomato and raspberry. Herbal on the deficient finish.",12.0,81,8,0.9994698635153196
5312,Alpamanta 2009 Natal Cabernet Sauvignon (Mendoza),"Wild, edgy and hot on the nose, which breaks up fast. The palate is narrow, sweet and pruney; stewed up on the finish and grapey throughout.",15.0,81,8,0.9994698635153196
5314,Espuela del Gaucho 2010 Cabernet Sauvignon (Mendoza),"A dilute and scratchy wine that lacks the body and depth of good Cab. Frankly, it's sour, lean and tough, with tart plum and pie cherry flavors. Dry as a bone on the finish.",13.0,81,8,0.9994698635153196
5358,Tamaya 2009 Reserva Cabernet Sauvignon (Limarí Valley),"A strange bird from the northern Limarí Valley, which just might be too cool and windy for fully ripe Cab. This is hard and a bit chemical on the nose, and then scratchy and clipped in the mouth, with herbal cherry and black plum flavors along with a fair amount of minty green.",17.0,84,8,0.9994698635153196
5383,Viña Casablanca 2014 Nimbus Single Vineyard Cabernet Sauvignon (Maipo Valley),"Rubbery, raw aromas of tomato and red fruits show a sweet note of milk chocolate. Tight, wiry and tough on the palate, this tastes mostly of red fruits and herbs. A lasting, herbal finish tastes a little salty.",15.0,87,8,0.9994698635153196
5481,Tilia 2014 Cabernet Sauvignon (Mendoza),"This is a concentrated, well-oaked Cabernet with blackberry, cassis, leather and woody aromas. The palate is fairly tight and tannic, with good structure, while flavors of toasty, spicy plum and berry finish woody and with elasticity.",10.0,87,8,0.9994698635153196
5507,Psagot 2012 Cabernet Sauvignon (Judean Hills),"This wine has a bouquet of raspberry, bell pepper, ground black pepper and a whiff of petrol. It fills the entire mouth with flavors of raspberry, cherry, rose petal, caramel, and flint. Offering a touch of salinity, to appeals to the entire palate, peaking with a grippy finish marked by smoke-tinged fruit flavors.",30.0,92,8,0.9994698635153196
5536,Taltarni 2004 Cabernet Sauvignon (Pyrenees),"The top Australian Cabernets retain distinct varietal character without veering into overly green territory. This one features hints of mint and tobacco alongside cassis and coffee. The texture is a treat: creamy at first, then firming up on the finish. Drink now-2015.",32.0,89,8,0.9994698635153196
5654,Acordeón 2012 Cabernet Sauvignon (Mendoza),"Red plum and scratchy, herbal aromas form a decent bouquet. This Cab is modest and edgy in feel, with equally raw and edgy red-berry flavors that finish quick and punchy.",9.0,84,8,0.9994698635153196
5825,Casa Montes 2014 Ampakama Cabernet Sauvignon (San Juan),"Berry and lemon-peel aromas come with a note of plastic. This feels narrow and acidic, and thus scraping. Tart plum and spice flavors lead to an herbal high-acid palate that leaves a sour lasting impression.",11.0,82,8,0.9994698635153196
6061,Hubert Weber 2007 Cellar Selection Cabernet Sauvignon (Mendoza),"This aged Cabernet is mild, mellow and earthy on the nose, with aromas of tobacco and baked berry fruits. Acidity is pronounced on the palate; after that there's a mix of spice, cherry and cassis flavors. Loud acidity on the finish freshens things up while creating citric scour. Drink now.",42.0,89,8,0.9994698635153196
6080,Le Riche 2003 Cabernet Sauvignon (Stellenbosch),"Subtle smoke, mocha and cassis on the nose lead into an elegant balance of berry, vanilla oak and mineral. An assertive wine with tannins that can use aging, the wine has a masculine, complex character and a savory finish, but is not overpowering. Overall, a choice with finesse.",25.0,89,8,0.9994698635153196
6220,Rietvallei Estate Wine 2007 Cabernet Sauvignon (Robertson),"Coffee, cigarbox and mocha aromas and flavors characterize this Rietvallei red. Complex and assertive, the wine unfolds with a chewy but poised intensity. The lingering finish has a tobacco-like touch. Pair with smoked meats, rich stews.",15.0,89,8,0.9994698635153196
6309,Ricordi 2012 Cabernet Sauvignon (Mendoza),"Closed aromas of red fruits, wet cement and green herbs precede a flat fairly tannic palate. Grinding cherry and plum flavors finish with hard tannins and midland rubbery red-fruit flavors.",14.0,84,8,0.9994698635153196
6316,Luis Segundo Correas 2011 Valle Las Acequias Cabernet Sauvignon (Mendoza),"Grassy, herbal aromas rest on top of basic red-fruit notes. This feels choppy and hollow, with flavors of buttery oak, chemical and red currant. The raw hot finish doesn't have a lot of body or padding.",13.0,84,8,0.9994698635153196
6509,Santa Alba 2012 Grand Reserve Cabernet Sauvignon (Curicó Valley),"Toasted bramble berry aromas come with hints of tree bark and mixed spices. This feels chewy, dense and round, while flavors of roasted plum and berry are well spiced. The chewy, round, tannic finish is rooty and spicy.",15.0,89,8,0.9994698635153196
6709,Kalbarri 2006 Bin Select 513 Cabernet Sauvignon (South Eastern Australia),"Kalbarri's Cab boasts plenty of red-berry flavors and a soft, easygoing, maybe even slightly sweet, finish.",7.0,83,8,0.9994698635153196
6803,Domaines Barons de Rothschild (Lafite) 2001 Los Vascos Cabernet Sauvignon (Colchagua Valley),"Lean and spicy in the nose, with a hint of pepper and some green vegetables. The palate is a continuation of the nose: there's mild red fruit but also some strong green-bean and bell-pepper flavors. The finish is dry and tannic, as it should be.",10.0,83,8,0.9994698635153196
6807,Calama 2001 Cabernet Sauvignon (Central Valley),"Mushroom and charcoal dot the nose, but with that comes just a modicum of fruit. The palate is a bit bland even if it's far from offensive, and so is the finish. Some wines don't offend while they fail to impress. This is an example of that type of wine.",6.0,83,8,0.9994698635153196
6817,San Pedro 2002 Gato Negro Cabernet Sauvignon (Central Valley),"Dusty, peppery aromas carry little richness, but in the mouth things turn more fruity. You get cherry and plum, but also a salty edge. The texture is smooth and solid enough, but the finish is disproportionately buttery, salty and mildly vegetal.",5.0,83,8,0.9994698635153196
6878,Suvla 2011 Reserve Single Vineyard Bozokbag Cabernet Sauvignon (Thrace),"Aromas of cherry, raspberry and buttered toast set the scene for a wine whose flavors of Bing cherry, custard, clove and fennel are bright on entry before pleasantly washing across the side palate. Unified fruit and spice flavors endure on the taste buds into the smooth, drawn out finish.",39.0,90,8,0.9994698635153196
6890,Eventide Cellar 2005 Cabernet Sauvignon (Wellington),"Flavors of bright, ripe black currant fruit and a nose of cinnamon, anise and blackberry recommend this energetic wine from the Wellington region. Slightly rustic but still restrained and elegant, the wine will pair well with grilled meat and a myriad of cheeses.",15.0,86,8,0.9994698635153196
7112,Bulgariana 2012 Cabernet Sauvignon (Thracian Valley),"Dark garnet to the eye, this wine has aromas of black cherry, black raspberry, coffee and freshly ground black pepper. Flavors of height-of-summer cherry, raspberry and baking spice persist on the palate through a finish that is awash in silky tannins.",11.0,90,8,0.9994698635153196
7130,La Playa 2005 Axel Cabernet Sauvignon (Colchagua Valley),"Minty and dusty at first, with secondary floral aromas that make you take notice. The palate is juicy and jumpy, with sizable coconut and black raspberry flavors that indicate ripeness but also some heavy oak aging. Shows grip and a touch of fire on the medium-long finish. Only 250 cases produced.",20.0,88,8,0.9994698635153196
7172,Valentin Bianchi 2010 Elsa Bianchi Cabernet Sauvignon (Mendoza),"Fresh, layered aromas of black fruits and licorice are appealing. The palate is full and offers kick, while flavors of berry and plum are fairly rich, spicy and honest for $9 Cabernet. A bit sticky and it falls off on the finish, but overall it's a nice value red.",9.0,87,8,0.9994698635153196
7301,Ricardo Santos 2015 Una Selección Cabernet Sauvignon (Mendoza),"Berry aromas with subtle spice accents are damp and soothing. In the mouth, this is the opposite: All dry tannins and rawness. Hard-driving black-fruit flavors pull up short on a peppery finish. It's an honest but rough wine.",20.0,87,8,0.9994698635153196
7322,Santa Rita 2015 Reserva Cabernet Sauvignon (Maipo Valley),"Berry and plum aromas smell a bit burnt, sort of like a burning field. A healthy lively medium-bodied palate delivers smoky oaky roasted berry and plum flavors in front of a lightly spiced finish.",13.0,87,8,0.9994698635153196
7550,Cramele Recas 2014 Dreamfish Cabernet Sauvignon (Viile Timisului),"Tart cherry, tobacco and leather present themselves on the nose, leading the way to fruit forward flavors of red plum and cherry pie backed by pleasant hints of vanilla.",7.0,85,8,0.9994698635153196
7556,François Lurton 2013 Gran Aracauno Cabernet Sauvignon (Colchagua Valley),"Scattered aromas of black olive and stewed berry fruits lead to a heavy, awkward palate. This tastes strained, with burnt, leafy black-fruit flavors and a soft, low-acid finish.",35.0,85,8,0.9994698635153196
7560,Indomita 2014 Gran Reserva Cabernet Sauvignon (Maipo Valley),"This is an overtly oaky Cabernet with resiny, balsamic aromas that share space with baked black-fruit scents. The palate feels flabby and fat, with modest tannic grip. Jammy blueberry and cassis flavors end oaky, resiny and jammy.",15.0,85,8,0.9994698635153196
7596,Montes 2009 Alpha Cabernet Sauvignon (Colchagua Valley),"Earthy, warm and generously oaked, with berry aromas that bring leather and smoke. The palate is healthy and tight, with spiky tannins and herbal black fruit flavors. Grippy on the finish, with olive and spice. Very much a good-quality, typically styled Chilean Cabernet.",24.0,88,8,0.9994698635153196
7604,Echeverria 2009 Family Reserva Cabernet Sauvignon (Curicó Valley),"Leather and woody/smoky aromas blend well with core cassis and berry scents. The palate feels fresh and healthy, with cassis, raspberry, herb and olive flavors. Tones it down on the finish, which is dry and tastes of carob and minty green herbs.",18.0,88,8,0.9994698635153196
7692,Cono Sur 2013 20 Barrels Cabernet Sauvignon (Maipo Valley),"Dense, baked and mulled blackberry and cassis aromas include bold but classy oak notes. This feels seamless except for raring tough tannins, while flavors of toast, graphite and spiced blackberry finish smooth and chewy, with a sense of lushness despite lasting residual tannins. Drink through 2025.",35.0,93,8,0.9994698635153196
7703,Odfjell 2005 Orzada Cabernet Sauvignon (Colchagua Valley),"Dark cola, black fruit and marzipan aromas give this a sweet bouquet. The palate is solid, with medium-strength tannins supporting cherry, blackberry and mocha flavors. Oak is no stranger to this wine, so expect ample vanilla and chocolate throughout. A bit herbal, which is common for Chilean Cabernet.",20.0,89,8,0.9994698635153196
7719,Viña Maipo 2015 Vitral Reserva Cabernet Sauvignon (Chile),"Cherry and black olive aromas are common for standard Chilean Cabernet, which this is. A fleshy, flush mouthfeel is raw due to prodding acidity and tannins. Herbal berry flavors are spicy and a touch green, while this tastes minty on the finish.",13.0,86,8,0.9994698635153196
7722,Balduzzi 2015 Reserva Cabernet Sauvignon (Maule Valley),"Tarry berry aromas come with notes of olive, rubber and eucalyptus. A tight, racy palate is driven by acidity, while this tastes of herbal plum and lightly salted tomato sauce. Woody, herbal berry flavors are spicy and a bit green.",11.0,86,8,0.9994698635153196
7908,Marques de Griñon 2013 Single Vineyard Estate Bottled Cabernet Sauvignon (Dominio de Valdepusa),"Highly concentrated black-fruit aromas of plum and currant are made more interesting by cola and forest-floor notes. This is a dense, chewy and almost fat Cabernet Sauvignon. Baked berry, fig and savory grilled-meat flavors are massive, backed up by a lush, deep finish. Drink 2018–2025.",40.0,93,8,0.9994698635153196
8010,Santa Helena 2010 Parras Viejas Cabernet Sauvignon (Colchagua Valley),"A spicy, dry berry aroma forms a strong opening that's crisp, focused and slightly herbal in character. The palate feels juicy and tight, with crisp tannins that set up racy cassis, plum and mocha flavors. Clean and fresh on the finish.",39.0,89,8,0.9994698635153196
8024,Misiones de Rengo 2010 Gran Reserva Cuvée Cabernet Sauvignon (Rapel Valley),"Ripe, concentrated and bullish from the start, this has a roasted berry aroma that leads to a saturated, tannic palate. The flavors on this full-bodied Cabernet run from toasted and crusty to blackberry-like and minerally. Toastiness and a sense of darkness remain on the finish.",20.0,89,8,0.9994698635153196
8032,Undurraga 2010 T.H. Alto Maipo Cabernet Sauvignon (Maipo Valley),"The aromatic opening includes a forest-like note, plus mineral and earthy berry scents. The palate feels chunky and wide, with solid tannins that don't bite or dominate. Flavors of herb, olive, spice, molasses and cassis are typical for the Alto Maipo, while the finish is defined by racy acids that should allow this wine to age nicely for another five-plus years.",25.0,89,8,0.9994698635153196
8085,Weinert 2002 Cabernet Sauvignon (Mendoza),"Classic Weinert wine; meaning it's well-aged, mature and sort of throwback. It's not purple and saturated and sticky; instead it's medium-weight and a touch scratchy, with roasted berry aromas followed by dry cherry, raspberry and plum flavors. A touch of burnt brown sugar offers balance and sweetness, and as a whole it seems ready to drink.",24.0,88,8,0.9994698635153196
8134,J. Bouchon 2014 Block Series Reserva Especial Cabernet Sauvignon (Maule Valley),"No-frills berry and cassis aromas open this Cabernet. A wide, jammy palate is generous but a touch off-centered. An aggressive herbal plum flavor leads the charge, while a tannic, grabby finish brings it home.",20.0,89,8,0.9994698635153196
8258,Calcu 2009 Cabernet Sauvignon (Colchagua Valley),"A generic wine with berry and cassis flavors but not much in the way of complexity. Feels rough and rubbery, with grabby tannins in front of herbal berry and plum flavors. Finishes herbal as well, with some heat and burn to boot. Contains 10% each Carmenère and Petit Verdot.",14.0,86,8,0.9994698635153196
8263,P.K.N.T. 2009 Gold Reserve Cabernet Sauvignon (Maule Valley),"Opens with pointed red fruit aromas as well as an herbal/green infusion. Feels grating and scratchy, with red currant, plum and milk chocolate flavors. Finishes with buttery oak and vanilla. Pretty much your standard fare Chilean Cab.",14.0,86,8,0.9994698635153196
8319,Siegel 2014 Über Cuvée Cabernet Sauvignon (Colchagua Valley),"Saucy, herbal berry aromas come with gritty notes of earth and rubber. This feels chunky and grabby, with drawing tannins. Flavors of black plum, clove, green herbs and coffee grinds finish with a noticeable herbal boost.",15.0,86,8,0.9994698635153196
8348,Marques de Griñon 2010 Single Vineyard Estate Bottled Cabernet Sauvignon (Dominio de Valdepusa),"Powerful blackberry, prune, juniper, cola and fern aromas are demanding but appealing for Spanish Cabernet. This feels tannic, full and generous, with flavors of spicy, lightly green berry fruits. A foresty note accents an elegant yet strong finish. Drink through 2022.",40.0,92,8,0.9994698635153196
8380,Maquis 2012 Cabernet Sauvignon (Colchagua Valley),"Dense aromas of earth, berry fruits, latex and animal fur are a touch challenging at first but balance out with airing. This has a crisp, fresh feel despite coming from a hot year. Lightly herbal, leathery flavors of red currant and wild berry finish oaky, with more than adequate filling.",20.0,89,8,0.9994698635153196
8398,Viu Manent 2012 La Capilla Single Vineyard Cabernet Sauvignon (Colchagua Valley),"Brambly cassis and raspberry aromas are warm and a touch cooked. This is bullish, heavy and grabby in feel, with big tannins. Blackberry, cassis, herb and chocolate flavors finish ripe and dark. Drink through 2017.",25.0,89,8,0.9994698635153196
8464,Tamarí 2011 Reserva Cabernet Sauvignon (Mendoza),"Dusty, earthy and herbal defines the nose on this minty Cab. There are also whiffs of animal and pickle on the bouquet. This feels raw and tight, with crisp acids and peppery, lightly herbal flavors of plum and berry. A minty, dry finish is slightly harsh.",13.0,83,8,0.9994698635153196
8471,Casa de Campo 2011 Cabernet Sauvignon (Mendoza),"Briny raspberry aromas are a bit murky. This smacks down hard with acidity, while the flavors run toward earthy, generic plum and berry. A salty finish with animal notes is firm but struggles with cleanliness.",8.0,82,8,0.9994698635153196
