,title,description,price,points,cluster_label,cosine_similarity
45815,Chateau Ste. Michelle & Dr. Loosen 2007 Eroica Riesling (Columbia Valley (WA)),"This Riesling collaboration between Chateau Ste. Michelle and Ernst Loosen is no longer unique, but the wine has been fine-tuned over the years and sets a consistently high standard. This may be the most acidic ever made, but it is juicy rather than sour, and has a textural creaminess that adds both depth and length. The fruit flavors mix ripe apple and Mandarin orange, with hints of sweet lime and wet stone.",22.0,90,1,0.9791730291902131
45820,L'Ecole No. 41 2007 Sémillon (Columbia Valley (WA)),"This Sémillon is quite dry, with an unusual mouthfeel that is a bit like chewing on beeswax, honeycomb without the sweetness of honey. It's a beautifully scented wine with a beguiling mix of floral and spice, suggestions of cinnamon, baking spice and body powder. Following on the palate are firm yet supple flavors of melon, pear and hints of baked apple, gliding into a smooth and satisfying finish, which resonates with hints of buttered toast.",16.0,90,1,0.9791730291902131
45990,àMaurice 2007 Red (Columbia Valley (WA)),"This vintage has the Horiuchi artist label. Another glorious wine from the 2007 vintage, full and forward, packed with plum and purple fruits. Sweet tobacco and baking spices lead into a lush, fruit-loaded core, ripe with berries and plums. The finish—thick and textural and darkly chocolaty—wraps around polished, elegant tannins.",35.0,94,1,0.9791730291902131
46000,Kent Rasmussen 2007 Esoterica Chavez-Leeds Vineyard Petite Sirah (Rutherford),"Very dry and tannic, as Petite Sirah should be. But unlike many “Pets,” it's also balanced and elegant. The official alcohol is only 13.5%, yet there's not a trace of greenness. In fact, the wine, which has plenty of French oak, is quite rich in blackberry and black currant flavors. Really a superb example, a Petite Sirah for Cabernet fans. Should evolve interestingly for many years.",40.0,94,1,0.9791730291902131
46138,White Oak 2007 Merlot (Napa Valley),"An ultra-dry, solid Merlot, filled with hard tannins and zingy acidity. Deep down under are some pretty good black cherry and cedar flavors. Your gamble is to cellar it, as it's just too tough to enjoy now.",26.0,86,1,0.9791730291902131
46139,Acorn 2007 Alegria Vineyard Sangiovese (Russian River Valley),"Lots of sweet cherry fruit in this polished red wine, which also shows the char and cedary flavors of oak barrel aging. It's gentle in tannins and has enough acidity for balance. A nice, everyday wine that brings to mind well-sauced pasta dishes.",28.0,86,1,0.9791730291902131
46151,Chiarito 2007 Estate Bottled Petite Sirah (Mendocino),"Juicy as a dark plum with a raspberry chaser, this 80-case Petite Sirah gets better and better as it opens, revealing itself to be mellow and rustic, yet big and broad-shouldered. It would make the perfect pairing with a plate of cheesy pasta, meat sauce and crusty garlic bread, or anything with pancetta.",30.0,91,1,0.9791730291902131
46360,William Hill Estate 2007 Merlot (Napa Valley),"Tannins and acids make for a hard, resistant mouthfeel on this three-year-old Merlot. But the flavors are very rich, suggesting black and red cherries, red currants, violets and milk chocolate. Drink it with a well-marbled steak to break through the astringency.",28.0,87,1,0.9791730291902131
46635,Divine Llama 2007 In a Heart Beat Red (Yadkin Valley),"Charred oak, green herbs and vanilla spice notes mix oddly. The palate is soft and plush, with notes of sweet mocha and chocolate, but also a bit tired and chalky with faint tannins in the background.",18.0,82,1,0.9791730291902131
46636,Fiddlehead 2007 Happy Canyon Sauvignon Blanc (Santa Ynez Valley),"A problematic wine, with unripe, green flavors. The citrus fruits are marred by the herbal taste of boiled vegetables.",25.0,82,1,0.9791730291902131
46673,Bardessono 2007 Petite Sirah (Napa Valley),"Harsh and tannic now, with a flood of primary fruit blackberries and dark chocolate washed with black pepper. Despite the scour, it's a well-structured, bone-dry wine, with noble Napa tannins. And it is Petite Sirah. Give it at least four years in the cellar.",37.0,90,1,0.9791730291902131
46688,Derby 2007 Pinot Noir Sparkling (San Luis Obispo County),"Made 100% from Pinot Noir, this bubbly has an orange copper color, and is full-bodied and dry. The flavors are of raspberries, strawberries and yeast, and the all-important mousse is refined. A little eccentric, but try it with sushi.",54.0,88,1,0.9791730291902131
46886,Willow Crest 2007 Cabernet Franc (Yakima Valley),"There is plenty of green tea flavor running through the fruit and the tannins here, along with dark cherry and bitter chocolate. A rustic, rough, but perfectly enjoyable take on pure Cab Franc.",12.0,87,1,0.9791730291902131
46902,Yorba 2007 Tempranillo (Amador County),"An easy-drinking red wine. It's silky, fruity and dry. You could substitute it as an interesting alternative to Pinot Noir. Shows cherry and tobacco flavors, with a brisk scour of acidity.",38.0,87,1,0.9791730291902131
46903,Le Vigne di Domenico 2007 Petite Sirah (Paso Robles),"Defines Paso Robles Petite Sirah with its soft, luxurious texture and wonderfully ripe fruit. Blackberry and cherry-pie filling, cola, beef jerky and sandalwood flavors flood the mouth, and are perfectly dry and moderate in alcohol. Drink now for sheer lusciousness.",30.0,87,1,0.9791730291902131
47261,Baer 2007 Ursa Red (Columbia Valley (WA)),"A five-grape Bordeaux blend dominated by Merlot and Cab Franc, this is a deft mix of grapes nicely melded into a complete and satisfying wine. It's anchored by black cherry and cassis fruit, supple and focused. Surrounding that core fruit are layers of smoke, black olive, pencil lead and coffee grounds. It resonates gracefully through a long finish.",35.0,93,1,0.9791730291902131
47291,Pianetta 2007 Estate Bottled Syrah (Monterey),"Lots of acidity and black pepper in this bone-dry wine, giving it a scoury mouthfeel. But you'll find very rich, elaborate blackberry and cherry jam, chocolate and bacon flavors. Drink now.",25.0,87,1,0.9791730291902131
47293,Taj 2007 Syrah (Los Carneros),"A smooth, ripe Syrah, easy and soft in the mouth, with richly extracted berry, mocha, white pepper and sandalwood flavors. It's a dry, balanced wine showing some real elegance.",24.0,87,1,0.9791730291902131
47430,Clos du Bois 2007 Fleur Late Harvest Riesling (Santa Lucia Highlands),"Enormously sweet, this decadent dessert wine has rich flavors of apricot jam, mandarin orange cream custard, crème brûlée, sweet smoked butter, vanilla and cinnamon. It's a delicious after-dinner sipper, and would score far higher if it had additional layers of complexity and structure.",25.0,87,1,0.9791730291902131
47487,Kamiak 2007 White Wine White (Yakima Valley),"This Sauvignon Blanc/Sémillon blend is all stainless steel fermented, but carries some lovely spice and toasty notes along with soft, broadly fruity flavors of melon and citrus.",14.0,88,1,0.9791730291902131
47696,Garfield Estates 2007 V° Viognier (Grand Valley),"The nose on this Viognier is a touch off and slightly green, and on the palate, thin flavors lack the curvy allure of the variety. Still, the wine has a clean character and overall easy drinking quality that recommends it.",20.0,82,1,0.9791730291902131
47709,Taylor 2007 Nouvelle Génération Sauvignon Blanc (Napa Valley),"Unbalanced, with weedy, grassy flavors side by side with sweet spearmint chewing gum and pineapple LifeSaver candy. Crisp acidity gives it the sweet-sour taste of certain Chinese sauces.",24.0,82,1,0.9791730291902131
47710,Husch 2007 Late Harvest Gewürztraminer (Anderson Valley),"Simple and a little one-dimensional in fruit and spice flavors, this dessert wine's main feature is sweetness. It has a flavor like the syrup from canned peaches.",20.0,82,1,0.9791730291902131
47712,Elizabeth Rose 2007 Rosé (Napa Valley),"Simple and a little sugary, this Syrah, Pinot Noir and Zinfandel blend has pop flavors of raspberries, cherries, vanilla and cola.",18.0,82,1,0.9791730291902131
47773,Dragonette 2007 MJM Red (California),"You might want to lay this Syrah-based Rhône wine down for a year or two. Tasted in the early fall of 2010, it's sharp and fresh-fruity, which gives the cherry, raspberry and cocoa a jammy taste. The grapes come from Paso Robles and Santa Barbara County.",50.0,89,1,0.9791730291902131
47781,Lujon 2007 Spofford Station Syrah (Walla Walla Valley (OR)),"Though the alcohol comes close to 15%, this is still relatively light compared with other Spofford vineyard Syrahs. Sweet cherry candy, or cherry pie fruit is slathered in flavors of coconut/vanilla cream. It's tasty, though relatively simple, especially for fruit from this vineyard, which is known for its earthy terroir.",25.0,88,1,0.9791730291902131
47783,Pedroncelli 2007 Mother Clone Zinfandel (Dry Creek Valley),"Here's a young, lusty, grapey Zinfandel that really gets the tastebuds watering. Crisp acidity stimulates the palate, while rich, dry flavors reward it with an array of briary blackberries, cherries, chocolate, tobacco and spices. Textbook Dry Creek Zinfandel.",15.0,88,1,0.9791730291902131
47856,Keller Estate 2007 La Cruz Vineyard Syrah (Sonoma Coast),"Very dry and pretty tannic, this cool-climate Syrah combines its blackberry and cherry fruit with less ripe notes of herbs and even a touch of asparagus. Intense umami flavors of salty, smoky bacon give it richness. Drink now.",40.0,88,1,0.9791730291902131
48336,Martin Ray 2007 Dry Rosé (Russian River Valley),"This blend of mainly Syrah, with Grenache, is heavy and dull, with candied raspberry-cherry flavors that finish a little sweet.",16.0,82,1,0.9791730291902131
48440,Anthony Road 2007 Semi-Sweet Riesling (Finger Lakes),"White flowers, honey and toasted spice lead on this Riesling from New York, and on the palate, a backbone of elegant fruit prevails. Paired with the wine's sweet touch, the flavors offer a simple, appealing quaff that will pair well with spicy cuisine.",16.0,83,1,0.9791730291902131
48483,Big House 2007 The Slammer Syrah (Santa Barbara County),"Very dry and rather sharp in acidity, this Syrah offers cherry-berry flavors with a hint of herbs and spices. It turns bitter on the finish. Good price, but could use greater richness.",12.0,83,1,0.9791730291902131
48486,Leaping Lizard 2007 Zinfandel (Sonoma County),"An everyday Zin, soft and candied, with blackberry, cherry, licorice and cocoa flavors. The tannin structure is rich. Drink now.",13.0,83,1,0.9791730291902131
48495,Adelaida 2007 Michael's Estate Vineyard Zinfandel (Paso Robles),"Too soft in acidity, so the blackberry, currant, cherry liqueur and spice flavors have a curious jamminess. The softness and high alcohol emphasize sweetness, affecting the finish.",28.0,82,1,0.9791730291902131
48497,Eagle Castle 2007 Royal Red Red (Paso Robles),"Thin in berry fruit and tannic, this rustic wine shows its high alcohol with a chili pepper burn through the finish. The flavors aren't rich enough for balance.",26.0,82,1,0.9791730291902131
48498,Fenestra 2007 Silvaspoons Vineyard Malbec (Lodi),"Very dry and raisiny-pruney, a harsh, somewhat bitter wine. The dryness is relieved by some ripely sweet blackberries that show up in the middle palate.",18.0,82,1,0.9791730291902131
48581,Shoup 2007 Red (Columbia Valley (WA)),"Made by Long Shadows winemaker Gilles Nicault, this wine, along with the 2008 and 2009 vintages, were released together. This is the most mature—a five-grape, Bordeaux-style blend. It's a beautifully integrated, floral and dusty wine, with contoured, sculpted fruit. Plums and cherries dominate, with dustings of cocoa powder, coffee and a hint of hazelnut. The wine is graceful and profound, with superb length and finesse.",95.0,95,1,0.9791730291902131
48965,Porter Family Vineyards 2007 Syrah (Napa Valley),"A bit tough in acidity, which seems to accentuate the ripe fruit, giving it a jammy, tart quality. The flavors are of blackberries, cherries, tangerines and sandalwood. Drink now.",47.0,86,1,0.9791730291902131
48966,Robert Craig 2007 Zinfandel (Howell Mountain),"A good Zinfandel, dry and rich in the thick tannins you'd expect off Howell Mountain. The blackberry, cassis and cedar flavors are liberally spiced with pepper. Loses a few points for a certain green herbaceousness.",50.0,86,1,0.9791730291902131
48971,Bogle 2007 Petite Sirah (California),"A good, rugged red wine, dry and tannic, with rich flavors of blackberries, black currants, sweet tobacco and herbs. Really versatile with everything from pizza to steak.",11.0,86,1,0.9791730291902131
48972,St. Francis 2007 Montecillo Vineyard Kaarin's Terrace Zinfandel (Sonoma Valley),"This Zin is made in the St. Francis style of dryness at the cost of extremely high alcohol. It's a good, lusty wine made for drinking with rich fare that will counter-balanced the heat. The flavors of blackberries, currants and peppery spices are very rich.",40.0,86,1,0.9791730291902131
49000,Summers 2007 Checkmate Red (Napa Valley),"This Cabernet Sauvignon-based blend is a best-of-barrels selection from Summers' various Cabs throughout Napa Valley. It's unquestionably a big wine, densely packed with blackberry, cherry and dark chocolate flavors. It's also very young. The tannins pack a real punch. New oak, to the tune of 100%, is apparent in the buttered toast richness. Don't drink it now, good as it is. Give it until 2014, and it will develop long beyond that.",100.0,94,1,0.9791730291902131
49046,Messina Hof 2007 Double Barrel Cabernet Franc (Texas),"Serious and solid, this Cab Franc delivers the goods with a complex nose of vanilla, coconut and orange clove pomanders layered over coffee and bittersweet chocolate. There's nice fruit in the mouth, with plum and blackberry shot through with notes of cinnamon. Medium, oaky finish. Serve with roast beef. Best 2011–2012.",14.0,87,1,0.9791730291902131
49049,Powers 2007 Syrah (Columbia Valley (WA)),"Slightly confected scents lead into sweetly spicy fruit, leaning to purple fruits with fig and prune highlights. The acidity is spot on, and the tannins are ripe and firm. The blend includes 10% Malbec.",14.0,87,1,0.9791730291902131
49051,Seghesio 2007 Sangiovese (Alexander Valley),"Quite a success for a California Sangiovese. It's dry and silky, with light tannins and a good crunch of acidity to brighten the cherry pie, anise and pepper flavors.",28.0,87,1,0.9791730291902131
49053,Hogue 2007 Genesis Meritage (Columbia Valley (WA)),"Meritage wines must be Bordeaux blends; otherwise, they can be all over the map. This is an all-purpose, affordable red blend of Merlot, Cabernet Sauvignon and Malbec. Black cherry and olive, smoke and some noticeable alcohol (14.4% is credited) define a sturdy red in wide distribution.",16.0,87,1,0.9791730291902131
49054,Jaffurs 2007 Grenache (Santa Barbara County),"Here's a pleasant, easy to drink Grenache. It's dry and tannic and filled with cherry flavors, sweetened with toasty oak. Wisely avoids many of the pitfalls Grenache is subject to. Drink now.",34.0,87,1,0.9791730291902131
49062,Hard Row To Hoe 2007 Shameless Hussy Syrah (Wahluke Slope),"Good fruit from the Riverbend vineyard brings earthy complexity to the wine. Sappy boysenberry fruit, soaked in barrel flavors of Kahlua and cinnamon, shows just a bit of alcoholic heat heading into the finish.",20.0,87,1,0.9791730291902131
49092,Shannon Ridge 2007 Sauvignon Blanc (Lake County),"With a sweet finish, this wine is filled with polished flavors of pears, pineapples, guavas, nectarines, honey and dusty spices. Crisp acidity provides balance.",16.0,85,1,0.9791730291902131
49432,Valley View 2007 Anna Maria Viognier (Rogue Valley),"Soft and peachy, with good midpalate concentration. This is a simple but fruity and flavorful wine, with just the vaguest suggestion of Meyer lemon in the finish.",22.0,87,1,0.9791730291902131
49748,C.G. di Arie 2007 Petite Sirah (Shenandoah Valley (CA)),"Pretty soft and delicate for a Petite Sirah, with the silkiness almost of Pinot Noir, except for the dark black color and firm, dry tannins. The blackberry, currant and leather have a touch of smoky cedar. Drink this pleasant wine with Mexican food, spare ribs, lasagna.",25.0,88,1,0.9791730291902131
49844,Wood Family Vineyards 2007 Madden Ranch Syrah (Livermore Valley),"The grapes for this immense, rich blueberry jammy Syrah come from NFL's John Madden's ranch. It's as big and loud as he can be, with not quite enough fruit or acid to overcome the alcohol, which even gets in the way of the nose. With a small percentage of Grenache blended in and the whole aged in 100% American oak (1/3 new), this style may appeal to some;, but can be interpreted as overly voluptuous, even on a second tasting eight hours after the first. Decant or, preferably, give it another 3–5 years.",24.0,84,1,0.9791730291902131
49856,Le Vigne di Domenico 2007 Merlot (Paso Robles),"Shows good blackberry and currant flavors, but there's something off in the mouthfeel. It's a sharpness, a rugged, tart green chlorophyll feeling that suggests unripe tannins.",30.0,84,1,0.9791730291902131
49859,Stuart Cellars 2007 Limited Reserve Syrah (Temecula Valley),"A dry, tannicly dessicated wine largely lacking in fruit. Tastes of alcohol and pepper, with just a sprinkle of blackberry juice.",40.0,81,1,0.9791730291902131
49861,Estraié 2007 Sauvignon Blanc (North Coast),"Dry, tart in acidity and vegetal, this Sauvignon Blanc isn't ripe. It tastes like green beans with just a hint of citrus.",18.0,81,1,0.9791730291902131
49862,Glen Ellen 2007 Proprietor's Reserve Merlot (California),"Pretty harsh, with green tannins and minty flavors, relieved by some modest cherry notes.",10.0,81,1,0.9791730291902131
49863,Beaver Creek 2007 Zinfandel (Lake County),"Soft, simple and sweet, with jellied raspberry, cherry and spice flavors. Tastes like an inferior dessert wine.",29.0,81,1,0.9791730291902131
49873,Buttonwood Farm 2007 Estate Grown Merlot (Santa Ynez Valley),"Nowhere near ripe, with asparagus and boiled green bean aromas and flavors. Simply lacks richness of fruit.",22.0,81,1,0.9791730291902131
49875,Rosa d'Oro 2007 Dolcetto (Lake County),"After the sulfur smell blows off, this wine remains tough in acids and tannins.",18.0,80,1,0.9791730291902131
49876,Agate Ridge 2007 Cascade Terrace Red Red (Rogue Valley),"A blend of five diverse red grapes, this lightly fruity quaffer is almost invisible as far as flavor is concerned. It hits the tongue and vanishes.",17.0,80,1,0.9791730291902131
50089,Syzygy 2007 Saros 154 Red (Columbia Valley (WA)),"This tightly-wound effort is built from 40% Malbec, 40% Tempranillo and 20% Cabernet Sauvignon. It's forceful and elegant, with streaks of black tea, anise and iron filings set in tangy red fruits that play out vertically through a lingering finish.",45.0,91,1,0.9791730291902131
50469,Souverain 2007 Merlot (Alexander Valley),"Here's a good, rugged but dry and fruity Merlot for drinking now. It has pleasant cherry, berry, cola, herb and pepper flavors. Production was 5,000 cases.",17.0,86,1,0.9791730291902131
50485,Brazin Cellars 2007 Old Vine Zinfandel (Lodi),"Peppery and hot, almost Porty, with rich flavors of blackberries, cherries, chocolate, bacon and sandalwood. With smooth tannins, it turns soft and spicy on the finish.",18.0,86,1,0.9791730291902131
50495,Alexander Valley Vineyards 2007 Redemption Zin Zinfandel (Dry Creek Valley),"Dry, minty and sharp, and very peppery, with tobacco, wintergreen, cherry and currant flavors, wrapped into sturdy tannins. Drink now.",20.0,85,1,0.9791730291902131
50499,Francis Ford Coppola 2007 Presents Bianco Pinot Grigio (California),"Everybody needs a dry, tart white wine and Coppola has provided us with one in this crisply citric bottling. It's fresh and uplifting in grapefruit, lime and spicy flavors, at a good price.",10.0,85,1,0.9791730291902131
50606,Stevenot 2007 Verdelho (California),"Stevenot has a good record at producing this stainless-steel-fermented wine. It's a savory, complex white, with high acidity framing honeyed flavors of Meyer lemons, limes, papayas, pine tar, slate and vanilla, with a hint of petrol. That sweet-tart tension makes the wine the perfect foil for Asian fusion fare.",14.0,88,1,0.9791730291902131
50610,Londer 2007 Dry Gewürztraminer (Anderson Valley),"Shows the crisp, dry Alsatian interpretation that Anderson Valley gives to Gewürz. The wine bursts with Asian spices that titillate the palate, alongside Mandarin orange, Asian pear, lychee, honeysuckle and vanilla flavors that are delicious. Drink now for its youthful vivacity.",26.0,88,1,0.9791730291902131
50616,Erath 2007 Pinot Gris (Oregon),"Erath is now part of the Ste. Michelle Wine Estates portfolio. The white wines, which have long been a strength of the brand, remain fresh and lightly fruity. The flavors of this young Pinot Gris suggest pear skin, grapefruit and lime, and there are bracing acids providing some additional lift. The '07 seems to show a bit more textural density than the previous vintage.",14.0,87,1,0.9791730291902131
50827,RoxyAnn 2007 Viognier (Rogue Valley),"Nice mix of citrus and tropical fruits in the nose, with a spicy burst on the palate. Bone dry, racy and yet still full-bodied, this excellent Viognier carries its tropical papaya flavors into a surprisingly creamy finish, laced with vanilla cream and butterscotch.",20.0,90,1,0.9791730291902131
50834,Ledson 2007 Cabernet Franc (Dry Creek Valley),"The flavors of oak and cherries stand out in this fruity, softly appealing wine. It's almost like a pastry tart, with the smoky-sweet pie crust. It's delicious and appealing, although it could show a bit more depth and complexity.",48.0,89,1,0.9791730291902131
50850,Cadaretta 2007 Windthrow Red (Columbia Valley (WA)),"Cadaretta's Windthrow is a limited-release southern Rhône blend of 37% Syrah, 27% Mourvèdre, 18% Counoise and 18% Grenache. The fruit is just ripe enough, clean and juicy, with a spicy and tart mouthfeel. What's most surprising is the length—the wine seems to gather itself and push on through a full-throttle finish, adding nougat and vanilla custard to the mix.",50.0,90,1,0.9791730291902131
50999,The Grapes of Roth 2007 Merlot (Long Island),"Over the last few years, veteran winemaker Roman Roth's eponymous Merlot has proven to be a consistent winner. His 2007 vintage is no exception. While intensely ripe with a rich, almost raisined black-fruit character, it's balanced with hints of granite, smoke and brine that all lend a savory, earthy tone. Penetratingly tannic and robust in structure, it's a wine to decant now, or cellar through 2019–2021.",44.0,91,1,0.9791730291902131
51149,Curtis 2007 Roussanne (Santa Ynez Valley),"Dryish and very fruity, this Roussanne has pleasant flavors of oranges, pineapples, orange honey, roasted hazelnuts and smoky oak. Crisp acidity makes it taste bright and clean.",25.0,86,1,0.9791730291902131
51278,Parducci 2007 Petite Sirah (Mendocino County),"Dusty, tannic and simple. Still, juicy and pleasant enough, with a touch of bitterness on the finish.",11.0,83,1,0.9791730291902131
51358,McGregor 2007 Rob Roy Red Red (Finger Lakes),"Hints of black coffee, dried lavender and herb add punch to the lean plum and cherry flavors of this medium-bodied Cabernet Franc blend. Brisk on the palate, with an herbaceous, green note that persists, it finishes firm, with a chalky coating of tannins.",40.0,85,1,0.9791730291902131
51744,Chiarito 2007 Estate Bottled Zinfandel (Mendocino),"John Chiarito is making Italian varieties like Nero d'Avola and Negro Amaro––as well as estate-grown Petite Sirah and Zinfandel––on the outskirts of Ukiah, from his basement winery. There he combines an Old-World sensibility with New World techniques. He's nailing it here with a rustic, tannic but intensely delicious Zin full of berry aromas and a spicy finish. Big and hearty, this wine has soul.",21.0,92,1,0.9791730291902131
52114,Ardenvoir 2007 Sémillon (Columbia Valley (WA)),"Silky and luscious, this extraordinary Sémillon from the makers of the Chateau Rollat red wines sends up cascading scents of orange blossom, orange peel, citrus and light tropical, moving into the mouth with beautifully integrated fruits dappled with honey and tea. Elegant and impressively long, it concludes with a light kiss of toast.",22.0,92,1,0.9791730291902131
52145,Pellegrini Vineyards 2007 Estate Grown Merlot (North Fork of Long Island),"This medium-bodied Merlot boasts an abundance of ripe, juicy black-cherry and plum flavors, but with a shade of savory green herbs that persist on the palate. Bright acidity and soft tannins make it brisk and easy to drink.",20.0,86,1,0.9791730291902131
52377,Ledgewood Creek 2007 Estate Grown G-S-M (Suisun Valley),"A polished, friendly wine, soft and gentle in the mouth, and carrying ripe flavors of cherries, black raspberries, mocha, bacon and pepper. Nice now if you want a dry, medium-bodied red. Grenache, Syrah and Mourvèdre.",16.0,87,1,0.9791730291902131
52407,Zina Hyde Cunningham 2007 Sauvignon Blanc (Mendocino County),"With its slightly sweet notes of pineapple pie, dates and vanilla, this zesty Sauvignon Blanc is nice to sip as a cocktail. It will also pair well with a smoky ham sandwich with Dijon mustard.",18.0,85,1,0.9791730291902131
52438,Cockerell 2007 Terroir Coquerel Sauvignon Blanc (Napa Valley),"This is a complex young wine, made in the white Bordeaux style. It has been barrel fermented and aged on the lees. Marked by crisp, mouthwatering acidity, it shows a grassy, hay quality that dries out the citrus fruit and apple fruit, giving the wine a bone-dry feel. Very fine and near the top of Napa Valley Sauvignon Blancs.",37.0,93,1,0.9791730291902131
