,title,description,price,points,lda_label,8
58645,Full Pull & Friends 2012 Bacchus Vineyard Cabernet Franc (Columbia Valley (WA)),"Aromas of flowers, graphite, licorice and high-toned herbs are followed by red- and black-fruit flavors that coat the palate from end to end. This has an extremely high yum factor that demands another sip.",30.0,92,8,0.9470422652718151
5906,The Foundry 2004 Syrah (Coastal Region),"This wine has a rustic but appealing air about it, with its cedary pepper and luscious jam nose and elegant balance of berry, smoke and spice. The wine is approachable and will pair with smoked meats and spicy dishes well.",35.0,87,8,0.9470421813901594
14635,The Foundry 2004 Syrah (Coastal Region),"This wine has a rustic but appealing air about it, with its cedary pepper and luscious jam nose and elegant balance of berry, smoke and spice. The wine is approachable and will pair with smoked meats and spicy dishes well.",35.0,87,8,0.9470421813901594
10560,Caricature 2012 Cabernet Sauvignon (Clarksburg),"Stylish oak aromas combine with rich fruit flavors in this full-bodied, velvet-textured wine. It smells like ripe black cherries, vanilla and caramel, with a fruit-forward palate. Made by the Lange Twins Winery.",16.0,86,8,0.9470419331165031
24825,Stolpman 2015 Hilltops Syrah (Ballard Canyon),"This red comes from one of the appellation's most important vineyards. Immense amounts of black peppercorn and raw beef show on the nose of this awesome bottling, which also offers soy-crusted meats that are gamy but not harsh. Rosemary oil, pine needle and peppercorns decorate the palate. It has a meaty lamb-roast richness at its core.",48.0,94,8,0.9470416901001988
96405,De Bortoli 2008 Gulf Station Shiraz-Viognier (Yarra Valley),"This is a bit chunkier and less suave than De Bortoli's more expensive estate bottled Shiraz-Viognier, but it's still a very nice wine. Peppery spice marks the nose, while the flavors feature a nice blend of plum with savory notes of coffee and black olives. Drink now–2015.",20.0,88,8,0.9470412976634245
17176,Kilikanoon 2005 Killerman's Run Shiraz (South Australia),"This medium- to full-bodied wine manages to be mouthfilling and round without being excessively soft or syrupy. A savory, meaty, coffee-like note complements the ripe blackberry fruit, which persists a good long time on the finish. Drink now–2015.",20.0,91,8,0.9470410178061309
70742,Del Rio 2012 Merlot (Rogue Valley),"Trim and tannic, this distinctive effort mixes bright black cherry and cassis fruit with peppery herbs, notably rosemary. The balance is right on track, and the wine holds together through a medium-long finish.",28.0,86,8,0.9470405399908429
71871,Del Rio 2012 Merlot (Rogue Valley),"Trim and tannic, this distinctive effort mixes bright black cherry and cassis fruit with peppery herbs, notably rosemary. The balance is right on track, and the wine holds together through a medium-long finish.",28.0,86,8,0.9470405399908429
68003,La Bouvaude 2011 Elégance Red (Côtes du Rhône),"Plush and creamy in texture, loaded up with toasted coconut and vanilla, this is a tasty, well crafted oaky red. Hints of berries add depth to the vanilla-laden palate, then linger on the supple finish. Drink now.",15.0,89,8,0.947040416186749
94446,Ott & Murphy 2010 L'Entente Red (Columbia Valley (WA)),"This blend of Syrah, Petite Sirah, Mourvèdre and Viognier offers intriguing aromas of blackberry and plum with woodspice accents. It's pleasingly fresh and pure with rich, focused fruit flavors that linger.",36.0,91,8,0.9470399408560688
70782,Rochioli 2014 Little Hill Pinot Noir (Russian River Valley),"Succulent and complex, this wine offers substantial body and lush plushness on the palate, alluring in its layering of cardamom spice and orange, cranberry and cherry. Satisfyingly ripe, with inimitable balance, it shows the elegance possible in spite of the appellation's power.",78.0,94,8,0.9470374887617459
108423,Rochioli 2014 Little Hill Pinot Noir (Russian River Valley),"Succulent and complex, this wine offers substantial body and lush plushness on the palate, alluring in its layering of cardamom spice and orange, cranberry and cherry. Satisfyingly ripe, with inimitable balance, it shows the elegance possible in spite of the appellation's power.",78.0,94,8,0.9470374887617459
45213,Sextant 2012 Holystone Red (Paso Robles),"Made from 47% Primitivo, 29% Zinfandel, 16% Syrah and 8% Petite Sirah, this offers a complex nose that mixes sanguine elements of iron, tar and black rocks with smoked meats. The palate is plush and smoky with decent grip, culminating with a bit of creosote funk on the finish.",28.0,89,8,0.9437450112658211
82698,Sextant 2012 Holystone Red (Paso Robles),"Made from 47% Primitivo, 29% Zinfandel, 16% Syrah and 8% Petite Sirah, this offers a complex nose that mixes sanguine elements of iron, tar and black rocks with smoked meats. The palate is plush and smoky with decent grip, culminating with a bit of creosote funk on the finish.",28.0,89,8,0.9437450112658211
35514,Browne Family Vineyards 2013 Cabernet Franc (Columbia Valley (WA)),"This wine is all varietal coming from Canyon Vineyard Ranch and Blackrock vineyards. Aromas of herbs, vanilla, dill and coffee are followed by full-feeling chocolate and cherry flavors. Vanilla and coffee notes linger on the finish.",36.0,88,8,0.9437422147907666
96933,Once and It's Gone 2013 Cabernet Sauvignon (Napa Valley),"This affordable wine impresses in smoky, charred oak and a full, robust profile that it embraces completely. Leather, blackberry and black pepper combine on the palate for power and a lengthy, lasting impression on the finish.",20.0,91,8,0.9437417928700575
32542,Mercer 2013 Reserve Syrah (Horse Heaven Hills),"The barrel influence plays prominently on the aromas, with notes of cocoa, vanilla and spice that show some warmth. On the palate, a mix of fruit and barrel flavors conveys creamy dark fruit, caramel and vanilla.",42.0,88,8,0.9437417683193974
42553,Shannon Ridge 2010 High Elevation Collection Petite Sirah (Lake County),"Grown in the High Valley appellation within Lake County, this is huge, black and packed with blackberry and blueberry flavors. It's decadent like a blueberry pie topped with chocolate sauce. Ready to drink now.",23.0,87,8,0.9437416935798287
80888,Cadaretta 2013 Windthrow Red (Columbia Valley (WA)),"A blend of three-quarters Syrah along with 17% Mourvèdre and 8% Cinsault, this wine brings aromas of vanilla, herb, coffee and cherry. The blackberry flavors are lush and full, showing precision, with oak notes speckled throughout.",50.0,91,8,0.9437416877369914
43357,Sparkman 2013 Evermore Cabernet Sauvignon (Columbia Valley (WA)),"This wine is 100% varietal, coming from old blocks at Dionysus and Upland vineyards. It enchants the senses with aromas of pure blackberry along with dried herb and coffee that are followed by restrained yet luxurious espresso and cherry flavors. The balance is impeccable and the finish lingers.",100.0,92,8,0.9437415890165675
101660,Bartholomew Park 2011 Estate Vineyard Zinfandel (Sonoma Valley),"Made from head-trained vines planted where California winemaking pioneer Agoston Haraszthy first grew the variety 150 years ago, this lush wine offers intense aromatics of tar, brick and smoke, with briary blackberry secondary on the nose. The finish is topped by flavors of cocoa and a sprinkling of black pepper.",45.0,90,8,0.9437415178938962
18715,Mira 2009 Hyde Vineyard Syrah (Napa Valley),"The esteemed Hyde Vineyard is in Carneros, and is the source for some incredible Syrahs from winemakers like Joseph Phelps and the Hyde Vineyard label itself, and Mira now joins that list. The wine is wonderful. Made from 100% Syrah, it's high in alcohol, offering rich, dense waves of blackberry and blueberry jam, chocolate, peppercorn and vanilla.",48.0,92,8,0.9437414856526238
116316,Rex Hill 2014 Sunny Mountain Vineyard Pinot Noir (Willamette Valley),"Chewy and packed with flavors of dark chocolate, espresso and a bit of cracker, this retains focus as it punches through to a tasty finish. The black-cherry fruit is cloaked in the dark accents listed above, and has the muscle to stand up to blackened seafood and smoked meats.",55.0,90,8,0.9437413895269982
51067,Novy 2013 Zinfandel (Russian River Valley),"Dark in color and generously bodied, this wine exudes a taste and aroma of brown sugar and roasted plum, flavors that ride a wave of soft, velvety texture, blackberry compote and mocha chocolate. Richly rewarding, it's also a tremendous value.",22.0,90,8,0.9437413829566677
103402,The Lucky Country 2014 Shiraz (McLaren Vale),"Rich, full bodied and plush, with mochaccino-like fruit and plummy notes. This Shiraz is warm and inviting, picking up hints of vanilla and mint along the way. The velvety finish lingers.",20.0,90,8,0.9437413342731815
31812,Bridge Press 2013 XL Vineyard Cabernet Franc (Walla Walla Valley (WA)),"This wine hails from a new vineyard region high above famed Seven Hills. Baking spice, cocoa and herb aromas are followed by focused black-fruit flavors, with espresso and vanilla notes that linger. It captures the attention.",30.0,91,8,0.9437412255146557
115444,Terra d'Oro 2015 Teroldego (Amador County),"This is a dark, almost thick, velvet-textured wine with plenty of tannin and flavors of blackberry and black pepper. While mouthcoating in texture, its not overly full in body, and will pair well with cheesy pastas and rich meat braises.",18.0,90,8,0.9437412049057723
114275,Rasa 2009 Occam's Razor Block Ten Syrah (Walla Walla Valley (WA)),"Sourced from the Seven Hills vineyard, this deep and dark Syrah offers rich black-cherry and cassis flavors. The palate is dense and complex, with beautifully integrated charcoal, gravel, earth and espresso components.",60.0,93,8,0.943741129932709
67962,Masi 2003 Mazzano  (Amarone della Valpolicella Classico),"This has enormous richness and intensity, with penetrating aromas of leather, tobacco, spice, dark fruit and dark chocolate. On the palate, it's inky, rich and supersmooth. This is one of the best Italian wines ever made from the difficult 2003 vintage.",175.0,96,8,0.9437410366209122
110138,One Hope 2013 Cabernet Sauvignon (California),"This big, savory wine has lots of personality, offering cedar and mahogany aromas followed by generous flavors like tobacco, black olive and blackberry. The texture is appropriately tannic yet smooth, and the finish lingers.",19.0,89,8,0.943740964816264
1006,Château d'Or et de Gueules 2010 Les Cimels Red (Costières de Nîmes),"Dense almost to the point of chewiness, this is a concentrated blend of Syrah, Carignan and Grenache. Earthy, plummy notes pick up hints of dark chocolate and licorice before ending rich and velvety.",17.0,90,8,0.9437409349043882
85195,Fidelitas 2014 Ciel du Cheval Vineyard Cabernet Sauvignon (Red Mountain),"Coming from one of the state's premier vineyards, barrel-spice aromas are at the fore on first pour, with black-fruit and herb notes far in the background. The dark-fruit flavors are concentrated initially, tapering slightly toward the finish.",65.0,89,8,0.9437409103203181
371,Guardian 2013 Confidential Source Merlot (Columbia Valley (WA)),"All varietal, this wine is a blend of fruit from top sites Ciel du Cheval, Conner Lee, Obelisco and Stonetree. The aromas are quite reserved, with notes of barrel spice that are followed by full-bodied fruit flavors with a spicy finish. It drinks well but the variety seems lost.",30.0,89,8,0.9437408933981862
72788,Castello Romitorio 2006  Brunello di Montalcino,"Sandro Chia and his family at Castello Romitorio offer a rich, plush and velvety expression of Brunello with excellent dimension and staying power. Plump fruit flavors and black cherry color the long, soft fade.",45.0,93,8,0.9437408317082656
91589,Domaine des Remizières 2011 Cuvée Christophe  (Crozes-Hermitage),"One of the finest Crozes-Hermitage wines I can remember tasting, this wine combines mouthwatering notes of hickory-smoked pork and dark berries. There's plenty of richness on the midpalate and a long, velvety finish, making this truly a complete package. Drink now–2030.",47.0,93,8,0.9437407452395895
12225,Sensorium 2009 Uvas Valley Vineyard Cabernet Sauvignon (Santa Cruz Mountains),"There's a unique and pleasing savory character to the nose of this wine, like a just-seared filet mignon. On the palate, it's quite smooth, with rich plum, tart cherry and dark chocolate flavors, making for a complex yet quality sipping experience.",36.0,91,8,0.9437406662302925
112271,Peachy Canyon 2010 Especiale Zinfandel (Paso Robles),"Zinfandel is joined by Mourvèdre and a few other minor grape varieties in this overtly sweet, high alcohol wine. It's soft and glyceriney, with cherry, blueberry, dark chocolate and pepper flavors. You have to give it credit for being true to its style.",40.0,88,8,0.9437404895729149
94492,Auclair 2013 Red Wine Heart of the Hill Vineyard Cabernet Sauvignon (Red Mountain),"Coming from the warm 2013 vintage, this wine is chock-full of dark fruit aromas and flavors, along with generous spice notes. It brings a lot of appeal, though it occasionally seems slightly dried out.",55.0,89,8,0.9437404376454714
67583,Force Majeure 2014 Estate Grown Syrah (Red Mountain),"Though Viognier only makes up 1% of this wine, it substantially lifts the aromas, which bring notes of wild flowers along with blue and black fruit. The flavors are bold and full bodied, pulling no punches but showing exquisite concentration and length.",70.0,93,8,0.9437404073295735
3836,Ryan Patrick 2013 Elephant Mountain Vineyard Reserve Cabernet Sauvignon (Rattlesnake Hills),"Toast, savory herb, vanilla and dark cherry aromas are followed by lush, full-bodied fruit and barrel flavors. Vanilla and dill notes are speckled throughout and at times intrude.",50.0,88,8,0.9437404047661222
6974,D'Arenberg 2010 The Blind Tiger Single Vineyard Shiraz (McLaren Vale),"This wine starts off a bit tarry at first, with scents of asphalt and roasted meat that then give way to brighter notes of blackberry and vanilla. On the palate, it's full, supple and rich, with a finish marked by hints of campfire and cherry.",85.0,92,8,0.9437404024790953
82857,Villa Maria 2014 Reserve Gimblett Gravels Merlot (Hawke's Bay),"Impressively rich, velvety and long, this appears to have all the ingredients for cellaring. Ample oak supports and elevates the fruit-derived notes of cherry preserves, dark chocolate and black olives, while lending hints of cedar, vanilla and mocha. Drink this remarkable effort 2020–2030.",50.0,93,8,0.9437403579606657
614,Bunnell 2011 ALX Syrah (Columbia Valley (WA)),"All Syrah, this blend of Yakima Valley and Wahluke Slope fruit offers aromas and flavors of cocoa, vanilla, pepper and dark cherry. The pleasing interplay of fruit and barrel comes with a soft, pillowy feel.",42.0,90,8,0.9437403544173015
7478,Edmeades 2011 Zinfandel (Mendocino County),"A dusty, brambly Zinfandel nuanced in blueberries and plums, this is smooth and soft on the palate with an earthy quality throughout. On the finish this medium-bodied wine offers leathery tobacco and smoke.",20.0,87,8,0.9437403208012743
31231,J. Bookwalter 2014 Antagonist Elephant Mountain Syrah (Yakima Valley),"This site is seeing an increasing number of vineyard-designated bottles made from it. This one brings brooding aromas of dark fruit, licorice and spice that lead to full-bodied, almost jammy fruit flavors. It shows a lot of hedonism but retains its impeccable balance.",45.0,91,8,0.9437403178637984
14034,Della 2015 Pinot Noir (Russian River Valley),"Made from three vineyards within the appellation, this displays exemplary blending. Slightly reductive now, in its youth, it effortlessly melds together dark blackberry, strawberry and chocolate flavors, with a surly shock of pine forest-like earthiness. Decadent and velvety.",60.0,94,8,0.9437402528128741
17718,Cadaretta 2014 Windthrow Red (Columbia Valley (WA)),"This wine is 76% Syrah, 15% Mourvèdre and 9% Grenache. Aromas of black fruit, bittersweet chocolate, coffee, raw meat and spice are followed by smooth black-coffee flavors. It lingers on the finish.",50.0,90,8,0.9437402196220284
51880,Cadaretta 2014 Windthrow Red (Columbia Valley (WA)),"This wine is 76% Syrah, 15% Mourvèdre and 9% Grenache. Aromas of black fruit, bittersweet chocolate, coffee, raw meat and spice are followed by smooth black-coffee flavors. It lingers on the finish.",50.0,90,8,0.9437402196220284
24997,Ben Ish 2015 Ben's Select Zinfandel (Lodi),"Powerful, dark syrupy flavors and strong salt and pepper spices vie for attention in this full-bodied wine. It has heady fruit aromas, savory, spicy accents and a lingering finish.",20.0,86,8,0.9437401682513911
107072,Charles Cimicky 2008 Trumps Shiraz (Barossa Valley),"A strong effort from Cimicky, the 2008 Trumps displays ample complexity in its hints of chocolate, coffee, cedar, blueberries and baking spices, then puts all of that in a soft, creamy, mouthfilling package tinged with licorice on the finish. Drink now.",20.0,90,8,0.9437401195988431
379,Milbrandt 2013 The Estates Clifton Hill Vineyard Syrah (Wahluke Slope),"Aromas of coffee, barrel spice and dark-blue fruit lead to rich, full-bodied blackberry and spice flavors. It's not for the faint of heart but delivers a lot of enjoyment.",42.0,89,8,0.9437400246614279
37736,Milbrandt 2013 The Estates Clifton Hill Vineyard Syrah (Wahluke Slope),"Aromas of coffee, barrel spice and dark-blue fruit lead to rich, full-bodied blackberry and spice flavors. It's not for the faint of heart but delivers a lot of enjoyment.",42.0,89,8,0.9437400246614279
14786,Patricia Green Cellars 2015 Estate Vineyard Etzel Block Pinot Noir (Ribbon Ridge),"Named after neighboring winery owner Mike Etzel (Beaux Frères), this exceptional wine is brilliantly focused and rippling with muscular depth. The palate is etched with blackberry and black cherry fruit, immersed in lush vanilla, coffee and caramel tones. It's instantly gratifying, impossibly seductive and exceptional in every way.",60.0,96,8,0.9437400197442588
100814,Artisan Uprising 2012 Merlot (Paso Robles),"Heady aromas of pine needles, beef char, pork fat, cooked cherries, pipe tobacco and leather greet the nose on this wine by the Vondrasek brothers. There is lots of zing on the palate, with flavors of purple fruit and cracked black pepper.",32.0,88,8,0.9437399891326558
93576,Declaration 2014 Cabernet Sauvignon (Napa Valley),"With its compelling label art, this wine offers intense ripeness and lingering vanilla- and cola-like sweetness. Softly textured, it's unfussy in its expression of baked cherry and blackberry fruit.",80.0,87,8,0.9437399566107558
36245,J & J 2013 Les Collines Vineyard Syrah (Walla Walla Valley (WA)),"Aromas of caramel, coffee bean and assorted blue fruit are in the lead, with cinnamon notes providing accents. The palate is full flavored yet restrained, with smoked meat and olive flavors that glide on the finish.",30.0,90,8,0.9437398619924376
71926,Genoa 2012 Leeway Reserve Boushey Vineyard Merlot (Yakima Valley),"Vanilla, coconut shavings, earth and dark-fruit aromas are followed by full-bodied fruit and barrel flavors. It delivers enjoyment, but the variety seems to get lost in the oak.",33.0,88,8,0.9437398198856018
15297,Figaro 2011 Tinto Red (Calatayud),"This is dark as night, with boysenberry, blackberry, animal fur and smooth oak aromas. For $10, it's bringing all sorts of power and quality, like oak-influenced flavors of vanilla, chocolate, blackberry and cassis. On the finish, this is full and smacks down with tannic grab.",10.0,88,8,0.9437398111584452
104837,Prime Solum 2011 Cabernet Sauvignon (Napa Valley),"Black licorice, blackberry and a luxurious current of dark chocolate play off the palate in this full-bodied, well-crafted and ultimately delicious wine. Plush and lush, it ends memorably in a spark of spicy clove and nutmeg.",49.0,93,8,0.9437398041789892
94115,Domaine de la Mordorée 2010 La Reine des Bois Red (Châteauneuf-du-Pape),"The Delorme family's luxury cuvée is aged in a fair bit of small oak, which imparts a plush texture and cedary overtones to the wine. It's full-bodied and powerful, loaded with dark cherry fruit and baking spices that linger on the finish. Drink now–2020 or so.",141.0,94,8,0.9437397541409022
81181,Kay Brothers 2012 Amery Vineyard Hillside Shiraz (McLaren Vale),"Like it's slightly more elevated cousin, Kay's Block 6 Shiraz, this is full bodied and almost painfully concentrated. Lovely oak-derived notes of cinnamon, vanilla and mocha cosset roasted meat and blueberries, then glide to a long, dusty finish. Drink 2020–2030.",60.0,93,8,0.9437397353014239
84351,Lantz 2012 Syrah (Red Mountain),"Aromas of raspberry jam, pencil lead and barrel spices are followed by rich, full-bodied fruit flavors that pack a hefty punch. Not for the faint of heart, it shows the power this growing region can bring.",36.0,92,8,0.9437396083406052
19861,Cloak & Dagger 2014 Illuminatus Sangiovese (Paso Robles),"This almost-opaque bottling from the Hidden Valley Vineyard unleashes a powerful wave of aromas, from concentrated blueberry to licorice and vanilla to plum sauce. Cassis flavors permeate the dense palate, feeling lavish and nearly over-the-top.",40.0,88,8,0.9437395627729763
69272,Esk Valley 2013 Winemaker Reserve Gimblett Gravels Syrah (Hawke's Bay),"Rich, velvety and intense, this is packed with gorgeous mulberry and spice aromas and flavors, with intriguing hints of tar and espresso. Senior Winemaker Gordon Russell deserves much credit for crafting such a voluptuous expression of Hawke's Bay Syrah. Drink now–2025.",39.0,93,8,0.9437395279615085
50692,14 Hands 2012 The Reserve Cabernet Franc (Horse Heaven Hills),"This wine brings aromas of herbs, black cherry, chocolate and flowers. The palate is medium bodied, showing a mixture of fruit and barrel flavors that include vanilla, cocoa and cherry.",30.0,90,8,0.9437395183160203
14468,Alpha Omega 2012 Cabernet Sauvignon (Napa Valley),"With an underlying current of power and tension, this wine offers a wealth of chocolate, dust and tobacco leaf flavors, its texture softly layered with integrated tannin and oak. Complex and long on the finish, it continues to unravel in the glass.",108.0,93,8,0.9437394906973939
3713,Lava Cap 2012 Estate Bottled Cabernet Franc (El Dorado),"An almost sweet oakiness rounds the corners of this full-bodied, lavishly flavorful wine. It wafts vanilla and chocolate in the aromas, ripe black cherry and dark chocolate on the palate, and a lingering baking-spice character on the finish.",28.0,90,8,0.9437393849546998
106215,Rock Wall 2012 Westphall Ridge Vineyard Zinfandel (Rockpile),"A twist of clove, fig and chocolate figure into this powerful, concentrated wine, with baked plum, tobacco and maple taking on secondary roles. It's full bodied and thick, so pair appropriately. It finishes in black pepper.",45.0,90,8,0.9437393634954849
86315,Round Pond 2012 Cabernet Sauvignon (Rutherford),"Soft and spicy, this wine is a mix of full-bodied ripeness and edgier undertones of dried herb, black tea and tobacco leaf. Blackberry jam is the fruitier component, while the finish is sizable in tannin.",60.0,88,8,0.9437393596830826
108613,Spring Valley Vineyard 2013 Nina Lee Estate Grown Syrah (Walla Walla Valley (WA)),"Brooding aromas of herb, dark fruit and spice lead to full bodied cranberry and cherry flavors that bring a lot of oomph. It's a delicious example of the variety.",50.0,92,8,0.9437392896127934
55405,Monticello Vineyards 2011 Estate Merlot (Oak Knoll District),"Very dense and eminently intriguing on the nose, this wine shows aromas of turned earth, black olive, concentrated strawberry and gravel. Sagebrush and tarragon power the tip of the palate, which emerges into dense yet restrained blueberry and black cherry, all presented in a very appealing way.",35.0,92,8,0.9437392501482956
602,Seven Hills 2013 McClellan Estate Vineyard Malbec (Walla Walla Valley (WA)),"All varietal, this wine offers unique aromas of toast, fig, dried herb and exotic spice. The purple fruit flavors are deft in style with a pleasing sense of balance, length and texture.",30.0,90,8,0.9437390530396538
39458,The Better Half 2013 Pinot Noir (Marlborough),"The brand name is a reference to the winemaker, George Elworthy, being married to the considerably more renowned winemaker, Jules Taylor. George's wine is a bargain compared to most Pinots on the market, offering ample cherry fruit backed by vanilla and herb notes. It's supple and medium bodied, with a soft, inviting finish. Drink now.",14.0,87,8,0.9437390346616467
109121,Paro 2013 Mounts Vineyard Malbec (Dry Creek Valley),"Meaty, brawny and substantial in every way, this powerfully robust and full-bodied wine is softened somewhat by floral notes of violet and lavender on the nose. Tannin and oak overpower the licorice and blueberry that lurk, finishing bittersweet.",35.0,86,8,0.9437390163192224
17787,Tedeschi 2008  Amarone della Valpolicella,"Veins of sweet cinnamon and chocolate run through the body of this thick, concentrated wine. Exceedingly soft and supple, it has penetrating endnotes of cherry preserves, blackberry pie and Middle Eastern spice.",50.0,90,8,0.9437389889110223
84254,Tedeschi 2008  Amarone della Valpolicella,"Veins of sweet cinnamon and chocolate run through the body of this thick, concentrated wine. Exceedingly soft and supple, it has penetrating endnotes of cherry preserves, blackberry pie and Middle Eastern spice.",50.0,90,8,0.9437389889110223
92962,Jean-Luc Colombo 2014 Les Forots Grenache-Syrah (Côtes du Rhône),"A strong effort from Jean-Luc and his team, the 2014 Les Forots is a nearly 50-50 blend of Grenache and Syrah. It offers layers of ripe fruit, ample weight and a supple mouthfeel, with just hints of garrigue for complexity and interest. Drink now–2022.",19.0,90,8,0.9437387910066055
