,title,description,price,points,lda_label,8
77677,Sonsierra 2012 Pagos de la Sonsierra Reserva  (Rioja),"Concentrated black-fruit aromas are charred and savory, with notes of grilled beef and black olive. A plush plump layered palate offers earthy saucy savory plum fruit, while the finish is round, wholesome and smooth. Drink through 2023.",35.0,92,8,0.9526222358975251
107746,Sonsierra 2012 Pagos de la Sonsierra Reserva  (Rioja),"Concentrated black-fruit aromas are charred and savory, with notes of grilled beef and black olive. A plush plump layered palate offers earthy saucy savory plum fruit, while the finish is round, wholesome and smooth. Drink through 2023.",35.0,92,8,0.9526222358975251
14088,Hess 2014 Small Block Series Reserve Cabernet Sauvignon (Napa Valley),"Textured and lengthy, this full-bodied reserve-level wine is soft and round on the palate, expressive in black olive, black cherry, mocha and vanilla. It offers impressive richness and leathery grit on the palate.",125.0,91,8,0.952622160227706
12785,Ramey 2014 Syrah (Sonoma Coast),"From a range of vineyards including Cole and Rodgers Creek, this blend is thick and soft, highlighted in charcuterie, black licorice and tar aromas. Birch and leather add more savory personality, as the nose continues to suggest the aromatic landscape of an Italian deli. It's cofermented with a small percentage of Viognier.",40.0,92,8,0.9526221461081326
6986,J & J 2012 Les Collines Vineyard Syrah (Walla Walla Valley (WA)),"Coming from one of the state's top Syrah sites, this wine dazzles the senses with notes of freshly roasted coffee, char, dark plum and sweet spices. It's medium bodied with thoroughly delicious coffee flavors backed by a soft feel.",30.0,92,8,0.9526221132683065
98566,K Vintners 2012 The Beautiful Syrah (Walla Walla Valley (WA)),"Aromas of kirsch and spiced plum mix with smoked meat, blue fruit and assorted herbs, with the Viognier (4%) blended in adding a floral top note. The palate offers dense, layered blue-fruit flavors that glide on the finish. Best by 2020.",50.0,93,8,0.9526220267711221
107634,Arbor Crest 2012 Four Vineyards Merlot (Columbia Valley (WA)),"A sensational value, the grapes come from top vineyards that generally command high prices. Tobacco and cherry scents roll smoothly into a rich, dense palate loaded with kirsch, crème de cassis and framboise flavors. The fruit is concentrated, sappy and deep.",18.0,91,8,0.9526220194460132
44219,Chateau Ste. Michelle 2008 Cold Creek Vineyard Merlot (Columbia Valley (WA)),"Reserve caliber fruit—a throat-coating mix of blueberry, cherry and cassis—rolls into a rich, full throttle wash of barrel flavors. Toast, smoke, espresso and dark chocolate give the wine depth and gravitas. Ageworthy to be sure, but also enjoyable right now.",28.0,91,8,0.9526218680190605
44686,Trinity Hill 2010 Homage Syrah (Hawke's Bay),"Perennially one of New Zealand's top Syrahs, this full-bodied, creamy-textured wine finishes long and velvety. The black olives, espresso and cracked peppercorns on the nose are marvelously varietally true, while the palate features those dark fruit notes and a moderate dose of dried spices. Drink now–2025.",120.0,93,8,0.9526218466840959
80675,Beckmen 2013 Purisima Mountain Vineyard Syrah (Ballard Canyon),"Rich and layered on the nose, this wine shows peppercorn, bacon fat and blackberry jam aromas. It is full and soft on the palate, with deeply rich yet still a tad tart boysenberry and elderberry fruit as well as an asphalt-driven grip.",32.0,93,8,0.9526218136801254
5176,Balletto 2013 Sexton Hill Vineyard Pinot Noir (Russian River Valley),"From a steep hillside vineyard that is estate owned and farmed, this wine is pungent in dark fruit and black tea. Elusive at first, it takes time to open and reveal classic Sebastopol Hills elements of earth and black cherry, finishing awash in cardamon.",42.0,92,8,0.9526218119409758
48221,Earthquake 2013 Zinfandel (Lodi),"This full-bodied and extroverted wine has become one of Lodi's best-selling. It has an unusually deep color plus lavish aromas of ripe fruit, maple syrup, and milk chocolate. Rich, nearly sweet fruit flavors suggest boysenberry jam.",26.0,90,8,0.9526217544165477
53434,Kilikanoon 2007 Oracle Shiraz (Clare Valley),"Sourced from Kilikanoon's home region of Clare, this is a lush, creamy-textured Shiraz of chocolaty richness, balanced by notes of black olive, plum and mocha. It's intense but not overbearing, with lingering notes of dark fruit and spice on the finish. Drink now–2020.",70.0,93,8,0.9526217080091731
47158,Lost Blues 2013 Good Fences Syrah-Grenache (Santa Maria Valley),"Emerging winemaker Giovanni Grandinetti is one to watch. In this bottling he blends co-fermented lots of 60% Syrah and 40% Grenache from Bien Nacido and Murmur vineyards to produce aromas reminiscent of venison in a rainbow peppercorn glaze, with touches of tar and crushed graphite. The palate is likewise quite gamy and tarry, with dried beef and teriyaki touches.",42.0,92,8,0.9526215681171917
44109,La Fortuna 2007  Brunello di Montalcino,"La Fortuna Brunello shows a distinctive nose with a vein of sweet spice that holds up the plump fruit. You'll find rum cake, cinnamon bun, Christmas spice and chocolate-covered cherry. It's soft, plush and rich on the finish, with a lingering note of sweetness that drives its cheerful personality.",49.0,94,8,0.9526215104961595
50443,Poliziano 2004 Asinone  (Vino Nobile di Montepulciano),"This is a bold, meaty wine with thick aromas of smoke, cured meat, mesquite wood, ripe blueberry and sweet cherry. It makes a grand impression on both the nose and the tongue because of its exceptional density, its supple texture and its impressive length.",65.0,91,8,0.9526214678924472
82217,Chateau Ste. Michelle 2013 Ethos Reserve Merlot (Columbia Valley (WA)),"Most of the fruit for this wine comes from the esteemed Cold Creek Vineyard. It brings an aromatic medley of plum, cocoa, vanilla, milk chocolate and spice. The flavors are plush in feel, barrel heavy, but still bringing plenty of appeal.",45.0,91,8,0.9526213763699647
13481,Newsome-Harlow 2009 The Deviant Red (Calaveras County),"NH is making a heritage blend here from 50% Carignane, 30% Zinfandel from the Big John Vineyard and 20% Petite Sirah from Dalton Vineyard, all grown in Calaveras County. Superfull in body and texture, the blend is high in ripe raspberry and plum, Zin-spicy with savory cedar and smokiness too.",42.0,89,8,0.9526212214415659
56761,Robert Ramsay 2012 McKinley Springs Cinsault (Horse Heaven Hills),"A seldom-seen near 100% offering of this variety (6% Syrah is blended in), this wine shows notes of herbs, sugared plum, thistle and chocolate. It coats the palate from end to end with silky soft, almost pillowy fruit and savory flavors that keep the interest high.",32.0,89,8,0.9526211901930874
87506,Keating 2013 Buchignani Vineyard Zinfandel (Dry Creek Valley),"Bacon meat and blackberry pie jump from the glass in this full-bodied, ripely concentrated vineyard-designate, a strong and powerful wine. Smoky oak and a thickness of body weight round out the big, bold experience.",35.0,87,8,0.9526211671119106
608,Acacia 2013 Pinot Noir (Carneros),"Smoky cinnamon and nutmeg pierce the entry of this wine, a dense, full-bodied expression of place. Layers of rich cherry and strawberry lie over classic varietal earthiness, finishing medium in length.",28.0,90,8,0.9526209963047795
50696,Dry Creek Vineyard 2014 Heritage Vines Zinfandel (Dry Creek Valley),"Impressively crafted from 20-plus-year-old vines, thus the Heritage tag, this blend of mostly Zin with 20% Petite Sirah and 1% Primitivo is like Sunday brunch. It offers a study in bacon and strawberries laced in syrup, a thick, leathery wine that finishes balanced and just shy of over-decadent.",22.0,90,8,0.9526208043763427
51124,Dry Creek Vineyard 2014 Heritage Vines Zinfandel (Dry Creek Valley),"Impressively crafted from 20-plus-year-old vines, thus the Heritage tag, this blend of mostly Zin with 20% Petite Sirah and 1% Primitivo is like Sunday brunch. It offers a study in bacon and strawberries laced in syrup, a thick, leathery wine that finishes balanced and just shy of over-decadent.",22.0,90,8,0.9526208043763427
108654,Gramercy 2013 Lower East Syrah (Columbia Valley (WA)),"The aromas bring immediate appeal, with notes of brown stems, herbs, crushed flowers, smoked meat and black pepper. The flavors don't disappoint, showing purity, focus and generosity with a spot-on sense of balance and a lengthy finish that kicks it up a notch. Give it time to open up.",28.0,93,8,0.952620773081923
72276,Carlisle 2014 Zinfandel (Dry Creek Valley),"Combining fruit from two different ranches, as well as 11% Petite Sirah from another site, this fulsome, sultry wine broods in blackberry, vanilla and coconut, presenting itself as friendly if buxom. Broadly appealing, it's full bodied and yet restrained in terms of oak, allowing the fruit to sing.",37.0,92,8,0.952620550095103
77174,Domaine Saint Pierre 2013 Red (Vacqueyras),"This blend of 60% Grenache and 40% Syrah is a terrific bargain. It's full-bodied and creamy in texture yet without excessive weight, featuring complex notes of garrigue and cherries, plus hints of chocolate, cinnamon and clove. Finishes silky and long. Drink now–2025.",21.0,93,8,0.9526204704091414
4426,Rudius 2013 Stoney Vine Vineyard Syrah (Walla Walla Valley (OR)),"This winery's Walla Walla Valley debut displays aromas of ash, green olive, grilled asparagus, dried flowers, smoked meat and blue fruit. The smoke and savory flavors are soft and reserved in style, showing a pleasing persistence on the finish.",58.0,91,8,0.9526204251376321
81826,Rudius 2013 Stoney Vine Vineyard Syrah (Walla Walla Valley (OR)),"This winery's Walla Walla Valley debut displays aromas of ash, green olive, grilled asparagus, dried flowers, smoked meat and blue fruit. The smoke and savory flavors are soft and reserved in style, showing a pleasing persistence on the finish.",58.0,91,8,0.9526204251376321
85118,Kokomo 2013 Pauline's Vineyard Merlot (Dry Creek Valley),"A richness of brown sugar and cinnamon lies at the heart of this soft, supple wine, accented in bold shakes of cinnamon toast. Hints of rustic leather beat softly beneath its full-bodied core.",34.0,89,8,0.9526201698288669
37705,Genoa 2013 Danger Buoy Sangiovese (Walla Walla Valley (WA)),"Sangiovese from this appellation is quite a rarity. This one offers aromas of vanilla, coconut and dark cherries that are followed by full-bodied fruit and barrel flavors. The variety gets lost in the oak but it still brings appeal.",24.0,88,8,0.9526201533851274
19137,Sinor-LaVallee 2013 Black Label Bassi Vineyard Syrah (San Luis Obispo County),"Mike Sinor is taking his fans on an experimental ride through his new oceanview vineyard, here presenting a rich take on Syrah. It's lush on the nose with olallieberry and blackberry fruit as well as rich bacon fat, vanilla bean and milkchocolate notes. Concentrated black cherry thrives on the palate alongside caramel and vanilla cream.",45.0,93,8,0.9526201298675289
69016,La Rasina 2007 Il Divasco  (Brunello di Montalcino),There's a slightly meaty or stewy quality to this wine that gives it a bold and savory personality. The wine shows slightly jammy notes of cherry and strawberry with touches of leather and tobacco at the back. That overt ripeness seems limited to this vintage of the wine.,80.0,88,8,0.9526200209467092
73392,Barra of Mendocino 2015 Estate Grown Cabernet Sauvignon (Mendocino),"Concentrated earthy, meaty and spicy aromas precede layered, dense flavors of espresso, cassis and cherries as this full-bodied, velvety wine coats the palate and clings to the sides of the mouth. It has extraordinary depth, showing lavish but appropriate oak accents and a delicious lingering finish.",20.0,92,8,0.9526200075089172
80129,Longview 2007 Yakka Shiraz (Adelaide Hills),"Not a typically fruit-driven Shiraz, Longview's 2007 Yakka boasts pungent scents of smoke, leather and marinated beef, then delivers earthy, meaty flavors. It's full in the mouth, with a creamy texture that turns chewier on the finish—perfect alongside rare beef or lamb. Drink now-2018.",25.0,90,8,0.9526199247883973
34773,Plumb Cellars 2011 Cabernet Sauvignon (Columbia Valley (WA)),"Blackberry, cigar box, vanilla bean and black-licorice aromas are out front, with savory herbs in the background, becoming more prominent over time. The dark-fruit flavors are elegant in style and linger on the smoky finish.",39.0,88,8,0.9526198924882063
76173,Domaine de la Terre Rouge 2008 Tête-à-Tête Red (Sierra Foothills),"Bill Easton's “large” production GSM (Grenache, Syrah and Mourvèdre) blend out of the Sierra Foothills exhibits intense mushroom and licorice notes and makes for a great first entry into Easton's headier wines. An affordable Rhône-red pairing with earthy dishes.",18.0,89,8,0.9526198062521676
22839,St Hallett 2013 Black Clay Shiraz (Barossa),"An excellent value, this is a fairly full-bodied, slightly creamy-textured Shiraz that should provide ample pleasure through 2020. Smoky, plummy fruit finishes warm and plush.",15.0,90,8,0.9526196782087933
91954,St Hallett 2013 Black Clay Shiraz (Barossa),"An excellent value, this is a fairly full-bodied, slightly creamy-textured Shiraz that should provide ample pleasure through 2020. Smoky, plummy fruit finishes warm and plush.",15.0,90,8,0.9526196782087933
55786,Two Hands 2006 Harry & Edward's Garden Shiraz (Langhorne Creek),"Like all of the 2006 Garden offerings from Two Hands, this one is full-bodied, creamy and makes a slightly sweet impression on the palate because of its combination of high alcohol (15.2%) and superripe fruit. Cedary, spicy oak accents raspberry and cassis flavors, which persist on the long finish. Drink now–2011.",60.0,90,8,0.95261958740173
17136,Cairdeas 2012 Counoise (Yakima Valley),"This rare varietal offering, blended with 25% Petite Sirah, displays notes of dark plum, herbs and black and green olive. The fruit flavors are sweet, lush and concentrated with abundant olive flavors on the finish.",36.0,90,8,0.9526195505456286
57372,Jackson Estate 2012 Hawkeye Mountain Cabernet Sauvignon (Alexander Valley),"From a site with elevation rising as high as 2,200 feet, this wine delivers tremendous complexity and minerality, the grapes from volcanic soils. Meaty, with a wisp of smoky char, it's ripe and full bodied in cherry and cassis, nuances of bay leaf and rocky tannin.",55.0,92,8,0.9526194762566759
30520,Argiolas 2005 Turriga Red (Isola dei Nuraghi),"This hearty blend boasts a dark, inky color, with bright aromas of black fruit, cola, dried rosemary, black olive and spice. The finish is thick, concentrated and long lasting.",80.0,90,8,0.9526194642581276
38004,Argiolas 2005 Turriga Red (Isola dei Nuraghi),"This hearty blend boasts a dark, inky color, with bright aromas of black fruit, cola, dried rosemary, black olive and spice. The finish is thick, concentrated and long lasting.",80.0,90,8,0.9526194642581276
53444,Doyenne 2008 Signature Syrah (Yakima Valley),"Cofermented with 2% Viognier, this elegant Syrah rests on a base of toast, coffee grounds, loam and savory herbs. The fruit—pie cherries and plums—is subservient to the details of earth, mushroom and leather. All is beautifully integrated, balanced and long. A wine to savor.",40.0,93,8,0.9526192980483309
111996,Temple Bruer 2005 Organic Shiraz-Malbec (Langhorne Creek),"This unusual blend is 68% Shiraz and 32% Malbec, resulting in a full-bodied, deeply plummy wine. Hints of clove, pepper and earth impart welcome complexity on the nose, while the flavors fold in a black olive component. Softly tannic, so drink now or hold 2-3 years.",15.0,88,8,0.9526192691629581
101582,Giacomo Vico 2007  Barbera d'Alba Superiore,"This elegant Superiore expression of Barbera d'Alba offers loads of spice and black fruit aromas and slightly jammy notes of strawberry and blackberry pie. You'll also get pretty tones of chocolate and tobacco, capped by a smooth, velvety finish.",24.0,89,8,0.9526192236077207
77346,Sonoma-Loeb 2013 Dutton Ranch Pinot Noir (Russian River Valley),"Bombastic and burly, this wine holds a depth of black raspberry and cherry at its edge, surrounded in swathes of smoky oak. Rich and full bodied, it is a testament to the intrigue of baking spices and black tea, but more significantly to dark chocolate and espresso.",39.0,89,8,0.9526192213375446
9193,Christian Leperchois 2012 Lunar Apogé Made with Organic Grapes Red (Côtes du Rhône),"Leperchois's wines are almost always interesting. This one, a blend of 50% Grenache, 25% Syrah, 15% Mourvèdre and 10% Cinsault, features distinctive green olive and peppercorn aromas alongside cherry fruit. It's silky and elegant on the palate, with a long finish. Drink now–2017.",28.0,91,8,0.9526192037370411
54980,Tardieu-Laurent 2008 Guy Louis Red (Côtes du Rhône),"This lush wine will be too oaky for purists, but there is no denying the superb quality of the underlying fruit. It's full-bodied, soft and succulent in texture, with cassis fruit framed by ample cedar and vanilla. A blend of 60% Grenache and 40% Syrah. Drink now–2018.",28.0,90,8,0.9526191189061367
115406,Tenuta Sant'Antonio 2004 Selezione Antonio Castagnedi  (Amarone della Valpolicella),"Run by four boisterous brothers, Tenuta Sant'Antonio is among the rising stars of Valpolicella. This 2004 Amarone delivers thick concentration and intense aromas of dried fruit and black licorice followed by big power and heat. The wine tastes smooth and exceptionally rich in the mouth. It's absolutely gorgeous.",50.0,94,8,0.952618816754556
12892,Wrath 2013 KW Ranch Pinot Noir (Santa Lucia Highlands),"Strong iron, rosebuds, wet gravel and a touch of hibiscus show on the nose of this bottling, which seems ready to unfurl but remains quite reserved right now. The palate starts rather tarry, with more iron and some graphite as well as pine needle and touch of cranberry fruit.",49.0,86,8,0.9526185273091193
108606,MacPhail 2014 Wightman House Pinot Noir (Anderson Valley),"Rich fruit flavors and aromatic complexity make this full-bodied wine tempting and satisfying. Aromas suggest ripe, seemingly sweet cherry plus whiffs of cedar, and the flavors are expressive and layered, carried on a velvety texture that melts in the mouth.",55.0,92,8,0.9526184667745712
69570,Korta Katarina 2006 Reuben's Private Reserve Plavac Mali (Peljesac),"A kaleidescope of scents and flavors, Korta Katarina's premiere bottling is a fascinating study of Plavac Mali at its best. Sweet on the nose and palate with hints of dark chocolate, café au lait, dried herbs and preserved fruit, it's a richly textured wine with a beautifully feminine profile. Big, bold tannins on the finish smooth out considerably with aeration.",57.0,91,8,0.9526182829562567
106070,Armida 2012 Il Campo Estate Field Blend Red (Dry Creek Valley),"Zinfandel, Petite Sirah and Mixed Blacks go into this sumptuous wine, velvety smooth in texture with dollops of blackberry, strawberry and chocolate combining for a decadent experience. The grapes are sourced from an estate vineyard and co-fermented together, giving the wine a seamless feel.",48.0,90,8,0.952618039174929
13405,Monteci 2006  Amarone della Valpolicella Classico,"Wine doesn't get much bigger than this. Bold and opulent, with a whopping 17% alcohol, this over-the-top bottling is aged in oak for two years and delivers masculine, chewy aromas of blackberry jam and Indian spice. Pair it with wedges of aged pecorino cheese.",80.0,88,8,0.952618008075518
49752,Ruca Malen 2009 Yauquen Malbec (Mendoza),"Quintessential Best Buy stuff, with full aromas of meaty berry and leather. Concentrated and dark across the palate, with full-bodied black fruit, black olive and savory flavors. Offers all the color, weight and fruit that a $12 wine should.",12.0,88,8,0.9526179809181519
35879,Fincas Don Martino 2013 Old Vine Reserva Malbec (Luján de Cuyo),"Deep cool aromas of cola and toast blend with sweeter notes of maple and blackberry on this lush full-bodied Malbec. Flavors of blackberry, boysenberry, coffee, mocha and black pepper finish nicely on a well-cut, well-proportioned finish. Drink through 2020.",33.0,91,8,0.9526179320487678
107468,Fincas Don Martino 2013 Old Vine Reserva Malbec (Luján de Cuyo),"Deep cool aromas of cola and toast blend with sweeter notes of maple and blackberry on this lush full-bodied Malbec. Flavors of blackberry, boysenberry, coffee, mocha and black pepper finish nicely on a well-cut, well-proportioned finish. Drink through 2020.",33.0,91,8,0.9526179320487678
42100,Pride Mountain 2012 Syrah (Sonoma County),"Full-bodied and layered, this is a stellar example of the variety, exhibiting elegance beneath a broader exterior. Black pepper and blackberry wrap around dense tannins and a robust texture. The wine is co-fermented with Viognier to bring a floral note to the bouquet.",60.0,91,8,0.9526175750676303
65888,Pride Mountain 2012 Syrah (Sonoma County),"Full-bodied and layered, this is a stellar example of the variety, exhibiting elegance beneath a broader exterior. Black pepper and blackberry wrap around dense tannins and a robust texture. The wine is co-fermented with Viognier to bring a floral note to the bouquet.",60.0,91,8,0.9526175750676303
8821,Joseph Swan Vineyards 2010 Great Oak Vineyard Syrah (Russian River Valley),"Dense and chewy at first, this deliciously brooding wine is all about black licorice, berry and meat. Contoured layers of integrated tannin give it an understated elegance and sense of class despite its wild power and body.",32.0,93,8,0.9526173467629461
41358,Chateau Ste. Michelle 2009 Cold Creek Vineyard Cabernet Sauvignon (Columbia Valley (WA)),"This workhorse vineyard supplies grapes to a wide variety of wines across the entire Ste. Michelle portfolio, but the vineyard-designated wines are much more limited, and they're often the best of show. As the alcohol reaches 15.5%, this selection is sappy, dense and a bit warm. There's plenty of fruit flavor and concentration, but it's difficult to pair such a blockbuster with food.",28.0,89,8,0.9526171178573332
112409,Fossacolle 2006  Brunello di Montalcino,"Brunello Fossacolle opens with a darkly concentrated color and aromas of tobacco, spice, chocolate and meaty, pulpy black fruit. The wine presents a bigger, inky style and shows good depth and density on the palate thanks to its extracted consistency, creaminess and overall intensity.",65.0,92,8,0.9526168502460054
58265,Cooper-Garrod 2013 Finley Vineyard Syrah (Santa Cruz Mountains),"Savory black pepper and cooked blueberry show on the nose of this bottling. Cracked pepper also gives a savory touch to the sip, adding depth to the blackberry and plum flavors. The tannins are fairly sticky into the finish.",35.0,88,8,0.9526168112679105
65101,Rocca di Montemassi 2011 Le Focaie  (Maremma Toscana),"Impressive work is quietly being performed at Rocca di Montemassi, the Zonin-owned property in southern Tuscany. Thanks to new investments and high-profile consultancies, the estate's new range of wines is showing nicely. Among them is this selection that offers a bright, spicy cherry flavor and a silky texture.",15.0,88,8,0.9526167678142452
71405,Silvan Ridge 2010 Cabernet Sauvignon (Rogue Valley),"Fairly aromatic, it conveys notes of red and black fruit, savory herbs, toffee and barrel spices. Lighter in style, it shows abundant vanilla flavors while still bringing a lovely sense of texture and overall balance.",28.0,89,8,0.9526166256913857
102505,Tohu 2010 Single Vineyard Pinot Noir (Marlborough),"Tohu is a wine company owned by New Zealand's indigenous peoples, the Maori. The wines have been mixed over the years, but this is an excellent bottling. It boasts a full, ample mouthfeel and plenty of supple tannins. Black cherry fruit marries well with complex savory notes, while hints of pomegranate brighten the aromas. Drink now.",23.0,90,8,0.9526166230252545
96720,J. Rickards 2008 Ancestor Selections Zinfandel (Alexander Valley),"They can't call the grapes old vine, because the vineyard is only 15 years old. But it was planted from clones that constituted an old vineyard that contained Petite Sirah, Carignane, Mataro and Alicante Bouschet. The wine is robust and rustic, with bright, briary berry fruit and spice flavors that will stand up well against any roasted meats.",22.0,88,8,0.9526165870232772
109948,J. Rickards 2008 Ancestor Selections Zinfandel (Alexander Valley),"They can't call the grapes old vine, because the vineyard is only 15 years old. But it was planted from clones that constituted an old vineyard that contained Petite Sirah, Carignane, Mataro and Alicante Bouschet. The wine is robust and rustic, with bright, briary berry fruit and spice flavors that will stand up well against any roasted meats.",22.0,88,8,0.9526165870232772
80512,Sequum 2012 Kidd Ranch Zinfandel (Napa Valley),"A brambly and intense vineyard-designate rich in blackberry and brown sugar, this proffers just intense enough to provoke, but never gets extreme. Soft on the palate, it has a lively undercurrent of dark cherry grenadine and black pepper. This is one to remember, with a cool label to boot.",40.0,93,8,0.9526165852790991
77869,Water Wheel 2005 Shiraz (Bendigo),"Water Wheel's 2005 Shiraz is a full-bodied, creamy-textured effort filled with the scents and flavors of dark plums, vanilla and coffee. It's delicious now, but should evolve through 2020, thanks to its concentrated fruit and ample tannins.",17.0,90,8,0.952616500980458
