,title,description,price,points,lda_label,9,price_bin
4075,Biondi 2014 Contrada Monte San Nicolò  (Etna),"Fragrant and loaded with finesse, this opens with aromas of wild berry, blue flower, new leather, aromatic herb and a whiff of exotic spice. The structured, elegant palate delivers layers of red cherry, strawberry, flinty mineral, orange zest, star anise and clove framed in firm, polished tannins and bright acidity. It's still young and will develop even more complexity. Drink 2019–2029.",30.0,95,9,0.977494266793796,20-40
24635,Il Colle 2011  Brunello di Montalcino,"Red berry, wild mint, crushed rose, forest floor and new leather are just some of the aromas you'll find on this fragrant delicious red. Seamlessly boasting structure and finesse, the full-bodied palate displays layers of succulent morello cherry, raspberry compote, licorice and cinnamon while firm velvety tannins lend support and a polished texture. A savory saline note wraps up the lingering finish. Drink 2018–2026.",45.0,96,9,0.9735243913868448,above 40
53677,Baricci 2012  Brunello di Montalcino,"Enticing perfumed berry, violet, new leather and a truffle scents emerge in this textbook Brunello. On the savory, full-bodied palate, licorice, clove and chopped herb flavors accent a juicy core of ripe black cherry fruit. Firm, refined tannins provide structure. It's already tempting but hold for even more complexity. Drink 2020–2032.",50.0,96,9,0.9727218371371621,above 40
107160,Produttori del Barbaresco 2011 Rabajà Riserva  (Barbaresco),"Combining finesse and structure, this impressive wine opens with alluring aromas of mature berry, pressed rose, aromatic herb, star anise, new leather and a balsamic note. The palate shows depth and tension, offering raspberry compote, Marasca cherry, licorice, clove and pipe tobacco alongside taut refined tannins. Hold for even more complexity. Drink 2019–2031.",58.0,97,9,0.9718696253850414,above 40
107165,Grimaldi Bruna 2013 Badarina  (Barolo),"A balsamic note of menthol, dark culinary spice, crushed herb, new leather and wild berry aromas come together in the glass. Firmly structured but extraordinarily refined, the palate doles out red cherry, crushed strawberry, tobacco and cinnamon set against tightly woven refined tannins. Lively acidity lends balance and energy while a licorice note wraps around the lingering finish. Drink 2025–2043.",75.0,97,9,0.9742792405445788,above 40
109270,Brovia 2013 Garblèt Suè  (Barolo),"This stunning wine opens with classic Nebbiolo aromas of new leather, rose, wild berry, crushed herb, dark spice and menthol. The palate is chiseled and loaded with finesse, doling out juicy red cherry, ripe strawberry, licorice and cinnamon flavors. It's structured with polished tannins and bright acidity. Drink 2023–2043.",83.0,98,9,0.9666614111230393,above 40
40887,Terralsole 2010 Riserva  (Brunello di Montalcino),"Tilled soil, mature berry, menthol, leather and a suggestion of game unfold on this delicious, full-bodied red. The structured, polished palate doles out juicy Morello cherry, raspberry jam, cinnamon, chopped herb and licorice while firm, refined tannins lend finesse and a silky texture. Drink 2018–2028.",89.0,96,9,0.9689611675272801,above 40
14787,Albino Rocca 2014 Angelo  (Barbaresco),"Earthy, enticing violet, pressed rose, new leather crushed mint and game aromas follow through to succulent, savory palate, along with Marasca cherry and cranberry notes. Star anise, white pepper and clove accents add depth while youthfully assertive, refined tannins and vibrant acidity provide an ageworthy framework. Drink 2022–2034.",98.0,96,9,0.970964259619759,above 40
40881,Gianni Brunelli 2010 Riserva  (Brunello di Montalcino),"Underbrush, dark-skinned berry, chopped mint and cooking spice aromas lead the way on this fabulous, structured wine. The full-bodied palate delivers a juicy core of ripe black cherry while white pepper, cinnamon, dried herb and a balsamic note provide the backdrop. Firm but refined tannins and fresh acidity provide balance and support. Drink 2018–2030.",100.0,97,9,0.9735245632159867,above 40
91818,Mascarello Giuseppe e Figlio 2010 Villero  (Barolo),"Enticing aromas of iris, rose, perfumed red berry and cake spice emerge on this stunning wine. The elegantly structured, silky palate delivers juicy wild cherry, crushed raspberry, mint, white pepper and tobacco alongside firm but ultrafine tannins. It's already tempting but hold to let it unwind and develop more complexity. Drink 2018–2035.",100.0,97,9,0.9678525499691062,above 40
98399,Arpepe 2007 Sassella Vigna Regina Riserva  (Valtellina Superiore),"This radiant, fragrant Nebbiolo opens with a potpourri of scents including aromatic herb, leather, cedar, pressed rose petal and dark spice. The luminous, subtle palate is loaded with finesse, delivering juicy red cherry, cinnamon, star anise, white pepper and pipe tobacco. It's impeccably balanced, with noble tannins and bright acidity. Drink now or hold for even more complexity. Drink through 2032.",105.0,96,9,0.973524501721782,above 40
40877,Baricci 2010 Nello Riserva  (Brunello di Montalcino),"New leather, mature black-skinned fruit, tilled soil and a touch of dark spice are some of the aromas you'll find on this fantastic, full-bodied red. The big, velvety palate shows power and finesse, offering mouthfuls of juicy wild cherry, black raspberry, licorice, Mediterranean herb and a note of exotic spice framed in firm, ripe tannins. It's already balanced and delicious, but hold for more complexity. Drink 2020–2035.",120.0,98,9,0.9774935505948413,above 40
40159,Rivetto 2010 Briccolina  (Barolo),"Succulent wild cherry, black raspberry, rose, violet, licorice, chopped mint, ground pepper and tobacco are just some of the aromas and flavors you'll find on this delicious, structured Barolo. A backbone of firm, velvety tannins and bright acidity support the juicy flavors. Drink 2018–2030.",149.0,96,9,0.9639957680819392,above 40
74174,Massolino 2010 Vigna Rionda Riserva  (Barolo),"This stunning wine opens with scents of tilled earth, leather, pipe tobacco, forest floor and wild berry. The focused, vibrant palate delivers ripe red cherry, white pepper, grilled herb, licorice and an energizing mineral note. Youthfully austere, refined tannins and fresh acidity provide impeccable balance and an impressive, ageworthy structure. Drink 2020–2045.",150.0,96,9,0.9727207936645456,above 40
107175,Aldo Conterno 2013 Bussia Cicala  (Barolo),"Aromas of dark berry, iris, menthol and a whiff of oak emerge on this vibrant wine. Firmly structured but loaded with finesse, the palate delivers ripe Marasca cherry, crushed black raspberry, vanilla, savory mineral and thyme alongside fine-grained tannins. A licorice note wraps around the tight finish. This is still primary so be sure to give it time to fully develop. Drink 2025–2045.",150.0,96,9,0.9727214061198854,above 40
40163,Sandrone 2011 Cannubi Boschis  (Barolo),"Initially shy and brooding, it eventually reveals a potpourri of aromas, including forest floor, graphite, wild berry, mint, rose and a balsamic note. The palate delivers layers of ripe red cherry, black raspberry, tobacco, ground pepper, menthol and cinnamon alongside youthfully assertive but ripe tannins. Drink 2019–2031.",165.0,96,9,0.9678536067691567,above 40
39806,Il Palazzone 2010 Riserva  (Brunello di Montalcino),"Enticing scents of ripe dark-skinned berry, leafy underbrush, chopped herb, dark spice and a toasted note come together on this structured, poised wine. The delicious, full-bodied palate offers layers of juicy black cherry, crushed raspberry, licorice, mint and a blast of orange peel while firm, velvety tannins provide the polished framework. A coffee note closes the lingering finish. Drink 2019–2028.",170.0,95,9,0.976918881629105,above 40
41071,Paolo Scavino 2011 Rocche dell'Annunziata Riserva  (Barolo),"Aromas of mature iris, blackberry, tobacco, crushed mint and baking spice lift out of the glass on this gorgeous Barolo. Despite the scorching heat, the Scavino made a supremely elegant wine, boasting black cherry, crushed black raspberry, menthol, star anise and ground clove framed in fine-grained, velvety tannins and fresh acidity. A gorgeous wine. Drink 2020–2031.",190.0,96,9,0.9718694512430183,above 40
40876,Conti Costanti 2010 Riserva  (Brunello di Montalcino),"Aromas of ripe black-skinned fruit, new leather, menthol and a whisper of blue flower unfold on this stunning, elegantly structured wine. The vibrant palate doles out ripe black cherry, cinnamon and star anise framed in firm, fine-grained tannins. Hold for even more complexity. Absolutely superb. Drink 2022–2035.",190.0,98,9,0.96785234628486,above 40
40888,Fuligni 2010 Riserva  (Brunello di Montalcino),"The nose is still a bit closed but eventually reveals black-skinned berry, dark spice, iris and a whiff of tilled soil. The palate is more expressive and downright delicious, offering juicy black cherry, raspberry jam, cinnamon and a touch of exotic spice. Firm, fine-grained tannins and fresh acidity provide the framework while a licorice note closes the lingering finish. Drink 2020–2032.",195.0,96,9,0.9742811248861601,above 40
