,title,description,price,points,lda_label,8
76722,Sobon Estate 2008 Cougar Hill Zinfandel (Amador County),"A nice dusty Zinfandel from Sobon's Cougar Hill, with spicy, pepper and cedar elements rounding out the prominent blackberry. A deeply concentrated wine that would be great with barbecue.",17.0,88,8,0.9356999064674321
68359,Valley View 2010 Anna Maria Tempranillo (Applegate Valley),"Though the palate can't deliver all that the aromas have to offer, there's intrigue to this estate Tempranillo with notes of dark flowers, sweet tobacco, and dried tea leaves playing off olive and other savory notes.",18.0,86,8,0.9356998174232392
58944,Seven Falls 2012 Merlot (Wahluke Slope),"Mocha, vanilla, woodspice and cherry aromas are at the front of this barrel-forward wine. Flavors display a mixture of fruit and barrel, with the latter winning out on the finish. The variety seems a bit lost but it provides plenty of pleasure.",20.0,88,8,0.935699758693797
60991,Darby 2011 Mourvèdre (Columbia Valley (WA)),"This wine plays to the variety's savory side, with aromas of smoke, raw meat and generous amounts of black pepper. It's full bodied, with mesquite and spice flavors that linger.",42.0,90,8,0.9356996934583394
102381,Waterbrook 2015 Syrah (Columbia Valley (WA)),"Pleasing aromas of marionberry, cocoa and spice are followed by lightly styled but still palate-coating fruit flavors. A velvety texture heightens the appeal, with fruit and barrel flavors lingering on the finish.",13.0,88,8,0.9356996929845505
79388,Kestrel 2012 Winemaker's Select Series Malbec (Yakima Valley),"All varietal from the winery's vineyard, this bottling offers aromas of toast, tar, dark fruit and spice. It's reserved in style with plum and spice flavors that narrow around the edges.",40.0,88,8,0.935699689266384
15739,SeaGlass 2015 Pinot Noir (Santa Barbara County),"One of the more reliable grocery store brands on the market right now, this bottling shows aromas of hot cherry pie with a vanilla and nutmeg crust. The palate moves more toward darker boysenberry flavors, with cola, mace and dried wild herbs.",13.0,87,8,0.9356996209368674
90583,Château de Beaucastel 2009 Coudoulet de Beaucastel Red (Côtes du Rhône),"Beaucastel's Côtes du Rhône is like a mini Châteauneuf-du-Pape in its blend of grapes and its sourcing, just outside that famous appellation. The 2009 is a very successful and flattering Coudoulet, with scents of garrigue and cherry followed by a palate that's round and lush without being at all heavy. Long and velvety on the finish.",36.0,91,8,0.9356996202094348
49448,Umani Ronchi 2007 Cúmaro Riserva  (Conero),"Cúmaro Riserva is a gorgeous wine that offers rich notes of ripe fruit and chocolate, followed by leather, tobacco and exotic spice. Its smooth chocolate richness that sets this wine apart.",45.0,91,8,0.9356995132934337
13831,Northstar 2013 Merlot (Columbia Valley (WA)),"Herb, pencil lead, plum and vanilla aromas are followed by smooth, soft blue-fruit flavors. It shows a beautiful sense of balance.",41.0,90,8,0.9356994949083083
76377,Northstar 2013 Merlot (Columbia Valley (WA)),"Herb, pencil lead, plum and vanilla aromas are followed by smooth, soft blue-fruit flavors. It shows a beautiful sense of balance.",41.0,90,8,0.9356994949083083
50878,Fox Creek 2014 Cabernet Sauvignon (McLaren Vale),"Full bodied, creamy and supple, this wine offers textbook aromas of cedar, tobacco and cassis. It brightens slightly on the palate, where cherry notes join the fun, then finishes long and softly dusty. Drink now–2028.",21.0,91,8,0.9356994406431
39694,Drops of Jupiter 2016 Pinot Noir (San Benito County),"A collaboration between winemaker James Foster and rockstar Pat Monahan of Train, this bottling shows black raspberry, pencil shavings and a feral animal-hide touch to the nose. The palate packs in a lot of licorice spice atop the heavy purple-fruit background.",20.0,89,8,0.935699399751647
106818,D'Arenberg 2011 The Swinging Malaysian Single Vineyard Shiraz (McLaren Vale),"Somewhat restrained yet undeniably potent, this wine boasts a lovely blend of cassis, cinnamon and cedar. It's medium to full in body, with a long, dusty finish. Drink now–2025.",85.0,91,8,0.9356992979910759
10133,Woodward Canyon 2013 Merlot (Columbia Valley (WA)),"Woodspice and vanillin are out in front on the aromas followed by mocha, raspberry and dark fruit. The palate brings lush, concentrated flavors and a lingering finish. It drinks beautifully now sbut should have a long life ahead of it.",52.0,93,8,0.9356991317612748
115891,Woodward Canyon 2013 Merlot (Columbia Valley (WA)),"Woodspice and vanillin are out in front on the aromas followed by mocha, raspberry and dark fruit. The palate brings lush, concentrated flavors and a lingering finish. It drinks beautifully now sbut should have a long life ahead of it.",52.0,93,8,0.9356991317612748
82610,Chateau Ste. Michelle 2011 Cold Creek Vineyard Merlot (Columbia Valley (WA)),"Coming from the cool 2011 vintage this wine offers a blue-fruit profile seldom seen in the state for this variety along with notes of chocolate and coffee. It's elegantly styled with a soft feel, trailing toward the finish.",28.0,87,8,0.9356990088188076
82770,Chateau Ste. Michelle 2011 Cold Creek Vineyard Merlot (Columbia Valley (WA)),"Coming from the cool 2011 vintage this wine offers a blue-fruit profile seldom seen in the state for this variety along with notes of chocolate and coffee. It's elegantly styled with a soft feel, trailing toward the finish.",28.0,87,8,0.9356990088188076
90403,Puccioni 2012 Petite Sirah (Dry Creek Valley),"Soft and approachable, this full-bodied wine features classic elements of blueberry, blackberry and leathery chocolate that finish without much ado.",30.0,86,8,0.9356989471469834
98393,Charles Smith 2013 Royal City Northridge Vineyard Syrah (Columbia Valley (WA)),"The aromas pop, with notes of stargazer lilies, brown stems, green olive and smoked meat, revealing more on each swirl. The fruit and savory flavors are rich and layered, earthshaking in their intensity, with a lengthy finish that only heightens the interest. It's a complete showstopper.",140.0,96,8,0.9356987313971757
34694,Borjón 2010 Clockspring Vineyard Primitivo (Shenandoah Valley (CA)),"Hearty in toasty vanilla, this softly textured Primitivo has a wealth of blackberry fruit and weighty texture that veers dangerously close to overpowering before pulling back and finding its balance. The finish keeps you coming back for more.",24.0,88,8,0.9356983733089429
7648,Great American Wine Company 2013 Zinfandel (California),"Blackberry and boysenberry flavors so ripe they seem sweet fill out this smooth, full-bodied wine. The texture is soft and not at all tannic, letting the potent fruit flavors flow easily through the finish.",16.0,87,8,0.9356983451903658
57703,"Mettler Family Vineyards 2009 Epicenter, Old Vine Zinfandel (Lodi)","Estate-grown from one of the family's oldest Zin blocks, this wine is hugely toasty and oaky, with hits of bacon and dark coffee overshadowing an underlying layer of blackberry flavor.",20.0,85,8,0.93569822681906
76969,Materra Cunat Family Vineyards 2013 Right Bank Merlot (Oak Knoll District),"Floral and soft, this is an enjoyable well-crafted varietal wine, spicy in plum and cherry. Full bodied, the midpalate is relaxed and integrated in nuanced oak.",50.0,88,8,0.9356980976789208
3839,Swiftwater Cellars 2013 Malbec (Columbia Valley (WA)),"The aromas of tar, clove, wood spice and dark fruit show nuance. The flavors are velvety and full, pinching together on the finish. The oak seems a bit prominent at times.",42.0,88,8,0.9356980153023039
60860,Kimmel 2012 Merlot (Mendocino County),"Opulent fruit flavors and an almost thick texture make this delicious and dramatic. The aromas pop with blackberry and cherry, flavors resemble blueberry juice and the mouthfeel is rich and nicely tannic.",38.0,91,8,0.9356978704714024
44785,Four Vines 2012 The Sophisticate Zinfandel (Sonoma County),"This wine, combined with 10% Petite Sirah, impresses in grip and softness, offering big, rich waves of raspberry, cinnamon and allspice, before unveiling a leathery finish. An all-around likable wine, it's ready to enjoy now.",25.0,90,8,0.9356976238387182
17357,D'Arenberg 2011 The Blind Tiger Single Vineyard Shiraz (McLaren Vale),"More concentrated-tasting and intense than some of d'Arenberg's other 2011 single-vineyard Shirazes, this is still somewhat restrained. Some tobacco notes add nuance to the Ribena-like fruit, picking up hints of vanilla and earth on the finish.",85.0,89,8,0.9356974203728995
54522,Saint Clair 2008 Pioneer Block 4 Sawcut Pinot Noir (Marlborough),"The best of this year's crop of Saint Clair Pinots is the Pioneer Block 4, which boasts dark and mysterious aromas of damp earth and ripe plums. It's full bodied and creamy in texture, with hints of mocha emerging on the supple finish. Drink now–2015.",27.0,91,8,0.935697402889613
51010,Seven Hills 2012 Merlot (Columbia Valley (WA)),"Smooth and palate-coating, it's 100% varietal, with just the right balance between blackberry and black cherry fruit, and barrel-induced flavors of toffee, toasted macadamia nuts, and café crème.",28.0,91,8,0.9356973302887598
26972,Nashwauk 2010 Wrecked Shiraz (McLaren Vale),"This wine is dark and inky in color. Nearly impenetrable at first on the nose, this reluctantly giving up hints of plum, cocoa and earth. The plum-pudding palate is dense and weighty, with savory overtones. Give it until 2018 or 2020 to unclench and brighten up.",73.0,92,8,0.9356972829770579
34486,Mocali 2008 I Piaggioni Sangiovese Grosso (Toscana),Mocali is a well-established estate in Montalcino and I Piaggioni is one of its super Tuscan wines. This youthful expression of Sangiovese offers hearty cherry aromas with loads of pretty spice and vanilla at the back.,15.0,88,8,0.9356972742203234
113390,Botter 2011 Caleo Primitivo (Salento),"This exciting selection offers spicy nutmeg and cinnamon notes behind the ripe fruit and prune aromas. A soft, slightly sweet finish is carried forth by the wine's medium density.",10.0,86,8,0.9356967796497924
74243,Clearwater Canyon 2010 Verhey Vineyard Syrah (Washington),"Hailing from Verhey Vineyard in the Rattlesnake Hills, the Syrah from this Idaho producer has notes of cherry cola, chocolate, and medicine cabinet. It's full throttle with palate coating chocolate notes and tart fruit flavors along with a surprising amount of tannins.",28.0,85,8,0.9356959904211859
82464,Skouras 2007 Grande Cuvée Agiorgitiko (Nemea),"Black cherry, pepper and smoked meat on the nose are followed by flavors of smoked cherry, vanilla and pepper on the palate. Focused, with a spin of minerality on the finish, this is a versatile food wine.",26.0,85,8,0.9356958898988949
23132,Pheasant Valley Winery 2009 Primitivo (Columbia Valley (OR)),"Rustic and full bodied, this Oregon Primitivo is plenty ripe, yet it retains nuances of olive and herb, along with thick red fruit. A whisper of smoke weaves through the finish.",30.0,87,8,0.9356958701787502
95548,Pheasant Valley Winery 2009 Primitivo (Columbia Valley (OR)),"Rustic and full bodied, this Oregon Primitivo is plenty ripe, yet it retains nuances of olive and herb, along with thick red fruit. A whisper of smoke weaves through the finish.",30.0,87,8,0.9356958701787502
7849,Alexandria Nicole 2012 Purple Reign Destiny Ridge Vineyard Grenache (Horse Heaven Hills),"An aromatically intriguing wine with notes of pepper, cherry cola, chocolate and herbs. It's medium bodied, flavorful with generous cherry notes and a fleshy feel.",42.0,89,8,0.9356957989563932
25122,Sineann 2014 Russell-Grooters Vineyard Pinot Noir (Eola-Amity Hills),"Wild berries, from elderberry to salmonberry to mountain strawberries, are in play in this wine. The underpinning scents suggest earth and wet cement, while in the finish a strong flavor of breakfast tea lingers. This is an interesting addition to the Sineann lineup.",36.0,90,8,0.9356956452284451
76287,Sineann 2014 Russell-Grooters Vineyard Pinot Noir (Eola-Amity Hills),"Wild berries, from elderberry to salmonberry to mountain strawberries, are in play in this wine. The underpinning scents suggest earth and wet cement, while in the finish a strong flavor of breakfast tea lingers. This is an interesting addition to the Sineann lineup.",36.0,90,8,0.9356956452284451
21490,Cinquain 2006 Nagengast Estate Vineyard Syrah (Paso Robles),"An intensely fruit-driven Syrah marked by jammy blackberry, cherry and raspberry flavors, pepper and melted milk chocolate. Delicious and unidimensional.",41.0,85,8,0.9356956186400969
603,Snoqualmie 2013 Eco Made with Organic Grapes Cabernet Sauvignon (Columbia Valley (WA)),"Dark berry, herb and fig aromas lead to dense, full and palate-coating dark fruit flavors. It checks all the boxes for varietal correctness, concentration and value.",13.0,90,8,0.9356955466119942
110526,Bota Box 2013 Shiraz (California),"This deep-colored wine has a concentrated smell like dried figs and lots of ripe blackberry flavors that glide along on a smooth, nicely dense texture. One gulp easily leads to another one.",23.0,86,8,0.9356954816664648
71089,Gamache 2012 Vineyard Select Reserve Cabernet Franc (Columbia Valley (WA)),"Woodspice, herb and coffee aromas vie for attention on this blend of Champoux (60%) and Ciel du Cheval vineyard fruit. The black-fruit flavors show a good sense of balance that lingers through the long, mesquite-accented finish.",40.0,90,8,0.9356954034078653
34745,Bellangelo 2006 Porto Elana Cabernet Sauvignon-Merlot (Finger Lakes),"Cigarbox, pepper and red cherry on the nose leads into vanilla, smoke and cedar on the palate. Rich but not heavy, it will pair well with cured meats, cheeses, heartier dishes.",24.0,86,8,0.9356953682239489
13605,Phillips Hill 2013 Valenti Vineyard Pinot Noir (Mendocino Ridge),"This wine features the signature, woodsy, savory aromas of Phillips Hill. It has a lighter, slightly tawny color compared with most of its peers from Anderson Valley. Flavors combine spice and fruit with meaty, mushroomy notes, giving character and personality to a delicious wine.",45.0,94,8,0.9356951552790012
68548,Renieri 2009 Tenuta di Renieri  (Chianti Classico),"Wines from the Berardenga area in the southern part of the appellation tend to show extracted fruit flavors because of the clay soils and extra heat. Tenuta di Renieri reflects the region, and it offers bright cherry and chocolate notes.",20.0,88,8,0.935694536108928
6436,Cloudy Bay 2014 Pinot Noir (Marlborough),"This wine may be on the fleshy, supple side of the spectrum, but it remains grounded in savory spice and earth. Cola and baking spices end on a mouthwatering note.",40.0,90,8,0.9356941913465585
106686,Frank Family 2012 Pinot Noir (Carneros),"There's a substantive strength and intensity of ripe black cherry to this wine that's well-intentioned in its seamless and soft texture. With just enough of a floral element adding flair to its fleshiness, the wine finishes rich in savory oak.",35.0,88,8,0.9356941106508683
81651,Liberty Lake 2011 Heritage Reserve Red (Red Mountain),"Aromas of vanilla, pickling spices, green pepper and dark fruit are followed by tart cherry flavors. It shows both the elegance of the vintage and the power of the appellation.",35.0,88,8,0.9356938570055645
51361,Fenestra 2012 Ghielmetti Vineyard Malbec (Livermore Valley),"Classy and complex oak nuances give the aromas and flavors of this wine a suave, spicy personality. Grilled baguette and cedar notes merge nicely with its focused and concentrated berry and black cherry flavors.",30.0,90,8,0.9356937873032638
76905,Browne Family Vineyards 2012 Cabernet Sauvignon (Columbia Valley (WA)),"This wine seems a bit muddled, with aromas of cranberries, dried herbs, vanilla, cashews and barrel spices struggling to get to the surface. The palate is medium bodied with tart fruit flavors and blocky tannins, with the concentration not seeming to all be there.",35.0,87,8,0.9356936359149547
115301,Browne Family Vineyards 2012 Cabernet Sauvignon (Columbia Valley (WA)),"This wine seems a bit muddled, with aromas of cranberries, dried herbs, vanilla, cashews and barrel spices struggling to get to the surface. The palate is medium bodied with tart fruit flavors and blocky tannins, with the concentration not seeming to all be there.",35.0,87,8,0.9356936359149547
5453,Abeja 2011 Heather Hill Estate Cabernet Sauvignon (Walla Walla Valley (WA)),"All varietal, this offers aromas of coffee, cherry, chocolate, oak spices and green herbs that show a touch of underripeness. The palate displays elegance, restraint and polish along with a tart finish.",55.0,89,8,0.9356933702045719
14609,Henry's Drive Vignerons 2012 Magnus Shiraz (Padthaway),"This wine is fleshy and seductive, with irresistible layers of smoke, mint and plum. It's full bodied, creamy textured and lush, staying supple through the long, charming finish. Drink now through 2025.",80.0,94,8,0.935693169004305
24268,Razor's Edge 2008 Shiraz (McLaren Vale),"A terrific value if you like the style, this is an impressively concentrated, slightly syrupy Shiraz imbued with potent cassis fruit and framed with vanilla oak. Surprisingly long on the finish. Drink now.",12.0,90,8,0.9356930105385675
11437,Bouchaine 2012 Bacchus Collection Terraces Estate Vineyard Pinot Noir (Carneros),"Oaky and tannic at first sip, this wine has a softness waiting to let loose on the palate and reveal more floral cherry and raspberry notes. Through and through, the standout characteristic is dried herb, plenty of it, especially on the finish.",60.0,88,8,0.9356929435473256
74357,Damsel 2014 Boushey Vineyard Syrah (Columbia Valley (WA)),"Coming from one of the state's most esteemed Syrah vineyards, this wine opens with nuanced aromas of bacon fat, smoke and berry. The palate is rich and sumptuous, with fruit and savory flavors lingering on the finish.",42.0,89,8,0.9356929229634661
78517,Damsel 2014 Boushey Vineyard Syrah (Columbia Valley (WA)),"Coming from one of the state's most esteemed Syrah vineyards, this wine opens with nuanced aromas of bacon fat, smoke and berry. The palate is rich and sumptuous, with fruit and savory flavors lingering on the finish.",42.0,89,8,0.9356929229634661
33526,Jones of Washington 2013 Cabernet Franc (Columbia Valley (WA)),"Aromas of green and garden herbs, tobacco and cherry lead to generous plum and cocoa flavors. It brings a sense of softness that adds to its appeal.",17.0,88,8,0.9356925204694918
63320,Wargin Wines 2012 Granite Hill Vineyards Petite Sirah (El Dorado),"Intense color, intense hot aromas and intense blackberry-jam flavors make this an extreme, full-bodied wine. It has plenty of tannins and an overtone of heat in the aroma and the finish.",34.0,82,8,0.9356921448451104
25222,St. Pauls 2009 Gries Lagrein (Alto Adige),"This opens with dark, inky concentration and savory aromas of leather, spice, tobacco and black fruit. An interesting touch of bitterness appears on the finish.",16.0,87,8,0.9356919504271064
75526,Pennywise 2013 Merlot (California),"Bold oak aromas like wood smoke and toasted baguette meet almost-sweet flavors like cherries, plums and a bit of maple syrup in this medium-bodied wine.",12.0,86,8,0.9356914843593395
80548,Tamburini 2009 Italo Riserva  (Chianti),"Italo Riserva harkens back to those old-style Chiantis that once graced the checkered tabletops of your childhood Italian restaurant. That's the inspiration for this wine, perhaps, but the style is modern and bold, with loads of oak spice, cinnamon and dark berry.",19.0,87,8,0.9356914811523822
6998,Glen Fiona 2006 Basket Press Syrah (Columbia Valley (WA)),"The best of Glen Fiona's current releases, this displays cool-climate varietal character, with mountain berry fruit, herb, spice, tar and a streak of licorice.",15.0,87,8,0.9356913603537702
50640,Remo Farina 2010  Valpolicella Classico Superiore Ripasso,Remo Farina is a standout producer with a beautiful portfolio of Amarone and Ripasso wines. This expression shows youthful berry tones that are backed by notes of freshly grated cinnamon and nutmeg. Its consistency is dark and rich.,15.0,88,8,0.9356899493342218
52871,Remo Farina 2010  Valpolicella Classico Superiore Ripasso,Remo Farina is a standout producer with a beautiful portfolio of Amarone and Ripasso wines. This expression shows youthful berry tones that are backed by notes of freshly grated cinnamon and nutmeg. Its consistency is dark and rich.,15.0,88,8,0.9356899493342218
53975,Drumheller 2014 Cabernet Sauvignon (Columbia Valley (OR)),"Aromas of milk chocolate, herb, plum and cherry are followed by a palate full of cherry and chocolate flavors that persist on the finish. The tannins bring astringency that provides some distraction.",12.0,86,8,0.9356886478354195
61653,Wattle Creek 2012 Cabernet Sauvignon (Alexander Valley),"A hint of deli meat marks the bouquet of this wine, before smoke, leather and blackberry characterize the palate, the texture soft yet tannic. The finish takes a heartier tone, as the tannins slightly pucker and stick around.",42.0,86,8,0.93568852039315
83995,William Church 2013 Tres Bien Cabernet Franc (Columbia Valley (WA)),"Fresh, savory herb and barrel-spice aromas intertwine, with dark fruit lurking in the background. The black-fruit flavors are supple and show a sense of polish.",36.0,91,8,0.935688152048057
10066,Kestrel 2012 Winemaker's Select Cabernet Franc (Yakima Valley),"Varietal aromas of fresh and dried herbs, flowers and cherries mix with tar, chocolate and barrel spices. The palate displays a reserved styling and a lingering finish.",40.0,88,8,0.9356864116984056
6019,Domaine de la Petite Cassagne 2013 Red (Costières de Nîmes),"This wine offers a complex, intoxicating bouquet: espresso, charred meat and black olive notes meld seamlessly together, adding notes of blueberries and pastry crust on the palate. It's not overly weighty, remaining fresh through the long, silky finish.",15.0,91,8,0.9356851757439494
109441,àMaurice 2012 Gamache Vineyard Malbec (Columbia Valley (WA)),"Aromas of dried herb, clove and plum are fresh. The flavors are supple and reserved, showing a pleasing tension between the fruit and acid that keeps the attention high.",38.0,91,8,0.9356845595005036
52826,Sightglass 2014 Cabernet Franc (Columbia Valley (WA)),"This wine, which is 100% varietal, brings aromas of fresh herbs, coffee, toast and char. The palate is rich with dark-fruit flavors while maintaining a lovely sense of balance.",40.0,91,8,0.9356842407444563
8590,Zaca Mesa 2014 Black Bear Block Syrah (Santa Ynez Valley),"This bottling from Santa Barbara County's oldest Syrah planting is always like tasting history. Aromas of roasted coffee beans and charred wood meet with pressed blackberry, vanilla and caramel on the nose. The palate combines tart black-plum skins with charred meat, more roasted coffee and lots of cocoa dust, with riper hints of fig and blueberry fruit arising toward the finish.",68.0,93,8,0.9336026011455242
100118,Stephen Vincent 2013 Crimson Republica de'California Red (California),"An affordably priced wine brings meaty, peppery aromas, interesting fruit, spice and smoke flavors, and a mouthcoating texture. It is full bodied, complex and concentrated.",17.0,90,8,0.9307608276927866
40674,Ardor 2013 Lawrence Vineyard Syrah (Columbia Valley (WA)),"This wine starts out brooding, with aromas of vanilla, herbs and brown spices. The cherry flavors are full bodied yet show subtlety, with a captivating mouthfeel and meaty flavors on the finish that increase the interest.",40.0,90,8,0.9307606930735128
111125,Mercer 2012 Reserve Ode to Brothers Red (Horse Heaven Hills),"This is a blend of Syrah (41%), Grenache (31%) and Mourvèdre. Aromas of vanilla, coffee, game and spice are followed by fruit flavors that seem dried out. Drink now.",40.0,87,8,0.9307603495947233
9101,Jules Taylor 2009 Ballochdale Estate Pinot Noir (Marlborough),"Sourced from a high-altitude vineyard near the top of the Awatere Valley, this wine shows some of the leafiness characteristic of the region. The fruit is more roasted root vegetable than tree fruit, with a potent savory and fairly muscular character.",22.0,86,8,0.9307598461516781
64530,Lauren Ashton Cellars 2012 Malbec (Columbia Valley (WA)),"All coming from Upland Vineyard, this 100% varietal wine has a lighter color. Supple flavors of coffee, spice, plum, dried herbs and pepper contribute to a finish that lingers.",40.0,90,8,0.9307593426176691
52077,College Cellars 2014 Anderson Estate Vineyard Tempranillo (Walla Walla Valley (WA)),"This wine intrigues with its aromas of peppery spices, tobacco and purple fruit. The flavors are lush and focused, bringing a lot of hedonistic pleasure, though it trails a bit toward the finish.",20.0,88,8,0.9307593043009932
7637,Keira 2014 G-S-M (Columbia Valley (WA)),"This wine is 60% Grenache, 35% Syrah and 5% Mourvèdre. Vanilla aromas are prominent along with prune and other dried fruit. Fruit and barrel flavors intermingle on the palate, with the fruit seeming dried out.",28.0,87,8,0.9307591099396102
94458,Prominence 2012 Cabernet Sauvignon (Napa Valley),"This is a smooth, thick and tannic wine that's full-bodied, robust and priced to sell. Cassis and blackberry both figure into the mix, along with a finish of tobacco and vanilla.",23.0,87,8,0.9307586549896646
26290,Cedarville Vineyard 2013 The Rules of Fair Play Red (Fair Play),"A charred, peppery aroma and a stiff, tannic mouthfeel go along with dark-fruit flavors in this full-bodied blend of Zinfandel and Petite Sirah.",36.0,88,8,0.9307586381912273
50111,Cedarville Vineyard 2013 The Rules of Fair Play Red (Fair Play),"A charred, peppery aroma and a stiff, tannic mouthfeel go along with dark-fruit flavors in this full-bodied blend of Zinfandel and Petite Sirah.",36.0,88,8,0.9307586381912273
