,title,description,price,points,cluster_label,cosine_similarity
46229,DeLille 2014 Shaw Vineyard Cabernet Sauvignon (Red Mountain),"The aromas are brooding, with notes of plum, barrel spice, incense and black cherry. The palate is rich and concentrated with blackberry flavors, backed by firm tannins that need some time to settle in. It's high on the hedonistic scale.",65.0,93,1,0.3358652246643378
85910,O. Fournier 2009 Urban Uco Malbec-Tempranillo (Uco Valley),"A bit warm and baked on the nose, with aromas of fruit cake and pastry. The palate is full-bodied and chewy, with ripe, sweet black fruit flavors that finish with vanilla and chocolate.",14.0,86,1,0.3358223761439202
58586,Mano A Mano 2010 Venta la Ossa Tempranillo (Vino de la Tierra de Castilla),"After this opens with charred, roasted aromas, things settle on smoky black-fruit scents and savory notes. The palate is big and concentrated, with fine balance for such a modern, full-fruited wine. Flavors of ripe blackberry, toast, coffee, chocolate and spice cover the spectrum of what you want from a crowd pleaser such as this.",21.0,90,1,0.33581593481099786
101818,Rubino Estates Winery 2014 Landmark Collection Proprietary Red (Livermore Valley),"This well-made red blend has no shortage of ripe black-fruit flavors or gripping texture. It's full bodied, very dark in color, smells like cinnamon, clove and cherries, and tastes very ripe and concentrated: like chocolate covered cherries without the sweetness.",50.0,91,1,0.33580494891863794
69194,Topel 2006 Estate Reserve Cabernet Sauvignon (Mendocino County),"This is a Cabernet with intense berry concentration and soft tannins. It's very dry and savory, with leathery black cherry and cassis bursting almost out of its seams, finishing with a hint of dark chocolate. Nicely crafted, this shouldn't overpower your food.",36.0,90,1,0.3357749515189354
18280,Markham 2013 Estate Grown Pinot Noir (Napa Valley),A robust structure of tannin and oak in this fuller-bodied wine masks the finer components of black cherry and blackberry fruit that lurk underneath layers of tobacco and cigar box.,31.0,85,1,0.33574252732896936
710,Bella 2009 Big River Ranch Zinfandel (Alexander Valley),"This is dry, rich, heady, spicy and utterly delicious. As usual, it contains a splash of Petite Sirah. Already throwing some sediment, it's pretty tannic, with complex flavors of wild blackberry and blueberry, black currant, licorice, cola, bacon and plum sauce, with a hint of exotic pepper and spice. This great Zinfandel is a joy to drink.",38.0,92,1,0.3357123223402187
12803,Graziano 2013 Coro Mendocino Red (Mendocino),"Richness is the hallmark of this full-bodied, luxuriously ripe and fruit-drenched Zinfandel blend. Blueberry, black cherry and blackberry jam aromas and flavors coat the palate, crowding out any oak-derrived accents that might be present. It comes off as pure and fruity deliciousness.",40.0,92,1,0.33570382686070926
93969,Harrington 2006 Brosseau Vineyard Pinot Noir (Chalone),"Extraordinarily rich and ripe, just explodes with cherry jam, crushed black raspberries and sweet toasted oak and vanilla flavors. But it's not a simple fruit bomb. Crisp acidity and a deep, fine tannin structure give it complexity and limited ageability. Good now and through 2012.",50.0,92,1,0.3357021204860649
103576,Bodega Cuarto Dominio 2012 Chento Vineyard Selection Malbec (Mendoza),"This concentrated, midnight-black Malbec delivers the aromatic goods in the form of charcoal, grilled meat and blackberry scents. An extracted palate benefits from core acidity, while black cherry, cassis and blackberry flavors come to rest on a rich but controlled finish. Drink through 2018.",20.0,91,1,0.3355731419033743
69582,I Capitani 2009 Emè Red (Irpinia),"This blend of Aglianico, Merlot and Sangiovese opens with aromas of ripe black plum, toasted oak, chocolate and game. The thick, one-dimensional palate is overripe, offering stewed black cherry, prune, vanilla and chocolate alongside drying wood tannins.",30.0,86,1,0.33551030155170547
98294,Mount Veeder 2009 Cabernet Sauvignon (Napa Valley),"Soft and gentle in texture, this Cabernet is very rich and forward in blackberry and black-currant flavors, enriched with sweet oak. It's a flashy, opulent wine that's delicious for drinking now.",40.0,89,1,0.3354967355816799
45801,Lyeth 2013 Merlot (North Coast),"Generous flavors of red and black cherry, and a nice, firm coating of fine tannins make this full-bodied wine good and substantive. Those dark fruit flavors are fairly deep and concentrated, and linger on the finish.",13.0,87,1,0.33543207588796803
91067,EOS 2015 Estate Petite Sirah (Paso Robles),"Black cherry, dark chocolate, coffee and mint touches show on the nose of this approachable bottling. The palate is solidly structured, pairing soy and licorice flavors with tangy black-plum and elderberry fruit.",20.0,90,1,0.33541629809259754
112906,EOS 2015 Estate Petite Sirah (Paso Robles),"Black cherry, dark chocolate, coffee and mint touches show on the nose of this approachable bottling. The palate is solidly structured, pairing soy and licorice flavors with tangy black-plum and elderberry fruit.",20.0,90,1,0.33541629809259754
41770,Quasar 2006 Gran Reserva Cabernet Sauvignon (Central Valley),"Full, honest aromas of brandied cherry, woodspice and cola are inviting, while the palate is thorough and lively, with good acidity and tannic grip. Flavors of black cherry and cassis are correct and finish with an herbal note and a hint of black olive.",11.0,87,1,0.3354085414155109
15688,Mi Terruño 2012 Expresión Malbec (Mendoza),"Black cherry and blackberry aromas are ripe, with a touch of prune weighing in. In the mouth, punchy acidity sticks out. Wiry raspberry and plum flavors are surprisingly tart and underdeveloped, while lactic oak notes and choppy acidity make for a jumbled finish.",14.0,86,1,0.3353922296537571
16296,Vini 2009 Veni Vidi Vici Merlot (Thracian Valley),"Harmonious on the nose and palate with ripe black plums and cassis enveloped by a layer of char and smoke. Medium to full bodied with structured acidity, it's a straightforward but sound Merlot with powdery, soft tannins and a tasty black cherry and graham cracker finish.",8.0,87,1,0.3353298093526558
68199,Santa Carolina 2011 Herencia Carmenère (Peumo),"Over the last few years, Herencia has risen to the top of Chile's Carmenère kingdom. This vintage opens with rich aromas of vanilla, barrel spice, pepper, herbs and black fruits. A full dense palate is balanced, while this tastes dark and spicy, with lightly baked black-fruit flavors that finish intense and oaky. Drink through 2022.",100.0,94,1,0.33528639390673837
81505,Frog's Leap 2005 Cabernet Sauvignon (Rutherford),"A gorgeous Cab, lush and soft and delicious. Shows a New World, cult winemaking sensibility, with superripe fruit and melted tannins framing blackberry and cherry pie, cassis, dark chocolate, anise and cedar flavors. Should age for the next ten years.",75.0,93,1,0.3352765950432128
45938,Foxen 7200 2007 Vogelzang Vineyard Cabernet Sauvignon (Santa Ynez Valley),"Lots of rich, ripe fruit in this Cabernet, which comes from the Happy Canyon area of the warmer eastern part of the valley. It shows deliciously forward blackberry, blueberry and cherry flavors, with a sweet overlay of toasty oak and rich, firm tannins. Dry and lovely, it's fine to drink now.",50.0,90,1,0.3352288453146293
76749,Yatir 2012 Petit Verdot (Judean Hills),"Aromas of blackberry, vanilla and violet lead into flavors of black cherry, blueberry, custard, anise and a suggestion of mint. This wine is bright and fruity at first sip, but it stiffens up after a few moments as plush tannins coat the palate. The strawberry finish is marked with a touch of black pepper.",50.0,90,1,0.3351228948192484
80601,Casa Sola 2010  Chianti Classico,"This wine shows aromas of toasted oak, black berry and espresso. The palate offers forward flavors of black cherry, café au lait and chocolate. It's soft and round, but lacks a bit of vibrancy.",22.0,87,1,0.3350366624225914
51712,Prospect 772 2005 The Brawler Syrah-Viognier (Calaveras County),"Mainly Syrah, with a little splash of Viognier, this opulent, sensual wine floods the mouth with flavors of blackberry and blueberry pie filling, chocolate-raspberry truffle, red licorice, black pepper, clove and vanilla oak. Made in the modern, cult Cab style, it has high alcohol and is soft.",36.0,90,1,0.3350138876946002
92187,Vivera 2010 Martinella  (Etna),"Made with 80% Nerello Mascalese and 20% Nerello Cappuccio, this opens with aromas of black fruit, subtle oak, toast and vanilla. The palate offers juicy black cherry and raspberry flavors that are lightly accented by notes of clove and chocolate. The tannis are polished.",35.0,89,1,0.33500081931303466
70629,Dalton 2014 Estate Merlot (Galilee),"Deep garnet in color, this wine has a nose marked by black cherry and blackberry scents. It's soft on entry but brightens as it washes across the palate, offering blackberry, cassis and chocolate flavors. Velvety tannins persist into the zesty, cranberry-tinged finish.",18.0,90,1,0.33498908127680405
100063,Dalton 2014 Estate Merlot (Galilee),"Deep garnet in color, this wine has a nose marked by black cherry and blackberry scents. It's soft on entry but brightens as it washes across the palate, offering blackberry, cassis and chocolate flavors. Velvety tannins persist into the zesty, cranberry-tinged finish.",18.0,90,1,0.33498908127680405
23600,Goldeneye 2013 Ten Degrees Pinot Noir (Anderson Valley),"Great aromatic complexity and richly layered fruit flavors propel this full-bodied, sophisticated and deep wine. An array of cinnamon, clove and cedar notes blend with ripe black cherry and blackberry, while firm, fine-grained tannins seem to lift them up. Best to drink after 2020.",120.0,94,1,0.3349610459406908
100139,Donnachiara 2007 Aglianico (Campania),"A meaty note of bresaola or smoked bacon opens the nose of this hearty Aglianico. The wine offers black concentration and rich aromas of sweet spice, blackberry jam, crushed pepper, milky chocolate and sour cherry.",16.0,86,1,0.33495321454717825
73008,Gran Vinaio 2010 Red Grenache (Montsant),"Deep, smoky aromas of black fruits are muscular and full. This is well structured and strong, with toast and dark-fruit flavors of blackberry and plum. Spicy, peppery flavors and mild heat drive the finish.",13.0,88,1,0.3349116023977972
56741,Regina Viarum 2014 Mencía (Ribeira Sacra),"Ripe raisin and black-fruit aromas come with a licorice sidenote. This feels tight and pure but not demanding, with proper balance. Plum, blackberry and chocolate flavors give way to a spongy fruit-driven finish.",16.0,90,1,0.33485618007031714
19435,Muscardini 2006 Pauli Ranch Barbera (Mendocino County),"This Barbera is soft, sweet and simple. It shows the rich tannins of the variety, but isn't ageworthy. Tastes like melted blackberry jam mixed with anise, black pepper and smoke.",47.0,82,1,0.3348543879181425
27187,Castello Monaci 2013 Piluna Primitivo (Salento),"This starts off with aromas of mature black fruit, allspice and toast. The full-bodied palate offers prune, mature blackberry, toasted oak and ground black pepper alongside hearty tannins.",15.0,87,1,0.3347798146002801
106397,Peter Franus 2006 Cabernet Sauvignon (Napa Valley),"A big, rich wine, candy-sweet in fruit and toasted oak. Shows the blackberry, cherry, nougat, roasted almond and chocolate flavors of a delicious granola bar. The tannins are a work of art, soft, intricate and refined.",40.0,88,1,0.3347368420401417
67050,Scott Harvey 2005 Mountain Selection Zinfandel (Amador County),"Here's a full-bodied, lusty Zin. With a rustically tannic structure and ripe, almost overripe flavors of blackberry and cherry jam and black pepper, it's a natural for a peppery flank steak.",20.0,85,1,0.3346936133138036
31653,Ruby Hill Winery 2013 Jewel Collection Cabernet Sauvignon Cabernet Sauvignon (Livermore Valley),"Intense concentration and firm structure make this an age-worthy, big and tannic wine. It boasts a deep, dark color, dense ripe blackberry and black cherry aromas and spicy, oaky nuances that add complexity. Best after 2019.",55.0,91,1,0.3346847488484818
77571,Viña Vilano 2011 Reserva  (Ribera del Duero),"Bold berry and black-cherry aromas come with equal amounts of overt oak and coconut scents. This has hard but manageable tannins that create a powerful but rocky mouthfeel. Flavors of coconut, vanilla, blackberry and chocolate finish with firm, dry tannins, fresh acidity and a lasting mocha flavor. Drink through 2022.",45.0,92,1,0.33462498111794653
111508,Muga 2005 Torre Muga  (Rioja),"A rich, bacony, black fruit monster with deep, molten flavors and immense body and tannic grab. A bruising wine with boysenberry, blackberry, mint, licorice and chocolate for primary flavors, and then lemony oak as a backdrop. Young, tannic and wild now; best from 2011 through 2015.",96.0,94,1,0.33462204316468025
5071,Bonny Doon 2005 Le Pousseur Syrah (Central Coast),"Here's a bone-dry, powerful young Syrah that's packed with hard tannins. The vineyard sourcing is interesting, ranging from the Sierra Foothills through Paso Robles and the Salinas Valley to the Santa Cruz Mountains. Combining the ripe fruit of warm climates with the acidity of cool regions, the wine has black currant, beef jerky, sour cherry candy, black pepper, anise and cola flavors that are quite complex. Not likely to age, but a lovely, full-bodied red to have now.",18.0,90,1,0.3346204246049495
90229,Lamadrid 2014 Single Vineyard Reserva Bonarda (Agrelo),"Ripe blackberry, blueberry, graphite and toasty oak aromas make for a dark bouquet. This is slightly rough on the palate due to aggressive tartaric acidity, while flavors of ripe black fruits, cola, oak and chocolate finish with coconut and resiny oak notes.",20.0,89,1,0.33461079079109357
10006,Château Julien 2005 Private Reserve Syrah (Monterey County),"If you're looking for a soft, sweetish wine, here's one. It has flavors of ripe red and black cherries, currants, dark chocolate, root beer and licorice, and tastes like a fruit and honey energy bar.",36.0,84,1,0.33460780239611315
101247,Opolo 2015 Mountain Zinfandel (Paso Robles),"This unabashedly powerful and jammy wine shows black-cherry candy, sweet roses, vanilla, black rocks and black pepper on the nose. The soft tannins carry forth waves of vanilla, coconut, caramel and blueberry jelly, perfect to please those seeking a whopper of a wine.",29.0,92,1,0.3345795057975304
16539,Granate 2008 Garnacha (Campo de Borja),"Aromas of sweet black cherry and dark plum form a good bouquet. The palate has smack and acidic bite, but the flavors are forward and clean, with a focus on plum and black cherry. Finishes full and long, with licorice as well as leftover acidity.",15.0,86,1,0.33457281785546583
25964,Granate 2008 Garnacha (Campo de Borja),"Aromas of sweet black cherry and dark plum form a good bouquet. The palate has smack and acidic bite, but the flavors are forward and clean, with a focus on plum and black cherry. Finishes full and long, with licorice as well as leftover acidity.",15.0,86,1,0.33457281785546583
68850,Mesa 2009 Malombra Red (Isola dei Nuraghi),"Fine craftsmanship is evident in this Sardinian blend of Carignano and Syrah. The wine is rich and extracted, with bold fruit notes of blackberry and plum followed by spice and tobacco. Some toasted oak influences appear in the mouth alongside soft, smooth tannins.",65.0,91,1,0.33447113832517766
100550,Calera 2014 de Villiers Pinot Noir (Mt. Harlan),"Very dark in the glass, this drought-hammered bottling (from a yield of just two-thirds of a ton per acre!) shows deep and concentrated black plum, black currant and licorice aromas but retains the wild thyme and dark mint character typical of Central Coast Pinot Noir. The palate combines richness with strong acidity, its concentrated black cherry fruit cut with tart plum skin notes.",52.0,93,1,0.33442270789797895
39591,St. Supéry 2013 Dollarhide Petit Verdot (Napa Valley),"Full bodied and fully concentrated, this estate-grown wine showcases black tar, licorice and black cherry, well-developed flavors that ride a luxurious texture of grippy tannin and toasty oak. Dark as night, the flavors are protracted and extensive through the finish.",50.0,91,1,0.33439808967944357
42590,Dona Maria-Júlio Bastos 2012 Júlio B. Bastos Grande Reserva Alicante Bouschet (Alentejo),"Dedicated to the producer's father, this 100% Alicante Bouschet is superbly ripe and rich without overwhelming. It has the dark black colors of the grape that are followed by full-bodied black fruit flavors and impressive spice and pepper flavors. The wine is still young, so wait to drink until 2018.",150.0,92,1,0.334358444322308
102503,Terlato 2009 Angels' Peak Merlot-Cabernet Franc (Napa Valley),"For maximum enjoyment, drink this almost all-Merlot blend now. It shows ripe, lush black-cherry, red currant, plum and bacon flavors that finish spicy and sweet tasting. The tannins are thick but smooth.",48.0,90,1,0.33431484028534525
8771,LangeTwins 2013 Estate Grown Cabernet Sauvignon (Lodi),"This wine is well balanced and solidly constructed, wrapping its ripe blackberry and dark plum flavors in firm tannins. Light oak spice, vanilla and cinnamon touches are the icing on the cake.",15.0,89,1,0.3342665100979382
72251,Viña Mayor 2011 Vendimia Seleccionada  (Toro),"Ripe blackberry and cassis aromas are pure and lusty. In the mouth, it shows chewy tannins, a stout structure and generous flavors of blackberry, chocolate, pepper and a spot of salty brine. A toasty, dark, heady finish confirms the overall quality. Drink through 2020.",30.0,91,1,0.33424682264333394
92849,Mark Ryan 2012 Dead Horse Cabernet Sauvignon (Red Mountain),"This wine still seems to be in its shell with brooding notes of bittersweet chocolate, blackberry, raspberry and woodspice. It's a full-bodied mouthful of a wine. Layered black and red fruit flavors show good depth and density along with a firm structure of supporting tannins. Just a baby now, it should last well in the cellar until 2025 or more.",55.0,91,1,0.3341959977068805
32769,Entropy Cellars 2013 Cabernet Sauvignon (Livermore Valley),"Well rounded, subtly spicy and deep in fruit concentration, this full-bodied wine packs a lot of flavor into an almost deceptively smooth package. It has plenty of black cherry, blackberry and cocoa notes to savor and a texture that's saturated with fine-grained tannins. Best after 2018.",35.0,91,1,0.3341934940371792
7961,Macauley 2013 Reserve Cabernet Sauvignon (Napa Valley),"Softly layered, this ripe, bold wine shows a wealth of body and complexity. The ripeness will please for its interwoven notions of Dr Pepper, black-cherry jam and black pepper, its tannins leathery and full of bravado.",150.0,95,1,0.33413265594555225
82386,Gundlach Bundschu 2010 Cabernet Sauvignon (Sonoma Valley),"This wine is just what a Sonoma Valley Cabernet should be. It's softly tannic and likeable now, with rich, ripe blackberry, black currant, blueberry and oak flavors. Shows real elegance as well as structural integrity.",40.0,89,1,0.33412168554284444
5000,Jardin 2006 Cobblers Hill Red (Stellenbosch),"A Bordeaux-style blend made from 50% Cab Sauv, 30% Merlot and 20% Cab Franc and aged in new French oak for 24 months, this ripe and lush wine is ready for drinking now with easygoing black cherry and blackberry fruit aromas and flavors laced with notes of pepper, licorice root, tobacco leaf and soft leather. The creamy mouthfeel is given structure with medium tannins and balanced acidity.",40.0,90,1,0.334113665948304
80980,Weingut Seck 2011 Dornfelder (Rheinhessen),"Whiffs of toasted coconut, dark herbs and animal combine with plush black cherry on the nose of this full-bodied red. Dornfelder's characteristic ripe, ruddy black fruit flavors are a bit obscured in wood and sweet spice, but it's brisk finish is refreshing. Drink now.",27.0,86,1,0.334041421404134
76107,Ancient Peaks 2009 Petite Sirah (Paso Robles),"Ripe and seemingly sweet fruit, oak and spice characterize this rich, delicious Petite Sirah. It shows the variety's strong tannins, but here they're soft and melted. The flavors include blackberry jam and mocha.",35.0,88,1,0.3340217893149744
58797,Lamadrid 2012 Single Vineyard Reserva Malbec (Agrelo),"A heady but attractive bouquet of marzipan, balsam wood, blackberry, cassis and raisin introduce a loaded but well-balanced, full-bodied palate. Toast, chocolate and black fruit flavors finish with additional spice, chocolate and lustiness. Drink through 2019.",20.0,92,1,0.33394926244857165
78178,Lamadrid 2012 Single Vineyard Reserva Malbec (Agrelo),"A heady but attractive bouquet of marzipan, balsam wood, blackberry, cassis and raisin introduce a loaded but well-balanced, full-bodied palate. Toast, chocolate and black fruit flavors finish with additional spice, chocolate and lustiness. Drink through 2019.",20.0,92,1,0.33394926244857165
102447,Simonsig 2012 Redhill Pinotage (Stellenbosch),"This is a pronounced wine, boasting upfront aromas of blackberry, plum and boysenberry that are graced with additional scents of licorice, chicory, black pepper and crushed violet. The palate is bold, with a gripping texture that supports the lush black-fruit flavors. Toasted oak and sweet smoke accents grace the medium-length finish. Drink now–2020.",38.0,90,1,0.3339128791591908
79422,Donum 2012 Single Vineyard Pinot Noir (Anderson Valley),"The flavors run as deep as the dark garnet color in this full-bodied but sophisticated wine. Aromas trigger black cherry, subtle spicy oak and a walk in the forest, while the fruit flavors are ripe and delicious. The texture is like velvet—smooth but not slick. The complexity and inherent richness of flavor seem to increase with each sip, and it has firm acidity and tannins to cleanse the palate.",72.0,94,1,0.3339100091060349
106569,Donum 2012 Single Vineyard Pinot Noir (Anderson Valley),"The flavors run as deep as the dark garnet color in this full-bodied but sophisticated wine. Aromas trigger black cherry, subtle spicy oak and a walk in the forest, while the fruit flavors are ripe and delicious. The texture is like velvet—smooth but not slick. The complexity and inherent richness of flavor seem to increase with each sip, and it has firm acidity and tannins to cleanse the palate.",72.0,94,1,0.3339100091060349
64492,Bodegas Agapito Rico 2006 Carchelo Monastrell (Jumilla),"Call this chunkster Midnight Madness and you won't be off course. The wine is black in color and just as black on the nose and in the mouth. Cassis, asphalt and molasses aromas are a good prelude to chewy blackberry flavors. The palate and finish are both soft and meaty, with velvety tannins. Drink soon.",11.0,86,1,0.33388346703472654
77955,Peachy Canyon 2014 Incredible Red Zinfandel (California),"Dried black cherries, vanilla and a touch of roasted meat show on the rich, luscious and fruity nose of this bargain bottling. The palate is juicy with black cherry and milk-chocolate flavors that lean a little bit sweet.",12.0,86,1,0.3338404757216033
111687,Ty Caton 2012 Caton Vineyard Cabernet Sauvignon (Sonoma Valley),"This full-bodied, puckering wine is concentrated in black cherry and blackberry, its oak tart and surrounded by drying tannins. Once the bottle is open, expect the oak presence to increase along with cigar box and leather pouch.",44.0,86,1,0.3337927913886347
99862,Recanati 2013 Merlot (Galilee),"Deep ruby to the eye, this wine offers rich aromas of cherry, black licorice and orange rind and flavors of blackberry, black cherry, cassis, anisette and eucalyptus. Long-lasting tannins coat the mouth but there is always a sense of fresh fruit on the palate and a brightness that lingers right into the satisfying finish.",17.0,92,1,0.3337686986996387
58770,Alta Colina 2010 GSM Estate Red (Paso Robles),"This Rhône-style blend will uplift an ordinary cheeseburger, but has the complex power to match a big beef stew or game dish. Dry in style but big in alcohol, it's smooth and rich with luxurious blackberry, cherry, currant, mocha, black pepper and oak flavors.",38.0,87,1,0.333750339526265
67442,Rusack 2007 Syrah (Santa Barbara County),"A beautiful Syrah, dry, full-bodied and tannic, that shows lots of class and elegance at this price. It has rich, complex flavors of blackberries, black cherries, red currants and oak, with earthy, leathery, bacon and licorice notes. Needs a few years to come around due to the tannins, or give it a good decant.",25.0,91,1,0.33373427413188417
80630,Moncaro 2009 Riserva Vigneti del Parco  (Conero),"Earthy notes of forest floor, tobacco leaf and black cherry open this wine made entirely from Montepulciano. The lush palate offers a core of ripe black cherry layered with cinnamon-spice, chocolate and coffee. While purists will say there's too much oak, the fruit is undeniably delicious. Not an ager so enjoy soon.",30.0,87,1,0.33368092403626354
101474,Blackburn Wine Company 2014 Zinfandel (Central Coast),Black plum and black-cherry flavors are prominent but not too deep on the nose of this bottling. There is noticeable grip on the palate with flavors of black cherry and sagebrush.,13.0,85,1,0.3336769108867772
91176,Fidelitas 2013 Cabernet Sauvignon (Red Mountain),"One hundred percent varietal, this wine is a blend of fruit from Quintessence (69%), Fidelitas Estate, Canyons and Red Heaven Vineyards. Aromas of cassis, black licorice, barrel spice and dried black cherry lead to elegant dark fruit flavors backed by lightly chewy tannins. It shows a lot of finesse.",50.0,91,1,0.33358290238616245
