,title,description,price,points,cluster_label,cosine_similarity
84330,Red Stich 2013 Sierra Mar Vineyard Pinot Noir (Santa Lucia Highlands),"Longtime San Francisco Giant Rich Aurilia teams with fellow baseballer Dave Roberts to produce a wine with restrained, focused aromas of black cherry, pencil shavings, sarsaparilla and hints of allspice. The palate is all about black gravel and turned loam, with tiny bits of black cherry and noticeably firm tannins.",54.0,93,1,0.3567604980549649
20228,Easton 2013 Estate Bottled Cabernet Sauvignon (Shenandoah Valley (CA)),"In a classic combination of ripe flavors and lip-smacking structure, this full-bodied wine wraps concentrated black cherry and mint aromas and generous cherry and blackberry flavors in muscular tannins that keep the texture fresh.",40.0,90,1,0.3567487003034485
55256,Lost Angel 2010 Cabernet Sauvignon (California),"This has ripe blackberry and oak flavors. It's dry, full bodied and tannic enough to cut through a rich, ketchup-strewn cheeseburger.",10.0,84,1,0.3567359235117585
39941,Casar de Burbia 2013 Tebaida Mencía (Bierzo),"Dark, smoky, oaky aromas of tobacco, leather and black fruits lead to a palate that's muscular, tannic and solid as a pile of rocks. Cool, earthy black-fruit flavors include woodspice and dark-chocolate notes. This Mencía from a cold year is flush, rugged and dry on the finish. Drink through 2025.",76.0,93,1,0.35673579034288666
24565,El Nido 2003 Red (Jumilla),"Cabernet Sauvignon and Monastrell made in a ripe, high-alcohol style results in monster aromas of shoe polish and black licorice. The palate is a wave of chocolate and candied black fruits that crashes into a heavy, ultraripe finish of prune and pepper. A lunker wine with a sweet smile and a big handshake.",130.0,88,1,0.3566465578800254
67185,Jason-Stephens 2009 Estate Petite Verdot (Santa Clara Valley),"Closed in aromas, this wine has big, structured tannins and minty black fruit, and is soft in texture. Chocolate, leather and tobacco are the main points, dark plum fruit the afterthought.",32.0,85,1,0.3565780389442046
52616,Howell Mountain Vineyards 2011 Old Vine Zinfandel (Howell Mountain),"Fruity and juicy in blackberry and black cherry, this mountain-grown Zin has soft, integrated tannins and a backbone of spiciness, white pepper mostly, and dark black licorice, that winds its way through the finish.",45.0,91,1,0.3565469902854362
99935,Seven Angels 2013 Petite Sirah (Paso Robles),"Dense and black in the glass, this bottling shows black currant, blueberry, dark chocolate and coffee scents. The palate is framed by hearty tannins that provide structure but don't get in the way, holding up milk chocolate, violet, and black cherry flavors. It finishes on a burnt fudge kick.",34.0,90,1,0.3564686695906152
104870,Pasqua 2011 Famiglia Pasqua  (Amarone della Valpolicella),"Aromas of baked plum, exotic spice and vanilla almost jump out of the glass. The aromas follow through to the full-bodied, savory palate along with ripe black cherry, blackberry and mocha while velvety tannins give it a smooth, polished texture. It closes on a confectionary note.",45.0,93,1,0.3564302698374045
48774,Cinnabar 2008 Sextant Vineyard Syrah (Paso Robles),"Rich, dry and tannic, this Syrah has elaborate flavors of dried plums, blackberries, coffee, dark bitter chocolate and black pepper. It's a complex wine, compromised only by the heat of 15.4% alcohol.",36.0,87,1,0.35640812894440865
78277,Three Thieves 2013 Cabernet Sauvignon (California),"Deep in color, big in flavor and full bodied, this is a rustic, straightforward wine. It smells like very ripe blackberry and black cherry, tastes dense and feels full, tannic and firm-textured.",7.0,86,1,0.3563855815271132
70838,Podere Sapaio 2004 Sapaio  (Bolgheri Superiore),"Not bad for a first attempt. This is a thick, dark wine of almost impenetrable extraction and mature fruit notes of black cherry and black currant. Its aromas are painted in broad brush strokes and invoke roasted espresso bean, black chocolate and smoked game. It has an outstanding mouthfeel, with voluptuous but solid tannins and enormous length. Drink after 2015.",66.0,95,1,0.35633430754906836
24822,Foxen 2015 Williamson-Dore VIneyard Syrah,"Quite dark and viscous in the glass, this bottling shows very concentrated, deep and intense aromas of black currant, charred rosemary, roasted meat and a hint of incense. There's a coffee and chai spice component to the sip alongside the persistent dark fruit, charcoal, black pepper and uplifting flavors of violet and lilac. Strong tannins ensure a long lie. Drink now through 2030.",48.0,94,1,0.3562933996423738
10024,Campo Eliseo 2009  Toro,"Hailing from a warm region and a warm vintage, this is displaying maximum ripeness on the nose via raisin, prune, blackberry and fig aromas. In the mouth, this is loamy, chewy, a mile deep and rich as Bill Gates. Concentrated black cherry, blackberry, cassis, chocolate and mocha flavors conclude with baked notes, licorice and tobacco. So smooth, yet bullish. Drink through 2022.",85.0,95,1,0.355955074837388
112969,Mascota 2014 Big Bat Cabernet Sauvignon (Mendoza),"Toasty blackberry and prune are the key aromas on this plush Cabernet. A generous mouthfeel includes choppy tannins that will mellow in due time. Dark flavors of cassis and blackberry include spice and chocolate notes, while this finishes with ripe flavors of blackberry touched up by chocolaty oak. Drink this calm, slightly flabby Cab through 2021.",50.0,92,1,0.3559109697405282
107876,Lamadrid 2012 Single Vineyard Gran Reserva Malbec (Agrelo),"Cedar, graphite, marzipan, black plum and blackberry aromas ooze power and ripeness. This is concentrated and dark in style, with oaky blackberry and cassis flavors. Spice, vanilla, raisin, cassis and chocolate flavors reflect maximum ripeness, while the finish is dense, layered and potent. Drink this hefty, extracted Malbec through 2020.",35.0,91,1,0.35581936679010745
71157,Arboleda 2008 Cabernet Sauvignon (Aconcagua Valley),"Dark and charred, with aromas of shoe polish, asphalt, coconut and blackberry. It's masculine in style, with firm tannins that bite down in support of concentrated black fruit, chocolate and spice flavors. Coffee, bitterness and heat work the finish on this tannic, full-bodied Cabernet.",19.0,88,1,0.3557599286289971
115925,Chimney Rock 2014 Clone 7 Estate Grown Cabernet Sauvignon (Stags Leap District),"With round clove and dried herb flavors, this wine has a soft texture of integrated tannins and subtle oak, highlighted with pencil shaving and cedar notes. Its blackberry and black currant fruit is complemented by a tantalizingly dark, lush fig note.",110.0,90,1,0.35572655644487
23207,Bacio Divino 2009 Reserve Cabernet Sauvignon (Napa Valley),"This soft, gentle Cabernet doesn't have much structure, but it's rich in blackberry, currant and dark chocolate flavors, and thoroughly dry. The finish is hot like a jalapeño pepper.",80.0,86,1,0.3557003910972885
43507,Schulz 2008 Fortunati Vineyard Syrah (Oak Knoll District),"This is one of those wines that tastes dramatic and important. It's marked by rich, thick tannins, but they're ripe and smooth, and frame complex flavors of blackberries, black cherries, grilled teriaki beef and black pepper, enriched with smoky cedar. Texturally, it's medium-bodied and velvety, like a Merlot.",30.0,92,1,0.35567220600458976
84153,Hearst Ranch 2010 Pico Creek Merlot (Paso Robles),"A very rich, full-bodied Merlot, with chocolate, blackberry jam and sweet oak flavors, wrapped into firm tannins. Offers lots of immediate pleasure.",30.0,87,1,0.3556533779064152
75771,Tobacco Road 2007 Cabernet Sauvignon (Napa Valley),"This is a mature Cabernet that's still generous in brambly black cherry and plum, with layers of spice intermingled among the fine tannins and charred oak. Black tea and tobacco complete the intrigue of this wine, with a black licorice finish.",199.0,94,1,0.35558396150244814
51669,San Simeon 2013 Estate Reserve Cabernet Sauvignon (Paso Robles),"Dark chocolate and black cherry converge for an elegant and dense nose in this wine from the Riboli family. The palate offers an intriguing range of flavors, from blackberry to cocoa dust and black pepper. The chalky tannins still need some time to open up, but will ensure a long life.",25.0,91,1,0.3555005739688941
82745,La Mano 2007 Roble Mencía (Bierzo),"Robust aromas of ripe berry fruit and bacon give this a full and lusty starting point, while the textured body is rich, with sturdy tannins. Flavors of blackberry and black cherry are sweet, and the wine has good character and bounce. A wine you want to drink on a regular basis.",10.0,87,1,0.3554899528244096
43539,Aaron 2012 Petite Sirah (Paso Robles),"Lavish aromas of black cherry, blackberry jam, gingerbread, mincemeat pie and caramel chews combine for a hedonistic nose on this wine from Aaron Jackson. Dense, dark blueberry fruit drives the palate, which gains complexity from espresso beans, dark chocolate and graphite minerality.",44.0,91,1,0.3553203585938716
107438,Rockroom Winemaking Cooperative 2008 TKO Cabernet Sauvignon (Oakville),"There's no questioning how rich and delicious this Cabernet is. It's dazzling in ripe blackberry jam and cocoa flavors, with riper, more concentrated black currants, as well as plenty of toasty new oak. In the dark fruits and superb tannins, as well as the overall balance, the wine defines Oakville Cabernet. Ready to drink now and over the next 6–8 years.",80.0,91,1,0.35523310624837495
11130,Billsboro 2007 Cabernet Sauvignon (Finger Lakes),"Black fruit and cherry leads on this balanced red. Flavors of black pepper, black currant and plum on the palate are round but not overbearing. A good daily red to pair with pastas, stews and meat dishes.",20.0,84,1,0.35517085793473235
12869,Billsboro 2007 Cabernet Sauvignon (Finger Lakes),"Black fruit and cherry leads on this balanced red. Flavors of black pepper, black currant and plum on the palate are round but not overbearing. A good daily red to pair with pastas, stews and meat dishes.",20.0,84,1,0.35517085793473235
98558,Marqués de Cáceres 2011 MC  (Rioja),"This is arguably the best MC Cáceres has bottled. Dense, smoky aromas of bacon, toast and blackberry are showing well. A concentrated yet balanced palate is home to flavors of ripe black fruits accented by proper doses of spice and leather. A toasty finish is black as night, with coffee and hard spice notes. Drink through 2020.",33.0,92,1,0.3551028844851311
78384,Vigneti Villabella 2010  Valpolicella Classico Superiore Ripasso,"This has aromas of black cherry and spice. The palate shows ripe blackberry and spice flavors, along with evolved tannins. This has instant appeal, so drink soon.",18.0,87,1,0.3550825756218786
13809,Orgo 2015 Saperavi (Kakheti),"Aromas of black currant and cherry set the stage for flavors of cassis, leather, juniper berry and dark chocolate. There is a nice balance of fruit and deeper savory notes, and velvety tannins make way for a splash of cherry on the lingering finish.",28.0,90,1,0.3549928500536982
76373,Orgo 2015 Saperavi (Kakheti),"Aromas of black currant and cherry set the stage for flavors of cassis, leather, juniper berry and dark chocolate. There is a nice balance of fruit and deeper savory notes, and velvety tannins make way for a splash of cherry on the lingering finish.",28.0,90,1,0.3549928500536982
69831,Vasco Urbano 2013 GSM The Sheriff Red (Livermore Valley),"This extravagantly styled wine shows aromas like black pepper and grilled beef, then opulent deep black-cherry and dark-chocolate flavors come through. The spicy oak component is dominating and very tasty. Made from 61% Grenache, 25% Syrah and 14% Mourvèdre.",36.0,91,1,0.3549708804685186
75744,Tenuta Bellafonte 2010 Collenottolo  (Montefalco Sagrantino),"Forest floor, ripe black fruit, truffle, leather and balsamic aromas open this bold, concentrated wine. The delicious palate offers layers of blackberry, spicy plum, black pepper, cassis and savory herb alongside big, velvety tannins. It has balance and depth but it's still young and needs time to develop complexity. Drink 2018–2030.",55.0,94,1,0.35495854398539545
36453,Château du Prieuré des Mourgues 2012 Grande Réserve Red (Saint-Chinian),"A blend of 70% Syrah, 20% Grenache and 10% Mourvèdre, this wine is quite perfumed, with intense aromas of spiced black cherry, forest berry and licorice. The medium-weight palate is plush and mouthfilling, with velvety tannins lending structure to the ripe black-fruit flavors, alongside a touch of graphite. The enduring finish beams with notes of licorice and black pepper.",20.0,90,1,0.35492599190579427
77018,Mezzacorona 2008 Riserva  (Teroldego Rotaliano),"This opens with dark, inky concentration and savory aromas of leather, black fruit, tobacco and black cherry. The wine feels smooth and rich on the palate.",16.0,88,1,0.3548848590927753
3055,Meyer Family Cellars 2012 Petite Sirah (Yorkville Highlands),"Big and bold in character, this full-bodied and abundantly tannic wine looks black to the rim and smells like pencil shavings, leather and wood smoke. The flavors are dry but enticing, with dark chocolate, charred beef and black cherry. It needs until at least 2022 to peak.",42.0,92,1,0.3548611730873557
70518,Meyer Family Cellars 2012 Petite Sirah (Yorkville Highlands),"Big and bold in character, this full-bodied and abundantly tannic wine looks black to the rim and smells like pencil shavings, leather and wood smoke. The flavors are dry but enticing, with dark chocolate, charred beef and black cherry. It needs until at least 2022 to peak.",42.0,92,1,0.3548611730873557
74118,Continuum 2007 Red (Napa Valley),"Feels fancy and important in the mouth, with pure, refined tannins housing ripe, complex flavors of blackberries, black currants, cherries, chocolate, exotic spices and sweet, smoky oak. The finish is dry but with a tinge of sweetness, like an infused blackberry liqueur, which probably is the result of high (15.3%) alcohol. Very rich and layered, and a great addition to the Napa cult pantheon. Cabernet, with Cab Franc and Petit Verdot.",140.0,97,1,0.35485054601442445
105713,Prospect 772 2013 Black Tie Charlie Red (California),"This wine is powerful enough to serve with wild boar carpaccio, if there is such a thing, or with blue cheese like a Port. The color is unusually dark and opaque, a stark black with a faintly purple rim. It smells spicy and tastes very concentrated, like blackberry jam, wood smoke and black pepper. The texture is almost thick and drenched with fine tannins while the body is quite full as well.",27.0,89,1,0.35481446896898566
66922,Healdsburg Ranches 2008 Cabernet Sauvignon (Sonoma County),"Good price for a nice, dry Cabernet with so much fruit. It's forward in ripe blackberry, blueberry and cherry jam flavors, with a rich coat of smoky oak.",10.0,85,1,0.3547909678055975
105170,Shiloh Winery 2011 Legend Red (Judean Hills),"A blend of Petite Syrah, Petit Verdot and Shiraz, this wine has a bouquet of black cherry and black pepper with a touch of green bell pepper. It is well balanced and has good mouthfeel, with flavors of black cherry, chocolate, thyme and oregano. Smooth tannins coat the palate into the slightly minty finish.",45.0,91,1,0.3547001496530107
54919,Helwig 2013 Graciano (Shenandoah Valley (CA)),"This surprisingly rich, concentrated and full-bodied wine has delicious spicy oak accents and an easy-sippng texture. The color is a very dark, deep red. Aromas are grapy, jammy and fresh, and the flavors convey ripe blackberry and plum.",38.0,91,1,0.354604321355377
4139,St. Francis 2007 Cabernet Sauvignon (Sonoma County),"Good price for a nicely complex Cabernet for drinking now. Dry and smooth in tannins, it shows ripe blackberry, cherry, licorice and herb flavors, with a kiss of oak.",22.0,87,1,0.3544295382537671
98126,Terra Valentine 2010 Estate Grown Cabernet Sauvignon (Spring Mountain District),"Exceptionally ripe, concentrated mountain fruit as well as hard tannins characterize this fresh, young Cabernet. Through the tannic astringency, intense flavors of black currants, dark chocolate and the sweet sap of oak shine through. Needs time. Hold until 2016 and see how it's doing.",45.0,94,1,0.35434194717207945
44143,Villa Mora 2010 Passito  (Montefalco Sagrantino),"This dense dessert wine conveys aromas of fig, prune and blackberry jam. The palate offers dried black cherry, dark chocolate and cake spice alongside chewy tannins.",35.0,89,1,0.354180334909406
41046,Chateau Burgozone 2012 Cabernet Sauvignon (Danube River Plains),"Deep ruby in the glass, this wine has a bouquet of black cherry, raspberry, saddle leather and vanilla. It offers flavors of blackberry, black plum and fresh forest mushroom suspended in a cloud-like structure of silky tannins.",14.0,90,1,0.3540509341498303
49597,Trivento 2011 Reserve Cabernet Sauvignon (Mendoza),"This full and ripe Cabernet has berry and black cherry aromas. Tannic, narrow and tough on the tongue, it is blasting with flavors of blackberry, mint and black coffee. It's fruit flavor is met with plenty of kick and grab. Can age for a year.",11.0,87,1,0.3539464594715687
38361,Kagan 2008 White Hawk Vineyard Syrah (Santa Barbara County),"This has lovely aromas of black pepper and blackberry, but in the mouth, it turns a bit soft and sweet, with melted chocolate and blueberry jam flavors. It's ripe and tasty, but could use greater structure.",54.0,87,1,0.3538781188802957
17582,Recanati 2004 Special Reserve Kosher Cabernet Sauvignon (Galilee),"A well structured Cab with plenty of cassis, blackberry and black cherry aromas and flavors. Subtly smoky vanilla, herbal and roasted coffee notes complement the fruit on the palate. The mouthfeel is soft and supple and the finish appropriately long.",38.0,84,1,0.3538443226688611
80938,Beringer 2004 Alluvium Red Table Wine Red (Knights Valley),"This shows wonderfully layered, complex flavors, in addition to great structure. Thoroughly dry, with rich, fine tannins, it flatters with red and black currant, red cherry, milk chocolate, licorice, root beer, vanilla, dusty spice and smoky oak flavors. Luscious now and through 2010.",30.0,93,1,0.35384056957175064
91573,Midnight 2013 Moonlight Cabernet Franc (El Pomar District),"This wine's nose is a tad hollow, offering poppy seed, roast beef and black-fruit aromas. The palate conveys blueberry, blackberry and chocolate flavors, with a rising acidity on the finish.",44.0,85,1,0.3538090261993965
69919,Doyenne 2009 Signature Syrah (Yakima Valley),"This opens with deep, dense dark-fruit goodness. It's a massive wine that bursts with blackberry, black cherry and cassis. After that opening explosion of ripe fruit, it seems to float through the mouth, like riding in a big-finned Cadillac from the 1950s. Consume this one within 2–5 years.",40.0,92,1,0.3537262456732021
91395,Esoterica by Kent Rasmussen 2008 Chavez-Leeds Vineyard Petite Sirah (Rutherford),"Rich in blackberry tart, dark chocolate, grilled meat, pepper spice and smoky flavors, wrapped into firm tannins. The acidity is strong and a little unnerving. Drink over the next 2–3 years.",40.0,86,1,0.35359181133564827
4811,Stylo 2008 Old Vines Garnacha (Calatayud),"With full black-cherry and bacon aromas, this affordable wine comes across well on the nose. Thick and full-bodied in the mouth, this has flavors of blackberry, creamy oak, chocolate and vanilla. It feels broad and just bright enough on the finish.",11.0,87,1,0.35358606488344124
12797,Langtry 2013 Old Soldier Road Tephra Ridge Vineyard Red (Lake County),"This is a giant of a wine, packed to bursting with dark chocolate, black cherry, black pepper and clove flavors, all wrapped in a soft layer of tannins. Made of 63% Petite Sirah, 31% Cabernet Sauvignon and dashes of three other grapes, it has good depth, concentration and full body, and will make maximum impact at your next party.",40.0,92,1,0.3535590111507168
45131,Zolo 2015 Sustainably Farmed Estate Grown and Bottled Malbec (Mendoza),"Grapy aromas of black cherry introduce a tight, rubbery but fair palate. Ripe berry, black cherry and bitter chocolate flavors finish with a note of toasty oak but also fiery burn. Let this aggressive Malbec air out and it will show best.",12.0,86,1,0.3533756795190593
36209,Robert Mondavi 2010 Cabernet Sauvignon (Napa Valley),"Lots of elegance in this Cabernet. It's dry, full bodied and rich in tannins, with a good depth of black currants and sweet, toasty oak. Won't age, but who cares: Pop the cork and drink it now.",28.0,89,1,0.35333582134501934
114610,Robert Mondavi 2010 Cabernet Sauvignon (Napa Valley),"Lots of elegance in this Cabernet. It's dry, full bodied and rich in tannins, with a good depth of black currants and sweet, toasty oak. Won't age, but who cares: Pop the cork and drink it now.",28.0,89,1,0.35333582134501934
35811,Wilderotter 2014 Petite Sirah (Shenandoah Valley (CA)),"Dark and thick, this full-bodied wine from the Sierra region brings truckloads of jammy fruit flavors along with a firm texture that doesn't overly tighten the tannic grip. The blackberry and black-cherry notes are simply delicious.",32.0,90,1,0.35330994742857286
3671,Miraflores 2012 Clone 877.4.369.362 Red (El Dorado),"Here is a hefty, concentrated, satisfying wine to pair with big proteins. A dense red-black color, with aromas of blackberry jam and dried plums lead to bold fruit flavors, full body and a thick, nicely tannic texture. The intense plum and blackberry character lasts through the lingering finish.",29.0,90,1,0.35324515663363837
50675,Miraflores 2012 Clone 877.4.369.362 Red (El Dorado),"Here is a hefty, concentrated, satisfying wine to pair with big proteins. A dense red-black color, with aromas of blackberry jam and dried plums lead to bold fruit flavors, full body and a thick, nicely tannic texture. The intense plum and blackberry character lasts through the lingering finish.",29.0,90,1,0.35324515663363837
57140,Vineyard of Pasterick 2007 Estate Syrah (Dry Creek Valley),"Don't look for subtlety in this Syrah. It's all about overt, in-your-face ripe blackberry jam, mushu plum sauce and dark chocolate flavors. The wine is dry, tannic and soft, with a long, spicy finish. Doesn't seem capable of aging, as the alcohol is high, so drink up.",48.0,87,1,0.3532262308676339
95769,Feudi di San Gregorio 2004 Piano di Montevergine Riserva  (Taurasi),"This vineyard-designate Taurasi Riserva is probably one of the biggest, boldest wines produced in Italy. It opens with an inky black color and intense aromas of black fruit, toast, spice, espresso bean and bitter black chocolate. The jackhammer tannins are steady and firm, and there's a long tail of prune and black fruit on the finish.",65.0,94,1,0.3532229484325486
5073,CVNE 2001 Real De Asúa  (Rioja),"Ripe, sweet and stylish, with blackberry, root beer and herb aromas. Bulky yet balanced, with black cherry fruit that comes at you in jammy style. Black tea, ground spices, coffee and raw oak work the finish. A dark and handsome wine, but one that isn't overly complex and is ready to drink now through 2011.",145.0,90,1,0.3530620735562434
58993,Renwood 2014 Petite Sirah (Amador County),"This wine is a classic of the type that can only improve with time. The aromas show tightly packed spices, superripe fruit and cedar. Dense blackberry, blueberry and dark chocolate flavors fill this full-bodied and lavishly tannic wine to the brim. The color is black, except for a slim ring of deep ruby at the edge. Best after 2025.",50.0,94,1,0.3530499542683263
8489,Château de Ferrand 2012  Saint-Émilion,"With a dominance of Merlot in the blend, this Saint-Émilion-classed growth has ripe, jammy fruits and softening tannins. It is dense and concentrated with big blackberry fruits that have a touch of spice and pepper from the alcohol. The wine is rich and ready to drink now and until 2024.",40.0,92,1,0.35304481898284323
95135,Re Manfredi 2008 Vigneto Serpara  (Aglianico del Vulture),"Made from 50-year old vines, this concentrated wine offers dense black currant and blackberry flavors that are layered with chocolate, black licorice, coffee, grilled red peppers, sage, oak and thyme sensations. The tannins are firm and drying; drink after 2018.",49.0,90,1,0.3530313038901427
73137,Buehler 2010 Papa's Knoll Estate Cabernet Sauvignon (Napa Valley),"A fine Cabernet, this is dry, full bodied and softly tannic, with real Napa elegance. Feels smooth in the mouth, offering concentrated blackberry, currant, dark chocolate and sweet oak flavors. Drink over the next six years.",45.0,89,1,0.35300414032778643
110957,ONX 2014 Level 22 Red (Templeton Gap District),"Stewed blackberry and black plum fruit meets with leather, black pepper and shiitake mushroom aromas on the nose of this blend of 45% Petite Sirah, 33% Syrah, 12% Mourvèdre and 10% Grenache. It's savory on the palate, with dried herb and roast beef flavors set against a backdrop of black fruit. The acidity is searing toward the finish.",54.0,91,1,0.35279157056368726
34343,Covenant 2013 Cabernet Sauvignon (Napa Valley),"This is a blockbuster of a wine, impressive in its smoky oak and crisp black currant brightness. Soft, integrated tannin supports a full-bodied, lush palate that has plenty of length and breadth, seasoned with black licorice, pepper and clove.",100.0,93,1,0.35272104640353164
1092,St. Francis 2014 Reserve Cabernet Sauvignon (Alexander Valley),"Black in color, this heavy concentrated wine is thick in black pepper and clove, with underlying streaks of cedar. Well structured, it unfurls depths of black cherry, currant and vanilla as it develops in the glass, finishing a full bodied as it started.",52.0,93,1,0.3525961200731483
