,title,description,price,points,cluster_label,cosine_similarity
92563,Tormentoso 2009 Mourvèdre (Paarl),"Fleshy black-plum, cherry and blackberry notes lead this medium-weight wine, with a light dusting of cocoa powder. Dark but vibrant in the mouth, with a good amount of pepper and licorice on the finish. Drink now.",13.0,87,1,0.3219315745521174
42765,Brian Benson 2013 Camatta Hills Vineyard Syrah (Paso Robles),"Extremely dark fruit tones come from the nose of this wine, including blackberry and black cherry. It also offers touches of red fruit alongside snapped dark chocolate, licorice and a tarragon mintiness. Density and darkness consume the palate too, with blueberry fruit laced by dried basil, oregano, lavender and tar.",45.0,93,1,0.32192861297633557
54502,Blair Fox 2009 Fox Family Vineyard Syrah (Santa Barbara County),"This is a rich, ripe Syrah, with deep, long-lasting chocolate, blackberry jam and oak flavors. Impresses for its sheer razzle dazzle. Probably best over the next few years.",45.0,89,1,0.3218606508038128
81514,Arger-Martucci 2005 Odyssey Red (Atlas Peak),"This is a big, powerful and still young Cabernet blend that's not ready to drink yet. The massive blackberry, black currant, violet and dark chocolate flavors haven't meshed with the smoky oak, while a cut of fruity acidity makes for a tart mouthfeel. But it should easily negotiate the years. Better after 2011, and should blossom afterwards.",50.0,93,1,0.32184809833331446
85362,Estampa 2009 Reserve Assemblage Carménère-Cabernet Sauvignon-Cabernet Franc Red (Colchagua Valley),"A big blast of roasted berry, herb and spice hits hard on the composed bouquet. Feels stocky and lush, with full tannins, good extract and flavors of herb, black olive, earth, cola and toasty blackberry. Toasted on the finish, with bitter chocolate notes.",16.0,88,1,0.32182393602968634
53366,Atwater 2012 North Block Six Cabernet Franc (Finger Lakes),"A spray of violet perfumes ripe blueberries and blackberries on this deep, rich Cabernet Franc. Lusciously full in body, the palate is a concentrated crush of black fruit flavor accented with brisk acidity and soft, velveteen tannins on the finish.",28.0,88,1,0.32181762803804015
25088,Clarendon Hills 2005 Hickinbotham Grenache (Clarendon),"Ripe black cherry and cedary aromas can't hide the touch of alcohol that seems to emanate from the glass. But the wine is balanced on the palate, not showing any excessive warmth, framing its black cherry and chocolate flavors with bright acidity. The crisp acids on the finish accentuate the tannins, making this an uncommonly structured Grenache. Imported by Wine Brokers Unlimited.",65.0,90,1,0.32181368458145515
104359,Ottimino Vineyards 2005 Ottimino Vineyard Zinfandel (Russian River Valley),"A good followup to the 2004, Ottimino's 2005 is exuberantly rich and forward in jammy wild blackberry and cherry flavors, with an array of spicy pepper, clove and anise. Entirely dry, it's wrapped into ripe, firm tannins. Now through 2010.",32.0,90,1,0.3218111835383367
41038,Bulgariana 2011 Cabernet Sauvignon-Syrah (Thracian Valley),"This wine features aromas of raspberry and black currants with touches of coffee and bacon. Luxurious flavors of ripe black plum, black cherry, espresso and pipe tobacco wash over the taste buds in a web of velvety tannins, culminating in a vivid finish.",14.0,90,1,0.32179133327177983
113311,Joyce 2011 Pedregal Vineyard Merlot (San Benito County),"A bit aggressive, with blackberry, cherry, cassis and sweet licorice flavors. It's a big, exuberant, fruity wine to drink now.",24.0,86,1,0.321719315255319
18625,Cadence 2006 Cara Mia Vineyard Bel Canto Red Wine Red (Red Mountain),"The complement to the Camerata from Cadence, this estate-grown blend is 52% Cab Franc and 48% Merlot. There's a juicy core that is delightful, with ripe blackberry and black cherry fruit. Both of the Cara Mia wines see 50% new oak for a full 18 months, and at this early age this shows as aliquorous, almost bourbony aftertaste. The aromatics display dark notes of smoke and coffee, along with some mocha and cracker.",55.0,91,1,0.3216779792096234
99734,Martin Ranch 2009 J.D. Hurley Cabernet Sauvignon (Santa Cruz Mountains),"Aggressive in tannins and concentrated in fruit, this Cab is a little rustic, but fine for drinking now. It's sweet in raisin, cassis, black pepper and oak flavors. Give it some time in the decanter.",27.0,85,1,0.321627746538507
184,Sierra Starr 2014 Rising Starr Estate Bottled Cabernet Franc (Nevada County),"This is a beatifully balanced, not-too-full-bodied wine from vines grown at 2,400 feet in the Sierra range. It has classic black cherry, black olive and anise aromas, harmonious fruit flavors accented with light oak spiciness and a firm, fine-grained tannic structure.",28.0,90,1,0.3216126733142595
61216,Sierra Starr 2014 Rising Starr Estate Bottled Cabernet Franc (Nevada County),"This is a beatifully balanced, not-too-full-bodied wine from vines grown at 2,400 feet in the Sierra range. It has classic black cherry, black olive and anise aromas, harmonious fruit flavors accented with light oak spiciness and a firm, fine-grained tannic structure.",28.0,90,1,0.3216126733142595
62778,Opolo 2012 Serenade Cabernet Sauvignon-Malbec (Paso Robles),"Caramelized blackberries, black plum, lilacs and milk chocolate make for a nicely rounded nose. Baked blackberry and blueberry meet with vanilla and oak flavors on the palate, which is held up by solid tannins.",32.0,92,1,0.32159134407906276
6581,Paso a Paso 2012 Estate Bottled Tempranillo (La Mancha),"Robust black-fruit aromas suggest plum and blackberry. This everyday red is concentrated, generous and packed with power. Flavors of dark berry fruits, chocolate and espresso finish with verve and clarity.",9.0,88,1,0.32158729571205036
84519,Rutherford Ranch 2010 Cabernet Sauvignon (Napa Valley),"Soft and fruity, this has ripe black-cherry and blackberry compote flavors, plus plenty of oak influence. Drink now.",19.0,85,1,0.3215738423191917
41575,Le Bertarole 2009 Podere Le Marognole  (Amarone della Valpolicella Classico),"This Amarone opens with slightly rustic but not unpleasant aromas of earth and farmland that burn off to reveal dark fruit and spice notes. The palate shows ripe black cherry, plum and raisin flavors, spiced with a black pepper accent.",45.0,87,1,0.32156114968987853
79169,Bonterra 2004 The McNab Red (Mendocino),"This Merlot, Cab and Petite Sirah blend sneaked into a very upscale Napa Cabernet tasting, and it acquitted itself very well. Dry and firm in tannins, it shows a high level of refinement, not to mention ageability. With black currant, plum, pepper and dark chocolate flavors, it's fine now and should hold and blossom for 6–8 years.",45.0,91,1,0.3215424204138025
115052,Ken Forrester 2008 The Gypsy G-S-M (Western Cape),"Fleshy fruit tones of cherry, plum, blackberry and raspberry all abound on the nose of this G-S-M blend, alongside secondary hints of black pepper and cured meat. There's a nice evolution to the medium-weight palate, which starts off with fruity dominance but then transitions to spice, followed by sweet smoke and finally ends of a decadent mocha flavor. It's firmly textured with gripping tannins and a long finish.",65.0,90,1,0.32153615431577626
101746,Treasure 2010 Cabernet Sauvignon (Napa Valley),"Rich, complex black currant, dark chocolate, mineral and oak flavors mark this bone dry, extremely tannic young Cabernet. It possesses a firm structure and mouthfeel, so give it until 2020 to begin to come around.",99.0,93,1,0.32151357270132247
84191,Troll Bridge 2010 Password Red (Napa Valley),"Herbal and excessive in wood tannins, this has strong elements of jalapeño and pepper amidst a full-bodied expression of black plum and chocolate.",75.0,85,1,0.3215002732770996
11985,El Pensador 2008 Tempranillo (Campo de Borja),"Raisin, black plum and peppery aromas make for a good bouquet, and the palate is healthy and dark, with snappy black cherry and blackberry flavors floating on a current of zesty acidity. Full on the finish, but still there's some acidic scour. Best with food.",17.0,86,1,0.32141703316706893
21793,Sonsierra 2013 Perfume de Sonsierra  (Rioja),"Heady aromas of cola, blackberry and licorice set up a youthful choppy palate with hard tannins and a sense of skins. Blackberry, licorice and charred toasty oak flavors finish dry, spicy and with a strong note of dark chocolate. Drink through 2028.",53.0,92,1,0.32136978854352477
81116,Sonsierra 2013 Perfume de Sonsierra  (Rioja),"Heady aromas of cola, blackberry and licorice set up a youthful choppy palate with hard tannins and a sense of skins. Blackberry, licorice and charred toasty oak flavors finish dry, spicy and with a strong note of dark chocolate. Drink through 2028.",53.0,92,1,0.32136978854352477
61746,Cenay 2009 Blue Tooth Vineyard Cabernet Sauvignon (Oak Knoll District),"A very nice Cabernet from a winery that's done a good job with this vineyard bottling for many years. The wine is smooth as velvet, with soft, lush tannins and opulent blackberry, currant, dark chocolate and cedar flavors. It should develop in the bottle over the next 6–8 years.",40.0,91,1,0.32134301744576466
54776,Montemaggiore 2009 Nobile Cabernet Sauvignon-Syrah (Dry Creek Valley),"Blackberry, tobacco, dark chocolate, currant and spice flavors mark this dry, tannic blend. It has furry tannins and a briary mouthfeel that make it somewhat rustic. Give it a long decant before drinking now.",45.0,87,1,0.3213226420058569
99859,Nittnaus Anita und Hans 2013 Kalk und Schiefer Blaufränkisch (Burgenland),"The white pepper of Blaufränkisch is joined here by rounder spices of oak. The fruit is ripe but not plump, everything is in balance and makes for a refreshing yet rich red, dense with blueberry and black cherry flavors. There is energy and drive and no heaviness at all. This is full of life.",20.0,92,1,0.3212915292072081
20322,Cima Collina 2012 Tre Gatti Vineyard Syrah (San Antonio Valley),"Aromas of blackberry syrup, black pepper, fresh fennel stalk and mint emerge from this wine, which comes from a five-acre vineyard in one of Monterey County's warmest appellations. Full, ripe flavors of black cherry, cola and licorice are cut by bright acidity and an appropriate tannic intensity.",28.0,90,1,0.32127356099568427
84983,Ruby Hill Winery 2012 Jewel Collection Series Estate Reserve Cabernet Sauvignon (Livermore Valley),"Complex aromas like cedar, pipe tobacco and pencil lead light up this inky dark wine as concentrated black cherry and blackberry flavors kick in. It's extremely full bodied and the texture is plush, almost thick, coating the mouth with fruit and fine tannins that linger nicely on the finish.",55.0,91,1,0.3212732741827794
9522,Fabre Montmayou 2012 Grand Vin Red (Mendoza),"With an opaque purple color and grapy, full aromas of blackberry Kool-Aid and cassis, this ripe Bordeaux blend is plump, chewy and a touch soft on the palate. Toasty but largely generic black-fruit flavors finish blackened, with a note of creosote, heat and drawing tannins. Drink through 2019.",42.0,91,1,0.321263745456768
7038,Alta Vista 2012 Single Vineyard Alizarine Malbec (Luján de Cuyo),"Right away this pitch-dark Malbec displays max ripeness through a dynamic mix of prune, blackberry, coconut, violet petal and leathery aromas. A hugely concentrated palate is hardly a shock, while firm acidity cuts a viscous palate with ripe cassis, plum, blackberry and black cherry flavors. Drink this voluptuous wine through 2022.",48.0,94,1,0.32119323804111044
56785,Mersenne 2013 Dalla Gasperina Vineyard Cabernet Sauvignon (Rutherford),"From an organically farmed vineyard, this rich, full-bodied wine offers flavors of baked plum, cherry and chocolate cake, taking on an edgy flirtation with toasted oak. It finishes with a sprinkling of black pepper and nutmeg, ready for a giant steak.",59.0,90,1,0.32117176088186505
75602,Bazelet HaGolan 2011 Reserve Cabernet Sauvignon (Galilee),"Aromas of blueberry, cherry and anise yield on the palate to flavors of cherry, blackberry, eucalyptus and black pepper. Smooth tannins appear early on and endure into a pleasing finish that is interspersed with bright and spicy notes.",40.0,90,1,0.3211355253196648
41486,Full Pull & Friends 2008 WWBDX Red (Walla Walla Valley (WA)),"This wine is a joy to drink with its aromas and flavors of coffee, dark chocolate, herbs and cherry. The opulently styled flavors are rich but well balanced, with chewy tannins backing it all up. It's irresistible.",34.0,92,1,0.3211256191854
80491,Full Pull & Friends 2008 WWBDX Red (Walla Walla Valley (WA)),"This wine is a joy to drink with its aromas and flavors of coffee, dark chocolate, herbs and cherry. The opulently styled flavors are rich but well balanced, with chewy tannins backing it all up. It's irresistible.",34.0,92,1,0.3211256191854
97239,Château du Glana 2009 Terre du Lion  (Saint-Julien),"Densely tannic and rich, this is full of ripe chocolate and blackberry fruit. It is dark, brooding and dense—a great success for the second wine of Château du Glana.",64.0,90,1,0.32109726535172023
52064,Vino z Czech 2012 Hrabal Frankovka (Moravia),"Known in other regions as Blaufränkisch, Frankovka is widely grown in the Czech Republic and Slovakia. This wine is garnet in the glass, with aromas of black cherry, cherry cola, and black plum. Flavors of black cherry and anise linger on the palate right through the spicy finish.",24.0,88,1,0.3210716922543303
67346,Cass 2010 Rockin' One Red (Paso Robles),"A blend of Syrah, Grenache, Petite Sirah and Mourvedre, this is a full-bodied, smoothly fruity wine for drinking now. It has rich blackberry and cherry flavors, with a hit of sweet, smoky oak.",42.0,88,1,0.3210236140520148
54965,Pride Mountain 2008 Syrah (Sonoma County),"This wine earns its high score by virtue of sheer richness. It's enormous in blackberry, cassis, roasted meat, licorice, black pepper and smoky cedar flavors, and finishes dry and spicy. There's a tannic toughness that resists the palate, and doesn't seem likely to age out, so drink over the next few years.",60.0,90,1,0.32101538810673513
3934,Bell 2006 Cabernet Sauvignon (Napa Valley),"This young, vigorous Cabernet is full of ripe, upfront fruity flavors, yet it's dry and complex, and is grounded by a pleasing tug of herbaceousness. Most notable is the rich blackberry, raspberry and currant fruit, and the way the sweet, smoky oak complements it. Drink now for freshness.",45.0,91,1,0.3210101871240768
47445,Newsome-Harlow 2010 The Dalton Ranch Syrah (Calaveras County),"The Dalton Ranch is a special vineyard source for Newsome-Harlow and its ability to grow great fruit shows in this wine, a Syrah black in color, boastful in earthy ripe, bright violet, blackberry and raspberry, the tannins subtle and softened.",32.0,91,1,0.32099229323540895
35109,Le Macchiole 2006 Paleo Cabernet Franc (Toscana),"This beautiful vintage of Paleo (an oak-aged expression of Cabernet Franc) shows dark, inky intensity and loads of mature black fruit, spice, plum, prune and blackberry. It is extremely smooth and rich with a long-lasting fade that consists of fruit and clove-like flavors. Yet, the tannins are still firm, so put this wine aside in your cellar for at least five years.",125.0,96,1,0.3209772880759942
93117,Carlisle 2014 Papa's Block Syrah (Russian River Valley),"Black in color and rich in aromas of grilled meat, Papa's is thick and concentrated, offering bold flavors of damson plum, leather and cola spice. Full bodied and ripe, its ability to showcase crisp acidity amid all this flavor and texture is remarkable.",44.0,91,1,0.3209648413312968
17668,Mark Ryan 2013 Lost Souls Red Willow Vineyard Syrah (Yakima Valley),"Intricate, jammy aromas of black cherry, blackberry, flowers, spice and mineral lead to plentiful black-fruit flavors. It shows the warmth of the vintage while bringing an undeniable sense of deliciousness, with lip smacking tannins backing it up.",48.0,91,1,0.320869566018462
58497,Binyamina 2007 Reserve Kosher Cabernet Sauvignon (Galilee),"This Mevushal Cab offers tons of dark fruit flavors matched with milk chocolate and whole tobacco leaf spice. Straightforward and fruit- driven in the mouth with strong black plum and cherry flavors. Very drinkable with a round, soft structure and low tannins.",25.0,85,1,0.32080337542155285
52105,Brandlin 2005 Cabernet Sauvignon (Mount Veeder),"This is an excellent young Cabernet Sauvignon that will take some bottle age. Coming on the heels of the high-scoring 2004, it's full-bodied and extraordinarily rich, with intense blackberry, black currant, chocolate, coffee and cedar flavors, wrapped into near-perfect tannins. Shows great grapes and a deft winemaking hand.",85.0,93,1,0.3207927543135122
81510,Brandlin 2005 Cabernet Sauvignon (Mount Veeder),"This is an excellent young Cabernet Sauvignon that will take some bottle age. Coming on the heels of the high-scoring 2004, it's full-bodied and extraordinarily rich, with intense blackberry, black currant, chocolate, coffee and cedar flavors, wrapped into near-perfect tannins. Shows great grapes and a deft winemaking hand.",85.0,93,1,0.3207927543135122
16377,Gérard Bertrand 2009 Syrah-Mourvèdre Syrah-Mourvèdre (Saint-Chinian),"You won't be disappointed with this attractively priced Saint-Chinian. Floral and herbal, with strong scents of lavender, licorice, laurel and menthol all infusing the black cherry, currant and boysenberry center. Rich and concentrated with a tecture like crushed velvet and fine but well-structured tannins. Hints of black pepper and bittersweet chocolate grace the close.",21.0,91,1,0.3207670769424499
71978,Gérard Bertrand 2009 Syrah-Mourvèdre Syrah-Mourvèdre (Saint-Chinian),"You won't be disappointed with this attractively priced Saint-Chinian. Floral and herbal, with strong scents of lavender, licorice, laurel and menthol all infusing the black cherry, currant and boysenberry center. Rich and concentrated with a tecture like crushed velvet and fine but well-structured tannins. Hints of black pepper and bittersweet chocolate grace the close.",21.0,91,1,0.3207670769424499
26489,Gosalbez Orti 2003 Qubél Red (Vinos de Madrid),"Roasted and dark, with full blackberry and smoked-meat aromas. Organic Tempranillo, Syrah, Garnacha and Cabernet Sauvignon comprise this tight, dark, rugged wine with forward tannins and acidity bolstering cherry, cassis and   cola flavors. Made in the modern, ripe style. Drink now–2010.",53.0,88,1,0.320765558147674
34912,Shafer 2013 One Point Five Cabernet Sauvignon (Stags Leap District),"The velvety approachability of this soft, supple wine belies a strength and sophistication always at the heart of this producer's wines, an intensity of flavor and power that commands attention. Black currant, black cherry, sage and smoky oak ride atop an underground of black pepper, combining ultimately into a tantalizingly juicy package. Drink now through 2023.",85.0,95,1,0.32076355479456053
72193,Lamadrid 2010 Matilde Single Vineyard Malbec (Agrelo),"Loamy, rich aromas of blackberry, licorice and chocolate cake come before a bold, balanced palate with acidic kick. Loamy blackberry, prune and licorice flavors finish with jammy richness and lingering flavors of blackberry, chocolate and anise. Drink through 2020.",80.0,92,1,0.32075447358717557
59996,Terre Rouge 2007 Cotes de l'Ouest Syrah (California),"Sweetly ripe, this Syrah offers attractive flavors of blackberry and cherry preserves, mocha, anise, pepper and sweet vanilla and caramel, wrapped into rich, fine tannins. It's a lovely Syrah to drink now.",18.0,87,1,0.3206946531012448
1317,Epoch Estate Wines 2013 Ingenuity Red (Paso Robles),"The winery's characteristic dense style is immediately apparent in this blend of 54% Syrah, 21% Mourvèdre, 16% Grenache and 9% Petite Sirah. It offers black licorice, smoked meat, baked black cherry and graphite aromas, needing time to breathe before unleashing black coffee, elderberry jam, asphalt and charcoal flavors through tarry tannins. Drink 2018–2028.",70.0,94,1,0.32069453175060064
65789,Valley Legend 2009 Cabernet Sauvignon (Napa Valley),"Scads of ripe blackberry, blueberry, cherry and Cocoa Puff fruit flavors on this Cabernet, which is also rich in sweet, buttery oak. It's delicious by definition, yet the modern style could use some restraint.",55.0,88,1,0.3206524663852743
71741,Finca El Origen 2014 Reserva Malbec (Uco Valley),"Blackberry and animal aromas precede a rubbery, tannic, full-bodied palate. This rugged, black-colored Malbec pumps out big blackberry flavors in front of a chocolaty but short finish with emerging oak.",12.0,87,1,0.3206482614559161
10196,Highlands 2012 Cabernet Sauvignon (Napa Valley),Smoky oak enwraps fully developed layers of cherry and blackberry fruit in this thick wine packed with generous tannins. A hearty backbone of oak accents additional leather and dark chocolate flavors.,85.0,91,1,0.32064536716050573
36781,Maldonado 2012 Los Olivos Vineyard Pinot Noir (Napa Valley),"With deep color and generous, ripe fruit aromas, this gives a first impression of being a big wine—which it is. Flavors are deep and rich, like black currant jam and black cherry juice with hints of mint and nutmeg. The body is full, the tannins firm enough to back up that gorgeous flavor, and the texture stays velvety through the finish.",42.0,91,1,0.3206383422815914
75313,Pavlidis 2008 Thema Red (Drama),"Anise, blackberry, black pepper and savory spice aromas lead this ripe red from Pavlidis. The palate is laced with a vanilla note, and the red berry flavors are rich and easy to like. With its good spice and complex fruit, this should pair well with grilled meats and tomato pastas.",30.0,86,1,0.32063802850790474
29191,La Pisara 2007 Primitivo (Salento),"Thickly extracted, concentrated and boasting a deep ruby color, this succulent Primitivo is redolent of chocolate fudge, black tea, espresso bean and black cherry. It's a well-executed, well-priced wine that has benefited from oak aging offering sweet, chewy tannins and lingering spice flavors.",12.0,87,1,0.32062047802054566
60118,Knights Bridge 2010 Cabernet Sauvignon (Knights Valley),"This is a big, strong Cabernet, flooding the mouth with intensely ripe blackberry, cassis liqueur, dark chocolate and white pepper flavors. It's tannic and acidic, and the oak hasn't been integrated at all with the fruit. Everything should begin to come together by 2017.",115.0,90,1,0.3206079018649583
4839,Gualdo del Re 2010 Amansio Passito Aleatico (Val di Cornia Suvereto),"Aromas recall spicy plum and black raspberry. The concentrated but balanced palate offers cassis, prune and blackberry, with velvety tannins and fresh acidity.",55.0,89,1,0.32056086485952245
22837,Salentein 2013 Reserve Malbec (Valle de Uco),"Earthy black-fruit and spice aromas are clean and welcoming, while this is potent and full of life on the palate. Black cherry, coffee and chocolate flavors are intense and finish with a notable amount of minty menthol character. Drink through 2019.",19.0,90,1,0.3205561770045368
11418,Langtry 2006 Serpentine Meadow Petite Sirah (Guenoc Valley),"A fine Petite Sirah, dark, full bodied and dry, with ripe flavors of blackberries, mocha, leather, herbs and spices. Feels good and clean in the mouth, with chewy tannins and a long, rich finish.",40.0,90,1,0.3204955066674933
10925,Timothy Moore 2012 Doyle Family Vineyards Reserve Merlot (Finger Lakes),"This bold, fruit-forward Merlot is voluptuously ripe and chock full of rich, luscious blackberry and blueberry flavors. It's dense and a bit jammy in texture, but brightened by crisp red-cherry acidity and the faintest shroud of gossamer tannins. Drink now.",45.0,86,1,0.3204724137089291
77619,Silver Buckle 2010 Ranchero Red (Central Coast),"This Syrah, Merlot and Malbec blend is full bodied and tannic. It has rich, ripe blackberry and chocolate flavors. An everyday wine for drinking with barbecue or tacos.",20.0,85,1,0.3204548799748862
55498,Courtney Benham 2011 Lucca Red (North Coast),"A nicely balanced red blend, this is high toned with smooth tannins and dark cherry and plum flavors amid a twist of black licorice. A fine wine for a crowd or easy mid-week drinking.",10.0,86,1,0.32043602112458286
79206,Viña Vilano 2012 Crianza  (Ribera del Duero),"Aromas of molasses, wood grain, blackberry and cassis are alluring. Bright, bold and energetic across the palate, this Crianza from a warm, dry year offers toasty oak, chocolate, spice, licorice and black-fruit flavors. As it moves towards the finish, toasty, blackened notes along with hints of mocha rise up. Drink from 2018–2028.",39.0,93,1,0.3204016628837312
62995,Phipps 2005 Sonoma County Ranches Zinfandel (Sonoma County),"With 10% Petite Sirah, which seems to give it a tannic essence of dark fruit intensity, this Zin is enormous in jammy blackberry and cherry fruit, with cola and caramel notes. It's full-bodied and dry and, once again, those tannins are center-stage.",36.0,87,1,0.32038996608764597
46057,Liberty School 2013 Cabernet Sauvignon (Paso Robles),"A solid wine for the price, this often sells for less than suggested retail in grocery stores. This bottling shows bacon fat, tart blackberry, black loam and baked goods on a just-enough-of-everything nose. The soft palate is smooth, with mouth-coating tannins and flavors of cigar leaf, black currant and black pepper.",16.0,88,1,0.3203777109342373
114691,Miro 2013 Mancini Vineyard Reserve Century Old Vines Zinfandel (Russian River Valley),"Mancini has 20% Carignane field-blended within, and shows burly, thick black fruit at its core. Integrated oak supports black cherry and pepper. A dustiness on the palate that finishes ripe.",34.0,89,1,0.3203424924207671
