,title,description,price,points,lda_label,3
36870,Emiliana 2010 Natura Sauvignon Blanc (Casablanca Valley),"Pithy and citrusy on the nose, but ultimately it's rather neutral. The palate is citric and lean, with orange, lemon and sour apple flavors. Zesty to the point of tartness, with a citrusy, juicy finish. A pointed SB with zing.",11.0,86,3,0.9461769969076067
5210,La Vieille Ferme 2014 White (Vin de France),"An easy-drinking and non-offensive white, this offers light yet direct notes of citrus peel, melon rind and apple, with a bitter edge to the palate and a short but refreshing finish.",9.0,83,3,0.9461649902091974
42222,Monterebro 2014 Sauvignon Blanc (Jumilla),"Aromas of yeast, talcum powder and grass set up a palate of pithy citrus and pyranzinic flavors that are green and grassy. The finish on this Sauvignon Blanc, a grape you don't see too often in hot Jumilla, is green-flavored and snappy.",11.0,84,3,0.94615101370446
55294,Long Neck 2015 Sauvignon Blanc (Western Cape),"Fresh grass, gooseberry, lime leaf and a touch of melon rind appear on the nose and mouth of this straightforward wine. It's lightweight and easygoing, with brisk acidity and a crisp, refreshing finish. Drink now.",10.0,85,3,0.9461490005461178
52249,Aresti 2014 Trisquel Sauvignon Blanc (Leyda Valley),"Pungent and green on the nose, this is showing cool-climate aromas. In the mouth, this is shear and tangy, with a high level of citric acidity. Flavors of lime, Granny Smith apple and asparagus finish briny, crisp and scouring.",15.0,85,3,0.9461312533537323
86347,Château Réal d'Or 2014 Rosé (Côtes de Provence),"The flavors of this wine follow the same light character as its pale, almost-white color. It does have some fresh juiciness, light acidity and a cut of lemon at the end. Crisp and clean, it's ready to drink.",21.0,85,3,0.9461276129597405
34396,Ciringa 2011 Fosilni Breg Reserve Sauvignon Blanc (Štajerska),"This Slovenian Sauvignon Blanc has aromas of lemon grass and freshly mowed lawn. It is sharp on entry with flavors of lime juice, orange zest and grapefruit before the bright acidic finish.",31.0,89,3,0.9461264059517781
51356,MAN Vintners 2011 Sauvignon Blanc (Western Cape),"This is forward and fresh, with notes of green apple, gooseberry and lemon-lime on the nose and palate. Zippy and mouthwatering, it has faint suggestions of lime zest and fresh-cut grass on the back.",11.0,85,3,0.9460887608723318
71012,Conceito Vinhos 2016 Contraste Branco White (Douro),"This is a fruity wine, crisp with citrus acidity and bright with light minerality and zest. It is a refreshing wine with an attractive sliced apple and melon aftertaste. Drink this lively wine now.",19.0,88,3,0.9460733530722223
71042,Steininger 2014 Riesling (Kamptal),"A very fresh nose of slight citrus leads to an equally light, slightly lemon-scented palate of ultralight dimensions. There is a hint of riper fruit on the midpalate, but this is simple, refreshing and clean.",24.0,89,3,0.9460533976621255
64642,Montes 2013 Classic Series Sauvignon Blanc (Casablanca Valley),"This is fresh, with good pungency and a mix of passion fruit and bell pepper aromas. A scouring mouthfeel pulls no punches, while grassy, slightly bitter flavors of arugula and lemon-lime finish citrusy and tangy.",13.0,87,3,0.9460521059941975
75618,Montes 2013 Classic Series Sauvignon Blanc (Casablanca Valley),"This is fresh, with good pungency and a mix of passion fruit and bell pepper aromas. A scouring mouthfeel pulls no punches, while grassy, slightly bitter flavors of arugula and lemon-lime finish citrusy and tangy.",13.0,87,3,0.9460521059941975
29620,Bodegas Copaboca 2014 Gorgorito Verdejo (Rueda),"Almond skin, green banana and pool water aromas precede a spritzy, citric, acidic palate. Flavors of white grapefruit, melon and apple finish zesty and briny, with a citric aftertaste similar to a gin & tonic.",10.0,85,3,0.9460483556704108
48257,Domaine du Touja 2015 White (Côtes de Gascogne),This white wine is fruity and crisp with a deliciously refreshing herbal edge. Lemon and pink grapefruit are cut by some zingy acidity and finished with a bright aftertaste. Drink now.,9.0,85,3,0.9460473269611629
8667,Viña Bisquertt 2014 Petirrojo Reserva Sauvignon Blanc (Colchagua Valley),"Stony lemon-lime aromas are low on fruit but clean and familiar. This is racy and fresh, with cutting acidity. Flavors of lime and passion fruit register as common, while the finish is zesty, with an emphasis on grapefruit.",8.0,85,3,0.9460458776582022
63672,Storks' Tower 2012 Sauvignon Blanc-Verdejo (Vino de la Tierra de Castilla y León),"Pungent citrus aromas settle on grapefruit. This feels regular and tastes like grapefruit and citrus pith. A standard feeling finish is fresh, citrusy in flavor and mildly bitter.",13.0,85,3,0.9460316030294771
79636,San Elias 2011 Sauvignon Blanc (Central Valley),"Largely neutral from front to back, with citrus and apple on the nose. Easygoing and basic in the mouth, with green melon and apple flavors in front of an inoffensive, slightly bitter and pithy finish.",9.0,84,3,0.946026502973183
63950,San Pedro 2012 Castillo de Molina Reserva Sauvignon Blanc (Elqui Valley),"Minerally opening aromas yield to a tight collection of green herb and citrus scents that steer clear of anything feline or grassy. This offers shear, zesty flavors of gooseberry, lime and tarragon in front of a stony feeeling finish that's crisp but not grating.",13.0,89,3,0.9460260822129872
108488,Heron 2010 Sauvignon Blanc (Napa Valley),"A nice Sauvignon Blanc, easy to drink with almost anything calling for a crisp, off-dry white wine. It's clean and citrusy, with a brisk cut of refreshing acidity.",13.0,87,3,0.946023393783426
95271,MAN Vintners 2010 Sauvignon Blanc (Western Cape),"Light and easy-drinking with fresh notes of lemon citrus, watercress and a touch of wild field grass. Clean acidity and herbal flavors carry through the palate to the crisp finish. Drink now.",11.0,86,3,0.9460229301117998
38282,Vista Hills 2011 Piedmont Estate Pinot Noir (Dundee Hills),"Rhubarb, strawberries and a strong streak of citrus and orange peel are the dominant flavors here. This reflects the cool vintage, finishing with tart, citrusy acids.",44.0,87,3,0.9460218346987328
104571,Casa do Valle 2013 Rosé (Vinho Verde),"Bright pink in color, this is a fresh rosé, just off dry, with lively citrus and wild strawberry fruits. Acidity cuts through the wine, making it crisp and ready to drink.",12.0,86,3,0.9460178535861997
14260,Viña Chocalan 2015 Gran Reserva Origen Sauvignon Blanc (San Antonio),"An amplified green nose smells like lime infused with bell pepper and asparagus. A citrusy snappy palate is brash, while pyrazinic green flavors are balanced by citric notes. This is a typical San Antonio SB: racy, green and citric.",16.0,88,3,0.9460167787684255
68733,Seppi Landmann 2014 Sylvaner (Alsace),"Soft, lifted pine and lime-peel notes make for a refreshing opening. The palate seems less focused and a bit confected, but slender and fresh nonetheless. Drink soon.",18.0,87,3,0.9460147264941923
55002,Adelsheim 2014 Pinot Noir (Willamette Valley),"Deceptively light and tight when first opened, this wine has flavors and character more in line with Gamay than most Pinots. Tart cranberry and raspberry fruit carries into a tangy finish, with citrus, mineral and herbal highlights.",32.0,90,3,0.9460127833416059
25464,Helfrich 2013 Riesling (Alsace),"The wine is crisp, lightly fruity with good acidity and a bright, tight texture. Apple and lime juice fruit flavors give a fresh, crisp aftertaste. Drink from 2015.",17.0,85,3,0.9460066663202115
91421,De Martino 2015 Legado Reserva Sauvignon Blanc (Casablanca Valley),"Pungent briny citrus aromas announce a lean, tangy palate. This edgy SB features zesty, sharp citrus and green-herb flavors, which are typical for Casablanca. A dilute finish displays watered-down snap.",20.0,87,3,0.9460037232269012
103371,Lagar de Indra 2016 Albariño (Rías Baixas),"Fresh white-fruit aromas are pure in their set up of a citric, racy palate. Salty orange leads to a briny finish with salty apple and citrus flavors.",17.0,87,3,0.9459986673395488
4572,Enanzo 2013 Garnacha Rosado (Navarra),"Snappy, dry red-fruit and citrus aromas are a good opening. The palate is fresh and bouncy, with punchy pomegranate and grapefruit flavors. A zesty finish with mild citrus and nectarine flavors is par for the course.",10.0,87,3,0.9459951337028227
55572,Esperanza 2015 Verdejo-Viura (Rueda),"Aromas of orange zest, apple cider and yeast come in front of a plump, slightly wayward palate with citric acidity. Generic citrus flavors finish lemony but with acidic scour.",9.0,86,3,0.9459949162058977
106274,Esperanza 2015 Verdejo-Viura (Rueda),"Aromas of orange zest, apple cider and yeast come in front of a plump, slightly wayward palate with citric acidity. Generic citrus flavors finish lemony but with acidic scour.",9.0,86,3,0.9459949162058977
42531,Strauss 2012 Strauss White White (Steiermark),"This fresh, fragrant wine is buoyed by citrus acidity and green apples. It's all fruit—light and bright—finishing with a tangy lemon-zest character. Screwcap.",12.0,85,3,0.9459923013148163
62622,Strauss 2012 Strauss White White (Steiermark),"This fresh, fragrant wine is buoyed by citrus acidity and green apples. It's all fruit—light and bright—finishing with a tangy lemon-zest character. Screwcap.",12.0,85,3,0.9459923013148163
104092,Volver 2014 Tarima Blanco White (Alicante),"Briny citrus, feline notes and pithy scents send this Merseguera-led blend toward a pulpy, citrusy palate. Grapefruit and pithy, lightly bitter flavors finish citric, with little change from the wine's primary flavors.",9.0,85,3,0.9459905241658297
8872,Companhia das Quintas 2015 Quinta do Cardo Branco Siria (Beira Interior),"The Síria grape—a relative of Malvasia and Roupeiro—is only found under this name in the mountainous eastern Beira region. This rendition is aromatic, with a tight, cool texture, tangy acidity and lime zest and apple flavors that give a crisp, fruity aftertaste.",15.0,88,3,0.9459836342631236
114966,Château Fonfroide 2014 Rosé (Bordeaux Rosé),"Tight, bright and very crisp, this is a lively and fruity wine. Citrus fruit flavors compete happily with the red berries to give a bone-dry wine, light and fresh at the end.",13.0,87,3,0.9459764365484661
91414,Aveleda 2012 Grinalda White (Vinho Verde),"Off dry, crisp, and with a strong citrus element that gives a lemon-candy character to the wine. It's a light, bright wine that's great for drinking this summer. Screwcap.",9.0,84,3,0.9459762389154501
80325,Conde de Altava 2015 Joven Viura (Rioja),"Briny pickled aromas are just clean enough to pass muster. This simple Viura is lemony and tangy on the palate, with saline-influenced flavors of citrus fruits and bell pepper. On a snappy finish, a briny flavor leads the way.",10.0,84,3,0.9459733971890907
56629,Domaine Charles Frey 2010 Plaisir Perlant Millesimé Extra Brut Sparkling (Crémant d'Alsace),"Strong, attractive apple aromas also give the flavor profile of this fresh and fruity wine. It has a light tangy, zesty texture, fresh acidity and a bright, mineral aftertaste.",30.0,87,3,0.9459731566040293
98168,Domaine Charles Frey 2010 Plaisir Perlant Millesimé Extra Brut Sparkling (Crémant d'Alsace),"Strong, attractive apple aromas also give the flavor profile of this fresh and fruity wine. It has a light tangy, zesty texture, fresh acidity and a bright, mineral aftertaste.",30.0,87,3,0.9459731566040293
72385,Viña Casablanca 2010 Cefiro Reserva Sauvignon Blanc (Casablanca Valley),"Citrus aromas are familiar. Lively and zesty in the mouth, with refreshing acidity. Orange and passion fruit lead the palate, which transitions to grapefruit. Crisp on the finish. Good for an everyday white wine.",12.0,86,3,0.9459693889314875
90290,Fritsch 2013 Schlossberg Grüner Veltliner (Wagram-Donauland),"A subtle nose of citrus suggests a restrained wine. Indeed, the palate is slender, citrus-fresh and light, but enlivened by the peppery varietal edge that invariably adds interest. Clean, crunchy finish.",30.0,89,3,0.9459668310563646
72521,Mont Marçal 2012 Brut Reserva Sparkling (Cava),"Pickled aromas of citrus and apple suggest sauerkraut. A bit flat and lazy on the palate, this tastes of briny citrus and green herbs. A grassy-tasting finish brings back pickled, briny notes.",15.0,86,3,0.9459659439917237
1972,Pratsch 2016 Ried Kittel Sauvignon Blanc (Niederösterreich),"Soft notes of green bell pepper, nettle and grass give this a fresh aspect. The slender palate then adds lemon, giving a focused zestiness, with glimpses of boxwood. The wine is citric, slender and very refreshing.",16.0,90,3,0.9459614337864404
30945,Pratsch 2016 Ried Kittel Sauvignon Blanc (Niederösterreich),"Soft notes of green bell pepper, nettle and grass give this a fresh aspect. The slender palate then adds lemon, giving a focused zestiness, with glimpses of boxwood. The wine is citric, slender and very refreshing.",16.0,90,3,0.9459614337864404
52039,Cameron Hughes 2010 Lot 326 Pinot Noir (Sonoma Coast),"Light in body and tart in acids, this bone-dry Pinot Noir shows modest flavors of cherry skins, red apple peelings and cola.",16.0,84,3,0.9459591960736798
17265,Robert Oatley 2010 Rosé of Sangiovese Rosé (Mudgee),"Coming in at just under 13% alcohol, this is a dry, Provence-styled rosé marked by crisp strawberry and citrus flavors. Ending on a refreshing, slightly chalky-mineral note, this would make a fun summer sipper.",16.0,87,3,0.9459503643626198
23208,Banfi 2011 Centine Rosato (Toscana),"This opens with a light pink color, exhibiting lively aromas of raspberry, cranberry and pink grapefruit. The wine is slender and easy on the finish, with a final zesty-citrus blast.",11.0,86,3,0.9459501222344618
106088,Ritual 2015 Sauvignon Blanc (Casablanca Valley),"Aromas of green apple and citrus are as classic as it gets for Chilean Sauv Blanc. This is straight forward but enjoyable, with modest minerality. Flavors of citrus and gooseberry carry over onto a refreshing finish.",18.0,87,3,0.9459476413460087
45400,Concha y Toro 2011 Terrunyo Costa Los Boldos Vineyard Block 5 Sauvignon Blanc (Casablanca Valley),"This is about as racy as Sauvignon Blanc from Chile gets. It's green and melon-like on the nose, with punchy asparagus and lime aromas. It is wide awake on the palate, where citrusy acids push lemon, lime, green herb and lemongrass flavors. It cuts like a razor; drink with shellfish.",25.0,90,3,0.9459469238295396
25598,Indomita 2016 Gran Reserva Sauvignon Blanc (Casablanca Valley),"Aromas of citrus fruits, green herbs, grass and celery set up a shear lean palate with little body and pointed acidity. Tart lemon-lime flavors are crisp and scouring on the finish.",13.0,85,3,0.9459468464370975
9302,Golser Wein 2015 Una Grüner Veltliner (Burgenland),"A rather neutral nose leads to a simple, dry, fresh palate. There is a little citrus and green pear flavor. This is easy-drinking, fresh summer wine.",14.0,87,3,0.9459467487109892
53021,Golser Wein 2015 Una Grüner Veltliner (Burgenland),"A rather neutral nose leads to a simple, dry, fresh palate. There is a little citrus and green pear flavor. This is easy-drinking, fresh summer wine.",14.0,87,3,0.9459467487109892
105230,Château des Demoiselles 2012 Rosé (Côtes de Provence),"As fresh as it comes, this is crisp and clean rosé, ready for summer aperitifs. Bright red berries cut through a warmer texture and bring acidity with them. There's an attractive lively finish.",28.0,90,3,0.9459209617970451
85179,Höpler 2016 Grüner Veltliner (Burgenland),"Fresh green pear, lemon and lime notes pervade the nose and palate of this light-footed, zesty wine. It's slender in body and easy-drinking, with a fruity, dry and refreshing finish.",15.0,89,3,0.9459147646348787
2648,Quintas de Melgaço 2013 QM Blue White (Vinho Verde),"Light and bright, this has a crisp prickle on the tongue, along with canned grapefruit and tight apple-skin flavors. It is almost dry, which gives the wine a mineral texture that adds a bite. Drink now.",9.0,86,3,0.9459137294636153
23074,Terrapura 2013 Sauvignon Blanc (Curicó Valley),"Grassy aromas of green melon and white pepper feed into a plump yet citrusy palate. Slightly pyrazinic and mildly bitter, underripe green melon and grapefruit are the lead flavors.",11.0,84,3,0.9459098419801176
80084,Tolloy 2011 Sauvignon Blanc (Vigneti delle Dolomiti),Here's a fresh and easy Sauvignon Blanc that would pair with easy appetizers or a salad lunch. Crisp but simple aromas of citrus and green apple give the wine that food-friendly appeal.,13.0,86,3,0.9459020397253337
12943,Château de Parenchère 2014  Bordeaux Blanc,"Very fruity, this is a crisp, lemon-scented and flavored wine, with grassy, herbaceous character from the green Sauvignon Blanc in the blend. The aftertaste is tight with some bitterness.",15.0,84,3,0.9458996770215116
23138,Acrobat 2011 Pinot Gris (Oregon),"This runs to the tart, lemony style of Pinot Gris, common in cool vintages. Citrus and gooseberry flavors are balanced against refreshing minerality, and the acidity is neither harsh nor simply sour.",12.0,87,3,0.9458906935822122
95556,Acrobat 2011 Pinot Gris (Oregon),"This runs to the tart, lemony style of Pinot Gris, common in cool vintages. Citrus and gooseberry flavors are balanced against refreshing minerality, and the acidity is neither harsh nor simply sour.",12.0,87,3,0.9458906935822122
83309,San Pedro 2016 Castillo de Molina Reserva Sauvignon Blanc (Elqui Valley),"Pungent, pure aromas of citrus and tarragon are appealing. This feels upright and tangy, with bright, driving acidity. Grapefruit, lime and jalapeño flavors finish juicy, with leftover citrus notes and a dash of white pepper.",11.0,89,3,0.9458887410013844
54362,Finca Wölffer 2015 Rosé (Mendoza),"Pungent, sweaty aromas of nettle and cactus are sharp and muddled. This feels citric and alert, with an oily sense to the palate feel. Flavors of pink grapefruit turn pithy and bitter in front of a chalky finish.",17.0,84,3,0.9458886882305765
85065,Domaine de Ménard 2015 Colombard-Ugni Blanc (Côtes de Gascogne),"The herbal aromas leap from the glass in this crisp, green-fruit and citrus-flavored wine. It is tangy, herbal and grassy in character with a zesty texture and a tight mineral aftertaste. Drink now.",9.0,85,3,0.9458856075992608
19559,Pratsch 2014 Rosé (Niederösterreich),"Fresh strawberry and zesty lemon, redoubled on the taut, light palate, give this the ultimate refreshment factor. Oodles of fruit makes this go down far too easily. It's a true summer wine. Drink soon.",13.0,89,3,0.9458820232490905
22812,Sierra Cantabria 2016 Rosé (Rioja),"A yeasty nose smells all right but somewhat artificial and not that fruity. A low-acid palate has flavors of melon and grape skins, but the total package seems a touch nutty and prematurely stale. A flat finish is consistent with what came before.",12.0,85,3,0.945875019795927
31738,Loriñon 2014 White (Rioja),"Initial briny citrus aromas give way to white grapefruit scents. Like the nose, this feels bracing and citric. Tangy flavors of lime and tangerine finish short but with tingling acidity.",14.0,87,3,0.9458731037379848
84790,Château du Cèdre 2015 Blandine le Blanc Ugni Blanc-Colombard (Côtes de Gascogne),"This is a bright, lively blend of Ugni Blanc and Colombard. It has tangy acidity and a refreshing lemon-peel texture. With its herbal green-fruit character and refreshing aftertaste it is ready to drink now.",11.0,87,3,0.9458729072019144
55232,Neil Ellis 2015 Sincerely Sauvignon Blanc (Western Cape),"A very pale, watery straw color, this is soft and low in intensity, with faint aromas and flavors of citrus pith and fresh grass. The palate is thin and light, followed by a short, brisk finish. Drink now.",15.0,85,3,0.9458726209363933
60766,Blanco Nieva 2014 Pie Franco Verdejo (Rueda),"Minerality and raw citrus aromas create a true Verdejo bouquet. This is properly acidic and fresh, but a touch round and pulpy as well. Briny, borderline bitter flavors of grapefruit, lime, tarragon and scallion finish pithy. Drink now.",30.0,89,3,0.9458689617625083
62233,Peltier 2013 Hybrid Pinot Grigio (Lodi),"An extremely pale color and light fruit salad aromas are followed by fresh, gentle texture and banana and cherry flavors. Light in alcohol, delicate in mouthfeel and short on the finish, it's a mere wisp of a wine.",10.0,84,3,0.9458676839644434
78803,Argami 2015 Old Vines Verdejo (Rueda),"Melon and apple aromas are at first stony, then more mealy. This feels sturdy enough, with dry yeasty white-fruit flavors. On the finish, this turns increasingly bready, yeasty and less fresh.",18.0,85,3,0.9458613166934412
8642,Producteurs Plaimont 2013 Colombelle L'Originel White (Côtes de Gascogne),"A blend of Colombard and Ugni Blanc, this crisp, light wine is as fresh as a daisy. Fruity and aromatic, it offers citrus and melon flavors. The fruit explodes in the mouth, leaving a light, bright aftertaste.",8.0,85,3,0.9458540255953679
29659,Delaire Graff 2015 Sauvignon Blanc (Western Cape),"This light-footed Sauvy is opens with attractive aromas of green melon, fresh-cut grass and lime leaf. The palate is bright and refreshing, with zippy acidity and a mouthwatering finish. Drink now.",18.0,87,3,0.9458533896517118
87500,Nivarius 2015 Nivei White (Rioja),"Clean, snappy aromas of apple and citrus are sharp but appealing. This fresh, healthy white offers tangerine, nectarine and stony flavors before a crisp, refreshing finish.",12.0,87,3,0.9458515913999836
104464,Nivarius 2015 Nivei White (Rioja),"Clean, snappy aromas of apple and citrus are sharp but appealing. This fresh, healthy white offers tangerine, nectarine and stony flavors before a crisp, refreshing finish.",12.0,87,3,0.9458515913999836
15472,Spindrift Cellars 2013 Pinot Gris (Willamette Valley),"A pleasing mix of grapefruit, green apple and melon fruit flavors highlights this fresh and appealing wine. Crisp acidity buoys up the fruit and ensures a clean exit.",16.0,89,3,0.9458503143182406
49621,Markus Huber 2015 Hugo Grüner Veltliner (Niederösterreich),"An almost neutral nose nonetheless gives slight hints of crisp citrus. An ultralight body provides easy, clean-cut drinking with a superdry, citrussy finish. Drink soon.",13.0,88,3,0.9458461729025436
69442,Markus Huber 2015 Hugo Grüner Veltliner (Niederösterreich),"An almost neutral nose nonetheless gives slight hints of crisp citrus. An ultralight body provides easy, clean-cut drinking with a superdry, citrussy finish. Drink soon.",13.0,88,3,0.9458461729025436
50926,Anew 2016 Rosé (Columbia Valley (WA)),"Pale pink in color, the aromas offer notes of strawberry, bubblegum and apple. Lightly spritzy, it brings forward somewhat-weighty-feeling fruit flavors. Despite the spritz, it seems a bit ponderous.",11.0,86,3,0.9458454816395047
88252,Anew 2016 Rosé (Columbia Valley (WA)),"Pale pink in color, the aromas offer notes of strawberry, bubblegum and apple. Lightly spritzy, it brings forward somewhat-weighty-feeling fruit flavors. Despite the spritz, it seems a bit ponderous.",11.0,86,3,0.9458454816395047
3511,Bodegas Docampo 2008 Viña do Campo White (Ribeiro),"Tight and largely neutral white fruit aromas show a little apple but little more. The palate is friendly and easy, with melon as the lead flavor. Turns more citrusy and weighty on the finish, which fades fast.",18.0,86,3,0.9458347926842172
26318,The Gnome Knows 2012 Sauvignon Blanc (Côtes de Gascogne),"Get passed the name and label and this is a typical fresh and fruity wine from Gascogne. It is light, herbaceous and immediately drinkable with its lemon and green fruits. Screwcap.",10.0,85,3,0.9458273774474059
50196,Joyce 2011 Tondre Grapefield Pinot Noir (Santa Lucia Highlands),"This is a red wine for white wine drinkers. It's silky and vibrantly crisp in acidity, like a Sauvignon Blanc, except the flavors are pure Pinot, suggesting sour cherry candy, persimmons and tart cranberries. Drink now–2017.",35.0,88,3,0.9458246202347932
47885,DeMorgenzon 2013 DMZ Rosé Cabernet (Western Cape),"This is an easy and clean selection, with fruity notes of cherry, strawberry and a touch of carnation. Light weight and brisk in acidity, this ends bright and mouthwatering. Drink now.",12.0,87,3,0.9458168791540559
1644,Castillo de Liria 2014 Winemaker's Selection White (Valencia),"This blend of Merseguera and Sauvignon Blanc is modest as a church mouse, with clean but dilute green-apple aromas. An easygoing, round palate offers orange and lime flavors in front of a pithy, citrusy finish.",9.0,85,3,0.9458020696235173
35666,Maysara 2007 Asha Pinot Noir (McMinnville),"Though the first sniffs seem to promise a light, floral, elegant Pinot Noir, it turns vegetal in the glass, with tomato and herbal flavors.",39.0,84,3,0.945800609847601
18330,Kon Tiki 2015 Sauvignon Blanc (Central Valley),"A neutral nose announces a fresh but basic palate with briny flavors of citrus, white pepper and bell pepper. A chalky, dry finish is juicy but lacks depth.",13.0,85,3,0.9457932545695831
46859,Domaine Laporte 2014 Les Duchesses  (Pouilly-Fumé),"This is an attractive, perfumed wine that has fresh acidity and a crisply herbal flavor. It's bright with tangy citrus and refreshing, delicate apple and grapefruit flavors. The aftertaste is all fruit.",28.0,88,3,0.9457869421702625
77550,Marqués de Riscal 2010 White (Rueda),"Oily and melony smelling and after that it's pretty much your average, innocuous white wine. Feels like orange juice on the palate and tastes like orange and tangerine. Cleansing, fresh enough and easy to drink.",10.0,84,3,0.9457818652483027
