,title,description,price,points,lda_label,3
89168,Errazuriz 2008 Single Vineyard Sauvignon Blanc (Aconcagua Valley),"Pungent and teetering on the edge of herbaceousness. But then it draws back, settling on passion fruit, tropical breezes and lime. The wine has pulsing acidity and it dances on the palate. It's also sort of bracing and sharp, which some may find too razor-like for their palate. Very nice for coastal Aconcagua, an outland where few besides Errazuriz have gone.",17.0,89,3,0.9417816761559693
82594,Castro Martin 2015 A2O Sobre Lias Albariño (Rías Baixas),"Melon and a green note of pole beans and lettuce set up a high-acid citric palate. Grassy notes of clover and lettuce infiltrate core citrus flavors, while this shows lemony punch and an herbal note on a juicy tangy finish.",18.0,87,3,0.9417801162693017
15175,Remy-Pannier 2012  Rosé d'Anjou,"Very light, crisp, fresh, it has some sweetness that is balanced by the acidity and raspberry fruit. For those who like a really pink color in their rosés, this is perfect. Screwcap.",12.0,84,3,0.9417769370469624
8244,Poliziano 2008  Rosso di Montepulciano,"Easy-drinking, fresh and informal, this bright Rosso di Montepulciano would pair perfectly with wild mushroom risotto or potato gnocchi. There's tight acidity, backed by cherry and raspberry.",15.0,86,3,0.941776594834276
113192,Casa Santos Lima 2015 Lab Branco White (Lisboa),"Lab (or Labrador Retriever) is the preferred dog of the Santos Lima family. The wine is fresh, citrus flavored and crisply attractive. Acidity, lemon zest and green apples keep the wine really fresh. Drink now.",10.0,84,3,0.9417763237200949
84780,Viña Casablanca 2016 Nimbus Single Vineyard Chardonnay (Casablanca Valley),"Grassy aromas include notes of corn and apple. This feels fresh and citric, with moderate roundness. Salty citrus and kiwi flavors are lasting on a crisp juicy finish.",20.0,87,3,0.9417758383842099
52958,DFJ Vinhos 2008 Portada Rosé Red (Estremadura),"A fresh, slightly sweet rosé, that keeps crispness through its bright, breezy strawberry flavors. The wine is soft, crisp, clean, a summer rosé.",8.0,84,3,0.9417757116495388
52146,Quintas de Melgaço 2012 Terra Antiga White (Vinho Verde),"Bright, lively and fruity, this is a delicious, crisp, dry Vinho Verde from the north of the region, close to Spain. It has citrus notes, a bright texture, lively acidity and a touch of spritz.",9.0,86,3,0.9417726145323652
12365,Louis Max 2014  Chablis,"Fresh, light and fruity this is attractive young Chablis. It is soft, dwelling on the fruit rather than any texture. Crisp and with citrus and green apple flavors, it will be ready to drink easily by mid-2016.",29.0,86,3,0.9417724087644624
47995,Pacific Rim 2014 Spring Creek Ranch Grüner Veltliner (Yakima Valley),"Aromas of white pepper, herbs and grass lead to bone-dry flavors and tart acidity. It doesn't quite stand on its own but should perk up nicely at the dinner table.",16.0,89,3,0.9417681448596409
90850,Buehler 2013 Chardonnay (Russian River Valley),"The producer takes a hands-off approach to its wines. In this case the tactic may not have paid off, the wine muted, dull and slightly sour. The acidity veers in the wrong direction vis-a-vis the fruit, which suggests tart green apple and lemon.",16.0,83,3,0.9417669397248783
10009,Cantina Terlano 2006 Müller-Thurgau (Alto Adige),"This pale-colored get by with standard aromas of stone fruit, kiwi and passion fruit. Easy-to-drink and decidedly uncomplicated, it offers simple, fruit-driven flavors.",18.0,84,3,0.9417665334243992
17236,Les Rocailles 2015 Apremont Jacquère (Vin de Savoie),"Lively and crisp, this delicious, snow-fresh wine has apple and melon flavors over aromatic acidity. With its bright texture and lightly herbal edge it is a refreshing wine to drink now.",16.0,87,3,0.9417632894235871
110522,Domaine Daniel Reverdy et Fils 2014  Sancerre,"Light, bright and fresh, this wine is ready to drink. Crisp apple and lemon flavors are lifted by tangy acidity. Juicy and very fruity it has a perfumed aftertaste.",24.0,86,3,0.9417599378209255
48179,Barton & Guestier 2015 Passeport Lobster & Shrimp  (Muscadet),"A light and crisp wine that has a creamed apple texture. It is fruity, light with a fine citrus tang to add to the general freshness of the wine. The name suggests a very appropriate pairing.",10.0,86,3,0.9417570093674045
94602,Legaris 2012 Verdejo (Rueda),"While not a mind-blower, this fresh Verdejo is all that it should be. The nose offers a just-right blend of minerally crispness along with apple, melon and citrus aromas. The palate is properly tangy, while flavors of orange and melon finish solid and zesty.",13.0,88,3,0.9417551066837909
997,Mercer 2013 Sauvignon Blanc (Yakima Valley),"With alcohol in the low-moderate range, this immaculately fresh wine is flush with juicy gooseberry and grapefruit. It carries the varietal hallmarks of fresh herbs, notably chive, and a balancing lick of minerality.",13.0,90,3,0.9417545561766482
72664,Fleur de California 2014 Pinot Noir Rosé (North Coast),"This copper-colored wine has good, light cherry and apple aromas, and fresh, tangy but lean fruit flavors. It is nicely dry, well balanced and a bit crisp in texture.",16.0,87,3,0.9417536408356757
7779,Laurenz V. 2015 Singing Laurenz V. und Sophie Grüner Veltliner (Niederösterreich),"Fresh, pliable, slightly pear and apple scented and dry—what's not to like? This does not make any demands on you and is a marvel of versatility, also implying lots of fun and freshness. Easy-drinking, dry Grüner with a wonderfully appley finish.",16.0,88,3,0.941753640363713
105099,Geyser Peak 2016 Pinot Grigio (California),"Lively lemon and herb aromas and bright, vivid grapefruit flavors make this an eye-opening dry wine. It has plenty of good fruit acidity to whet the appetite for appetizers and seafood.",12.0,87,3,0.9417524439294627
116044,Geyser Peak 2016 Pinot Grigio (California),"Lively lemon and herb aromas and bright, vivid grapefruit flavors make this an eye-opening dry wine. It has plenty of good fruit acidity to whet the appetite for appetizers and seafood.",12.0,87,3,0.9417524439294627
31755,Gear and Sprocket 2013 Pinot Noir (Willamette Valley),"This is well made, in a light, pale, tart style. The ample acidity boosts sour cherry fruit, keeping the wine sporty and fresh. It would make a fine match to salmon or turkey.",20.0,87,3,0.9417523705767123
63286,Gear and Sprocket 2013 Pinot Noir (Willamette Valley),"This is well made, in a light, pale, tart style. The ample acidity boosts sour cherry fruit, keeping the wine sporty and fresh. It would make a fine match to salmon or turkey.",20.0,87,3,0.9417523705767123
109138,Concha y Toro 2014 Casillero del Diablo Reserva Sauvignon Blanc (Central Valley),Citrus and tropical-fruit aromas show snap in front of a racy palate. White pepper and grassy notes work the finish on this easygoing Sauvignon Blanc.,11.0,86,3,0.9417485522036243
25184,Hawley 2006 Oehlman Vineyard Pinot Noir (Russian River Valley),"This is a light Pinot, both in color and body, with modest flavors of cola, cherryskin and orange tea. It's very dry and nicely silky in the mouth. Seems at its best now.",33.0,85,3,0.9417409076735571
115869,Eikendal 2010 Sauvignon Blanc (Western Cape),"Green grass and a hint of baby powder are paired with notes of green gooseberry and lime on the nose, while riper but similarly tart flavors of white cranberry and citrus take hold of the mouthwatering palate. Drink now.",13.0,86,3,0.9417398667188275
102950,Alto Los Romeros 2012 Reserva Sauvignon Blanc (Maule Valley),"The nose on this SB is pure grass, bell pepper and hay. The palate is citric on one hand but still flat and wayward in feel, with globular green-fruit flavors and a bitter tasting finish.",12.0,81,3,0.94172600181207
27788,Companhia das Quintas 2000 Pegos Claros Castelão (Palmela),"Palmela is the region just south of Lisbon, producing light, fresh wines that are both great values and great everyday drinking. The strawberry fruit flavors are immediately appealing, freshened by the acidity.",10.0,86,3,0.941725645040842
109100,Mas Foraster 2013 Josep Foraster Macabeu Macabeo (Conca de Barberà),"Almondy in color, with bready, drawn aromas of mustard and pithy citrus, this feels flat and chunky. Flavors of almond skins and pithy white fruits finish with a note of orange peel.",21.0,83,3,0.9417225803326809
65572,Gustav Adolf Schmitt 2012 Fisherman Riesling (Rheinhessen),"Brisk and elegant, this wine has an alpine feel that accentuates its lean, cutting profile. The palate is a tad austere, highlighting minerality and acidity over fruit, but a touch of white grapefruit peeks through nicely on the finish.",11.0,87,3,0.9417194802865553
28007,Robert Karcher et Fils 2014 Cuvée du Commandeur Pinot Noir (Alsace),A strangely bitter note mingles with unusually high-toned leafy red-fruit notes. The palate is slightly bitter but dry and fresh. The body is very light. Drink soon.,24.0,86,3,0.9417062272245269
24848,Santa Rita 2015 120 Sauvignon Blanc (Colchagua Valley),"Grassy, slightly green aromas are fresh and suggest cactus pad. This is easy on the palate, with flavors of citrus fruits and green herbs, such as tarragon and rosemary. A crisp finish is just solid enough to maintain integrity.",8.0,86,3,0.9416975156982462
92485,Santa Rita 2015 120 Sauvignon Blanc (Colchagua Valley),"Grassy, slightly green aromas are fresh and suggest cactus pad. This is easy on the palate, with flavors of citrus fruits and green herbs, such as tarragon and rosemary. A crisp finish is just solid enough to maintain integrity.",8.0,86,3,0.9416975156982462
77621,Zardetto 2012 Millesimato Dry Zeta  (Conegliano Valdobbiadene Prosecco Superiore),"Zeta Dry, with a Zorro-style “Z” etched across the label, offers an easy-drinking sparkling wine experience with light shades of citrus, mineral and stone fruit.",23.0,85,3,0.9416950501325293
13010,Domaine Saumaize-Michelin 2013  Mâcon-Villages,"Light and bright, this fruity wine has a more bitter element that gives a sharper character that will hopefully round out. At the back, plenty of acidity leaves a crisp aftertaste.",25.0,84,3,0.9416947986834421
38918,Domaine Saumaize-Michelin 2013  Mâcon-Villages,"Light and bright, this fruity wine has a more bitter element that gives a sharper character that will hopefully round out. At the back, plenty of acidity leaves a crisp aftertaste.",25.0,84,3,0.9416947986834421
90907,Kingston Family 2016 CJ's Barrel Sauvignon Blanc (Casablanca Valley),"Aromas of field greens and wax bean are restrained on the nose. This has a round palate with citric acidity. Flavors of briny green fruits finish slightly closed and bitter. This wine reflects the 2016 vintage which was a cloudy, wet one in Casablanca.",26.0,88,3,0.9416909841633934
79071,Cave de Beblenheim 2008 Baron de Hoen Riesling (Alsace),"Lightly floral, showing a hint of minerality and pink grapefruit fruit. There is a fine apple skin edge to this bright wine. Screwcap.",12.0,88,3,0.9416853232054768
101121,Bodegas Valdemar 2011 Rosado Garnacha (Rioja),The candied red-fruit aroma is soft yet snappy. It tastes briny and citrusy before ending with a persistent peppery bitterness and lively acidity.,9.0,83,3,0.9416847678738983
110724,Zanoni 2010  Valpolicella,"White cherry, raspberry, almond skin and cola describe the simple bouquet of this easy-going red. On the palate, it's crisp and lean.",14.0,84,3,0.9416842111269028
6329,Château Laulerie 2014 White (Bergerac Sec),"This fresh, vibrant wine is light and fruity. A classic blend of Sauvignon Blanc and Sémillon, it has an herbal character along with bright green and citrus fruits. The wine is ready to drink.",12.0,84,3,0.9416781334174325
37682,La Val 2016 Más Que 2 White (Rías Baixas),"Pinched austere aromas of cat pee and oily sweat are extreme and unusual for a Rías Baixas wine. A citric and raw palate tastes like this smells. Fresh acidity is about all this underripe, sour and bitter blend of Albariño, Treixadura and Loureira has going for it.",19.0,80,3,0.9416711900245608
431,Winzer Krems 2011 Kellermeister Privat Goldberg Grüner Veltliner (Kremstal),"This is a soft, creamed-apple style of wine, with a great shaft of acidity cutting through the crisp fruit. Kiwi and gooseberry fruits are lifted on the bright, lively finish.",18.0,87,3,0.9416671617743015
66799,Château de Brigue 2016 Fleur Rosé (Côtes de Provence),"This wine is on the pale side for this vintage. There is a yeasty character that comes across as bitterness. By contrast, the acidity and the crisp fruits are fine, light and delicate. Drink now.",20.0,84,3,0.9416539336930083
41699,Wine with Spirit 2013 Dine with me Tonight White (Tejo),"Fruity and soft, this appealing wine is ready to drink. Lemon juice and lime zest give freshness along with bright acidity and a light sense of mineral texture.",18.0,85,3,0.9416469090983229
98255,Ulacia 2013 White (Getariako Txakolina),"Stalky, flat scents vie for attention with brighter citrus aromas on a bland nose. This Txakoli feels round but not too lively. Flavors of lettuce, green bean, green apple and tangerine finish with a hint of lime.",20.0,85,3,0.9416409908262644
6786,Yali 2009 Wetland Winemaker's Selection Sauvignon Blanc (Rapel Valley),"Opens with honest green notes of gooseberry, lime and sea foam, and while the palate is a touch soft in texture, it has true Chilean SB flavors of bell pepper, fresh lettuce and melon. Sturdy on the finish, with a forward attitude.",8.0,85,3,0.9416368163144805
58493,Convergence Zone 2009 Sunbreak Chenin Blanc (Columbia Valley (WA)),"This seems to be a little on the watery side; it does not have the floral highlights that Chenin can sometimes show, nor the fruit concentration that would elevate the score. It's clean and quaffable, with very light citrus and apple fruit flavors.",17.0,85,3,0.9416314577317703
90708,Château de Brigue 2016 Les Meyans Elégance Rosé (Côtes de Provence),The Cinsault that dominates this blend creates a light and gently fruity wine. It has attractive acidity and just the lightest of red-fruit flavors. The aftertaste is soft and tangy with orange zest.,12.0,86,3,0.9416236359063365
95828,Quinta da Lixa 2016 Escolha White (Vinho Verde),"This is a classic crisp apple-driven and fruity wine. With delicious acidity and a lively aftertaste, the wine is tangy and zesty and a great summer drink.",10.0,87,3,0.9416211832881859
9589,Volver 2016 Tarima Blanco White (Alicante),"Pungent aromas of cactus and sweaty citrus suggest Sauvignon Blanc or Verdejo, but this is mostly Merseguera with Macabeo and Moscatel thrown in. A pulpy palate is marginally focused, while this tastes of tropical fruits, namely grapefruit and passion fruit.",9.0,84,3,0.9416192364967392
2190,Arboleda 2011 Sauvignon Blanc (Aconcagua Valley),"This is a prickly wine, with a strong blast of nettle and green herb aromas. It has weight and texture on the palate, while the flavors of citrus fruits and salad greens are pithy and mildly bitter. Green and white pepper notes dominate the finish.",18.0,85,3,0.9416165164709618
106648,Casa Silva 2009 Reserva Sauvignon Blanc (Colchagua Valley),"With mineral and apple on the nose, this qualifies as a pure and pleasing SB for almost any occasion. The palate is elegant and lithe, while the flavors of green apple, gooseberry and grapefruit are what they should be. Pure, sound and solid wine to drink right now.",12.0,88,3,0.9416116418338576
68698,Prada A Tope 2015 Palacio de Canedo Godello (Bierzo),"Dusty apple aromas show a good level of pop and freshness. This Godello feels round yet fresh. Yeasty, bready white-fruit flavors are more basic than specific.",13.0,88,3,0.9416116032901302
68454,Quinta da Alorna 2010 Rosé Touriga Nacional (Tejo),Touches of caramel and bright red cherry fruit give this pink-colored wine a great lift. It's as fresh as possible for summer drinking.,12.0,84,3,0.9416085531686073
97286,Txomín Etxaníz 2014 Rosé (Getariako Txakolina),"Even the very best Txakoli won't appeal to everyone, and this rosé is far from the best. Fruitless aromas of arugula and vinaigrette set up a sour palate with arrow-sharp acidity. Piercing, tart citrus flavors end with scour and sizzle.",25.0,83,3,0.941607798168281
16581,Schlumberger Wein- und Sektkellerei 2012 Brut Sparkling (Österreichischer Sekt),"Elderflower scented freshness dominates this light-footed, soft sparkler. Balance, a dry finish and an easy-drinking style make this a light-hearted party-wine of welcome freshness.",24.0,87,3,0.9415906238019998
5077,Steininger 2015 Kittmannsberg Reserve Grüner Veltliner (Kamptal),"The nose does not want to give a lot away. The palate, however, shows spicy hints of nettle and a fresh bouncy zesty backbone of lemon and grapefruit, which makes it all the more appetizing.",35.0,90,3,0.9415897008333237
13681,Steininger 2015 Kittmannsberg Reserve Grüner Veltliner (Kamptal),"The nose does not want to give a lot away. The palate, however, shows spicy hints of nettle and a fresh bouncy zesty backbone of lemon and grapefruit, which makes it all the more appetizing.",35.0,90,3,0.9415897008333237
99677,François Lurton 2016 Piedra Negra Alta Colección Pinot Gris Rosado (Valle de Uco),"Aromas of citrus and talcum powder are a bit muddled. This rosé of Pinot Gris feels lean, jumpy and juicy, while tangy flavors of citrus and stone fruits finish with a mild spritzy tingle. Other than that, there's not much to this.",12.0,86,3,0.9415849175982692
84748,Bonavita 2011 Rosato (Sicilia),"This Rosato is part of the natural wine movement, and it's apparent. Aromas of apple juice and citrus open the bouquet, with some evidence of volatility or instability. Fresh acidity is present, with notes of lemon and red raspberry.",25.0,81,3,0.9415837473287019
41307,Waterbrook 2008 Mélange Blanc White (Columbia Valley (WA)),"Off-dry with a candied orange character, this is indeed a mélange, including portions of seven different white wine grapes. It's an interesting wine, though might prove a bit challenging to match to food. Perhaps a curry?",15.0,86,3,0.9415788182387492
80042,Waterbrook 2008 Mélange Blanc White (Columbia Valley (WA)),"Off-dry with a candied orange character, this is indeed a mélange, including portions of seven different white wine grapes. It's an interesting wine, though might prove a bit challenging to match to food. Perhaps a curry?",15.0,86,3,0.9415788182387492
91399,Grafen Neipperg 2008 Trocken Spätburgunder (Württemberg),"A pretty, vibrant Pinot Noir from southern Germany, featuring strawberry and raspberry fruit, some slightly herbal nuances and a bright, lively finish. Drink now–2013.",28.0,86,3,0.9415772068703735
69708,Dancing Flame 2015 Ojos del Salado Sauvignon Blanc (Central Valley),"Grassy citrus aromas blend with sulfur and yeasty, dusty notes. A moderate acidic cut meets flavors of melon, quince and citrus fruits to finish quick and mild. Drink now before this turns for the worse.",10.0,85,3,0.9415768573319346
111189,Silver Lake 2008 Girly Girl Pinot Gris (Columbia Valley (WA)),"A pear-flavored Pinot Gris from Yakima valley fruit. The fruit is limned with well-defined skin flavors, and the wine has a light tawny color. It starts off well, then stops short with a plastic, Band-Aid finish.",15.0,83,3,0.9415748098434654
25261,Silvan Ridge 2006 Pinot Gris (Oregon),"This is a crisp, serviceable Pinot Gris, with sharp green-apple and cut pear fruit dominating. It's got plenty of acid underscoring the fruit, and should work well as an all-purpose wine.",15.0,87,3,0.9415736082600256
59919,Caves da Cerca 2008 Famega White White (Vinho Verde),"Delicious citrus and grape juice aromas, with a vivid, lively dry style that explodes with white fruit and lime flavors. The wine is a great apéritif, or with shellfish.",8.0,85,3,0.9415730192045796
66531,Villa Rubini 2006 Pinot Grigio (Colli Orientali del Friuli),"Villa Rubini delivers a fresh, easy Pinot Grigio that will wash down informal summer meals and picnic foods. Aromas include stone fruit, grapefruit and talc and the wine's consistency is lean and thin.",15.0,84,3,0.9415685814348109
53149,The Dot 2016 Austrian Plum St. Laurent (Niederösterreich),"Wonderfully tart, fresh red cherry fruit expands on this wine's nose and palate. It's wonderfully poised and pitched just right between generosity and restraint. Its crunchy cherry fruit feels honest and elegant. The finish is lip-smackingly fresh.",14.0,91,3,0.9415632036830109
105446,The Dot 2016 Austrian Plum St. Laurent (Niederösterreich),"Wonderfully tart, fresh red cherry fruit expands on this wine's nose and palate. It's wonderfully poised and pitched just right between generosity and restraint. Its crunchy cherry fruit feels honest and elegant. The finish is lip-smackingly fresh.",14.0,91,3,0.9415632036830109
9437,Viña Costeira 2010 White (Ribeiro),"This is a perennial winner among well-priced Spanish whites. The nose is clean, light and suggests apple blossom and buttercup. The palate has a good, tight, regular feel and honest flavors of green fruits and melon. Pleasant at every checkpoint.",15.0,88,3,0.9415529843625657
74777,Cape Mentelle 2007 Sauvignon Blanc-Semillon (Margaret River),Classic Semillon aromas of hay and quince create an intriguing but subtle opening act while the simpler palate displays some attractive cut-grass notes from the Sauvignon Blanc. A good partner for flavorful shellfish preparations.,16.0,86,3,0.9415503715279779
6596,Zarate 2012 Albariño (Rías Baixas),"This shows stalky, corny notes on the nose along with mineral and white-fruit scents. There's a lemony quality to an otherwise neutral palate, while saline, lemon and mild but increasing bitterness control the flavor profile and finish.",25.0,88,3,0.9415486983273662
79580,The Furst... 2004 Grand Cru Schlossberg Riesling (Alsace),The disappointingly quiet nose gives way to a palate laced with bready notes. Citrus peel adds interest to the palate while crisp acidity gives the one-dimensional finish a lift. A bit of a letdown for the great Schlossberg vineyard.,23.0,84,3,0.941546127290739
42927,Undurraga 2015 Sibaris Gran Reserva Sauvignon Blanc (Leyda Valley),"Briny aromas of oyster shell blend with green onion, lime and matchstick scents on this sulfuric-smelling SB. Tangy and round, with an oily note to the mouthfeel, this tastes of salty lime, tangerine, saline solution and pickle brine.",18.0,87,3,0.9415446924984968
62699,Echo Bay 2013 Sauvignon Blanc (Marlborough),"This is a broadly expansive wine in the mouth, but what it may lack in focus it makes up for in mouthwatering fruit intensity. Gooseberry and grapefruit lead the way, with just the right amount of herbal flourishes. Drink now.",14.0,89,3,0.9415444466427656
15965,Talus 1998 Zinfandel (California),"Plenty of herbal, mushroomy notes in the nose. The wine is light, soft and fruity. The mushroom flavors could be a real asset with the right food. Finishes true to form, with nothing off.",8.0,85,3,0.9415363140424508
113775,Wakefield 2010 Riesling (Clare Valley),"Light and crisp, with a perfumed bouquet of baby powder and lime blossom. Simple green apple and lime flavors carry a tart edge through the finish.",17.0,86,3,0.9415351531956738
97101,Joseph Cattin 2016 Riesling (Alsace),"A slightly earthy note colors the apple and lemon aromas on the nose. The palate shows lots of freshness and has a tart, light and dry body. The finish is lemony and fresh. Drink while aromas are expressive.",18.0,87,3,0.941519943359213
70877,Bodega Virgen de la Sierra 2015 Albada Viña Viejas Macabeo (Calatayud),Generic mild citrus aromas come with a note of compost. This Macabeo feels round but basic. Dry limited flavors of papaya and citrus fruits finish slightly briny.,14.0,85,3,0.941516216446543
68615,Seguin-Manuel 2013  Viré-Clessé,"An ill-defined wine, closed and tight, this just hints at fruit without showing much intensity. The aftertaste has some bright lemon zest texture.",20.0,84,3,0.9415133950786966
73410,Lionel Osmin & Cie 2015 Mauzac (Gaillac),"Found almost exclusively in Gaillac and Limoux, the Mauzac grape is made into sparkling wines as well as still wines such as this. This apple crisp wine is lightly oxidative (none the worse for that) with a bright pepper and tangy lemon character. It is ready to drink.",15.0,89,3,0.9415111393834433
1014,Domaine Rolet Père et Fils 2008 Brut Sparkling (Crémant de Jura),"Chardonay and Pinot Noir are both present in this apple and pear flavored wine. A lively mousse brings out the fruit and acidity, giving a tangy, bright wine that's ready to drink now.",24.0,90,3,0.9415066998196471
45119,Casa de Vila Verde 2014 Pluma Alvarinho (Minho),"The wine is all fruit, so fresh and crisp and light. Sliced apples and sharp lime juice are swirled around with so much acidity that the wine just dances in the glass. This is delicious and ready to drink.",14.0,86,3,0.9415011799685797
5823,Altos de Cristimil 2015 Albariño (Rías Baixas),"Chunky pithy stone-fruit and citrus aromas are sketchy, while the palate is tangy and none too pleasant. Flavors of mealy citrus fruits and a finish with the consistency of orange juice do nothing to help this along.",20.0,82,3,0.9415010645818903
90027,Red Mud 2007 Unoaked Chardonnay (South Australia),"Fresh but faint aromas of hay, candlewax and grass open this honest but simple effort. The palate lacks intensity but displays a bit of a mineral streak. Disappointingly short on the finish. Imported by Nelwood Wines.",15.0,81,3,0.9414951165797777
51179,Caves Aliança 2006 White (Vinho Verde),"An easy, fresh, slightly sparkling wine with pleasant, soft, lightly sweet fruit flavors. It is clean, a great apéritif for a summer's day.",8.0,83,3,0.9414822370743171
