,title,description,price,points,lda_label,3
77499,Brancott 2001 Sauvignon Blanc (Marlborough),"Extremely dry lime and green pepper aromas don't really roll out the welcome mat. Nor are the lean, tangy green flavors fully up to par. However, served chilled in a less than formal setting, say a picnic, it should work well enough. There's ample citrus and zest to save the day.",13.0,85,3,0.954505086618312
37804,Bernard Machado 2012 Reserve Pinot Noir (Chehalem Mountains),"This new Pinot is quite light in color, and hits the palate with a mix of tart cranberry and bitter herb. In 2012, a fruit-forward vintage, it seems slightly underripe, and thins out quickly.",40.0,86,3,0.95449142613663
81195,Antica Corte 2011 Pinot Grigio (Delle Venezie),"Easy, thin and bright, this is a straightforward Pinot Grigio that makes for a totally informal, no-fuss drinking experience. It feels watery and thin in the mouth with mild tones of grapefruit and melon on the close.",12.0,83,3,0.954477747911076
75512,Veiga Naúm 2015 Albariño (Rías Baixas),"Pinchy, staunch citrus and briny aromas are gritty and lacking in fresh fruit notes. Tight citric acidity makes this austere, while juicy but bitter flavors of orange and lime are tangy but pithy-tasting on the finish.",35.0,86,3,0.9544488499372303
94193,Simonnet-Febvre 2014  Irancy,This blend of Pinot Noir and the rare local César grape is as light as red wine can get in Burgundy. This northern region close to Chablis produces bright fruity expressions that attractively balance red cherry flavor with racy acidity. Drink now.,21.0,87,3,0.9544408072341435
77732,Coeur de Terre 2008 Estate Pinot Noir (McMinnville),"Cola, Dr. Pepper, cherry coke all come to mind, as this has a strong emphasis on those flavors, or sassafras as some define them. It's tasty, forward and light, with a lightly herbal aftertaste. Perfectly pleasant, though not showing much depth.",34.0,86,3,0.9544331822433801
97206,Gypsy Dancer 2005 Broadley Vineyard Pinot Noir (Dundee Hills),"A tart, cranberry- and raspberry-flavored wine, this young, high-acid style of Pinot has a charming, Burgundian feeling to it. The snappy red fruits are underscored with citrus, and the balance is disarmingly light, but not simple or dull.",43.0,88,3,0.9543996148594062
1956,Lo Nuevo 2015 Covello Albariño (Rías Baixas),"Lemon and apple aromas precede a high-acid citric palate without much elegance or finesse. This pedestrian Albariño deals pithy orange flavors that come with a note of grape skins. On the finish, this seems like orange juice.",16.0,84,3,0.9543859096895387
70271,Mionetto 2011 Rive di San Pietro di Barbozza Millesimato Brut  (Conegliano Valdobbiadene Prosecco Superiore),"A delicate bouquet of white flower and talc powder gives this vineyard-designate Prosecco Superiore a very clean, sharp and fresh first impression. That enormous focus continues to the palate where the wine's fresh acidity and tight perlage does a great job of refreshing the mouth.",20.0,89,3,0.9543754378972819
67545,Marques de Monistrol 2007 Winemakers Select Sparkling (Cava),"Light, airy and dusty on the nose, with apple and melon along with a touch of yeast. The palate is plump and healthy, with a good bead, nice acids and cidery, lightly briney apple and green fruit flavors. Shows some complexity beyond what's normal for Cava.",15.0,88,3,0.9543733841827161
37948,Aveleda 2012 Vinho Branco White (Douro),"Almost cool in character, this crisp Douro comes from high-altitude vineyards. The grapes yield a fruity citrus- and pear-driven wine that's minerally, with just the right amount of acidity to push its freshness forward.",9.0,89,3,0.9543647296199775
53185,Bradgate 2007 Chenin Blanc - Sauvignon Blanc White (Stellenbosch),"Grassy herbal aromas offer a fresh, appealing start to this accessible Chenin/Sauvignon Blanc blend. On the palate, it's a mix of flinty and round fruit, and the finish is clean and lively. Simple, but good.",10.0,85,3,0.9543643167264684
71104,Proidl 2014 Hochäcker Reserve Riesling (Kremstal),"Just a little hint of freshly cut lemon zest is offered on the nose. The palate however reveals fresh green and red apple fruit and a lively, joyful freshness. This simply shines with honest, fruity purity and is a splendid refresher on a warm, sunny day.",39.0,90,3,0.9543641579118605
61905,Marqués de Gelida 2010 Brut Reserva Rosé Pinot Noir (Cava),"Dusty red-fruit aromas set up an easy, likable palate with a mix of citrus and briny apple flavors. There's good tang and acidity along with length to the finish. That briny character from the flavor profile comes back on the finish.",18.0,87,3,0.9543566012105588
4755,Garces Silva 2013 Boya Sauvignon Blanc (Leyda Valley),"Tight, gritty, steely aromas of nettle and ocean mist allow for a modest amount of citrus fruit to poke through. A narrow, high-acid palate may peel back the enamel on your teeth, while flavors of sour green apple and gooseberry finish shear and tart.",18.0,88,3,0.954348639858865
31058,Loma Larga 2011 Sauvignon Blanc (Casablanca Valley),"This juicy white opens with a blend of citrusy and grassy aromas. The mouthfeel is healthy and round, with good acidic cut. Flavors of lime, Granny Smith apple and green herb are fresh and correct, while the finish is clear and refreshing. Drink now before it begins to fade.",16.0,88,3,0.9543152276938437
32426,Maison L'Envoyé 2014 Two Messengers Pinot Noir (Willamette Valley),"Young, bright raspberry fruit brings fresh, forward flavors front and center. There's a touch of cherry Popsicle also. It's an undeniably pretty wine, ready to drink, though don't look for much in the way of either depth or concentration.",30.0,87,3,0.9542695653799577
28265,Uvaggio 2012 Vermentino (Lodi),"From two vineyard sources in Lodi, Uvaggio's Vermentino is always a delicious bet, with crisp, light melon fruit and a salty quality that calls out for food from the sea. Modest in alcohol, the texture is mouthwateringly addictive, a quality that follows through from first sip to last.",14.0,89,3,0.9542426891187269
50021,Viña Tabalí 2009 Reserva Especial Sauvignon Blanc (Limarí Valley),"Cool, green, minerally aromas lead it off, and next there's fresh bell pepper, jalapeno and gooseberry flavors. Bright, focused, edgy and stony, with proper acidity, bite and clarity. A good one similar to the winery's Reserva SB, but clearer and more precise.",20.0,89,3,0.954126019231792
61993,Sileni 2011 Cellar Selection Pinot Gris (Hawke's Bay),"The Hawke's Bay region isn't known for its Pinot Gris, but this is a solid example at a very reasonable price. It's citrusy and very nearly dry, giving an overall impression that's a bit lean. Probably best with seafood dishes. Drink now.",12.0,85,3,0.9541062801980528
64009,Domaine de la Métairie d'Alon 2016 Le Village Pinot Noir Rosé (Pays d'Oc),"This pours an extremely pale-pink color, with dainty aromas of white cranberry, cherry and orange blossom in the bouquet. The lightweight palate is bright and lively, with good verve and tart berry and citrus flavors that finish quick yet clean. Drink now.",19.0,87,3,0.9540811313232956
14043,Alta Maria 2013 Carbonic Pinot Noir (Santa Maria Valley),"A fascinating wine, it was processed in a carbonic fashion, in which the juice is allowed to ferment inside the mostly intact grape skins, much like what's done in Beaujolais. The result is a transparent, ruby red wine that offers scents of a dust storm mixed with crushed rock and chile pepper herbaciousness. It's warm and soft on the mouth with a presence that suggests something between peppercorns and bell peppers.",24.0,92,3,0.954067952185302
86275,Alta Maria 2013 Carbonic Pinot Noir (Santa Maria Valley),"A fascinating wine, it was processed in a carbonic fashion, in which the juice is allowed to ferment inside the mostly intact grape skins, much like what's done in Beaujolais. The result is a transparent, ruby red wine that offers scents of a dust storm mixed with crushed rock and chile pepper herbaciousness. It's warm and soft on the mouth with a presence that suggests something between peppercorns and bell peppers.",24.0,92,3,0.954067952185302
47852,Anam Cara 2008 Nicholas Estate Reserve Pinot Noir (Chehalem Mountains),"A funky undertone, similar to the Nicholas Estate bottling, weaves through the wine, along with a mix of cranberry, raspberry and sour cherry fruit. Despite the 14% alcohol, this wine seems light, delicate, the flavors pleasing but pale, and the finish a gentle fade.",40.0,88,3,0.9540143642548611
29725,La Montagne 2012 John Sebastiano Vineyard Pinot Noir (Sta. Rita Hills),"Slightly sour orange-cranberry aromas meet with a touch of sagebrush on this wine from an increasingly popular vineyard at the eastern edge of the Sta. Rita Hills. The even-keeled, very drinkable flavors surround tongue-tantalizing spice, light red fruit and a little caramel on the finish.",50.0,92,3,0.9540103787946435
102105,La Montagne 2012 John Sebastiano Vineyard Pinot Noir (Sta. Rita Hills),"Slightly sour orange-cranberry aromas meet with a touch of sagebrush on this wine from an increasingly popular vineyard at the eastern edge of the Sta. Rita Hills. The even-keeled, very drinkable flavors surround tongue-tantalizing spice, light red fruit and a little caramel on the finish.",50.0,92,3,0.9540103787946435
74716,Casa Silva 2014 Cool Coast Viñedo de Paredones Sauvignon Blanc (Colchagua Valley),"Casa Silva is a pioneer in the chilly Paredones region, but it has taken them a few years to get this wine right. In 2014, it's there. Dusty, round, briny citrus aromas are not overly pungent or spiky. This is tangy and citric on the palate, but not unfriendly. Lime, gooseberry and sour orange flavors finish long and true.",24.0,90,3,0.9540015910554409
94719,San Pedro 2012 Epica Sauvignon Blanc (Central Valley),"Gritty match-stick aromas come with grapefruit and citrus scents. This is lifted and entirely regular for Chilean Sauvignon Blanc. Flavors of lemon, lime and grapefruit are soft and mealy for such a young wine, while bitterness enters the frame on the finish.",11.0,84,3,0.95397551603739
114561,Domaine de la Chezatte 2000  Sancerre,"Despite the intense green aromas and flavors this wine possesses, it has its strong points. Namely, nice balance, a good mouthfeel and a certain cleanliness that shouldn't be overlooked. But be warned: If green flavors like bell pepper and jalapeño are not for you, you might want to steer clear of this offering. Green is the dominant characteristic, from front to back.",20.0,86,3,0.953957143922832
75852,Dragonette 2014 Vogelzang Vineyard Sauvignon Blanc (Happy Canyon of Santa Barbara),"This is a light and lively take on the grape, with dried apple, hay, sour lime and petrol touches to the nose. The palate packs gravelly minerality and a touch of green herb alongside tangy lime peel flavors.",45.0,89,3,0.9539311085246824
12697,Txomín Etxaníz 2010 Getaria White (Getariako Txakolina),"When caught fresh, this is one of the Txakoli region's best wines. It comes on hard, clacky and tight as a box of nails, with citrus and minerally aromas. The palate is crisp and tight, with apple, lime, kiwi and spritz. Long, clean and refreshing.",25.0,89,3,0.9538807754199896
112562,Loimer 2015 Lois Grüner Veltliner (Kamptal),"A little bit of green pear, a little bit of pepper and quite a bit of juiciness add up to a whole lot of easy-drinking fun on this light, dry and zippy Grüner. There's some spice and yeastiness around the edges, too. Drink soon.",15.0,90,3,0.953880606654547
19680,Tussock Jumper 2014 Pinot Noir (Vin de France),"This easy-drinking Pinot leads with bright aromas of red currant, raspberry and strawberry hull, all leaning slightly sour. The palate is light and tangy, with tart red-berry flavors that finish clean.",12.0,84,3,0.9538533408716374
39303,Domingo Molina 2011 Hermanos Torrontés (Cafayate),"The chiseled lemon-lime aromas are minerally and crisp, with a touch of lychee. This feels light on its feet but shows depth, with flavors of citrus, green herbs and lychee. It's smooth and fresh on the finish, with a green herb note.",15.0,87,3,0.9538482074061639
101559,Domingo Molina 2011 Hermanos Torrontés (Cafayate),"The chiseled lemon-lime aromas are minerally and crisp, with a touch of lychee. This feels light on its feet but shows depth, with flavors of citrus, green herbs and lychee. It's smooth and fresh on the finish, with a green herb note.",15.0,87,3,0.9538482074061639
56790,Cloudy Bay 2012 Te Koko Sauvignon Blanc (Marlborough),"The 2012 vintage was a cool one in Marlborough, and it shows in this wine, especially when compared to the fine, elegant 2013 Te Koko. This is grassy and herbal, even hinting a bit at green peas, yet still offers a compelling texture and ample length. It may even outlive the 2013, even if it doesn't quite reach the same heights.",60.0,90,3,0.9537782962051062
82004,Cloudy Bay 2012 Te Koko Sauvignon Blanc (Marlborough),"The 2012 vintage was a cool one in Marlborough, and it shows in this wine, especially when compared to the fine, elegant 2013 Te Koko. This is grassy and herbal, even hinting a bit at green peas, yet still offers a compelling texture and ample length. It may even outlive the 2013, even if it doesn't quite reach the same heights.",60.0,90,3,0.9537782962051062
105458,Stadt Krems 2016 Grüner Veltliner (Kremstal),"A touch of yeast and sage emerges amidst lime peel scents on the nose of this wine. The palate reinforces those flavors, while white pepper and lime notes tingle around the edges. It's lean but concnetrated and finishes with such a clean and refreshing zip that you just want to sip more.",15.0,91,3,0.9537471325641278
111602,Blanco Nieva 2011 Verdejo (Rueda),"This is waxy on the nose, with the aromatic spunk of nettle and sweaty citrus. It feels fresh, minerally and zesty, with citrus, apple and green herb flavors. It's solid, smooth and elegant on the finish, which turns slightly bitter as it concludes.",22.0,89,3,0.9536802771757219
108586,Winzerkeller Andau 2016 Sauvignon Blanc (Burgenland),"A touch of green bell pepper and boxwood appears amidst the citrus scent on the nose. The palate majors on crisp lemon tartness, with some of those appetizing green boxwood and pepper flavors, too. The body is light, lean, dry and refreshing.",13.0,90,3,0.952575160288455
26793,Root:1 2009 Sauvignon Blanc (Casablanca Valley),"Aromas of nettle, gooseberry, grapefruit and mineral are sharp, distinct and varietally appropriate, while the wet, short palate is hollow but edged by green apple, gooseberry and other green fruit flavors. Zesty on the finish, but a little pithy. Drink right away.",13.0,85,3,0.952541031545858
33395,Coquelicot 2016 Sauvignon Blanc,"Fresh and crisp on the nose, this lively and laser-sharp wine shows grapefruit skin and pith, Gala apple and cut grass scents on the nose. That grassy element grows more prevalent on the sip, accenting tarter lime peel flavors.",26.0,88,3,0.952529265330904
75224,Coquelicot 2016 Sauvignon Blanc,"Fresh and crisp on the nose, this lively and laser-sharp wine shows grapefruit skin and pith, Gala apple and cut grass scents on the nose. That grassy element grows more prevalent on the sip, accenting tarter lime peel flavors.",26.0,88,3,0.952529265330904
101044,Santa Luz 2015 Gran Reserva Corte Sauvignon Blanc (Leyda Valley),"Pungent, feline aromas of nettle and passion fruit are sharp and uric. This feels narrow and angular, with racy acidity. Flavors of passion fruit, grapefruit, bell pepper and cactus pad finish with pink-grapefruit sharpness and pithy bitterness.",18.0,86,3,0.9524987067240241
84435,Vermador 2009 White Wine Made With Organic Grapes White (Alicante),"Neutral on the nose, and then crisp but bland tasting. There's apple and green hints of fresh bell pepper and lettuce, while the finish shows lime, citrus pith and mild bitterness. Light and basic; made from 50% each of Airen and Macabeo (Viura).",10.0,84,3,0.9524906110562023
76231,De Martino 2010 Made with Organically Grown Grapes Sauvignon Blanc (Maipo Valley),"Lime, fresh-cut grass, tangerine and other clean, pure aromas are the greeting. The palate is whimsical and offers good acidic cut; flavors of lime, green apple and chili peppers are correct and turn mildly pithy on the finish.",16.0,88,3,0.952486826633979
41474,Goat Bubbles 2013 Solomon Hills Vineyard Sparkling Pinot Noir (Santa Maria Valley),"A pleasant rose-petal pink in color, this wine by regional sparkling veteran Norm Yost shows red-grapefruit pulp and skin, lime spritz and a shred of bubble gum on the nose, playing both on hedonism and restraint. It's extremely refreshing once sipped, with more lime and pink grapefruit zest.",42.0,92,3,0.9524582419217499
53794,Domaine Ehrhart 2014 Herrenweg Riesling (Alsace),"A subdued nose leads to a very zesty palate, with grapefruit zest and crunchy green apple. The fruit is lively, clean and rather vivacious. Lemony freshness brightens the dry finish and makes you sip more.",23.0,89,3,0.9524465049156713
25623,Château Barbanau 2015 L'Instant Rosé (Côtes de Provence),"Pale in color, this is a light, bright style of rosé. It is clean and crisp, with touches of red fruit that float through the attractive fresh acidity. The aftertaste is fleeting and refreshing.",18.0,87,3,0.9524339157878677
86442,Miguel Torres 2012 Santa Digna Reserve Sauvignon Blanc (Central Valley),"The snap pea, tarragon, scallion and passion fruit aromas make this wine easy to identify as Sauvignon Blanc. It feels linear and razor sharp, with sizzling grapefruit and apple flavors. Tangy and very fresh, it turns to lime and green onion on the finish.",12.0,86,3,0.9524133853512176
22209,Legaris 2011 Verdejo (Rueda),"Varietally correct on the nose, this has green apple, grapefruit and floral aromas. It feels basic, tangy and linear, with notes of melon, citrus and a dry, crisp finish that's mildly briny and a touch bitter.",13.0,87,3,0.9524099555666414
67051,San Simone 2007 Prestige Pinot Grigio (Friuli Grave),"Here is a light and easy Grigio with simple aromas of passion fruit and citrus that add bright freshness to the mouth. It is lean and watery in consistency, making for a good match to easy snacks or picnic foods.",18.0,85,3,0.952396197038595
34489,Juvé y Camps 2006 Brut Reserva Sparkling (Cava),"Snappy and a little green on the nose, with hints of juniper and green apple. The palate is perfectly good but nothing special, while the flavors of apple and citrus are punchy and pure. Frothy but controlled, with lots of flavor and forward kick. Apéritif city!",13.0,88,3,0.9523943391700059
65909,Bodegas Garci Grande 2013 Señorio de Garci Grande Verdejo (Rueda),"Grapefruit, passion fruit, cactus pad and stony aromas make for a textbook Verdejo bouquet. The palate on this fresh, crisp white is compact and clean. Flavors of nectarine and lime finish a touch salty yet refreshing.",14.0,89,3,0.9523902260854623
17829,Casas del Bosque 2012 Gran Reserva Estate Bottled Sauvignon Blanc (Casablanca Valley),"This relatively snappy SB reflects coastal Chile in a good, true way via minerally and citrusy aromas that include jalapeño notes. The palate is friendly but exact, with passion fruit, grapefruit and lime flavors. The minerally finish is sweeter and less acidic than in years past.",16.0,89,3,0.9523841344237124
25587,Camina 2016 Verdejo Verdejo (La Mancha),"Light, clean apple aromas lead to a basic palate with skin-driven texture. Airy green fruit and citrus peel flavors finish mild and fresh. At 11.5% abv, this is about as light as good wine gets.",9.0,85,3,0.9523625274681321
25313,Tegernseerhof 2008 Frauenweingarten Grüner Veltliner (Wachau),"Light, fresh crisp wine, showing a lively series of green fruits, bright acidity and a texture of tight apple skins. A deliciously light, vivid wine. Screwcap.",16.0,88,3,0.9523624802063386
76494,Le Vieux Pin 2006 Vaïla Pinot Noir Rosé (Okanagan Valley),"This is just the second vintage for this winery, whose inviting labels look like handwritten notes. The rosé captures the bright color, fresh fruit and silky texture of its Pinot Noir grape; it's a perfect salmon or turkey wine, and one you could happily sip as an apéritif.",24.0,90,3,0.952361098340068
116186,Espuela del Gaucho 2011 Gaucho Spur Torrontés (Mendoza),"Typically fragrant, with floral aromas vying with mildly green notes of lime and lychee. Feels tangy and downright citric, with lemon, orange, lime and green apple flavors. Cleansing and acidic on the finish, with lemony snap.",13.0,84,3,0.9523521286425017
91201,Montes 2011 Classic Series Sauvignon Blanc (Casablanca Valley),"Varietally and regionally correct, with green, grassy, punchy aromas of citrus, white pepper and jalapeño. This is prickly in the mouth, with lively acidity and flavors of lime, scallion, green apple and bell pepper. It finishes with cut and juicy acids.",12.0,87,3,0.9523479571690603
37045,Aveleda 2015 Aveleda White (Vinho Verde),"Lightly prickly on the tongue, this is a refreshing, almost dry wine. It is bright, lively and fruity with citrus and crisp apple flavors. The wine is light and bright with plenty of acidity at the end.",9.0,86,3,0.9523476690725123
37802,Aveleda 2015 Aveleda White (Vinho Verde),"Lightly prickly on the tongue, this is a refreshing, almost dry wine. It is bright, lively and fruity with citrus and crisp apple flavors. The wine is light and bright with plenty of acidity at the end.",9.0,86,3,0.9523476690725123
109003,Concha y Toro 2012 Marques de Casa Concha Sauvignon Blanc (Leyda Valley),"Light, classic aromas of gooseberry, lime and nettle are good indicators of what's to follow. That would be a high-acid, racy, seemingly early picked wine with flavors of lemon, Granny Smith apple and gooseberry. A lasting, tangy, acidic finish is crackling as a lightning bolt.",23.0,87,3,0.9523400797623395
42491,Château Roques Mauriac 2016  Bordeaux Blanc,"This lively, citrus-driven wine has tight acidity over bright grapefruit and lime, giving refreshing crispness. Immediately attractive, it offers an aftertaste that shines with lemon juice.",15.0,88,3,0.9523368678730141
103934,Château Roques Mauriac 2016  Bordeaux Blanc,"This lively, citrus-driven wine has tight acidity over bright grapefruit and lime, giving refreshing crispness. Immediately attractive, it offers an aftertaste that shines with lemon juice.",15.0,88,3,0.9523368678730141
107790,Los Molles 2010 Reserva Sauvignon Blanc (Limarí Valley),"Green and focused on the nose, with a hint of fresh bell pepper. The palate is light and chiseled, with crisp flavors of white grapefruit, lime and passion fruit. Finishes elegant and fresh. An ideal quaffer to go with salads and shellfish.",14.0,89,3,0.9523325838529284
59599,MontGras 2013 Reserva Sauvignon Blanc (Leyda Valley),"Crisp aromas of zesty citrus fold in touches of brine and bitterness. Fresh and peppery on the palate, it has pyrazinic flavors of bell pepper, arugula and passion fruit. A juicy, briny, mildly bitter finish is typical for Leyda SB.",12.0,86,3,0.9523230275629311
79839,Ermita Veracruz 2008 Verdejo (Rueda),"Crisp on the bouquet, with green apple and controlled fresh celery aromas. The palate is also fresh, with basic roundness, bounce and natural flavors of apple cider, citrus and lime. Finishes with a slice of white grapefruit and a tiny spot of pith. Drink immediately.",18.0,88,3,0.9523186300666872
108274,Angeline 2016 Rosé (California),"Crisp and dry, this bright pink wine is classically styled, showing apple skin aromas and lively grapefruit flavors. Made from Pinot Noir, it's light and appetizing and has a solid, mildly grippy mouthfeel.",13.0,88,3,0.9523117730941864
45139,Peza do Rei 2014 White (Ribeira Sacra),"Basic citrus aromas lean towards grapefruit. This blend of 70% Godello with Treixadura and Albariño feels fresh and snappy, with bracing acidity. Briny flavors of white grapefruit and tangerine finish fresh and cleansing. Drink immediately.",14.0,86,3,0.952307105506603
49476,Miguel Torres 2014 Santa Digna Sauvignon Blanc (Central Valley),"Fresh bell pepper and passion fruit aromas are a bit underripe in character. The palate feels juicy and bright, with zesty acidity. Nectarine and green-herb flavors hint at vegetal undertones, while the finish is short but fresh. Drink now.",12.0,86,3,0.9523008869512585
50978,Zarate 2015 Albariño (Rías Baixas),"Abnormally high pyrazines give this a sharp, oily nose. This feels and tastes much like it smells; the mouth is sharp and angular, while sour grapefruit flavors and oily bitterness on the finish suggest green Sauvignon Blanc.",30.0,82,3,0.9522908688662527
54321,Marqués de la Concordia 2013 Selección Especial Brut Rosé Sparkling (Cava),"Citrus peel and mineral aromas set up a zesty palate that doesn't show a lot of weight or body. Mild citrus and apple flavors are maintained on a basic finish. This is fresh, clean and easygoing.",11.0,86,3,0.9522903721882877
46592,Root:1 2014 Sauvignon Blanc (Casablanca Valley),"Aromas of celery, arugula, snap pea, dusty apple and citrus announce a clean palate with scouring acidity. Lemon-lime and grapefruit flavors are typical of Casablanca SB, while a fresh, citrusy finish brings a green-herb element into play.",12.0,86,3,0.9522901194036235
80175,Root:1 2014 Sauvignon Blanc (Casablanca Valley),"Aromas of celery, arugula, snap pea, dusty apple and citrus announce a clean palate with scouring acidity. Lemon-lime and grapefruit flavors are typical of Casablanca SB, while a fresh, citrusy finish brings a green-herb element into play.",12.0,86,3,0.9522901194036235
88098,Schug 2010 Pinot Noir (Sonoma Coast),"A thin, country-style Pinot Noir, light in color and body and tart in acidity. The flavors are very dry, suggesting cranberry, cola and sour cherry candy.",24.0,85,3,0.9522897351920794
