,title,description,price,points,cluster_label,cosine_similarity
71579,Castello di Fonterutoli 2013 Ser Lapo Riserva  (Chianti Classico),"Underbrush, grilled herb, roasted coffee bean and dark-skinned berry aromas unfold in the glass. The elegantly structured palate delivers red cherry, raspberry, sage, anise and clove framed in bright acidity and fine-grained tannins. Drink through 2020.",30.0,91,0,0.44721148571228186
100808,Nottola 2011  Vino Nobile di Montepulciano,"Round and rich, this blend of Sangiovese and 20% Merlot opens with aromas of dark berry and underbrush. The ripe, straightforward palate delivers black plum, crushed black cherry, coffee and a chocolate note while soft tannins make it extremely accessible. Enjoy through 2016.",25.0,88,0,0.4471984241183562
89853,Mazzei 2012 Mix 36 Sangiovese (Toscana),"Made entirely from Sangiovese, this polished red opens with aromas of red berry, violet, sunbaked earth and a whiff of thyme. Structured and smooth, the palate delivers juicy red cherry, cinnamon and clove alongside fine-grained tannins. Drink through 2023.",70.0,93,0,0.4471972897293234
93451,Mazzei 2012 Mix 36 Sangiovese (Toscana),"Made entirely from Sangiovese, this polished red opens with aromas of red berry, violet, sunbaked earth and a whiff of thyme. Structured and smooth, the palate delivers juicy red cherry, cinnamon and clove alongside fine-grained tannins. Drink through 2023.",70.0,93,0,0.4471972897293234
20517,Di Filippo 2010 Etnico  (Montefalco Sagrantino),"Earthy aromas of leafy underbrush, leather, ripe blackberry, savory herb and baking spice lead the nose on this warm, full-bodied red. The lush, juicy palate offers ripe black plum, fig, black pepper and graphite alongside velvety tannins. A licorice note signals the close.",35.0,91,0,0.44719198749148414
57544,Di Filippo 2010 Etnico  (Montefalco Sagrantino),"Earthy aromas of leafy underbrush, leather, ripe blackberry, savory herb and baking spice lead the nose on this warm, full-bodied red. The lush, juicy palate offers ripe black plum, fig, black pepper and graphite alongside velvety tannins. A licorice note signals the close.",35.0,91,0,0.44719198749148414
16246,Casa Sola 2010 Gran Selezione  (Chianti Classico),"Aromas of crushed flower, black raspberry, tilled earth, menthol and a hint of espresso lead the nose. The full-bodied palate delivers ripe black cherry, spiced plum and ground white pepper alongside assertive tannins that need time to unwind.  Drink 2016–2022.",45.0,90,0,0.44718208887188626
79964,Cantina del Pino 2011 Gallina  (Barolo),"Spiced berry, violet, menthol and anise aromas float out of the glass. The elegant, firmly structured palate doles out juicy black cherry, licorice, white pepper, clove and a hint of pipe tobacco alongside firm, fine-grained tannins that need a few more years to unwind. Drink 2019–2031.",66.0,93,0,0.4471579454582669
25198,La Fortuna 2010  Brunello di Montalcino,"Intense berry, violet, menthol and white-spice aromas lead the nose, with a whiff of new leather The vibrant palate delivers crunchy red cherry, fleshy raspberry, baking spice and savory herb alongside assertive but refined tannins and fresh acidity. Drink 2018–2018.",60.0,93,0,0.4471048505839201
105916,Nada Fiorenzo 2011 Manzola  (Barbaresco),"Crushed violet, woodland berry, eucalyptus and cake spice aromas meld in the glass. The structured palate doles out dried black cherry, licorice, espresso and white pepper alongside tight, fine-grained tannins. It closes on a note of chopped sage. Drink 2017–2022.",40.0,91,0,0.4469706344449087
93437,Brunelli Martoccia 2012  Brunello di Montalcino,"Dark-skinned berry, underbrush and leather are some of the aromas you'll find in this juicy Brunello. The palate doles out fleshy black cherry, raspberry jam and clove flavors held together by fine-grained tannins and fresh acidity. Enjoy 2018–2023.",50.0,90,0,0.4469077857810968
21872,Casisano Tommasi 2011  Brunello di Montalcino,"Aromas of grilled herb, dark spice and mature black-skinned fruit lead the nose. The ripe, generous palate doles out succulent black cherry, raspberry compote, licorice and nutmeg alongside round, velvety tannins. Drink through 2020.",58.0,91,0,0.44687040255228905
86342,Firriato 2011 Quater Red (Terre Siciliane),"A blend of four native grapes, Nero d'Avola, Perricone, Frappato and Nerello Cappuccio, this opens with aromas of oak, espresso, dried herb, mature blackberry and dark spice. The firm palate offers dried black cherry, prune, licorice and ground pepper alongside tightly knit, close-grained tannins.",22.0,88,0,0.4468531435140013
60773,I Sodi 2013  Chianti Classico,"A blend of Sangiovese and 7% Canaiolo, this bright red opens with pretty aromas of violet, woodland berry and a whiff of baking spice. The vibrant palate offers tart cherry, black raspberry and anise alongside sleek tannins and fresh acidity.",19.0,89,0,0.44685263655063706
50208,Cordella 2011  Brunello di Montalcino,"Tilled soil, forest floor, mature black-skinned fruit, leather and a truffle note come together in the glass. The firmly structured palate presents juicy black cherry, crushed raspberry, cinnamon, vanilla and an earthy hint of game while assertive, close-grained tannins provide support. Give it a few years for the tannins to relax then enjoy. Drink 2019–2023.",85.0,90,0,0.4468299388628389
87104,Rocca delle Macìe 2011 Riserva di Fizzano Gran Selezione Single Vineyard  (Chianti Classico),"Structured and polished, this opens with aromas that recall dark berry, leather, blue flowers, toasted oak, mint and spice. The firm palate offers ripe black cherry, espresso, cedar, menthol and licorice alongside assertive but refined tannins. Drink 2016–2021.",35.0,93,0,0.44680095000864967
25077,Pian delle Querci 2006 Riserva  (Brunello di Montalcino),"Aromas of leather, forest floor, tobacco, mature berry and a balsamic note open this structured, elegant wine. The palate delivers crushed black cherry, cinnamon, licorice and savory herb alongside firm but polished tannins and fresh acidity. Drink 2016–2026.",50.0,94,0,0.44674833774836836
44856,Pian delle Querci 2006 Riserva  (Brunello di Montalcino),"Aromas of leather, forest floor, tobacco, mature berry and a balsamic note open this structured, elegant wine. The palate delivers crushed black cherry, cinnamon, licorice and savory herb alongside firm but polished tannins and fresh acidity. Drink 2016–2026.",50.0,94,0,0.44674833774836836
74095,Re Manfredi 2010 Serpara  (Aglianico del Vulture),"Aromas of mature plum, leather, pressed violet, dried herb and a whiff of Asian spice unfold on this full-bodied red. The warm, chewy palate offers dried black cherry, blackberry extract, vanilla, licorice and tobacco alongside firm, velvety tannins. You'll also detect the warmth of alcohol on the close.",35.0,93,0,0.44669208408637234
89716,Cordero di Montezemolo 2012 Gattera  (Barolo),"Leather, underbrush, baked plum, menthol and a whiff of cake spice are some of the aromas that lift out of the glass. The ripe palate delivers dried black cherry, fig, star anise, mocha, espresso and grilled sage while close-grained tannins provide the framework. Drink 2017–2022.",85.0,90,0,0.44657731339312007
73187,Poggio al Tufo 2015 Rompicollo Red (Toscana),"A blend of 60% Sangiovese and 40% Cabernet Sauvignon, this has aromas of sunbaked earth, dried herb, dark berry and a whiff of underbrush. The soft straightforward palate offers juicy black cherry and a hint of spice framed in easygoing tannins. Drink soon.",18.0,87,0,0.44654816091442834
101218,Gianni Gagliardo 2012  Barolo,"Aromas of pressed rose, red berry, chopped herb and espresso lead the nose. The firm palate offers juicy black cherry, licorice and a hint of mocha alongside a backbone of fine-grained tannins. Drink after 2018.",53.0,90,0,0.44651137660418433
108318,Centovigne 2012 Il Centovigne Red (Coste della Sesia),"A fragrant blend of 80% Nebbiolo and 20% Vespolina and Croatina, this stunning red offers enticing scents of dark-skinned berry, tilled soil, new leather, dark spice and a balsamic note. Elegant, structured and savory, it boasts juicy black-cherry, raspberry, white-pepper, cinnamon and tobacco flavors set against a backbone of firm, refined tannins and fresh acidity. Drink 2019–2030.",16.0,92,0,0.4463958025680777
60092,Livio Voghera 2009 Basarin  (Barbaresco),"Enticing aromas of rose, violet, perfumed berry, baking spice and mint waft out of the glass while ripe black cherry, licorice, crushed herb and a hint of tobacco drive the full-bodied, structured palate. Firm, velvety tannins provide the backbone. Drink through 2026.",49.0,92,0,0.4463868519999153
80666,Mirafiore 2011  Barolo,"Classic Nebbiolo aromas of red berry, leather, crushed flower and a balsamic note unfold in the glass. The full-bodied palate doles out juicy black cherry, licorice and tobacco alongside firm, refined tannins. Drink 2018–2026.",49.0,93,0,0.4463049396575549
115177,Michele Satta 2012 Cavaliere Sangiovese (Toscana),"Made entirely from Sangiovese, this opens with intense violet, red berry, Mediterranean herb and tilled soil aromas. The palate is polished and layered in crushed raspberry, juicy black cherry, pipe tobacco, mint and white pepper flavors. Velvety tannins provide structure. Enjoy through 2022.",90.0,94,0,0.4462782097350371
39804,Il Marroneto 2011 Madonna delle Grazie  (Brunello di Montalcino),"This is perfumed with classic scents of wild cherry, leather, crushed violet, baking spice and a balsamic note. The bold palate delivers juicy black cherry, black raspberry, anise, white pepper and cinnamon alongside firm tannins. Despite the hefty body, it also shows an almost weightless elegance while the fruit richness seamlessly supports the warmth of alcohol on the close.",150.0,95,0,0.4462415022586631
110261,Castello di Gabbiano 2010 Bellezza Gran Selezione  (Chianti Classico),"Made with 100% Sangiovese, this conveys aromas of violet, vanilla, pressed powder and perfumed berry. The vibrant, structured palate delivers juicy wild cherry, licorice, black pepper and toast alongside firm tannins and fresh acidity. It finishes on a mocha note. Drink 2015–2022.",38.0,90,0,0.4461782886850691
2217,Romanelli 2010  Montefalco Sagrantino,"Underbrush, forest floor, crushed violet, new leather, mature plum and graphite aromas lead the nose on this brawny red. The hearty palate delivers dried black cherry, blackberry, nutmeg, grilled sage and licorice alongside youthfully aggressive but ripe tannins. Drink 2015–2025.",40.0,90,0,0.4461670497544136
27899,Romanelli 2010  Montefalco Sagrantino,"Underbrush, forest floor, crushed violet, new leather, mature plum and graphite aromas lead the nose on this brawny red. The hearty palate delivers dried black cherry, blackberry, nutmeg, grilled sage and licorice alongside youthfully aggressive but ripe tannins. Drink 2015–2025.",40.0,90,0,0.4461670497544136
87934,Feudo Principi di Butera 2013 Nero d'Avola (Sicilia),"This solid red opens with aromas of dark-skinned berry, toast and underbrush. The firm palate offers wild cherry, ground pepper, coffee and a hint of mineral alongside polished, fine-grained tannins.",17.0,88,0,0.4460615991905072
13648,Cordero di Montezemolo 2012 Monfalletto  (Barolo),"Exotic spice, French oak, mature berry, menthol and a floral note are some of the aromas you'll find on this structured red. The ripe, chewy palate presents mature black cherry, raspberry compote, espresso, licorice and aromatic herb while firm fine-grained tannins provide support. Drink 2019–2027.",48.0,93,0,0.4460453205031657
73345,Il Molino di Grace 2010  Chianti Classico,"A bright, lively wine made from Sangiovese, it has classic varietal aromas of blue flower, red berries, spice and just a whiff of leather. The palate delivers ripe red cherry accented with hints of white pepper, clove and cinnamon alongside firm but fine tannins and fresh acidity.",22.0,89,0,0.4459764130655718
40877,Baricci 2010 Nello Riserva  (Brunello di Montalcino),"New leather, mature black-skinned fruit, tilled soil and a touch of dark spice are some of the aromas you'll find on this fantastic, full-bodied red. The big, velvety palate shows power and finesse, offering mouthfuls of juicy wild cherry, black raspberry, licorice, Mediterranean herb and a note of exotic spice framed in firm, ripe tannins. It's already balanced and delicious, but hold for more complexity. Drink 2020–2035.",120.0,98,0,0.4459433168346936
92668,Erste Neue 2012 Mezzan Pinot Nero (Alto Adige),"Delicate aromas of wild berry, violet and a whiff of baking spice come together in the glass. The elegantly structured palate offers crushed black cherry, alpine herb and a trace of vanilla alongside firm, fine-grained tannins.",23.0,89,0,0.44593173668325703
99107,Cecchi 2011 Riserva di Famiglia  (Chianti Classico),"Leafy underbrush, scorched earth, tobacco, vanilla, toasted oak and spiced plum aromas lead the nose. The smooth palate offers crushed black cherry, game, grilled herb, espresso and cooking spice. Firm, fine-grained tannins provide support.",35.0,90,0,0.4459152082669831
5193,Monte Faustino 2010  Amarone della Valpolicella Classico,"Crushed violet, cake spice and ripe black plum aromas lead the nose on this bold wine. The round, full-bodied palate doles out juicy black cherry, blackberry jam, cinnamon, licorice and a hint of tobacco alongside ripe, velvety tannins that lend it a polished feel.",65.0,92,0,0.4457503441820079
93653,Fattoria di Corsignano 2013  Chianti Classico,"Aromas of plum, tilled soil, truffle, dark baking spice and a whiff of violet lead the nose. The medium-bodied, easygoing palate offers juicy black cherry, white pepper and clove framed in lithe tannins and lively acidity. Enjoy through 2018.",25.0,88,0,0.44566318282784084
64544,Salcheto 2012  Vino Nobile di Montepulciano,"A pure expression of Sangiovese, this delivers aromas and flavors of black cherry, dried plum, licorice, ground black pepper and hints of leather and tobacco. Solid tannins give it a firm structure. Drink 2017–2022.",28.0,90,0,0.44561995861989984
115660,Le Bèrne 2012  Vino Nobile di Montepulciano,"This 100% Sangiovese opens with pretty aromas of iris, violet, dark berry and a blend of cooking spices. On the palate, ground black pepper, anise and espresso accent a core of dried black cherry while tightly knit, assertive tannins provide backup. Drink 2017–2022.",25.0,91,0,0.44553028567647995
70294,Marchesi di Barolo 2011  Barbaresco,"This straightforward Barbaresco opens with a pretty nose of wild rose, crushed red berry and balsamic notes. The palate delivers ripe black cherry, licorice and cinnamon alongside chewy tannins.",45.0,89,0,0.44549301974984123
21776,I Veroni 2013 Riserva  (Chianti Rufina),"Made entirely from organically grown Sangiovese, this opens with red plum, new leather and underbrush aromas. The full-bodied palate delivers crushed raspberry, black cherry, pipe tobacco and a hint of black pepper, with polished tannins providing backbone. Drink through 2022.",30.0,92,0,0.4454866124509044
13607,Volpaia 2012 Coltassala Riserva  (Chianti Classico),"There's a lot to love on this juicy, delicious wine, starting with aromas of ripe, dark-skinned berry, baking spice, leather, sun baked soil and menthol. The elegant, structured palate delivers ripe black cherry, cinnamon, anise and tobacco while firm, polished tannins provide support and finesse. A blast of orange zest signals the close.",69.0,94,0,0.4454613501251204
68993,Casanuova delle Cerbaie 2010 Vigna Montosoli Riserva  (Brunello di Montalcino),"Aromas of crushed berry, fragrant purple flower, dark spice and a balsamic note almost jump out of the glass. The full-bodied structured palate delivers dried black cherry, raspberry compote, licorice and a hint of clove set against a backbone of firm, refined tannins. Drink 2018–2030.",80.0,92,0,0.44544754590470215
44266,Madonna Nera 2012  Brunello di Montalcino,"Plum, blue flower, baking spice and a whiff of French oak lead the nose along with new leather. The juicy palate shows both chewy concentration and finesse, doling out raspberry compote, ripe wild cherry, vanilla, dried rosemary and coffee alongside bright acidity and fine-grained tannins. Drink 2019–2027.",75.0,91,0,0.44535934922671466
49968,Giuseppe Cortese 2016  Dolcetto d'Alba,"This juicy wine opens with intense violet, red-skinned berry and white pepper aromas. The savory palate delivers red cherry and cooking spice flavors while polished tannins provide support. It's made to be enjoyed young, so drink soon.",20.0,88,0,0.4452886588303335
115641,Castello d'Albola 2011 Riserva  (Chianti Classico),"Aromas of wild red berry, sun-baked earth and dark cooking spices blossom in the glass. The medium-bodied, elegant palate delivers juicy wild cherry, crushed black raspberry, baking spice and grilled herb while smooth, polished tannins provide support.",28.0,91,0,0.4452513293569672
31163,Il Feuduccio Di S. Maria D'Orni 2012  Montepulciano d'Abruzzo,"This juicy, solid red offers aromas of scorched earth, mature berry, dark spice and a whiff of game. The chewy palate delivers ripe black cherry, raisin, star anise and clove alongside rounded tannins.",21.0,89,0,0.4450106512232419
50275,Tenuta di Capraia 2012 Riserva  (Chianti Classico),"This all-Sangiovese Chianti opens with black-skinned fruit, allspice and new leather aromas. Polished tannins lend structure to the dried black cherry, licorice and a tobacco flavors on the palate. Drink through 2022.",25.0,89,0,0.4449512156262647
54184,Tenuta di Capraia 2012 Riserva  (Chianti Classico),"This all-Sangiovese Chianti opens with black-skinned fruit, allspice and new leather aromas. Polished tannins lend structure to the dried black cherry, licorice and a tobacco flavors on the palate. Drink through 2022.",25.0,89,0,0.4449512156262647
37433,Fratelli Alessandria 2013 Priòra  (Barbera d'Alba Superiore),"Juicy, structured and delicious, this full-bodied wine doles out ripe blackberry, crushed raspberry, red cherry, white pepper, clove and licorice. Racy acidity and fine-grained tannins provide support.",30.0,90,0,0.4449247713433879
74085,Guastaferro 2011 Primum  (Taurasi),"Subtle aromas of underbrush, leather, blue flower, mature black-skinned fruit and ground pepper slowly emerge on this powerfully structured wine. The brooding palate delivers black cherry steeped in spirits, crushed raspberry, clove and licorice framed against tightly knit but ripe tannins. It's still austere and will benefit with more cellaring. Drink 2020–2031.",150.0,93,0,0.4448754517941282
49143,Fattorie Parri 2009 Tenuta Corfecciano Urbana Riserva  (Chianti Montespertoli),"Menthol, savory herb and dark-skinned berry aromas lead the nose along with a balsamic note. The full-bodied but accessible palate doles out black cherry, crushed plum, sage and soothing licorice alongside velvety tannins. Enjoy through 2016.",28.0,90,0,0.44485091497726426
64669,Il Paradiso di Manfredi 2015  Rosso di Montalcino,"Classic Sangiovese aromas of ripe black-skinned fruit, tilled soil and a whiff of new leather lead the nose on this delicious red. The round juicy palate doles out mouthfuls of wild raspberry, fleshy cherry, baking spice and an earthy hint of truffle alongside smooth, velvety tannins.",51.0,92,0,0.44482289546681303
7837,Castelli del Grevepesa 2011 Castelgreve  (Chianti Classico),"Made entirely with Sangiovese, this straightforward wine offers aromas of forest floor, violet, red berry and spices. The juicy palate delivers ripe black fruit accented with notes of white pepper, cinnamon, black tea and clove alongside firm but ripe tannins. Enjoy this now through 2018.",20.0,89,0,0.444698633662395
57048,Collosorbo 2011 Riserva  (Brunello di Montalcino),"Enticing Sangiovese aromas of truffle, ripe dark-skinned berry, pressed violet and new leather lead the way on this delicious red. The smooth succulent palate doles out juicy Marasca cherry, crushed raspberry, baking spice and wild herb framed in velvety tannins that envelope the palate while a licorice note wraps around the finish. Drink 2018–2026.",105.0,95,0,0.44464870577668136
14862,Piccini 2011  Chianti Classico,"Made with Sangiovese and 10% Merlot, this opens with aromas of red currant and a whiff of exotic spice. The straightforward palate offers dried black cherry, clove and a hint of grilled herb alongside smooth tannins. Simple but well made, it's is made to be enjoyed young so drink soon.",15.0,86,0,0.44464705246113334
28211,Michele Chiarlo 2015 Le Orme  (Barbera d'Asti),"Ripe black-skinned fruit, dark spice, underbrush and roasted coffee aromas lead the nose of this wine, along with an earthy note of game. The rounded, chewy palate is loaded with black cherry, black raspberry, baking spice and truffle flavors set against fresh acidity and polished tannins.",16.0,90,0,0.4445664910666248
48058,Michele Chiarlo 2015 Le Orme  (Barbera d'Asti),"Ripe black-skinned fruit, dark spice, underbrush and roasted coffee aromas lead the nose of this wine, along with an earthy note of game. The rounded, chewy palate is loaded with black cherry, black raspberry, baking spice and truffle flavors set against fresh acidity and polished tannins.",16.0,90,0,0.4445664910666248
4174,Mirafiore 2013 Paiagallo  (Barolo),"New leather, dark berry, fragrant blue flower, rose and baking spice aromas take shape in the glass. The smooth, delicious palate doles out juicy raspberry, crushed black cherry, star anise and cinnamon flavors, with polished tannins and bright acidity. Drink 2023–2033.",100.0,94,0,0.4444785780664698
7095,Vite Colte 2012 La Casa in Collina  (Barbaresco),"Dark berry, grilled herb and underbrush aromas float out of the glass along with a whiff of rose. The firm palate offers juicy dark cherry, raspberry, clove, anise and tobacco framed in velvety tannins.",40.0,90,0,0.4444671353134519
47927,Il Valentiano 2011 Campaperi  (Brunello di Montalcino),"Ripe and full-bodied, this opens with aromas of mature black-skinned fruit, leather toast, licorice and menthol. The round, forward palate doles out juicy black cherry nutmeg, mocha and grilled sage offset by loosely knit tannins. Drink 2017–2022.",50.0,89,0,0.4444624944284185
66666,Luca Bosio 2014  Barbaresco,"This bright, elegant wine opens with wild berry, violet, cake spice and aromatic herb notes. The palate delivers red cherry, cranberry, white pepper and licorice flavors framed by taut, fine-grained tannins and vibrant acidity.",37.0,89,0,0.44445073501180166
66073,Fattoria Lavacchio 2013 Puro  (Chianti),"Made entirely with organically grown Sangiovese, with no added sulfites, this medium-bodied red opens with earthy aromas of tilled soil, underbrush, game and black-skinned fruit. The lively palate doles out ripe black plum, wild cherry and crushed raspberry accented by subtle notes of white pepper and clove.",9.0,87,0,0.4444252693963017
105507,Pertinace 2014  Barbaresco,"This opens with textbook Nebbiolo aromas of new leather, forest floor, red berry, culinary spice and a whiff of blue flower. On the savory palate, taut, fine-grained tannins and vibrant acidity support Marasca cherry, raspberry compote, star anise and white pepper flavors that should integrate after a few more years in bottle. Drink after 2022.",30.0,92,0,0.44430552440349075
67921,Cantina Valle Tritana 2013 Tritano  (Montepulciano d'Abruzzo),"Aromas of ripe black-skinned berry and a whiff of cooking spice lift out of the glass. The solid straightforward palate offers black currant, dried cherry and clove framed in seasoned tannins.",20.0,87,0,0.4441362869368871
42884,Ca'Romè 2012 Chiaramanti  (Barbaresco),"Crushed violet, red berry, mint and menthol aromas lead the nose. The firm palate offers dried red cherry, raw strawberry, licorice, white pepper and sage alongside grippy tannins that leave an astringent finish. Give the tannins a few more years to unclench then enjoy before the remaining fruit fades.",94.0,88,0,0.4439905769766601
105770,Le Salette 2012 Pergole Vece  (Amarone della Valpolicella Classico),"Mature black-skinned fruit, raisin, crushed purple flower and baking spice are some of the aromas you'll find on this bold wine. The chewy full-bodied palate offers dried black cherry, black currant, ground pepper and pipe tobacco alongside firm velvety tannins. An espresso note closes the lingering finish. Drink 2018–2025.",152.0,93,0,0.44396255538673074
39539,Morini 2013 Nonno Rico Oriolo Riserva Sangiovese (Romagna),"Aromas of black-skinned berry, scorched soil and bell pepper lead the nose. The dense dark palate delivers juicy black plum, tobacco and clove framed in chewy tannins. Enjoy through 2020.",25.0,88,0,0.44395924514694884
102715,Tenuta di Trecciano 2012 Terra Rossa Riserva  (Chianti Colli Senesi),"Black plum, dark berry, fragrant blue flower, coffee and cake spice aromas take shape in the glass. The juicy palate delivers wild cherry, espresso and mocha alongside fine-grained tannins. An anise note signals the close.",20.0,88,0,0.4438332559587556
79897,Brezza 2012 Sarmassa  (Barolo),"Leather, ripe berry, cured meat, chopped herb and a hint of underbrush are some of the aromas you'll find on this full-bodied red. The firm, savory palate delivers ripe raspberry, juicy black cherry, star anise, clove and mineral alongside youthfully assertive tannins. It closes on a juicy note. Drink 2020–2027.",70.0,92,0,0.4438261712475158
59789,Castello di Radda 2014  Chianti Classico,"This easygoing red opens with black-skinned fruit and baking spice aromas. The straightforward palate displays red plum and leather notes, with a hint of black pepper and pliant tannins. Enjoy soon.",12.0,87,0,0.4436714925608309
