,title,description,price,points,cluster_label,cosine_similarity
8394,Tenuta Sette Ponti 2012 Crognolo Red (Toscana),"Firm and spicy, this blend of Sangiovese and 10% Merlot opens with aromas of black plum, crushed violet and kitchen spices. The juicy palate delivers ripe black cherry, licorice and clove alongside a backbone of tightly wound but refined tannins. Drink 2016–2020.",35.0,89,0,0.461916709506708
110079,Tenuta Sette Ponti 2012 Crognolo Red (Toscana),"Firm and spicy, this blend of Sangiovese and 10% Merlot opens with aromas of black plum, crushed violet and kitchen spices. The juicy palate delivers ripe black cherry, licorice and clove alongside a backbone of tightly wound but refined tannins. Drink 2016–2020.",35.0,89,0,0.461916709506708
108007,Castello del Poggio 2015  Barbera d'Asti,"This opens with black-skinned berry, dried violet and star anise aromas. The savory, easy-drinking palate delivers blackberry, black pepper and clove flavors set against bright acidity and supple tannins. Enjoy through 2020.",15.0,88,0,0.46184193729431544
107266,San Fabiano Calcinaia 2011 Cellole Gran Selezione  (Chianti Classico),"This full-bodied red opens with aromas of sun-baked soil, iris, baking spice and plum. The warm palate offers black berry, dried black cherry, espresso and tobacco alongside raspy tannins that leave a drying finish.",30.0,87,0,0.46181429921378325
106943,Corvo 2013 Rosso Nero d'Avola (Terre Siciliane),"Subdued aromas of mature black-skinned berry, spice and a whiff of leather lead the nose on this fresh, simple red. The soft, smooth palate shows juicy black cherry, blackberry and a hint of licorice. It's made to be enjoyed young so drink soon.",12.0,86,0,0.4617694074272289
18936,Citille di Sopra 2015  Rosso di Montalcino,"This opens with violet, red berry and leather aromas. The savory, straightforward palate offers ripe red cherry, raspberry and clove notes, with a hint of sage and fine-grained tannins. Enjoy through 2020.",32.0,89,0,0.46176601127077843
42879,Arbéta 2013 Superiore  (Barbera d'Alba),"Black-skinned fruit, blue flower and Oriental spice aromas come together in the glass. The bright, savory palate doles out black cherry, blackberry jam and black pepper alongside soft tannins and fresh acidity.",20.0,88,0,0.46175351556442834
95325,Vite Colte 2004 Essenze Riserva  (Barolo),"Aromas of leafy underbrush, mature berry, chopped herb and mocha lead the nose. The firm, full-bodied palate offers black cherry, licorice, menthol and clove alongside polished, fine-grained tannins. Drink 2017–2029.",90.0,91,0,0.46169613287729083
21862,La Palazzetta 2011  Brunello di Montalcino,"Ripe black-skinned fruit, underbrush, leather, sunbaked earth and a whiff of crushed herb come together on this solid red. The round palate doles out juicy wild cherry, raspberry compote, cinnamon, a hint of vanilla and anise alongside robust, velvety tannins that impart muscle and polish. A note of grilled sage closes the finish. Drink 2018–2025.",60.0,91,0,0.4616841758775504
48154,Castello di Radda 2012 Riserva  (Chianti Classico),"Underbrush, tilled earth, leather, ripe berry and a whiff of baking spice aromas meld together on this fragrant wine. The savory, refined palate offers juicy wild cherry, crushed raspberry, licorice and a tobacco note framed in firm, polished tannins. Drink through 2020.",28.0,91,0,0.4616693342228204
71580,Castello di Radda 2012 Riserva  (Chianti Classico),"Underbrush, tilled earth, leather, ripe berry and a whiff of baking spice aromas meld together on this fragrant wine. The savory, refined palate offers juicy wild cherry, crushed raspberry, licorice and a tobacco note framed in firm, polished tannins. Drink through 2020.",28.0,91,0,0.4616693342228204
29335,Cecchi 2011  Vino Nobile di Montepulciano,"Forest floor, black plum, menthol and a whiff of exotic spice unfold on this elegantly structured wine. The precise palate offers mature black cherry, ground pepper, licorice and hint of chewing tobacco framed in firm, fine-grained tannins. Drink through 2019.",32.0,90,0,0.46154414015832085
11892,Guado al Melo 2011 Atis Red (Toscana),"Intense aromas of red currants, cedar, spice, crushed mint, blue flowers and a whiff of grilled bell pepper lead the nose of this blend of 80% Cabernet Sauvignon, 10% Merlot and 10% Cabernet Franc. The palate delivers dried black cherries, menthol, clove, white pepper and licorice alongside firm, fine-grained tannins. Drink 2016–2021.",70.0,90,0,0.46151469627118297
66059,Fattoria di Grignano 2012  Chianti Rufina,"This blend of 85% Sangiovese, 10% Can aiolo and 5% other red grapes opens with aromas of ripe dark-skinned fruit, crushed blue flowers and a whiff of clove. The easygoing palate offers dried black cherry, espresso and a hint of anise alongside dusty tannins.",15.0,87,0,0.46136393485081756
79191,Fattoria di Grignano 2012  Chianti Rufina,"This blend of 85% Sangiovese, 10% Can aiolo and 5% other red grapes opens with aromas of ripe dark-skinned fruit, crushed blue flowers and a whiff of clove. The easygoing palate offers dried black cherry, espresso and a hint of anise alongside dusty tannins.",15.0,87,0,0.46136393485081756
109556,Villa Calcinaia 2011 Riserva  (Chianti Classico),"Aromas of red cherry, blackberry, herb and a whiff of blue flower lead the nose. Made entirely with Sangiovese, the palate doles out fleshy plum and juicy black cherry while clove, white pepper and grilled herb provide backup. Sleek tannins make this already very accessible.",35.0,90,0,0.46125118283422395
108310,Borgogno F.lli Serio e Battista 2013 Cannubi  (Barolo),"Wild berry, new leather, iris, dark spice and crushed herb aromas carry over to the elegant palate along with juicy Marasca cherry, raspberry, clove and white pepper. Firm fine-grained tannins and bright acidity lend balance and structure. Drink 2023–2035.",45.0,92,0,0.46112046497859965
110920,Bersano 2012 Mantico  (Barbaresco),"Menthol, dark berry, violet and cake spice aromas lead the way on this striking wine. It's still young and nervous, with tight tannins, but it also shows black cherry, white pepper, clove and mocha. Firm, velvety tannins and bright acidity provide the backbone. Drink 2018–2027.",50.0,93,0,0.4609780339840354
628,Ruffino 2010 Riserva Ducale Oro Gran Selezione  (Chianti Classico),"Aromas of violet, iris, forest floor, woodland berry and allspice lead the nose on this structured, savory wine. The concentrated palate delivers ripe black cherry, mocha, clove, tobacco and licorice alongside velvety tannins and fresh acidity. It's firm and well balanced.",43.0,91,0,0.46097419880260054
50285,Brunelli Martoccia 2011 Riserva  (Brunello di Montalcino),"Delicate black-skinned berry and baking spice scents lift out of the glass. The dense, ripe palate offers dried black cherry, white pepper and leather notes, framed by mature tannins. Drink through 2021.",100.0,89,0,0.460853143865366
40718,Capezzana 2013 Monna Nera Red (Toscana),"Made of 50% Sangiovese, 20% Merlot, 10% Cabernet and 10% Syrah, this opens with aromas of violet, red berry and a whiff of espresso. On the easy-drinking palate, a note of white pepper accents a core of juicy black cherry. It's balanced with fresh acidity and polished tannins. Enjoy soon.",10.0,87,0,0.4607487813731066
19867,Sartori 2011 Estate Collection  (Amarone della Valpolicella),"Aromas of violet, iris, ripe black-skinned fruit, dried grape and a whiff of tobacco lead the way on this full-bodied charmer. The smooth, structured palate delivers dried cherry, raspberry compote, licorice and cake spice while velvety tannins provide support.",42.0,92,0,0.4606888828052871
10656,Losi Querciavalle 2011  Chianti Classico,"Ripe black-skinned berry, truffle, scorched soil, violet and a potpourri of kitchen spice are some of the aromas that emerge on this polished red. The smooth, delicious palate doles out juicy black cherry, black raspberry, licorice and chopped mint set in a framework of silky, supple tannins. Enjoy through 2018.",25.0,92,0,0.46066360685663355
50325,Tommasi 2009 Ca' Florian Riserva  (Amarone della Valpolicella Classico),"Mature black-skinned fruit, forest floor, leather and dark spice aromas come together on this hearty red. The full-bodied, assertive palate offers dried black cherry, prune, licorice and pipe tobacco framed in firm, fine-grained tannins. Drink 2017–2024.",100.0,90,0,0.46065862029783905
93432,Argentiera 2013  Bolgheri,"A blend of predominantly Cabernet Sauvignon and Merlot with 10% Cabernet Franc, this opens with black-skinned berry, scorched earth and cooking spice aromas. The concentrated palate delivers black currant, mocha and licorice flavors with a hint of black pepper, all set against a backdrop of fine-grained tannins. Drink through 2021.",65.0,90,0,0.4606446080465215
28263,Tenuta di Nozzole 2010 Riserva  (Chianti Classico),"This wine opens with aromas of black plum, grilled bell peppers, cedar and spice. The dense palate offers black cherry, espresso, chocolate and black pepper alongside firm but fleeting tannins.",50.0,89,0,0.4606081996238121
44141,Tenute Lunelli 2009 Lampante Riserva  (Montefalco Rosso),"Blue flower, ripe berry and baking spice aromas unfold in the glass of this blend of Sangiovese, Sagrantino, Cabernet and Merlot. The juicy palate delivers black cherry, vanilla, cinnamon and espresso alongside bracing tannins.",23.0,89,0,0.46055711994933074
92442,Fattoria San Felo 2012  Morellino di Scansano,"Aromas of ripe berry, allspice and blue flower lead the nose. On the palate, notes of white pepper and clove accent a core of juicy black cherry. Firm, fine-grained tannins provide the framework. Drink through 2016.",15.0,88,0,0.4604192664609255
98930,Fattoria San Felo 2012  Morellino di Scansano,"Aromas of ripe berry, allspice and blue flower lead the nose. On the palate, notes of white pepper and clove accent a core of juicy black cherry. Firm, fine-grained tannins provide the framework. Drink through 2016.",15.0,88,0,0.4604192664609255
3670,Michele Chiarlo 2012 La Court  (Barbera d'Asti Superiore),"Fresh and structured, this offers aromas of ripe dark-skinned berry, mature plum, violet, coffee and baking spice. On the smooth palate, notes of chocolate, chopped mint and clove accent the black cherry core. Bright acidity and fine-grained tannins provide balance and structure.",50.0,90,0,0.4604135503433769
50674,Michele Chiarlo 2012 La Court  (Barbera d'Asti Superiore),"Fresh and structured, this offers aromas of ripe dark-skinned berry, mature plum, violet, coffee and baking spice. On the smooth palate, notes of chocolate, chopped mint and clove accent the black cherry core. Bright acidity and fine-grained tannins provide balance and structure.",50.0,90,0,0.4604135503433769
93129,Nada Giuseppe 2013 Casot  (Barbaresco),"Leather, dried rose petal, licorice, mature berry and a whiff of camphor waft out of the glass. The structured palate offers dried black cherry, baking spice, dried herb and a hint of pipe tobacco. Assertive, fine-grained tannins and fresh acidity provide balance. Drink 2018–2023.",35.0,91,0,0.46040112476584316
79044,Ceretto 2012  Barolo,"This luminous red offers aromas of wild red berry, dark spice, menthol and a whiff of espresso. The ripe, rather straightforward palate offers raspberry, tart cherry, licorice, toast, mocha and tobacco alongside polished tannins. Drink 2017–2022.",55.0,89,0,0.46032088063517795
48977,Boffa 2012  Barbaresco,"This elegantly structured wine opens with aromas of perfumed berry, game, leather and a whiff of cake spice. The delicious palate delivers juicy dark-cherry and -berry flavors, with cinnamon, white pepper and anise alongside a backbone of fresh acidity and firm, fine-grained tannins. Drink 2018–2028.",30.0,93,0,0.4600643702110911
85585,Le Gode 2012  Brunello di Montalcino,"Classic Sangiovese aromas of new leather, wild berry, baking spice and a whiff of menthol lead the way on this full-bodied red. It's juicy and delicious, delivering crushed raspberry, fleshy black cherry, cinnamon and pipe tobacco framed in polished and velvety tannins. Drink now through 2027.",80.0,95,0,0.4597630079190838
31440,Castello di Monsanto 2011 Il Poggio Riserva  (Chianti Classico),"Aromas of underbrush, dark-skinned berry, espresso menthol and scorched soil lead the nose. On the elegant, structured palate, firm, polished tannins carry dried black cherry, raspberry, cinnamon toast and a touch of anise. Drink 2017–2023.",55.0,91,0,0.4596813194937146
8127,Castello Gabiano 2011 Adornes  (Barbera d'Asti Superiore),"This dense, savory wine has tobacco, black-skinned berry and red plum aromas and licorice, blackberry jam and black pepper flavors. Fine-grained tannins provide support. Drink through 2022.",41.0,89,0,0.45951337068567066
105301,Rocca di Frassinello 2013 Poggio alla Guardia  (Maremma Toscana),"Aromas of cedar, plum, red currant, clove and menthol unfold in the glass. An easy-drinking blend of 45% Merlot, 40% Cabernet Sauvignon and 15% Sangiovese, the juicy palate delivers black cherry, blackberry, ground pepper and licorice alongside soft, polished tannins. Drink through 2018.",25.0,88,0,0.4595039968320127
60302,Mirafiore 2011 Paiagallo  (Barolo),"A classic Nebbiolo fragrance of perfumed berry, rose petal, tilled soil, chopped herb and a whiff of baking spice pervades this firm, full-bodied wine. The chewy palate offers juicy black cherry, crushed raspberry, clove, anise and a hint of tobacco framed in firm, ripe tannins and vibrant acidity. Drink 2019–2026.",135.0,94,0,0.4594244264032171
72436,Ascheri 2013 Pisapola  (Barolo),"This wine's forest floor, new leather, wild berry, clove and balsamic aromas lead the way, along with a heady whiff of violet. Its smooth, structured palate evokes dried black cherry, crushed raspberry, cinnamon and white pepper, while tightly knit, polished tannins provide framework. Drink 2020–2030.",120.0,93,0,0.45939388081174454
60311,San Biagio 2011 Sorano  (Barolo),"Classically crafted, this impressive wine opens with alluring Nebbiolo aromas of mature dark berry, pine forest, leather, aromatic herb, baking spice and an earthy whiff of game. The full-bodied palate delivers juicy wild cherry, black raspberry, licorice, clove and tobacco alongside firm, refined tannins. It's already tempting but hold to let it fully develop. Drink 2018–2031.",46.0,94,0,0.45930131391744694
4285,Il Poggione 2009  Brunello di Montalcino,"This forward Brunello opens with a fruit and spice fragrance of ripe black berries, cinnamon and hot red pepper. The dense palate delivers fleshy black cherry, ripe black raspberry, black pepper and cake spices alongside dusty tannins.",85.0,90,0,0.459251787879651
89735,Antichi Vinai 1877 2011 Koinè  (Etna),"Underbrush, dried wild flower and aromatic herb aromas come together in the glass. The full-bodied palate offers dried black cherry, licorice, leather, mint and clove alongside firm, polished tannins. Drink soon to capture the remaining fruit flavors.",40.0,90,0,0.459156340165886
77929,Donnafugata 2015 Sherazade Nero d'Avola (Sicilia),"Made entirely from Nero d'Avola, this opens with ripe dark-skinned berry, exotic spice and blue flower scents. The straightforward, juicy palate delivers fleshy black cherry, blackberry and white pepper notes alongside firm, refined tannins. Enjoy through 2019.",20.0,89,0,0.458978057800183
76596,Feudo Principi di Butera 2013 Deliella Nero d'Avola (Sicilia),"Structured but elegant, this polished wine opens with scents of tilled earth, dark-skinned berry, dark baking spice and a delicate note of toasted almond. The smooth, full-bodied palate delivers juicy black cherry, crushed raspberry, cinnamon and white pepper while velvety tannins and fresh acidity lend balance and finesse.",90.0,93,0,0.45889749391018986
19119,La Selva 2013 Colli dell'Uccellina Riserva  (Morellino di Scansano),"Made with 85% Sangiovese and 15% Merlot, this has aromas of violet, black-skinned berry and a whiff of baking spice. The round, chewy palate offers ripe morello cherry, red currant, white pepper and a hint of game. Supple tannins and bright acidity give it an easy-drinking vibe.",26.0,88,0,0.4588755323936212
2569,Coli 2013 Pratale  (Chianti Classico),"This blend of Sangiovese, 10% Canaiolo and 10% Merlot offers aromas of violet, black plum and a whiff of baking spice. The simple but fleeting palate offers black cherry, raspberry and a hint of clove alongside mild tannins and fresh acidity.",13.0,86,0,0.4588144084491389
5523,Giovanni Rosso 2011 del Comune di Serralunga d'Alba  (Barolo),"This opens with earthy aromas of ripe dark fruit, scorched earth, game and truffle. The concentrated palate doles out juicy black cherry, crushed raspberry, sweet cake spice, tobacco and herb accompanied by firm, fine-grained tannins and a vein of fresh acidity.",53.0,92,0,0.4586493272573042
60089,Giovanni Rosso 2011 del Comune di Serralunga d'Alba  (Barolo),"This opens with earthy aromas of ripe dark fruit, scorched earth, game and truffle. The concentrated palate doles out juicy black cherry, crushed raspberry, sweet cake spice, tobacco and herb accompanied by firm, fine-grained tannins and a vein of fresh acidity.",53.0,92,0,0.4586493272573042
610,Baracchi Riccardo 2011 Smeriglio Riserva Syrah (Cortona),"Full-bodied and concentrated, this opens with aromas of crushed black plum, spicy blueberry, vanilla and dried sage. The dense, warm palate delivers dried black cherry, blackberry extract, oak and black pepper alongside velvety tannins. The soft acidity shows the heat of the vintage, so enjoy soon.",50.0,90,0,0.4586234234636543
80141,Ormanni 2010 Etichetta Storica Gran Selezione  (Chianti Classico),"This opens with a classic Sangiovese fragrance of crushed violet, blue iris, perfumed berry, underbrush and baking spice with a whiff of leather and menthol. Structured but elegant, the palate offers crunchy red cherry, juicy raspberry, white pepper clove and savory herb alongside a tannic backbone and fresh acidity. It has great aging potential. Drink 2016–2030.",45.0,95,0,0.4585063263773221
70501,Farnetella 2012  Chianti Colli Senesi,"Aromas of woodland berry, violet, underbrush and a hint of tilled earth lead the nose. The savory palate doles out fleshy black cherry, crushed raspberry, spice and a tobacco note. Firm but polished tannins support the juicy flavors.",16.0,88,0,0.45849074870853207
99845,Farnetella 2012  Chianti Colli Senesi,"Aromas of woodland berry, violet, underbrush and a hint of tilled earth lead the nose. The savory palate doles out fleshy black cherry, crushed raspberry, spice and a tobacco note. Firm but polished tannins support the juicy flavors.",16.0,88,0,0.45849074870853207
18132,Montevetrano 2013 Core Aglianico (Campania),"Aromas of ripe dark-skinned fruit and baking spice lead the nose. The palate delivers black cherry, raspberry compote and a hint of ground pepper while close-knit, fine-grained tannins grip the finish.",27.0,88,0,0.45827079255919434
100017,Castello La Leccia 2010 Bruciagna Gran Selezione  (Chianti Classico),"Aromas of Mediterranean herb, balsam, eucalyptus and dark berry lead the nose. The firm, elegant palate delivers juicy black cherry, dried blackberry, black pepper, clove, thyme, orange peel and anisette alongside youthfully austere but fine-grained tannins. Let this wine develop. Drink 2017–2022.",40.0,92,0,0.4582494588206141
109566,Gagliole 2012 Rubiolo  (Chianti Classico),"Bright and savory, this opens with aromas of blue flowers, mint, dark berry and an earthy whiff of underbrush. The firm palate doles out black cherry, crushed raspberry, peppermint and white pepper alongside firm, sleek tannins. Drink through 2020.",19.0,90,0,0.45823171729986056
113149,Brandini 2015 Filari Lunghi  (Dolcetto d'Alba),"This opens with aromas of black-skinned berry, licorice and spice. The savory palate delivers black cherry, almond and a touch of anise set against pliant tannins. Enjoy soon.",23.0,88,0,0.45822046175448206
88155,Luigi Oddero & Figli 2009 Specola  (Barolo),"Aromas of perfumed wild berry, red rose petal, truffle, mint, leather and a balsamic note all waft from the glass. The polished, structured palate delivers juicy red cherry, white pepper, cinnamon-spice and savory herb alongside firm but ripe tannins. Drink through 2024.",89.0,94,0,0.45804667531926047
75645,San Martino 2012 Arberesko  (Aglianico del Vulture),"Sunbaked earth, mature black-skinned fruit, blue flower, tobacco and new leather aromas waft out of the glass. The juicy, chewy palate doles out fleshy black cherry, blackberry, cinnamon, white pepper and a hint of game accompanied by ripe, solid tannins. Drink 2017–2027.",28.0,90,0,0.45796926995595133
85223,San Martino 2012 Arberesko  (Aglianico del Vulture),"Sunbaked earth, mature black-skinned fruit, blue flower, tobacco and new leather aromas waft out of the glass. The juicy, chewy palate doles out fleshy black cherry, blackberry, cinnamon, white pepper and a hint of game accompanied by ripe, solid tannins. Drink 2017–2027.",28.0,90,0,0.45796926995595133
19553,Fattoria Le Pupille 2011 Riserva  (Morellino di Scansano),"This structured red features aromas of tilled soil and ripe berry. The palate delivers violet, mature black cherry, crushed berry and ground white pepper alongside smooth, polished tannins. It's ripe and ready, so enjoy soon.",30.0,89,0,0.4579243116011624
74473,Fattoria Le Pupille 2011 Riserva  (Morellino di Scansano),"This structured red features aromas of tilled soil and ripe berry. The palate delivers violet, mature black cherry, crushed berry and ground white pepper alongside smooth, polished tannins. It's ripe and ready, so enjoy soon.",30.0,89,0,0.4579243116011624
13833,Pasqua 2012 Famiglia Pasqua  (Amarone della Valpolicella),"This opens with aromas of mature black currant and dark baking spice. The full-bodied palate offers mature black cherry, ripe blackberry, licorice and pipe tobacco alongside a backbone of firm, fine-grained tannins. Drink 2017 through 2022.",40.0,90,0,0.4578426134972801
76379,Pasqua 2012 Famiglia Pasqua  (Amarone della Valpolicella),"This opens with aromas of mature black currant and dark baking spice. The full-bodied palate offers mature black cherry, ripe blackberry, licorice and pipe tobacco alongside a backbone of firm, fine-grained tannins. Drink 2017 through 2022.",40.0,90,0,0.4578426134972801
105914,Marchesi di Barolo 2011 Coste di Rose  (Barolo),"Pretty aromas of blue flower, rose, wild berry and graphite lead the way. The firm palate delivers mature black cherry, raspberry, star anise, black pepper and chopped sage alongside bright acidity and tightly knit tannins that need to unwind. Drink 2018–2026.",90.0,91,0,0.45766830193761776
49144,I Veroni 2013  Chianti Rufina,"Sleek and fresh, this vibrant wine opens with aromas of dark berry, leafy underbrush, grilled porcini mushrooms and a whiff of tilled soil. The savory palate doles out juicy black cherry, clove, dried herb and anise alongside bright acidity and polished tannins. Drink through 2017.",18.0,90,0,0.4576120015358596
52178,Clavesana 2010 Olo  (Barolo),"It leads with dense aromas of black fruit, plum, spice and dried rose petals. The rich palate offers juicy black cherry and red raspberry accented with notes of white pepper, cinnamon clove and cocoa alongside bracing tannins. It closes on a note of black licorice. Drink 2020–2030.",25.0,91,0,0.4575470573396185
84544,Guado al Melo 2013 Atis  (Bolgheri Superiore),"Made with 80% Cabernet Sauvignon, 10% Cabernet Franc and 10% Merlot, this opens with aromas of black currant, cedar and a whiff of bell pepper. The firm palate delivers black cherry, licorice and white pepper alongside fine-grained tannins. Drink 2018–2023.",68.0,90,0,0.45750084520356815
82856,Tenute Salvaterra 2007 Cave di Prun Riserva  (Amarone della Valpolicella Classico),"Aromas of mature black-skinned berry, leather, pressed violet, baking spice and a balsamic note slowly emerge on this full-bodied red. The firmly structured palate offers dried black cherry, fig, mocha, tobacco and licorice alongside a backbone of fine-grained tannins. A coffee note closes the finish. Drink through 2022.",100.0,93,0,0.45749941005958444
28994,Giuseppe Gabbas 2011 Arbòre  (Cannonau di Sardegna),"This full-bodied red opens with aromas of ripe plum, vanilla, toast and mocha. The chewy palate doles out ripe blackberry, juicy black cherry, licorice, baking spice and a confectionary note alongside velvety tannins. It's already accessible so enjoy soon.",45.0,89,0,0.45745640355320216
73272,Giuseppe Gabbas 2011 Arbòre  (Cannonau di Sardegna),"This full-bodied red opens with aromas of ripe plum, vanilla, toast and mocha. The chewy palate doles out ripe blackberry, juicy black cherry, licorice, baking spice and a confectionary note alongside velvety tannins. It's already accessible so enjoy soon.",45.0,89,0,0.45745640355320216
38424,Tua Rita 2012 Perlato del Bosco Sangiovese (Toscana),"Made entirely with Sangiovese, this offers aromas of blue flowers and wild berries. The firm palate delivers black cherry, black raspberry, white pepper and clove while a note of orange zest lifts up the finish. Firm, fine-grained tannins deftly support the juicy flavors. Drink 2016–2020.",30.0,93,0,0.45725131220057547
30308,Castel di Pugna 2012 Ellera  (Chianti Colli Senesi),"Here's a blend of Sangiovese, Canaiolo Nero and Ciliegiolo that opens with aromas of dark skinned fruit, underbrush and a whiff of leather. The easygoing palate delivers ripe Morello cherry, crushed black cherry, savory herb and a balsamic note alongside fresh acidity and smooth tannins. There's not a lot of complexity but it is delicious.",29.0,89,0,0.4572385726166417
